,summary,date
153,"Shares of Allegion PLC dropped 0.52% to $108.51 Monday, on what proved to be an all-around great trading session for the stock market, with the S&P 500 Index...",2022-05-23
154,Many investors are still learning about the various metrics that can be useful when analysing a stock. This article is...,2022-05-21
155,"Shares of Allegion PLC inched 0.25% higher to $109.08 Friday, on what proved to be an all-around great trading session for the stock market, with the S&P 500...",2022-05-20
156,"Shares of Allegion PLC sank 0.32% to $108.81 Thursday, on what proved to be an all-around rough trading session for the stock market, with the S&P 500 Index...",2022-05-19
157,"Shares of Allegion PLC slid 3.96% to $109.16 Wednesday, on what proved to be an all-around dismal trading session for the stock market, with the S&P 500...",2022-05-18
158,"Shares of Allegion PLC rallied 1.71% to $113.66 Tuesday, on what proved to be an all-around great trading session for the stock market, with the S&P 500...",2022-05-17
159,"Shares of Allegion PLC slipped 0.91% to $111.75 Monday, on what proved to be an all-around mixed trading session for the stock market, with the Dow Jones...",2022-05-16
160,Leslie Picker joins the 'Halftime Report' to discuss what to expect from the SEC 13-F filings.,2022-05-16
161,"Shares of Allegion PLC rallied 1.44% to $112.78 Friday, on what proved to be an all-around great trading session for the stock market, with the S&P 500 Index...",2022-05-13
162,,2022-05-13
163,"Shares of Allegion PLC rallied 2.38% to $111.18 Thursday, on what proved to be an all-around dismal trading session for the stock market, with the S&P 500...",2022-05-12
164,"Shares of Allegion PLC slipped 1.91% to $108.60 Wednesday, on what proved to be an all-around grim trading session for the stock market, with the S&P 500...",2022-05-11
165,"Shares of Allegion PLC shed 2.76% to $110.71 Tuesday, on what proved to be an all-around mixed trading session for the stock market, with the S&P 500 Index...",2022-05-10
166,"Shares of Allegion PLC rallied 1.14% to $113.85 Monday, on what proved to be an all-around dismal trading session for the stock market, with the S&P 500...",2022-05-09
167,"The news means that tens of millions of households could receive high-speed internet at no cost, according to the White House.",2022-05-09
168,"Shares of Allegion PLC slid 1.05% to $112.57 Friday, on what proved to be an all-around grim trading session for the stock market, with the S&P 500 Index...",2022-05-06
169,"Shares of Allegion PLC shed 3.97% to $113.76 Thursday, on what proved to be an all-around poor trading session for the stock market, with the S&P 500 Index...",2022-05-05
170,"Shares of Allegion PLC advanced 2.65% to $118.46 Wednesday, on what proved to be an all-around favorable trading session for the stock market, with the S&P...",2022-05-04
171,"Shares of Allegion PLC inched 0.54% higher to $115.40 Tuesday, on what proved to be an all-around great trading session for the stock market, with the S&P...",2022-05-03
172,"Shares of Allegion PLC inched 0.47% higher to $114.78 Monday, on what proved to be an all-around favorable trading session for the stock market, with the S&P...",2022-05-02
173,"Comcast and Charter's joint venture to challenge Roku, Amazon and other streaming platforms may signal cable's long-game strategy.",2022-05-01
174,Let's talk about the popular Allegion plc ( NYSE:ALLE ). The company's shares saw significant share price movement...,2022-04-30
175,"Shares of Allegion PLC slid 4.16% to $114.24 Friday, on what proved to be an all-around grim trading session for the stock market, with the S&P 500 Index...",2022-04-29
176,"Shares of Allegion PLC rose 2.74% to $119.20 Thursday, on what proved to be an all-around positive trading session for the stock market, with the S&P 500...",2022-04-28
177,These are the stocks posting the largest moves in midday trading. ,2022-04-28
178,Looking for stock market analysis and research with proves results? Zacks.com offers in-depth financial research with over 30years of proven results.,2022-04-28
179,"Allegion's (ALLE) Q1 earnings results reflect the impacts of supply-chain restrictions, high costs and expenses, shortages of components and effective pricing. Management lifts revenue view for 2022.",2022-04-28
180,"CNBC's 'Squawk Box' team break down the latest first-quarter earnings results from Comcast, which beat analysts' expectations on the top and bottom lines.",2022-04-28
181,"All eyes will be on Comcast's broadband division, which is expected to add 229,000 new high-speed internet customers during the first quarter. ",2022-04-28
182,"DUBLIN, April 27, 2022--Allegion plc (NYSE: ALLE) Senior Vice President and Chief Financial Officer Mike Wagnes will discuss the company’s long-term strategy at the 2022 Wells Fargo Industrials Conference on Wednesday, May 4.",2022-04-27
183,"Shares of Allegion PLC rose 1.57% to $116.02 Wednesday, on what proved to be an all-around positive trading session for the stock market, with the S&P 500...",2022-04-27
184,"Assa Abloy, the world's biggest lockmaker, reported on Wednesday first-quarter earnings above expectations on the back of robust demand and price hikes, sending its shares up.",2022-04-27
185,"Shares of Allegion PLC shed 0.43% to $114.23 Tuesday, on what proved to be an all-around grim trading session for the stock market, with the S&P 500 Index...",2022-04-26
186,"Allegion (ALLE) delivered earnings and revenue surprises of 8.08% and 3.99%, respectively, for the quarter ended March 2022. Do the numbers hold clues to what lies ahead for the stock?",2022-04-26
187,"DUBLIN, April 26, 2022--Allegion plc (NYSE: ALLE), a leading global provider of security products and solutions, today reported first-quarter 2022 net revenues of $723.6 million and net earnings of $93 million, or $1.05 per share. Excluding charges related to restructuring, acquisition and integration expenses, as well as a non-operating investment gain, adjusted net earnings were $95.2 million, or $1.07 per share, down 10.8 percent when compared with first-quarter 2021 adjusted EPS of $1.20.",2022-04-26
188,"Allegion plc Directors' Report and Financial Statements Financial Year Ended 31 December 2021 Allegion plc TABLE OF CONTENTS ... | April 26, 2022",2022-04-26
189,"The following Management's Discussion and Analysis of Financial Condition andResults of Operations contains forward-looking statements that involve risks anduncertainties. Our actual results may... | April 26, 2022",2022-04-26
190,"Allegion plc , a leading global provider of security products and solutions, today reported first-quarter 2022 net revenues of $723.6 million and net earnings of $93 million, or $1.05 per share.... | April 26, 2022",2022-04-26
191,"Item 2.02 Results of Operations and Financial ConditionOn April 26, 2022, Allegion plc issued a press releaseannouncing its first quarter 2022 results. The information in this Form 8-K andthe... | April 26, 2022",2022-04-26
192,"DUBLIN _ Allegion PLC on Tuesday reported first-quarter profit of $93 million. The Dublin-based company said it had net income of $1.05 per share. Earnings, adjusted for... | April 26, 2022",2022-04-26
193,Raises FY22 revenue view ... ALLE,2022-04-26
194,Reports Q1 revenue $723.6... ALLE,2022-04-26
195,"Shares of Allegion PLC inched 0.18% higher to $114.72 Monday, on what proved to be an all-around positive trading session for the stock market, with the S&P...",2022-04-25
196,"Baird analyst Timothy Woj... SWK, ALLE",2022-04-25
197,"Netflix doesn't plan to shut down password sharers overnight. Rather, it intends to bill shared accounts an extra fee in a global rollout that may take a year.",2022-04-23
198,"In this article, we will discuss some of the popular stocks gaining on Friday. To take a look at some more stocks that are rising, go to the Top 5 Gainers Today. The US markets are in the red today following hawkish comments by the Federal Reserve Chair Jerome Powell highlighting a possible 50 basis […]",2022-04-22
199,"Allegion's (ALLE) Q1 earnings are likely to have benefited from its effective pricing policies, strong end-market demand and acquired assets. Rising costs and expenses might have hurt the stock.",2022-04-22
200,"Shares of Allegion PLC rose 2.16% to $114.51 Friday, on what proved to be an all-around dismal trading session for the stock market, with the S&P 500 Index...",2022-04-22
201,"Michael Morris, Guggenheim Partners, joins 'TechCheck' to dicsuss Snap's Q1 earnings results, where his forecast currently is and whether investors are too bearish on the streaming service industry.",2022-04-22
202,"Allegion Plc said Friday it agreed to buy Access Technologies LLC from Stanley Black & Decker Inc. for $810 million. The price values the manufacturer, installer and service provider of automatic doors in North America at about 2.4 times its $340 million annual revenue. Allegion said it's received committed financing from Goldman Sachs & Co. LLC, a unit of Goldman Sachs Group Inc. . Separately, Allegion said it expects to report first-quarter earnings of $1.05 a share and adjusted earnings of $1",2022-04-22
203,"Stanley Black & Decker (NYSE: SWK) today announced it has signed a definitive agreement for the sale of its automatic doors business, Access Technologies, to Allegion plc (NYSE: ALLE) for $900 million in cash. The Access Technologies business generated approximately $340 million in revenue in 2021 at a mid-teen adjusted EBITDA margin.",2022-04-22
204,"DUBLIN, April 22, 2022--Allegion plc (NYSE: ALLE), a leading global security products and solutions provider, has signed a definitive agreement to acquire Stanley Access Technologies LLC (""Access Technologies"") and assets related to the automatic entrance solutions business from Stanley Black & Decker, Inc. (NYSE: SWK) for $900 million in cash. When adjusted for approximately $90 million in tax benefits, the purchase price is $810 million on a cash-free, debt-free basis. Reducing the amount paid",2022-04-22
205,"By Colin Kellaher Allegion PLC has agreed to buy Stanley Black &amp; Decker Inc.'s automatic-doors business, Access Technologies, for $900 million in cash,...",2022-04-22
206,"(RTTNews) - Allegion Plc (ALLE), a provider of security products and solutions, Friday said it has signed a definitive agreement to acquire Stanley Access Technologies LLC and assets related to the automatic entrance solutions business from Stanley Black & Decker, Inc. (SWK) for",2022-04-22
207,"NEWS RELEASE Allegion to Acquire Stanley Black & Decker's Access Technologies Business ... | April 22, 2022",2022-04-22
208,"Item 1.01. Entry into a Material Definitive Agreement.On April 22, 2022, Allegion US Holding Company Inc., a subsidiary of Allegionplc entered into a Transaction Agreement (theTransaction... | April 22, 2022",2022-04-22
209,"Bolsters Allegion’s seamless access strategy with a category market leaderExpands Allegion’s portfolio with full spectrum of high-quality automatic entrance solutionsGrows Allegion... | April 22, 2022",2022-04-22
210, ALLE,2022-04-22
211,"Sees Q1 revenue $723M, co... ALLE",2022-04-22
212,"Stanley Black & Decke... SWK, ALLE",2022-04-22
213,"Allegion (ALLE) has signe... ALLE, SWK",2022-04-22
214,"Shares of Allegion PLC shed 0.44% to $112.09 Thursday, on what proved to be an all-around poor trading session for the stock market, with the S&P 500 Index...",2022-04-21
215,Dissolving the district would mean Reedy Creek employees and infrastructure would be absorbed by the local counties.,2022-04-21
216,"Shares of Allegion PLC advanced 3.02% to $112.59 Wednesday, on what proved to be an all-around mixed trading session for the stock market, with the Dow Jones...",2022-04-20
217,"Instead of legacy media shares soaring as they imitate Netflix, the industry has brought Netflix down to a degree.",2022-04-20
218,Baird analyst Timothy Woj... ALLE,2022-04-20
219,Allegion (ALLE) doesn't possess the right combination of the two key ingredients for a likely earnings beat in its upcoming report. Get prepared with the key expectations.,2022-04-19
220,"Netflix has been willing to turn a blind eye toward password sharing when it was growing subscribers, but losing customers can change behavior quickly.",2022-04-19
221,"Shares of Allegion PLC rallied 2.52% to $109.29 Tuesday, on what proved to be an all-around positive trading session for the stock market, with the S&P 500...",2022-04-19
222,"DUBLIN, April 19, 2022--Allegion plc (NYSE: ALLE), a leading global security products and solutions provider, is creating additional transparency for company stakeholders with the release of two allegion.com features – the new ""Environmental, Social and Governance (ESG) Goals & Key Performance Indicators"" webpage and the 2021 digital ""Annual Report & More.""",2022-04-19
223,"NOTICE OF 2022 ANNUAL GENERAL MEETING OF SHAREHOLDERS Dear Fellow Shareholders: We are pleased to invite you to the Annual General Meeting... | April 19, 2022",2022-04-19
224,"Allegion plc , a leading global security products and solutions provider, is creating additional transparency for company stakeholders with the release of two allegion.com features – the new... | April 19, 2022",2022-04-19
225,"Shares of Allegion PLC shed 0.77% to $106.60 Monday, on what proved to be an all-around poor trading session for the stock market, with the S&P 500 Index...",2022-04-18
226,"Staff article entitled Interesting ALLE Put And Call Options For December 16th, about stock options, from Stock Options Channel.",2022-04-18
227,"Shares of Allegion PLC slid 0.70% to $107.43 Thursday, on what proved to be an all-around poor trading session for the stock market, with the S&P 500 Index...",2022-04-14
228,"Shares of Allegion PLC advanced 2.26% to $108.19 Wednesday, on what proved to be an all-around great trading session for the stock market, with the S&P 500...",2022-04-13
229,"Staff article entitled Funds Added To ALLE Positions, about stock options, from Holdings Channel.",2022-04-13
230,"Shares of Allegion PLC slipped 0.68% to $105.80 Tuesday, on what proved to be an all-around grim trading session for the stock market, with the S&P 500 Index...",2022-04-12
231,"DACK, a mobile-first SaaS platform that enables short-term rental operators to provide their guests with a seamless digital stay experience has recently partnered with connected home integration platform Yonomi, an Allegion brand. The partnership is a welcome addition to DACK's powerful guest experience platform which includes keycode / digital key management, customizable property guides and upsells, contactless check-in and checkout, dynamic local recommendations, one-touch WiFi, and more.",2022-04-11
232,"Shares of Allegion PLC shed 0.17% to $106.52 Monday, on what proved to be an all-around grim trading session for the stock market, with the S&P 500 Index...",2022-04-11
233,The start of every month is exciting for all dividend income investors as we look back at the previous month and see how much passive dividend income our portfolios generated. Read more.,2022-04-11
234,"Shares of Allegion PLC slipped 1.61% to $106.70 Friday, on what proved to be an all-around mixed trading session for the stock market, with the Dow Jones...",2022-04-08
235,"""Sonic the Hedgehog 2"" is the first major family film released in 2022 and is expected to signal if this demographic is finally ready to return to theaters.",2022-04-08
236,,2022-04-08
237,"DUBLIN, April 07, 2022--Allegion plc (NYSE: ALLE), a leading global security products and solutions provider, today announced that its board of directors declared a quarterly dividend of $0.41 per ordinary share of the company.",2022-04-07
238,"Shares of Allegion PLC advanced 1.38% to $108.45 Thursday, on what proved to be an all-around positive trading session for the stock market, with the S&P 500...",2022-04-07
239,"Item 5.02 Departure of Directors or Certain Officers; Election of Directors; Appointment of Certain Officers; Compensatory Arrangements of Certain OfficersOn April 4, 2022,... | April 7, 2022",2022-04-07
240,"Niche sports organizations such as UFC, WWE and Formula 1 could be alluring acquisition targets for big streaming companies like Disney and Netflix.",2022-04-07
241,"Shares of Allegion PLC shed 2.87% to $106.97 Wednesday, on what proved to be an all-around rough trading session for the stock market, with the S&P 500 Index...",2022-04-06
242,"The ""Halftime Report"" traders give their top picks to watch for the second half.",2022-04-06
243,"As tensions rise between Disney and Florida lawmakers, the company will air new a new public service announcement from GLAAD featuring a transgender teen.",2022-04-06
244,"Shares of Allegion PLC shed 1.05% to $110.13 Tuesday, on what proved to be an all-around rough trading session for the stock market, with the S&P 500 Index...",2022-04-05
245,"Today, Allegion U.S., a leading provider of security products and solutions, revealed the results of a health care survey that provides insight into trends and challenges of today's hospitals. This survey, ""2022 Health Care Trends Report: A Study on How Health Care Facilities Are Using Technology to Meet the Demands of the Changing Landscape,"" includes input from 100 decision makers across leading U.S. health systems including Ascension Health, HCA Healthcare, John Hopkins Medicine and Kaiser Pe",2022-04-05
246,"'Mad Money' host Jim Cramer and the 'Squawk on the Street' team break down shares of AT&T, Discovery and CNBC parent company Comcast.",2022-04-05
247,"Finding a business that has the potential to grow substantially is not easy, but it is possible if we look at a few key...",2022-04-04
248,"Shares of Allegion PLC sank 0.20% to $111.30 Monday, on what proved to be an all-around positive trading session for the stock market, with the S&P 500 Index...",2022-04-04
249,Barclays analyst Julian M... ALLE,2022-04-04
250,"Shares of Allegion PLC advanced 1.58% to $111.52 Friday, on what proved to be an all-around great trading session for the stock market, with the S&P 500...",2022-04-01
251,"Shares of Allegion PLC slid 3.15% to $109.78 Thursday, on what proved to be an all-around grim trading session for the stock market, with the S&P 500 Index...",2022-03-31
252,"Shares of Allegion PLC slid 1.48% to $113.35 Wednesday, on what proved to be an all-around poor trading session for the stock market, with the S&P 500 Index...",2022-03-30
253,"DUBLIN, March 29, 2022--Allegion plc (NYSE: ALLE), a leading global security products and solutions provider, will release its 2022 first-quarter financial results on Tuesday, April 26, 2022, before the market opens.",2022-03-29
254,"DUBLIN - Allegion plc , a leading global security products and solutions provider, will release its 2022 first-quarter financial results on Tuesday, April 26, 2022, before the market opens. ... | March 29, 2022",2022-03-29
255,"Shares of Allegion PLC rose 1.38% to $115.05 Tuesday, on what proved to be an all-around great trading session for the stock market, with the S&P 500 Index...",2022-03-29
256,"Shares of Allegion PLC rallied 1.05% to $113.48 Monday, on what proved to be an all-around great trading session for the stock market, with the S&P 500 Index...",2022-03-28
257,"""CODA"" won Best Picture at the Oscars. ""Dune"" won the most awards. Will Smith smacked Chris Rock for insulting Jada Pinkett-Smith.",2022-03-27
258,"A weekly summary of dividend activity for Dividend Champions, Contenders, and Challengers. Companies which changed their dividends. Companies with upcoming ex-dividend dates.",2022-03-27
259,"Shares of Allegion PLC slid 0.26% to $112.30 Friday, on what proved to be an all-around favorable trading session for the stock market, with the S&P 500...",2022-03-25
260,Our 3-step process focuses on wide-moat stocks (as per Morningstar’s rating). We are only interested in those attractively valued targets. Read more here.,2022-03-25
261,"Shares of Allegion PLC dropped 0.53% to $112.59 Thursday, on what proved to be an all-around great trading session for the stock market, with the S&P 500...",2022-03-24
262,"Shares of Allegion PLC slid 3.64% to $113.19 Wednesday, on what proved to be an all-around grim trading session for the stock market, with the S&P 500 Index...",2022-03-23
263,"Shares of Allegion PLC inched 0.19% higher to $117.47 Tuesday, on what proved to be an all-around favorable trading session for the stock market, with the...",2022-03-22
264,"Allegion US, a leading provider of security products and solutions, will be hosting demonstrations of new electronic access control technologies as well as educational training sessions at ISC West 2022 (booth #23037), the security industry's most comprehensive and converged trade show occurring from March 22-25, 2022, in Las Vegas.",2022-03-22
265,"Allegion (ALLE) stands to gain from strong demand for its products, acquired assets and shareholder-friendly policies. Supply chain issues & high debt level remain concerns.",2022-03-22
266,"Looking today at week-over-week shares outstanding changes among the universe of ETFs covered at ETF Channel, one standout is the SPDR S&P Homebuilders ETF (Symbol: XHB) where we have detected an approximate $435.4 million dollar outflow -- that's a 22.2% decrease week over",2022-03-22
267,"Shares of Allegion PLC sank 0.75% to $117.25 Monday, on what proved to be an all-around grim trading session for the stock market, with the S&P 500 Index...",2022-03-21
268,"These are the best cyclical stocks to invest in now. EXPE, HD, IIPR, M, NUE, XHB, and RUN can make great investments.",2022-03-21
269,A Rocky Mountain mansion owned by Russian oligarch Roman Abramovich would likely be among the first assets frozen by the U.S. government if he is sanctioned.,2022-03-20
270,"In that case, I think locks and security door company Allegion (NYSE: ALLE), electrical connection and protection product company nVent (NYSE: NVT), and advanced materials company Hexcel (NYSE: HXL) are excellent companies to add to a portfolio.  The addition of internet of things (IoT) capability to locks and doors significantly enhances the ""value add"" of Allegion's solutions.",2022-03-19
271,"Shares of Allegion PLC inched 0.30% higher to $118.14 Friday, on what proved to be an all-around great trading session for the stock market, with the S&P 500...",2022-03-18
272,"Shares of Allegion PLC rallied 1.16% to $117.79 Thursday, on what proved to be an all-around favorable trading session for the stock market, with the S&P 500...",2022-03-17
273,Allegion (ALLE) reported earnings 30 days ago. What's next for the stock? We take a look at earnings estimates for some clues.,2022-03-17
274,"Global Industrials Confer... MTUAY, ROK, J, HON, TT, CARR, AZPN, ETN, FTV, UPS, ALLE",2022-03-17
275,"Shares of Allegion PLC rallied 1.72% to $116.44 Wednesday, on what proved to be an all-around great trading session for the stock market, with the S&P 500...",2022-03-16
276,"Global Industrials Confer... MTUAY, ROK, J, HON, TT, CARR, AZPN, ETN, FTV, UPS, ALLE",2022-03-16
277,"Shares of Allegion PLC advanced 2.63% to $114.47 Tuesday, on what proved to be an all-around positive trading session for the stock market, with the S&P 500...",2022-03-15
278,"Allegion US, a leading provider of security products and solutions, announced today that the Schlage® MTB mobile enabled multi-technology readers have been tested and verified to meet the Security Industry Association (SIA) Open Supervised Device Protocol (OSDP) communications standard for access control security and interoperability. The distinguished OSDP Verified mark confirms the range's higher security, interoperability and advanced functionality, which instills confidence in integrators, s",2022-03-15
279,"Global Industrials Confer... MTUAY, ROK, J, HON, TT, CARR, AZPN, ETN, FTV, UPS, ALLE",2022-03-15
280,"Looking at the underlying holdings of the ETFs in our coverage universe at ETF Channel, we have compared the trading price of each holding against the average analyst 12-month forward target price, and computed the weighted average implied analyst target price for the ETF itsel",2022-03-15
281,"Shares of Allegion PLC inched 0.57% higher to $111.95 Monday, on what proved to be an all-around mixed trading session for the stock market, with the Dow...",2022-03-14
282,Netflix's stock has now given up all its pandemic gains. Shares were down more than 50% since their mid-November high.,2022-03-14
283,"Looking today at week-over-week shares outstanding changes among the universe of ETFs covered at ETF Channel, one standout is the SPDR S&P Homebuilders ETF (Symbol: XHB) where we have detected an approximate $211.0 million dollar inflow -- that's a 12.6% increase week over",2022-03-14
284,"China's latest Covid outbreak is prompting a round of business restrictions, while Russian and Ukrainian officials held another peace discussion.",2022-03-14
285,"A weekly summary of dividend activity for Dividend Champions, Contenders, and Challengers. Companies which changed their dividends. Companies with upcoming ex-dividend dates.",2022-03-13
286,All stocks have at least 5 fiscal years of dividend growth history and come from U.S. Dividend Champions List. See the list of 36 dividend increases here.,2022-03-10
287,"Shares of Allegion PLC rose 2.79% to $114.54 Wednesday, on what proved to be an all-around positive trading session for the stock market, with the S&P 500...",2022-03-09
288,In this article we are going to estimate the intrinsic value of Allegion plc ( NYSE:ALLE ) by taking the expected...,2022-03-09
289,"DUBLIN, March 08, 2022--Allegion plc (NYSE: ALLE) Senior Vice President and Chief Financial Officer Mike Wagnes will discuss the company’s long-term strategy at the 2022 Bank of America Global Industrials Conference on Tuesday, March 15.",2022-03-08
