,summary,date
290,"DUBLIN - Allegion plc Senior Vice President and Chief Financial Officer Mike Wagnes will discuss the company's long-term strategy at the 2022 Bank of America Global Industrials Conference on... | March 8, 2022",2022-03-08
291,"Shares of Allegion PLC slipped 2.88% to $111.43 Tuesday, on what proved to be an all-around grim trading session for the stock market, with the S&P 500 Index...",2022-03-08
292,Researchers help explain the wide disconnect between executives and employees about their excitement to return to the office.,2022-03-08
293,"Shares of Allegion PLC slid 2.18% to $114.73 Monday, on what proved to be an all-around poor trading session for the stock market, with the S&P 500 Index...",2022-03-07
294,"""Given the circumstances on the ground, we have decided to suspend our service in Russia,"" a spokesperson said Sunday afternoon.",2022-03-06
295,"Shares of Allegion PLC dropped 0.36% to $117.29 Friday, on what proved to be an all-around rough trading session for the stock market, with the S&P 500 Index...",2022-03-04
296,Disney announced a new ad-supported tier for its Disney+ streaming service on Friday.,2022-03-04
297,Batman has been a staple on the big screen since Tim Burton's 1989 superhero film. A look at how past Batman films have fared at the global box office.,2022-03-03
298,"Shares of Allegion PLC inched 0.29% higher to $117.71 Thursday, on what proved to be an all-around rough trading session for the stock market, with the S&P...",2022-03-03
299,"Shares of Allegion PLC rallied 2.39% to $117.37 Wednesday, on what proved to be an all-around favorable trading session for the stock market, with the S&P...",2022-03-02
300,"Monthly update of the Dividend Champions List. 139 companies declared higher dividends in the past month, with an average increase of 10.54% over their previous payouts.",2022-03-02
301,"Shares of Allegion PLC inched 0.10% higher to $114.63 Tuesday, on what proved to be an all-around poor trading session for the stock market, with the S&P 500...",2022-03-01
302,"Disney, Sony and Warner Bros. have halted future theatrical film releases in Russia following the country's attack on Ukraine. ",2022-02-28
303,"Shares of Allegion PLC slumped 0.50% to $114.52 Monday, on what proved to be an all-around poor trading session for the stock market, with the S&P 500 Index...",2022-02-28
304,"Shares of Allegion PLC rallied 3.04% to $115.10 Friday, on what proved to be an all-around great trading session for the stock market, with the S&P 500 Index...",2022-02-25
305,Dave Petratis boosted wages for his U.S. factory workforce in December - six months ahead of schedule for normal annual increases.,2022-02-25
306,"After initially shutting down factories and stores, the pandemic sparked demand for goods as home-bound consumers funneled stimulus money into shopping sprees rather than trips and dining out.",2022-02-25
307,"Shares of Allegion PLC advanced 1.95% to $111.70 Thursday, on what proved to be an all-around positive trading session for the stock market, with the S&P 500...",2022-02-24
308,"It was a strong quarter for Disney, HBO Max and Paramount+ as streaming leader Netflix acknowledged competition may be hurting its growth on the margins.",2022-02-24
309,"Shares of Allegion PLC slipped 3.48% to $109.56 Wednesday, on what proved to be an all-around rough trading session for the stock market, with the S&P 500...",2022-02-23
310,"The DividendRank formula at Dividend Channel ranks a coverage universe of thousands of dividend stocks, according to a proprietary formula designed to identify those stocks that combine two important characteristics — strong fundamentals and a valuation that looks inexpen",2022-02-23
311,"The recent market dip was felt most by stocks with high multiples, including Allegion. Read why Allegion is definitely a hold and potentially a buy on any dip.",2022-02-23
312,"Shares of Allegion PLC shed 0.54% to $113.51 Tuesday, on what proved to be an all-around dismal trading session for the stock market, with the S&P 500 Index...",2022-02-22
313,"Shares of Allegion PLC shed 0.40% to $114.13 Friday, on what proved to be an all-around poor trading session for the stock market, with the S&P 500 Index...",2022-02-18
314,"Shares of Allegion PLC shed 0.56% to $114.59 Thursday, on what proved to be an all-around dismal trading session for the stock market, with the S&P 500 Index...",2022-02-17
315,I provided predictions for 19 dividend growth companies in January. Read on for my February list of another 14 dividend growth companies that includes Walmart.,2022-02-17
316,"Analysts lowered the price target for Allegion PLC (NYSE: ALLE) post Q4 results. Mizuho analyst Brett Linzey lowered the price target to $145 (an upside of 26.7%) from $170 and maintained a Buy rating on the shares post the Q4 results. Linzey mentions Allegion's Q4 operational results were modestly ahead of expectations, with Americas driving the outperformance. Related: Allegion Q4 Results Surpass Expectation; Names Michael Wagnes As Finance Chief Morgan Stanley analyst Joshua Pokrzywinski redu",2022-02-16
317,"Shares of Allegion PLC slipped 1.58% to $115.24 Wednesday, on what proved to be an all-around mixed trading session for the stock market, with the S&P 500...",2022-02-16
318,Wells Fargo analyst Josep... ALLE,2022-02-16
319,Mizuho analyst Brett Linz... ALLE,2022-02-16
320,Credit Suisse analyst Joh... ALLE,2022-02-16
321,"Shares of Allegion PLC slid 1.05% to $117.09 Tuesday, on what proved to be an all-around favorable trading session for the stock market, with the S&P 500...",2022-02-15
322,"Allegion's (ALLE) Q4 earnings reflect the impacts of supply-chain restrictions, shortages of components, high costs and expenses, and effective pricing. It predicts y/y growth in 2022 earnings.",2022-02-15
323,"Allegion (ALLE) delivered earnings and revenue surprises of 11% and 4.85%, respectively, for the quarter ended December 2021. Do the numbers hold clues to what lies ahead for the stock?",2022-02-15
324,The following slide deck was published by Allegion plc in conjunction with their 2021 Q4 earnings call.,2022-02-15
325,"Allegion plc (NYSE:ALLE) Q4 2021 Earnings Conference Call February 15, 2022 8:00 A.M.",2022-02-15
326,"Shares of Allegion PLC were indicated up more than 8% in premarket trading Tuesday, after the security products and locks company reported fourth-quarter profit and revenue that beat expectations, as continued strong end-market demand helped offset supply-chain challenges. Net income rose to $112.7 million, or $1.26 a share, from $93.3 million, or $1.01 a share, in the year-ago period. Excluding nonrecurring items, adjusted earnings per share of $1.11 beat the FactSet consensus of $1.02. Revenue",2022-02-15
327,"DUBLIN, February 15, 2022--Allegion plc (NYSE: ALLE), a leading global provider of security products and solutions, today reported fourth-quarter 2021 net revenues of $709.2 million and net earnings of $112.7 million, or $1.26 per share. Excluding charges related to restructuring, acquisition and integration, debt refinancing and a non-cash investment gain, adjusted net earnings were $99.7 million, or $1.11 per share, down 25.5 percent when compared with fourth-quarter 2020 adjusted EPS of $1.49",2022-02-15
328,"DUBLIN, February 15, 2022--Allegion plc (NYSE: ALLE), a leading global provider of security products and solutions, today announced the appointment of Michael (Mike) Wagnes, as senior vice president and chief financial officer (CFO), effective March 1, 2022. He succeeds Patrick Shannon in that role, who has announced plans to retire by Sept. 2, 2022 and will serve as an advisor during the transition.",2022-02-15
329,"The following Management's Discussion and Analysis of Financial Condition andResults of Operations contains forward-looking statements that involve risks anduncertainties. Our actual results may... | February 15, 2022",2022-02-15
330,"InvestorPlace - Stock Market News, Stock Advice & Trading Tips",2022-02-15
331,"(RTTNews) - Allegion (ALLE) will host a conference call at 8:00 AM ET on Feb. 15, 2022, to discuss Q4 21 earnings results.",2022-02-15
332,"Allegion Announces Senior Leadership Appointments and CFO Retirement Experienced Leaders Named to Support Business Growth Michael Wagnes... | February 15, 2022",2022-02-15
333,"Item 5.02 Departure of Directors or Certain Officers; Election of Directors; Appointment of Certain Officers; Compensatory Arrangements of Certain OfficersOn February 15,... | February 15, 2022",2022-02-15
334,"Allegion plc , a leading global provider of security products and solutions, today reported fourth-quarter 2021 net revenues of $709.2 million and net earnings of $112.7 million, or $1.26 per share.... | February 15, 2022",2022-02-15
335,"(RTTNews) - Security products and solutions provider Allegion plc (ALLE), while announcing fourth-quarter results on Tuesday, said it expects fiscal 2022 earnings per share to be in the range of $5.50 to $5.70, and adjusted earnings per share in the $5.55 to $5.75 range.",2022-02-15
336,"By Colin Kellaher Allegion PLC on Tuesday said Patrick Shannon, who has served as senior vice president and chief financial officer since the company's...",2022-02-15
337,"DUBLIN _ Allegion PLC on Tuesday reported fourth-quarter earnings of $112.7 million. On a per-share basis, the Dublin-based company said it had profit of $1.26. Earnings, adjusted... | February 15, 2022",2022-02-15
338,Allegion announced the ap... ALLE,2022-02-15
339,Sees FY22 revenue up 6%-7... ALLE,2022-02-15
340,Reports Q4 revenue $709.2... ALLE,2022-02-15
341,"Shares of Allegion PLC sank 0.45% to $118.33 Monday, on what proved to be an all-around grim trading session for the stock market, with the S&P 500 Index...",2022-02-14
342,"The following companies are expected to report earnings prior to market open on 02/15/2022.  Visit our Earnings Calendar for a full list of expected earnings releases.Zoetis Inc. (ZTS)is reporting for the quarter ending December 31, 2021. The drug company's consensus earnings per",2022-02-14
343,"Allegion's (ALLE) Q4 earnings are likely to have gained from the solid residential and non-residential business momentum, and acquired assets. Supply-chain issues are likely to have been spoilsports.",2022-02-11
344,"Looking at the underlying holdings of the ETFs in our coverage universe at ETF Channel, we have compared the trading price of each holding against the average analyst 12-month forward target price, and computed the weighted average implied analyst target price for the ETF itsel",2022-02-11
345,"DUBLIN, February 10, 2022--Allegion plc (NYSE: ALLE) Chairman, President and CEO David D. Petratis will discuss the company’s long-term strategy at the 2022 Barclays’ Industrial Select Conference on Thursday, Feb. 24. The conference will be held at the Loews Miami Beach Hotel in Miami Beach, FL.",2022-02-10
346,"Allegion plc Chairman, President and CEO David D. Petratis will discuss the company’s long-term strategy at the 2022 Barclays’ Industrial Select Conference on Thursday, Feb. 24. The... | February 10, 2022",2022-02-10
347,"Shares of Allegion PLC shed 3.59% to $120.69 Thursday, on what proved to be an all-around rough trading session for the stock market, with the S&P 500 Index...",2022-02-10
348,Allegion plc ( NYSE:ALLE ) will increase its dividend on the 31st of March to US$0.41. Based on the announced payment...,2022-02-10
349,Analysts across Wall Street sang the praises of Disney after a quarterly print showing a stunning recovery in its parks business.,2022-02-10
350,"Allegion plc (NYSE:ALLE) will increase its dividend on the 31st of March to US$0.41.       This takes the annual payment to 1.2% of the current stock price, which is about average for the industry.",2022-02-10
351,"Shares of Allegion PLC rallied 2.84% to $125.18 Wednesday, on what proved to be an all-around positive trading session for the stock market, with the S&P 500...",2022-02-09
352,"The Super Bowl commercial is part of Tonal's broader ""Strength Made Me"" campaign, which celebrates women being strong both physically and mentally. ",2022-02-09
353,Allegion (ALLE) doesn't possess the right combination of the two key ingredients for a likely earnings beat in its upcoming report. Get prepared with the key expectations.,2022-02-08
354,"Shares of Allegion PLC advanced 1.05% to $121.72 Tuesday, on what proved to be an all-around favorable trading session for the stock market, with the S&P 500...",2022-02-08
355,"Investment company Tesco Pension Investment Ltd (Current Portfolio) buys Netflix Inc, Nike Inc, Salesforce.com Inc, PerkinElmer Inc, Allegion PLC, sells Fiserv Inc, Medtronic PLC, Aon PLC, Ryanair Holdings PLC, Aeva Technologies Inc during the 3-months ended 2021Q4, according to the most recent filings of the investment company, Tesco Pension Investment Ltd.",2022-02-07
356,"Investment company TPI Fund Managers Ltd (Current Portfolio) buys Netflix Inc, Nike Inc, PerkinElmer Inc, Salesforce.com Inc, Allegion PLC, sells Fiserv Inc, Medtronic PLC, Aon PLC, Ryanair Holdings PLC, Union Pacific Corp during the 3-months ended 2021Q4, according to the most recent filings of the investment company, TPI Fund Managers Ltd.",2022-02-07
357,"The latest 13F reporting period has come and gone, and Insider Monkey is again at the forefront when it comes to making use of this gold mine of data. We at Insider Monkey have plowed through 867 13F filings that hedge funds and well-known value investors are required to file by the SEC. The 13F […]",2022-02-07
358,"Shares of Allegion PLC advanced 1.01% to $120.46 Monday, on what proved to be an all-around mixed trading session for the stock market, with the Dow Jones...",2022-02-07
359,Allegion (ALLE) to reward shareholders with hiked quarterly dividend payments. The decision of the incremental rewards is in sync with the company's sound capital allocation policies.,2022-02-07
360,,2022-02-07
361,,2022-02-07
362,,2022-02-07
363,"Let's talk about the popular Allegion plc (NYSE:ALLE). The company's shares     saw significant share price movement during recent months on the NYSE, rising to highs of US$136 and falling to the lows of US$116. Some share price movements can give investors a better opportunity",2022-02-07
364,A weekly summary of dividend activity for Dividend Challengers. Companies which changed their dividends. Companies with upcoming ex-dividend dates.,2022-02-06
365,"DUBLIN, February 04, 2022--Allegion plc (NYSE: ALLE), a leading global security products and solutions provider, today announced that its board of directors declared a quarterly dividend of $0.41 per ordinary share of the company – representing a 14-percent increase from 2021 and the company’s eighth consecutive year of annual increase in dividends.",2022-02-04
366,By Stephen Nakrosis Allegion PLC on Friday said its board increased the company's quarterly dividend by 14%. The new dividend of 41 cents a share will be...,2022-02-04
367,"Allegion plc , a leading global security products and solutions provider, today announced that its board of directors declared a quarterly dividend of $0.41 per ordinary share of the company –... | February 4, 2022",2022-02-04
368,"Shares of Allegion PLC rose 2.70% to $119.25 Friday, on what proved to be an all-around mixed trading session for the stock market, with the S&P 500 Index...",2022-02-04
369,"Assa Abloy, the world's biggest lockmaker, reported better than expected fourth-quarter profit growth on Friday, as price hikes and stronger demand helped mitigate continued pandemic-related supply chain challenges.",2022-02-04
370,"Assa Abloy, the world's biggest lockmaker, reported slightly better than expected fourth-quarter profit growth on Friday as stronger demand helped mitigate continued pandemic-related supply chain challenges.",2022-02-04
371,Allegion announced that i... ALLE,2022-02-04
372,"Shares of Allegion PLC slid 3.39% to $116.11 Thursday, on what proved to be an all-around dismal trading session for the stock market, with the S&P 500 Index...",2022-02-03
373,"Shares of Allegion PLC inched 0.15% higher to $120.18 Wednesday, on what proved to be an all-around positive trading session for the stock market, with the...",2022-02-02
374,"New York, NY, based Investment company Oppenheimer & Co Inc (Current Portfolio) buys Canadian Pacific Railway, VanEck Vectors Fallen Angel High Yield Bond ETF, Invesco Total Return Bond ETF, SPDR Retail ETF, Allstate Corp, sells SPDR Bloomberg High Yield Bond ETF, Vanguard Short-Term Corporate Bond ETF, SPDR Portfolio TIPS ETF, , Alibaba Group Holding during the 3-months ended 2021Q4, according to the most recent filings of the investment company, Oppenheimer & Co Inc.",2022-02-02
375,,2022-02-02
376,"Shares of Allegion PLC slid 2.22% to $120.00 Tuesday, on what proved to be an all-around positive trading session for the stock market, with the S&P 500...",2022-02-01
377,Bud Light Seltzer is hoping that a Super Bowl ad starring celebrity chef Guy Fieri will help jump-start sales of its new hard soda line.,2022-02-01
378,"Shares of Allegion PLC advanced 1.25% to $122.73 Monday, on what proved to be an all-around great trading session for the stock market, with the S&P 500...",2022-01-31
379,Several mega-cap stocks will announce modest increases to the annual dividends in the first half of February. Check out those stocks.,2022-01-31
380,"Get ahead of the market by subscribing to Seeking Alpha's Stocks to Watch, a preview of key events scheduled for the coming week",2022-01-29
381,Investors' sudden change of heart on Netflix puts entire streaming wars narrative into question for 2022.,2022-01-29
382,"Shares of Allegion PLC inched 0.58% higher to $121.21 Friday, on what proved to be an all-around great trading session for the stock market, with the S&P 500...",2022-01-28
383,The Federal Communications Commission does not yet have the majority it would need to reinstate net neutrality on the federal level.,2022-01-28
384,"Shares of Allegion PLC inched 0.10% higher to $120.51 Thursday, on what proved to be an all-around rough trading session for the stock market, with the S&P...",2022-01-27
385,"Casey Newton, The Platformer editor and CNBC contributor, joins 'Power Lunch' to discuss the streaming landscape and recent developments in the space.",2022-01-27
386,Dow futures turned positive Thursday after falling more than 500 points overnight.,2022-01-27
387,Dow futures turned positive Thursday after falling more than 500 points overnight as the market's recent volatility persisted.,2022-01-27
388,"Lake Oswego, OR, based Investment company Northwest Investment Counselors, Llc (Current Portfolio) buys Becton, Dickinson and Co, Allegion PLC, Euronet Worldwide Inc, CSX Corp, Astec Industries Inc, sells iShares MSCI Intl Value Factor ETF during the 3-months ended 2021Q4, according to the most recent filings of the investment company, Northwest Investment Counselors, Llc.",2022-01-26
389,"Plymouth, MI, based Investment company Jlb & Associates Inc (Current Portfolio) buys KLA Corp, Target Corp, Gentex Corp, Allegion PLC, The Hershey Co, sells Global Payments Inc, Cracker Barrel Old Country Store Inc, Polaris Inc, C.H.",2022-01-26
390,"Shares of Allegion PLC slid 0.24% to $120.39 Wednesday, on what proved to be an all-around poor trading session for the stock market, with the S&P 500 Index...",2022-01-26
391,,2022-01-26
392,,2022-01-26
393,"Shares of Allegion PLC slid 2.32% to $120.68 Tuesday, on what proved to be an all-around grim trading session for the stock market, with the S&P 500 Index...",2022-01-25
394,"Shares of Allegion PLC rallied 1.87% to $123.55 Monday, on what proved to be an all-around favorable trading session for the stock market, with the S&P 500...",2022-01-24
395,Netflix tumbled for a second day on Monday after the company's weaker-than-expected subscriber forecast. ,2022-01-24
396,These are the stocks posting the largest moves in midday trading. ,2022-01-24
397,CNBC's Julia Boorstin reports on legal media companies which are ticking higher despite a broader sell-off. (Comcast is CNBC's parent company.),2022-01-24
398,U.S. stock futures indicated more losses to start the new week following the Nasdaq's and the S&P 500's worst weeks since March 2020.,2022-01-24
399,"The stocks making the biggest moves in premarket trading include Kohl's, Snap, Peloton, and more.",2022-01-24
400,"Microsoft, Tesla and Apple will release quarterly results, alongside a handful of other tech firms. McDonald's and Boeing will also offer updates.",2022-01-23
401,"Shares of Allegion PLC inched 0.44% higher to $121.28 Friday, on what proved to be an all-around grim trading session for the stock market, with the S&P 500...",2022-01-21
402,"The Federal Reserve's meeting trumps everything else for markets in the week ahead, as investors await any new clues on its plans to raise interest rates.",2022-01-21
403,"Investors in Allegion plc (Symbol: ALLE) saw new options begin trading this week, for the September 16th expiration.  One of the key inputs that goes into the price an option buyer is willing to pay, is the time value, so with 238 days until expiration the newly trading contrac",2022-01-21
404,"Stockholm, V7, based Investment company Nordea Investment Management Ab (Current Portfolio) buys Coca-Cola Co, Walmart Inc, Packaging Corp of America, International Paper Co, Medtronic PLC, sells AutoZone Inc, International Business Machines Corp, AT&T Inc, McKesson Corp, Pentair PLC during the 3-months ended 2021Q4, according to the most recent filings of the investment company, Nordea Investment Management Ab.",2022-01-20
405,"Netflix added a line in its quarterly shareholder letter acknowledging streaming competition is affecting its ""marginal growth.""",2022-01-20
406,"Shares of Allegion PLC slipped 1.77% to $120.75 Thursday, on what proved to be an all-around dismal trading session for the stock market, with the S&P 500...",2022-01-20
407,"For beginners, it can seem like a good idea (and an exciting prospect) to buy a company that tells a good story to investors, even if it completely lacks a track record of revenue and profit.  But as Peter Lynch said in One Up On Wall Street, 'Long shots almost never pay off.'",2022-01-20
408,"Shares of Allegion PLC slid 0.77% to $122.93 Wednesday, on what proved to be an all-around grim trading session for the stock market, with the S&P 500 Index...",2022-01-19
409,"Allegion's global manufacturing experience spans decades and geographies.Across the globe, Allegion's family of brands has been pioneering safety solutions to keep the places where we work, live and... | January 19, 2022",2022-01-19
410,"DUBLIN, January 18, 2022--Allegion plc (NYSE: ALLE), a leading global security products and solutions provider, will release its 2021 fourth-quarter and full-year financial results on Tuesday, Feb. 15, 2022, before the market opens.",2022-01-18
411,"Investment company Applied Capital LLC (Current Portfolio) buys Dimensional World ex U.S. Core Equity 2 ETF, Dimensional International Value ETF, Vanguard Ultra-Short Bond ETF, Dimensional Core Fixed Income ETF, Allegion PLC, sells Avantis Core Fixed Income ETF, PowerShares QQQ Trust Ser 1, Verizon Communications Inc during the 3-months ended 2021Q4, according to the most recent filings of the investment company, Applied Capital LLC.",2022-01-18
412,"DUBLIN - Allegion plc , a leading global security products and solutions provider, will release its 2021 fourth-quarter and full-year financial results on Tuesday, Feb. 15, 2022, before the... | January 18, 2022",2022-01-18
413,"Shares of Allegion PLC slumped 0.46% to $123.89 Tuesday, on what proved to be an all-around rough trading session for the stock market, with the S&P 500...",2022-01-18
414,,2022-01-18
415,Microsoft takes big $68.7 billion swing on video game company Activision Blizzard while legacy media stays on sidelines,2022-01-18
416,"Allegion (ALLE) stands to benefit from strength across its businesses, acquired assets, pricing and productivity initiatives and shareholder-friendly policies.",2022-01-17
417,"Shares of Allegion PLC shed 1.32% to $124.46 Friday, on what proved to be an all-around mixed trading session for the stock market, with the S&P 500 Index...",2022-01-14
418,President Biden urged companies to voluntarily impose Covid vaccination rules on workers after the Supreme Court blocked a government order to do that.,2022-01-13
419,"Shares of Allegion PLC slipped 1.14% to $126.12 Thursday, on what proved to be an all-around rough trading session for the stock market, with the S&P 500...",2022-01-13
420,"Shares of Allegion PLC shed 0.02% to $127.58 Wednesday, on what proved to be an all-around positive trading session for the stock market, with the S&P 500...",2022-01-12
421,Two of Sen. Kyrsten Sinema's former aides have become key aides for corporate giants looking to impact President Joe Biden's agenda. ,2022-01-11
422,"Shares of Allegion PLC rose 2.01% to $127.61 Tuesday, on what proved to be an all-around favorable trading session for the stock market, with the S&P 500...",2022-01-11
423,"Shares of Allegion PLC shed 1.22% to $125.09 Monday, on what proved to be an all-around grim trading session for the stock market, with the S&P 500 Index...",2022-01-10
424,Former aides to Sen. Joe Manchin who are now lobbyists are scoring big clients as their ex-boss battles President Biden's agenda,2022-01-10
425,"Looking at the underlying holdings of the ETFs in our coverage universe at ETF Channel, we have compared the trading price of each holding against the average analyst 12-month forward target price, and computed the weighted average implied analyst target price for the ETF itsel",2022-01-10
426,"Shares of Allegion PLC slid 1.12% to $126.63 Friday, on what proved to be an all-around dismal trading session for the stock market, with the S&P 500 Index...",2022-01-07
