,summary,date
0,"Shares of Allegion PLC slipped 1.20% to $91.10 Tuesday, on what proved to be an all-around dismal trading session for the stock market, with the S&P 500...",2022-09-20
1,"Shares of Allegion PLC rallied 2.81% to $92.21 Monday, on what proved to be an all-around great trading session for the stock market, with the S&P 500 Index...",2022-09-19
2,"Shares of Allegion PLC slid 3.71% to $89.69 Friday, on what proved to be an all-around grim trading session for the stock market, with the S&P 500 Index...",2022-09-16
3,"Shares of Allegion PLC slid 1.68% to $93.15 Thursday, on what proved to be an all-around dismal trading session for the stock market, with the S&P 500 Index...",2022-09-15
4,"Shares of Allegion PLC shed 0.77% to $95.15 Wednesday, on what proved to be an all-around positive trading session for the stock market, with the S&P 500...",2022-09-14
5,"Shares of Allegion PLC slid 5.26% to $95.89 Tuesday, on what proved to be an all-around grim trading session for the stock market, with the S&P 500 Index...",2022-09-13
6,"Shares of Allegion PLC rallied 1.59% to $101.21 Monday, on what proved to be an all-around favorable trading session for the stock market, with the S&P 500...",2022-09-12
7,"Allegion plc ( NYSE:ALLE ) stock is about to trade ex-dividend in three days. Typically, the ex-dividend date is one...",2022-09-11
8,"Weekly summary of dividend activity for Dividend Champions, Contenders, Challengers. Check here to see companies with upcoming ex-dividend dates and upcoming pay dates.",2022-09-11
9,"Shares of Allegion PLC advanced 1.51% to $99.63 Friday, on what proved to be an all-around favorable trading session for the stock market, with the S&P 500...",2022-09-09
10,"Shares of Allegion PLC inched 0.15% higher to $98.15 Thursday, on what proved to be an all-around favorable trading session for the stock market, with the...",2022-09-08
11,"Shares of Allegion PLC rose 3.55% to $98.00 Wednesday, on what proved to be an all-around positive trading session for the stock market, with the S&P 500...",2022-09-07
12,"Shares of Allegion PLC slipped 0.88% to $94.89 Friday, on what proved to be an all-around dismal trading session for the stock market, with the S&P 500 Index...",2022-09-02
13,"DUBLIN, September 01, 2022--Allegion plc (NYSE: ALLE), a leading global security products and solutions provider, today announced that its board of directors declared a quarterly dividend of $0.41 per ordinary share of the company.",2022-09-01
14,"Shares of Allegion PLC inched 0.66% higher to $95.73 Thursday, on what proved to be an all-around great trading session for the stock market, with the S&P...",2022-09-01
15,"Security door and lock maker Allegion (NYSE: ALLE) and industrial conglomerates Honeywell International (NASDAQ: HON) and Roper Technologies (NYSE: ROP) are not the first companies that spring to investors' minds when thinking about technology companies.  The industrial giant's management intends to become a ""software industrial"".  It wants to get there by the continued rollout of its analytical software platform, Honeywell Forge.",2022-09-01
16,"Shares of Allegion PLC shed 1.64% to $95.10 Wednesday, on what proved to be an all-around rough trading session for the stock market, with the S&P 500 Index...",2022-08-31
17,"Shares of Allegion PLC slipped 0.03% to $96.69 Tuesday, on what proved to be an all-around grim trading session for the stock market, with the S&P 500 Index...",2022-08-30
18,"Allegion (ALLE) is benefiting from robust end-market demand, acquisitions and shareholder-friendly actions.",2022-08-29
19,"Shares of Allegion PLC dropped 0.96% to $96.72 Monday, on what proved to be an all-around grim trading session for the stock market, with the S&P 500 Index...",2022-08-29
20,"Shares of Allegion PLC slipped 5.48% to $97.66 Friday, on what proved to be an all-around poor trading session for the stock market, with the S&P 500 Index...",2022-08-26
21,BRC vs. ALLE: Which Stock Is the Better Value Option?,2022-08-26
22,"Shares of Allegion PLC rallied 1.42% to $103.32 Thursday, on what proved to be an all-around great trading session for the stock market, with the S&P 500...",2022-08-25
23,"Shares of Allegion PLC sank 0.05% to $101.87 Wednesday, on what proved to be an all-around great trading session for the stock market, with the S&P 500 Index...",2022-08-24
24,"Shares of Allegion PLC shed 1.18% to $101.92 Tuesday, on what proved to be an all-around rough trading session for the stock market, with the S&P 500 Index...",2022-08-23
25,"Shares of Allegion PLC slid 3.11% to $103.14 Monday, on what proved to be an all-around grim trading session for the stock market, with the S&P 500 Index...",2022-08-22
26,"Staff article entitled First Week of October 21st Options Trading For Allegion, about stock options, from Stock Options Channel.",2022-08-22
27,"Shares of Allegion PLC shed 2.44% to $106.45 Friday, on what proved to be an all-around grim trading session for the stock market, with the S&P 500 Index...",2022-08-19
28,"Shares of Allegion PLC inched 0.50% higher to $109.11 Thursday, on what proved to be an all-around positive trading session for the stock market, with the...",2022-08-18
29,"Shares of Allegion PLC inched 0.10% higher to $108.57 Wednesday, on what proved to be an all-around rough trading session for the stock market, with the S&P...",2022-08-17
30,"Shares of Allegion PLC advanced 1.18% to $108.46 Tuesday, on what proved to be an all-around favorable trading session for the stock market, with the S&P 500...",2022-08-16
31,Today we'll do a simple run through of a valuation method used to estimate the attractiveness of Allegion plc...,2022-08-16
32,"Shares of Allegion PLC inched 0.74% higher to $107.20 Monday, on what proved to be an all-around positive trading session for the stock market, with the S&P...",2022-08-15
33,Intelligent Living Application sells locksets and is only in the process of developing smart locksets only now. Read what investors should know about ILAG.,2022-08-11
34,BRC vs. ALLE: Which Stock Is the Better Value Option?,2022-08-10
35,"Shares of Allegion PLC dropped 0.28% to $103.24 Thursday, on what proved to be an all-around dismal trading session for the stock market, with the S&P 500...",2022-08-04
36,"Shares of Allegion PLC inched 0.77% higher to $103.53 Wednesday, on what proved to be an all-around favorable trading session for the stock market, with the...",2022-08-03
37,"Shares of Allegion PLC slid 2.50% to $102.74 Tuesday, on what proved to be an all-around grim trading session for the stock market, with the S&P 500 Index...",2022-08-02
38,"Shares of Allegion PLC shed 0.31% to $105.37 Monday, on what proved to be an all-around dismal trading session for the stock market, with the S&P 500 Index...",2022-08-01
39,Wells Fargo analyst Joe O&#8217;Dea  m...,2022-08-01
40,Robert W. Baird analyst Timothy Wojs</a...,2022-07-31
41,"In a report issued on July 28, Brett Li...",2022-07-31
42,The following slide deck was published by Allegion plc in conjunction with their 2022 Q2 earnings call.,2022-07-30
43,"Allegion plc (NYSE:NYSE:ALLE) Q2 2022 Earnings Conference Call July 28, 2022 8:00 A.M.",2022-07-30
44,"Shares of Allegion PLC rallied 1.33% to $105.70 Friday, on what proved to be an all-around positive trading session for the stock market, with the S&P 500...",2022-07-29
45,Analysts have been eager to weigh in on the Industrial Goods sector with new ratings on Integer Holdings (<span class='tr-stock-ticker' style='color:blue; font-weig...,2022-07-29
46,Allegion's (ALLE) Q2 earnings results reflect gains from the solid performance of its Allegion Americas segment.,2022-07-28
47,These are the stocks posting the largest moves in midday trading. ,2022-07-28
48,"Allegion (ALLE) delivered earnings and revenue surprises of 3.01% and 0.36%, respectively, for the quarter ended June 2022. Do the numbers hold clues to what lies ahead for the stock?",2022-07-28
49,"DUBLIN, July 28, 2022--Allegion plc (NYSE: ALLE), a leading global provider of security products and solutions, today reported second-quarter 2022 net revenues of $773.1 million and net earnings of $115.1 million, or $1.30 per share. Excluding charges related to restructuring, acquisition and integration expenses, debt financing, as well as non-operating investment gains, adjusted net earnings were $121.1 million, or $1.37 per share, up 3.8 percent when compared with second-quarter 2021 adjusted",2022-07-28
50,"CNBC's 'Squawk Box' team breaks down the latest earnings results from Comcast, which beat analysts' expectations on the top and bottom lines.",2022-07-28
51,"The stocks making the biggest moves in premarket trading include Stanley Black & Decker, Southwest Airlines, Harley-Davidson, and more.",2022-07-28
52,Comcast beat revenue and profit estimates but failed to deliver broadband subscriber growth. Peacock subscriber numbers were also flat.,2022-07-28
53,"Allegion plc , a leading global provider of security products and solutions, today reported second-quarter 2022 net revenues of $773.1 million and net earnings of $115.1 million, or $1.30 per share.... | July 28, 2022",2022-07-28
54,"The following Management's Discussion and Analysis of Financial Condition andResults of Operations contains forward-looking statements that involve risks anduncertainties. Our actual results may... | July 28, 2022",2022-07-28
55,"Item 2.02 Results of Operations and Financial ConditionOn July 28, 2022, Allegion plc issued a press release announcingits second quarter 2022 results. The information in this Form 8-K and... | July 28, 2022",2022-07-28
56,"DUBLIN _ Allegion PLC on Thursday reported second-quarter profit of $115.1 million. On a per-share basis, the Dublin-based company said it had profit of $1.30. Earnings, adjusted... | July 28, 2022",2022-07-28
57,Consensus $5.60. Raises F... ALLE,2022-07-28
58,Reports Q2 revenue $773.1... ALLE,2022-07-28
59,Allegion (ALLE) has an impressive earnings surprise history and currently possesses the right combination of the two key ingredients for a likely beat in its next quarterly report.,2022-07-26
60,WWE can either move forward with sale discussions or take the business in new creative directions as Vince McMahon retires from his executive roles.,2022-07-26
61,BRC vs. ALLE: Which Stock Is the Better Value Option?,2022-07-25
62,The beginning of every month is exciting for all dividend income investors as we look back at the previous month and see how much passive dividend income our portfolios generated.,2022-07-22
63,"There's a head spinning amount of news for markets to navigate in the week ahead, the biggest of which will be the Federal Reserve's mid-week meeting.",2022-07-22
64,"Gains from non-residential businesses are likely to have aided Allegion's (ALLE) Q2 performance amid adversities from labor shortages, material and freight-related cost inflation.",2022-07-20
65,"Assa Abloy, the world's biggest lockmaker, on Tuesday reported second-quarter operating earnings above expectations, helped by sales growth in Europe and the Americas.",2022-07-19
66,Baird analyst Timothy Woj... ALLE,2022-07-18
67,Mizuho analyst Brett Linz... ALLE,2022-07-18
68,"""Knock at the Cabin,"" a new film by director M. Night Shyamalan, is the first adaptation of one of Paul Tremblay's horror novels.",2022-07-16
69,"Shares of Allegion PLC rose 1.47% to $97.01 Friday, on what proved to be an all-around favorable trading session for the stock market, with the S&P 500 Index...",2022-07-15
70,"Ride-related injuries dropped by more than 60% between 2004 and 2019, according to the International Association of Amusement Parks and Attractions.",2022-07-15
71,"Shares of Allegion PLC inched 0.15% higher to $95.60 Thursday, on what proved to be an all-around rough trading session for the stock market, with the S&P...",2022-07-14
72,"CNBC obtained a list of nearly 20 corporations and trade groups that RSVP'd to attend a swanky, three-day retreat at the Breakers resort starting Sunday.",2022-07-14
73,"Shares of Allegion PLC slid 1.50% to $95.46 Wednesday, on what proved to be an all-around rough trading session for the stock market, with the S&P 500 Index...",2022-07-13
74,The streamer announced in April that it was planning on rolling out an ad-supported tier after years of resisting the move.,2022-07-13
75,"Shares of Allegion PLC slipped 1.00% to $96.91 Tuesday, on what proved to be an all-around grim trading session for the stock market, with the S&P 500 Index...",2022-07-12
76,"""Succession"" tops the 2022 Emmy Award nominations followed by ""Ted Lasso"" and ""The White Lotus.""",2022-07-12
77,Wells Fargo analyst Josep... ALLE,2022-07-12
78,"Moviegoers aren't just returning to cinemas, they are spending more on premium tickets and concessions.",2022-07-11
79,"Shares of Allegion PLC slumped 0.66% to $97.89 Monday, on what proved to be an all-around rough trading session for the stock market, with the S&P 500 Index...",2022-07-11
80,BofA analyst Andrew Obin ... ALLE,2022-07-11
81,BofA analyst Andrew Obin ... ALLE,2022-07-11
82,"""Thor: Love and Thunder"" tallied $143 million during its domestic debut, pushing the overall weekend haul to more than $200 million.",2022-07-10
83,"A movie industry panel discusses how it assigns ratings to newly released films, including details about what constitutes an R rating.",2022-07-09
84,"Shares of Allegion PLC slipped 2.45% to $98.54 Friday, on what proved to be an all-around rough trading session for the stock market, with the S&P 500 Index...",2022-07-08
85,Barclays analyst Julian M... ALLE,2022-07-08
86,"Shares of Allegion PLC inched 0.31% higher to $101.01 Thursday, on what proved to be an all-around favorable trading session for the stock market, with the...",2022-07-07
87,"The acquisition of Access Technologies will enable Allegion (ALLE) to enhance the latter's access, egress and access control solutions offerings.",2022-07-06
88,"Shares of Allegion PLC inched 0.29% higher to $100.70 Wednesday, on what proved to be an all-around favorable trading session for the stock market, with the...",2022-07-06
89,"In an era of flagship streaming services like Disney+ and Peacock, Hulu is caught in the middle. ",2022-07-06
90,Baird analyst Timothy Woj... ALLE,2022-07-06
91,"Shares of Allegion PLC inched 0.80% higher to $100.41 Tuesday, on what proved to be an all-around mixed trading session for the stock market, with the S&P...",2022-07-05
92,"'Minions' and 'Toy Story' are among the most popular and profitable franchises for their respective studios — so why did ""Minions"" soar and ""Lightyear"" flop?
",2022-07-05
93,"DUBLIN, July 05, 2022--Allegion plc (NYSE: ALLE), a leading global security products and solutions provider, has, through its subsidiaries, completed the previously announced acquisition of Stanley Access Technologies LLC (""Access Technologies"") and assets related to the automatic entrance solutions business from Stanley Black & Decker, Inc. (NYSE: SWK) for $900 million in cash.",2022-07-05
94,"Stanley Black & Decker (NYSE: SWK) today announced it has completed the previously announced sale of its automatic doors business, Access Technologies, to Allegion plc (NYSE: ALLE) for $900 million in cash. The after-tax proceeds will support debt reduction and partially funding the $2.3 billion share repurchase completed in the first quarter. This transaction was announced on April 22, 2022.",2022-07-05
95,It's easy to match the overall market return by buying an index fund. Active investors aim to buy stocks that vastly...,2022-07-05
96,"NEWS RELEASE Allegion Completes Acquisition of Stanley Black & Decker's Access Technologies Business DUBLIN... | July 5, 2022",2022-07-05
97,"Item 2.01. Completion of Acquisition or Disposition of AssetsOn July 5, 2022, Allegion US Holding Company Inc., a subsidiary of Allegion plc consummated the previously announcedtransactions... | July 5, 2022",2022-07-05
98,"Allegion plc , a leading global security products and solutions provider, has, through its subsidiaries, completed the previously announced acquisition of Stanley Access Technologies LLC and assets... | July 5, 2022",2022-07-05
99,"Stanley Black & Decke... SWK, ALLE",2022-07-05
100,"""Minions: The Rise of Gru"" generated more than $108 million in ticket sales during its domestic opening weekend.",2022-07-03
101,"DUBLIN, June 30, 2022--Allegion plc (NYSE: ALLE), a leading global security products and solutions provider, will release its 2022 second-quarter financial results on Thursday, July 28, 2022, before the market opens.",2022-06-30
102,Our 3-step process focuses on wide-moat stocks. We are only interested in those targets that are attractively valued in historical comparison. Read more here.,2022-06-30
103,"Lindsay (LNN) delivered earnings and revenue surprises of 45.22% and 15.28%, respectively, for the quarter ended May 2022. Do the numbers hold clues to what lies ahead for the stock?",2022-06-30
104,A publicly traded Starz may look to increase in size by targeting other subscale media and entertainment companies.,2022-06-29
105,"In a report released today, Joe O&#8217;De...",2022-06-29
106,A string of solid theatrical performances coupled with a strong slate of upcoming films has left most box office analysts optimistic.,2022-06-29
107,"A weekly summary of dividend activity for Dividend Champions, Contenders, and Challengers. Companies that changed their dividends. Companies with upcoming ex-dividend dates.",2022-06-25
108,"Shares of Allegion PLC rallied 2.88% to $99.60 Friday, on what proved to be an all-around favorable trading session for the stock market, with the S&P 500...",2022-06-24
109,"Allegion (ALLE) is witnessing weakness across its residential business, owing to supply chain challenges, electronic chip shortages, rising costs and a high debt level.",2022-06-24
110,"Shares of Allegion PLC advanced 1.42% to $96.81 Thursday, on what proved to be an all-around favorable trading session for the stock market, with the S&P 500...",2022-06-23
111,"Shares of Allegion PLC inched 0.39% higher to $95.45 Wednesday, on what proved to be an all-around grim trading session for the stock market, with the S&P...",2022-06-22
112,"Item 1.01 Entry into a Material Definitive Agreement.On June 22, 2022, Allegion US Holding Company Inc. , issued$600,000,000 aggregate principal amount of its 5.411% Senior Notes due 2032... | June 22, 2022",2022-06-22
113,"Shares of Allegion PLC shed 0.62% to $95.08 Tuesday, on what proved to be an all-around positive trading session for the stock market, with the S&P 500 Index...",2022-06-21
114,"Pixar's ""Lightyear"" rocketed to a $51 million domestic opening, the best performance of an animated feature since the pandemic began.",2022-06-19
115,"Shares of Allegion PLC slumped 0.73% to $95.67 Friday, on what proved to be an all-around mixed trading session for the stock market, with the S&P 500 Index...",2022-06-17
116,"Shares of Allegion PLC slid 4.29% to $96.37 Thursday, on what proved to be an all-around dismal trading session for the stock market, with the S&P 500 Index...",2022-06-16
117,"Shares of Allegion PLC sank 0.17% to $100.69 Wednesday, on what proved to be an all-around favorable trading session for the stock market, with the S&P 500...",2022-06-15
118,"Netflix disrupted traditional TV by releasing entire seasons of shows all at once. Now, the model is under scrutiny as the streamer deals with big losses.",2022-06-15
119,"Volatile markets cause stress for investors but also create opportunities to buy stocks with solid long-term growth prospects.  With that in mind, investors should take a closer look at security doors and locks company Allegion (NYSE: ALLE), electrical-products maker nVent Electric (NYSE: NVT), and Google owner Alphabet (NASDAQ: GOOG) (NASDAQ: GOOGL).  There are two main reasons to take advantage of the share-price dip and buy Allegion stock for the long term.",2022-06-15
120,"Shares of Allegion PLC slipped 1.79% to $101.27 Tuesday, on what proved to be an all-around poor trading session for the stock market, with the S&P 500 Index...",2022-06-14
121,"dividend channel,ALLE,",2022-06-14
122,"Shares of Allegion PLC slipped 3.73% to $103.12 Monday, on what proved to be an all-around grim trading session for the stock market, with the S&P 500 Index...",2022-06-13
123,,2022-06-13
124,"""Jurassic World: Dominion"" roared to the top of the domestic box office over the weekend, generating more than $143 million in ticket sales during its debut.",2022-06-12
125,"Click here to read the dividend activity for Dividend Champions, Contenders, and Challengers and Companies with upcoming ex-dividend dates and upcoming pay dates.",2022-06-11
126,"Allegion's (ALLE) Q1 earnings results reflect the impacts of supply-chain restrictions, high costs and expenses, shortages of components and effective pricing. Management lifts revenue view for 2022.",2022-06-10
127,"""Jurassic World: Dominion"" may score to top spot at the domestic box office this weekend, but lackluster critical reviews and word of mouth could stall its potential haul.",2022-06-09
128,Allegion (ALLE) experiences weakness across its residential business and bears a heavy tax load coupled with a high debt level.,2022-06-09
129,"Universal's ""Jurassic World: Dominion"" enters domestic theaters Friday, and it will snag the majority of premium format screens from ""Top Gun: Maverick.""",2022-06-09
130,"Ownership Submission FORM 4 Check this box if no longer... | June 8, 2022",2022-06-08
131,Allegion (ALLE) prices senior notes worth $600 million in aggregate principal amount. The net proceeds will be used to finance the buyout of Stanley Access Technologies.,2022-06-08
132,"DUBLIN, June 07, 2022--Allegion plc (NYSE: ALLE) (""Allegion"" or the ""company""), a leading global provider of security products and solutions, today announced that it priced its previously announced offering by its subsidiary, Allegion US Holding Company Inc. (""Allegion US Holding""), of $600 million aggregate principal amount of 5.411% senior notes due 2032 (the ""notes""). The offering is expected to close on June 22, 2022, subject to the satisfaction of customary closing conditions.",2022-06-07
133,"Ownership Submission FORM 4 Check this box if no longer... | June 7, 2022",2022-06-07
134,"DUBLIN, June 07, 2022--Allegion plc (NYSE: ALLE) (""Allegion"" or the ""company""), a leading global provider of security products and solutions, has proposed a registered public offering of senior notes by its subsidiary, Allegion US Holding Company Inc. (""Allegion US Holding""), subject to market and other conditions.",2022-06-07
135,"Ownership Submission FORM 4 Check this box if no longer... | June 6, 2022",2022-06-06
136,"Item 5.07 Submission of Matters to a Vote of Security Holders.At the Annual General Meeting held on June 2, 2022 , theshareholders of Allegion plc : elected all eight of the Company's... | June 6, 2022",2022-06-06
137,Johnson Controls (JCI) reported earnings 30 days ago. What's next for the stock? We take a look at earnings estimates for some clues.,2022-06-03
138,Agriculture equipment maker Deere & Co said on Tuesday it has named Rajesh Kalathur as its new chief financial officer replacing Ryan Campbell effective immediately.,2022-05-31
139,"DUBLIN, May 31, 2022--Allegion plc (NYSE: ALLE), a leading global provider of security products and solutions, today announced that John H. Stone will succeed David D. Petratis as president and CEO, effective July 11, 2022. Stone will also become a member of the company’s Board of Directors at that time, and Petratis will serve as executive chairman until his retirement, which is expected by Jan. 2, 2023.",2022-05-31
140,"By Colin Kellaher Deere &amp; Co. on Tuesday unveiled a management shuffle prompted by the departure of a key executive. The Moline, Ill., maker of farm and...",2022-05-31
141,"Allegion Announces CEO Succession David D. Petratis to Retire Following Distinguished 40-Year Career, John H. Stone to Succeed Petratis as... | May 31, 2022",2022-05-31
142,"Item 5.02 Departure of Directors or Certain Officers; Election of Directors;Appointment of Certain Officers; Compensatory Arrangements of Certain Officers.On May 31, 2022, Allegion plc announced... | May 31, 2022",2022-05-31
143,"By Colin Kellaher Allegion PLC on Tuesday said David Petratis, who has led the provider of security products and solution since its spinoff from Ingersoll Rand in late 2013, plans to retire as... | May 31, 2022",2022-05-31
144,"By Colin Kellaher Allegion PLC on Tuesday said David Petratis, who has led the provider of security products and solution since its spinoff from Ingersoll...",2022-05-31
145,"Allegion (ALLE) announced... ALLE, DE",2022-05-31
146,Netflix's fall from grace has ended the first act of the streaming wars. Act two will determine whether the industry can right itself.,2022-05-29
147,"Shares of Allegion PLC rose 2.49% to $113.54 Friday, on what proved to be an all-around great trading session for the stock market, with the S&P 500 Index...",2022-05-27
148,Allegion (ALLE) reported earnings 30 days ago. What's next for the stock? We take a look at earnings estimates for some clues.,2022-05-26
149,"Shares of Allegion PLC advanced 2.48% to $110.78 Thursday, on what proved to be an all-around positive trading session for the stock market, with the S&P 500...",2022-05-26
150,"Shares of Allegion PLC inched 0.08% higher to $108.10 Wednesday, on what proved to be an all-around favorable trading session for the stock market, with the...",2022-05-25
151,"Shares of Allegion PLC dropped 0.46% to $108.01 Tuesday, on what proved to be an all-around mixed trading session for the stock market, with the Dow Jones...",2022-05-24
152,"Former White House press secretary Jen Psaki will join MSNBC this fall in time for the 2022 midterm elections, NBCUniversal confirmed.",2022-05-24
