,summary,date
1164,Looking for stock market analysis and research with proves results? Zacks.com offers in-depth financial research with over 30years of proven results.,2022-03-07
1165,Looking for stock market analysis and research with proves results? Zacks.com offers in-depth financial research with over 30years of proven results.,2022-03-07
1166,Looking for stock market analysis and research with proves results? Zacks.com offers in-depth financial research with over 30years of proven results.,2022-03-07
1167,Looking for stock market analysis and research with proves results? Zacks.com offers in-depth financial research with over 30years of proven results.,2022-03-07
1168,Looking for stock market analysis and research with proves results? Zacks.com offers in-depth financial research with over 30years of proven results.,2022-03-07
1169,Looking for stock market analysis and research with proves results? Zacks.com offers in-depth financial research with over 30years of proven results.,2022-03-07
1170,"Netflix, a global streaming entertainment service, top accounting firms KPMG and PwC and financial services firm American Express on Sunday cut ties with Russia as that country's conflict with Ukraine escalated.  The latest fighting blocked efforts to evacuate 200,000 people from the besieged Ukrainian city of Mariupol for a second day in a row on Sunday as Russian President Vladimir Putin vowed to press ahead with his offensive.",2022-03-06
1171,"Netflix, a global streaming entertainment service, top accounting firms KPMG and PwC and financial services firm American Express on Sunday cut ties with Russia as that country's conflict with Ukraine escalated.  The latest fighting blocked efforts to evacuate 200,000 people from the besieged Ukrainian city of Mariupol for a second day in a row on Sunday as Russian President Vladimir Putin vowed to press ahead with his offensive.",2022-03-06
1172,"About 200,000 people remained trapped in the besieged city of Mariupol on Monday after fighting stopped evacuation efforts over the weekend, with no sign that massive international sanctions were deterring Moscow from its invasion of Ukraine.",2022-03-06
1173,"TikTok, American Express and Netflix Inc. joined the long list of companies suspending operations in Russia on Sunday, in response to the invasion of Ukraine and Russia's crackdown on the media.",2022-03-06
1174,"Fighting stopped about 200,000 people from evacuating the besieged Ukrainian city of Mariupol for a second day in a row on Sunday, as Russian President Vladimir Putin vowed to press ahead with his invasion unless Kyiv surrendered.",2022-03-06
1175,"Persistent fighting blocked efforts to evacuate 200,000 people from the besieged Ukrainian city of Mariupol for a second day in a row on Sunday as Russian President Vladimir Putin vowed to press ahead with his offensive, which he said was going to plan, unless Kyiv surrendered.  Most people trapped in the port city are sleeping underground to escape more than six days of near-constant shelling by encircling Russian forces that has cut off food, water, power and heating supplies, according to the Ukrainian authorities.",2022-03-06
1176,"American Express Co said on Sunday it was suspending all operations in Russia and Belarus, joining a growing number of Western corporations to boycott business there over Moscow's invasion of Ukraine.",2022-03-06
1177,"American Express Co said on Sunday it was suspending all operations in Russia and Belarus, joining a growing number of Western corporations to boycott business there over Moscow's invasion of Ukraine.  ""In light of Russia's ongoing, unjustified attack on the people of Ukraine, American Express is suspending all operations in Russia,"" the credit card company said in a statement on its website.  ""We are also terminating all business operations in Belarus,"" American Express said.",2022-03-06
1178,"""Given the circumstances on the ground, we have decided to suspend our service in Russia,"" a spokesperson said Sunday afternoon.",2022-03-06
1179,Looking for stock market analysis and research with proves results? Zacks.com offers in-depth financial research with over 30years of proven results.,2022-03-06
1180,"The latest developments on the Russia-Ukraine war:__NEW YORK — American Express announced Sunday it is suspending all operations in Russia and Belarus.Globally issued American Express cards... | March 6, 2022",2022-03-06
1181,"NEW YORK - In light of Russia's ongoing, unjustified attack on the people of Ukraine, American Express is suspending all operations in Russia. As a result, globally issued American Express... | March 6, 2022",2022-03-06
1182,Looking for stock market analysis and research with proves results? Zacks.com offers in-depth financial research with over 30years of proven results.,2022-03-06
1183,Looking for stock market analysis and research with proves results? Zacks.com offers in-depth financial research with over 30years of proven results.,2022-03-06
1184,,2022-03-06
1185,American Express says it ... AXP,2022-03-06
1186,Looking for stock market analysis and research with proves results? Zacks.com offers in-depth financial research with over 30years of proven results.,2022-03-06
1187,American Express' (AXP) American Express Rewards Checking Account for U.S. consumer Card Members launches rewards system for eligible members.,2022-03-04
1188,The Dow Jones fell. Tesla CEO Elon Musk issued a challenge. Uranium stocks were punished after Russia attacked a nuclear plant,2022-03-04
1189,"Item 8.01 Other Events.Exhibits are filed herewith in connection with the issuance by American ExpressCompany , on March 4, 2022, of $1,750,000,000 aggregate principalamount of 2.250% Notes due... | March 4, 2022",2022-03-04
1190,"Looking today at week-over-week shares outstanding changes among the universe of ETFs covered at ETF Channel, one standout is the SPDR Dow Jones Industrial Average ETF Trust (Symbol: DIA) where we have detected an approximate $186.0 million dollar inflow -- that's a 0.6% increa",2022-03-04
1191,"In early trading on Friday, shares of Chevron topped the list of the day's best performing Dow Jones Industrial Average components, trading up 0.5%. Year to date, Chevron registers a 33.8% gain.",2022-03-04
1192,"In early trading on Friday, shares of Chevron topped the list of the day's best performing Dow Jones Industrial Average components, trading up 0.5% - Year to date, Chevron registers a 33.8% gain - AXP,CVX,JPN,AMGN.",2022-03-04
1193,Disney announced a new ad-supported tier for its Disney+ streaming service on Friday.,2022-03-04
1194,Looking for stock market analysis and research with proves results? Zacks.com offers in-depth financial research with over 30years of proven results.,2022-03-04
1195,"Berkshire Hathaway (NYSE: BRK.A)(NYSE: BRK.B) CEO Warren Buffett is arguably in a class of his own when it comes to generating wealth on Wall Street. Since taking over as CEO in 1965, he's created more than $710 billion in shareholder value for Berkshire Hathaway's shareholders (",2022-03-04
1196,U.S. stocks lower at close of trade; Dow Jones Industrial Average down 0.53%,2022-03-04
1197,Amex has a new checking account that earns rewards and interest and has no monthly maintenance fees.,2022-03-03
1198,Batman has been a staple on the big screen since Tim Burton's 1989 superhero film. A look at how past Batman films have fared at the global box office.,2022-03-03
1199,"Volatility has rocked the stock market lately, leaving many investors looking for safer alternatives. So, let's look at some funds to buy.",2022-03-03
1200,"Staff article entitled April 22nd Options Now Available For American Express (AXP), about stock options, from Stock Options Channel.",2022-03-03
1201,"Believe it or not, markets remain focused on another key issue besides the war between Russia and Ukraine.",2022-03-02
1202,Mastercard (MA) partners with DBS Bank and Pine Labs for launching a program aimed at providing consumers in selected Asian cities access to BNPL offers provided by a wide range of merchants.,2022-03-02
1203,"Online payments company PayPal Holdings Inc stopped accepting new users in Russia on Wednesday given current circumstances, a company spokesperson told Reuters.",2022-03-02
1204,Looking for stock market analysis and research with proves results? Zacks.com offers in-depth financial research with over 30years of proven results.,2022-03-02
1205,"In this podcast, Motley Fool analyst Jason Moser discusses hits and misses from Salesforce.com (NYSE: CRM), Meta Platforms (NASDAQ: FB), Hologic (NASDAQ: HOLX), Squarespace (NYSE: SQSP) and more, as well as the current state of publicly traded grill companies Weber and Traeger.",2022-03-02
1206,"Among the underlying components of the S&P 500 index, we saw noteworthy options trading volume today in Kroger Co (Symbol: KR), where a total of 37,823 contracts have traded so far, representing approximately 3.8 million underlying shares. That amounts to about 58.6% of KR",2022-03-02
1207,A look at the shareholders of American Express Company ( NYSE:AXP ) can tell us which group is most powerful...,2022-03-02
1208,"The stock market had an incredible run in the past couple of years. Beginning in 2020 through the end of 2021, the S&P 500 delivered an impressive 52% return -- despite a global pandemic wreaking havoc on the economy.",2022-03-02
1209,US market slightly less overvalued while geopolitical concerns remain high,2022-03-02
1210,American Express severs ties with Russian partners amid its invasion of Ukraine.,2022-03-02
1211,Looking for stock market analysis and research with proves results? Zacks.com offers in-depth financial research with over 30years of proven results.,2022-03-02
1212,Looking for stock market analysis and research with proves results? Zacks.com offers in-depth financial research with over 30years of proven results.,2022-03-02
1213,"The Dow Jones fell more than 600 points as crude oil surges past $105 a barrel, while financial and travel company shares slump.",2022-03-01
1214,"PRA Group, Inc.’s PRAA fourth-quarter 2021 earnings per share of 79 cents beat the Zacks Consensus Estimate and also increased year over year by 21.5% owing to lower expenses.Revenues of $256.9 million were down 6.2% from the year-ago quarter’s level due to lower portfoli",2022-03-01
1215,Looking for stock market analysis and research with proves results? Zacks.com offers in-depth financial research with over 30years of proven results.,2022-03-01
1216,"The Dow Jones industrials were sharply lower Tuesday, as Russian troops closed in on Kyiv. Lucid Motors plunged on earnings.",2022-03-01
1217,"Dow Jones futures were lower Tuesday, as the stock market rally attempt continues. Lucid and Zoom plunged on earnings after the close.",2022-03-01
1218,"With Omicron cases falling, Citi, American Express, Cisco Systems and others say they spot a window to bring workers back together.",2022-03-01
1219,"With Omicron cases falling, Citi, American Express, Cisco Systems and others say they spot a window to bring workers back together. ",2022-03-01
1220,U.S. stocks lower at close of trade; Dow Jones Industrial Average down 1.7600%,2022-03-01
1221,,2022-03-01
1222,"Dow Jones futures were in focus Monday, as the stock market rally attempt continues. Lucid and Zoom plunged on earnings after the close.",2022-03-01
1223,"In the latest trading session, American Express (AXP) closed at $194.54, marking a +0.43% move from the previous day.",2022-02-28
1224,"Disney, Sony and Warner Bros. have halted future theatrical film releases in Russia following the country's attack on Ukraine. ",2022-02-28
1225,"American Express, Inc. (AXP) stock has gained big this year so far, jumping 18.4%.",2022-02-28
1226,"Queensland Felicity, who identifies as lesbian, is a former student of a Christian college in Brisbane. Despite her young age , Felicity has gone on to become an advocate for LGBTQIA+... | February 28, 2022",2022-02-28
1227,"Leading with a forward-thinking approach, Sueoka says, ""The innovation agenda that Ventures helps drive is core to making sure we live by that promise of backing our customers and... | February 28, 2022",2022-02-28
1228,"American Express Celebrates, Honors and Amplifies Unique Perspectives of Black Colleagues American Express has a longstanding commitment to create an inclusive workplace... | February 28, 2022",2022-02-28
1229,There was little action for Warren Buffett's Berkshire Hathaway in 2021 but BRK.A did make progress in increasing intrinsic value. Click here to read the full stockholder letter.,2022-02-28
1230,"In a market slump like this one, where all the major benchmarks are in negative territory for the year, consistency may be a quality that is particularly important to many investors.",2022-02-27
1231,"Berkshire Hathaway's... BRK.A, BRK.B, AAPL, BAC, AXP",2022-02-27
1232,Looking for stock market analysis and research with proves results? Zacks.com offers in-depth financial research with over 30years of proven results.,2022-02-26
1233,"Warren Buffett's Berkshire Hathaway Inc on Saturday said fourth-quarter profit swelled, boosted by gains in many of its businesses and common stock investments such as Apple Inc, and said annual earnings reached a record high.",2022-02-26
1234,"Warren Buffett on Saturday signaled he will stick to his knitting, bemoaning the lack of good investment opportunities for Berkshire Hathaway Inc as it sits on a massive pile of cash even after repurchasing huge amount of its own stock.",2022-02-26
1235,,2022-02-26
1236,"A study of analyst recommendations at the major brokerages shows that American Express Co. (Symbol: AXP) is the #22 broker pick, on average, out of the 30 stocks making up the Dow Jones Industrial Average, according to ETF Channel. Within the broader S&P 500, when componen",2022-02-25
1237,"The latest tally of analyst opinions from the major brokerage houses shows that among the 30 stocks making up the Dow Jones Industrial Average, American Express (AXP) is the #22 analyst pick. Within the broader S&P 500, when components were ranked in terms of analyst favor",2022-02-25
1238,"Staff article entitled See How American Express Co. Ranks Among Analysts' Top Dow 30 Picks, about ETFs, from ETF Channel.",2022-02-25
1239,"The latest tally of analyst opinions from the major brokerage houses shows that among the 30 stocks making up the Dow Jones Industrial Average, American Express (AXP) is the #22 analyst pick - Within the broader S&P 500, when components were ranked in terms of analyst favorites, AXP claims the #362 spot - AXP.",2022-02-25
1240,"With market uncertainty ratcheting up, and more speculative names under pressure, now may be the time to cycle into Warren Buffett stocks.",2022-02-25
1241,[Updated 02/22/2022] American Express Valuation Update,2022-02-25
1242,"Tweedy, Browne’s (TBGVX) 13F portfolio value increased from $2.99B to $3.15B this quarter. Alphabet at ~20% of the portfolio is the largest position.",2022-02-24
1243,American Express (AXP) reported earnings 30 days ago. What's next for the stock? We take a look at earnings estimates for some clues.,2022-02-24
1244,"Electric vehicle giant Tesla is down 18% since the start of 2022, and the price of Bitcoin has also fallen by a similar amount.  Shares of both Jushi Holdings (OTC: JUSHF) and American Express (NYSE: AXP) are up more than 14%, even as the markets have been wobbly.  Jushi Holdings is a top cannabis producer growing its presence across the country.",2022-02-24
1245,"It was a strong quarter for Disney, HBO Max and Paramount+ as streaming leader Netflix acknowledged competition may be hurting its growth on the margins.",2022-02-24
1246,"Chevron Corp.'s stock is the only Dow Jones Industrial Average component gaining ground in premarket trading Thursday, as Dow futures tumbled in the wake of Russia's invasion Ukraine, while the other 29 components are falling by at least 1% and as much as 4.4%. Chevron's stock jumped 4.2% ahead of the open, putting them on track to open in record territory, as crude oil futures shot up 8.4%. Among the biggest Dow decliners, shares of travel-related companies American Express Co. shed 4.4%, Walt",2022-02-24
1247,"NEW YORK, February 24, 2022--Today, American Express (NYSE: AXP) and Resy announced the 'Every Resy Counts' reservation drive to encourage millions of consumers across the country to dine at independent restaurants throughout the month of March. The effort is part of the company’s broader ‘Let’s Grab a Table’ marketing campaign which is focused on bringing attention and support to independent restaurants throughout the United States. The first million completed reservations made on Resy will unl",2022-02-24
1248,"Investors in American Express Co. (Symbol: AXP) saw new options begin trading today, for the April 8th expiration. At Stock Options Channel, our YieldBoost formula has looked up and down the AXP options chain for the new April 8th contracts and identified one put and one call",2022-02-24
1249,"As part of the new campaign, American Express and Resy are kicking-off ‘Every Resy Counts’ – a reservation drive to bring millions of diners to independent restaurants ... | February 24, 2022",2022-02-24
1250,The rise could prompt an accounting change by Warren Buffett's conglomerate -- one that would boost annual profits by more than $1 billion.,2022-02-23
1251,"When we shop online, at the grocery store, or go to a restaurant, it's just taken for granted that they'll accept credit cards and even take a tap from a mobile phone.  In just the last month, there's been an advance on the Solana (CRYPTO: SOL) blockchain that could almost eliminate most of those credit card fees and replace them with blockchain transactions.",2022-02-23
1252,"Solana Pay aims to create a seamless peer-to-peer connection between merchants and consumers, adding to the investment thesis for SOL-USD.",2022-02-23
1253,Berkshire is a diversified blue chip conglomerate in which the whole is greater than the sum of the parts. Read more about Berkshire Hathaway here.,2022-02-23
1254,Looking for stock market analysis and research with proves results? Zacks.com offers in-depth financial research with over 30years of proven results.,2022-02-23
1255,"Shares of American Express Co. slid 1.25% to $192.44 Tuesday, on what proved to be an all-around poor trading session for the stock market, with the S&P 500...",2022-02-22
1256,"Among the underlying components of the Russell 3000 index, we saw noteworthy options trading volume today in lululemon athletica inc (Symbol: LULU), where a total of 5,439 contracts have traded so far, representing approximately 543,900 underlying shares. That amounts to about",2022-02-22
1257,Creating wealth in the stock market can be as simple as owning pieces of the world's most powerful corporations and letting them compound for decades. But you can't pick just any stock; most won't cut it over the long-term.,2022-02-22
1258,"American Express recently launched its American Express Rewards Checking account, a digital checking account available for all U.S. consumer card members. The account offers membership rewards points... | February 22, 2022",2022-02-22
1259,"Investors in American Express Co. (Symbol: AXP) saw new options become available today, for the May 20th expiration. One of the key data points that goes into the price an option buyer is willing to pay, is the time value, so with 87 days until expiration the newly available c",2022-02-22
1260,"Are These The Best Warren Buffett Stocks To Buy Now?Between Ukraine-Russia border tensions and the Federal Reserve’s plans to aggressively tighten monetary policy, stocks are in a tricky position. Accordingly, all this turbulence could see investors turning toward the top W",2022-02-19
1261,"Shares of American Express Co. dropped 0.42% to $194.88 Friday, on what proved to be an all-around grim trading session for the stock market, with the S&P...",2022-02-18
1262,"A Conversation On The Influences That Continue to Inform His Life and Work In a recent interview with Departures, the lifestyle-focused... | February 18, 2022",2022-02-18
1263,"Colleagues Talk About Leading With Purpose in Many Facets of Their Lives Being a caregiver at home is one of the most important roles American Express colleagues hold.... | February 18, 2022",2022-02-18
1264,,2022-02-18
1265,"Looking today at week-over-week shares outstanding changes among the universe of ETFs covered at ETF Channel, one standout is the First Trust Rising Dividend Achievers ETF (Symbol: RDVY) where we have detected an approximate $279.2 million dollar inflow -- that's a 3.1% increas",2022-02-18
1266,,2022-02-18
1267,,2022-02-18
1268,,2022-02-18
1269,"Shares of American Express Co. slipped 1.35% to $195.71 Thursday, on what proved to be an all-around dismal trading session for the stock market, with the...",2022-02-17
1270,"In this article, we discuss the 10 best stocks to buy according to Warren Buffett. If you want to skip our detailed analysis of these stocks, go directly to the 5 Best Stocks to Buy According to Warren Buffett. Warren Buffett, the chief of Berkshire Hathaway, was one of the biggest winners during the financial […]",2022-02-17
1271,"NEW YORK, February 17, 2022--American Express® (NYSE: AXP) and Delta Air Lines® (NYSE: DAL) today added Plan It®, American Express’ on-card buy now, pay later feature, as a checkout option on delta.com. With this update, American Express U.S. Consumer Card Members can now choose from the available Plan It options while booking Delta travel.",2022-02-17
1272,The recent market rout offers an opportune entry point to these seven robust stocks. These are good stocks to buy at their bottom now.,2022-02-17
1273,"TApple Inc., The Walt Disney Company, Broadcom Inc., American Express Co. and Becton, Dickinson and Co. are highlighted in this Analyst Blog.",2022-02-17
1274,Bearish flow noted in Ame... AXP,2022-02-17
1275,"Earlier this week, Berkshire Hathaway Inc. filed its latest Form 13F, which revealed the stocks that one of the world’s greatest investors – Warren Buffett – bought and sold during the last quarter of 2021.As of Dec 31, 2021, Buffett's investment portfolio was worth appro",2022-02-17
1276,"InvestorPlace - Stock Market News, Stock Advice & Trading Tips",2022-02-17
1277,,2022-02-17
1278,The Fed is getting ready to make its move. Prepare your portfolio by buying stocks that benefit from higher rates. Protect it further by using options.,2022-02-17
1279,"The Western Union Company stock (NYSE: WU) has gained 7.8% in the last week, outperforming the S&P 500 (down 2%). Further, the stock increased 6.9% in the last month vs a 5.6% fall in the broader markets. Overall, the stock has gained in the near term, as compared to t",2022-02-17
1280,"Today's Research Daily features new research reports on 16 major stocks, including Apple Inc. (AAPL), The Walt Disney Company (DIS), and Broadcom Inc. (AVGO).",2022-02-16
1281,"American Express Co. (AXP) shares closed today at 0.2% below its 52 week high of $198.72, giving the company a market cap of $150B. The stock is currently up 21.0% year-to-date, up 54.0% over the past 12 months, and up 164.8%",2022-02-16
1282,"Shares of American Express Co. inched 0.20% higher to $198.38 Wednesday, on what proved to be an all-around mixed trading session for the stock market, with...",2022-02-16
1283,"American Express Co. (AXP) shares closed today at 0.4% below its 52 week high of $198.72, giving the company a market cap of $146B. The stock is currently up 17.6% year-to-date, up 49.6% over the past 12 months, and up 157.9%",2022-02-15
1284,Berkshire Hathaway's 13F stock portfolio value increased from ~$293B to ~$331B. BRK.B's largest 3 holdings are 2/3rds of the portfolio. Read the full list here.,2022-02-15
1285,"In today's IBD's Screen of the Day, we look at stocks whose relative strength line is reaching an all-time high.  Easing geopolitical tensions are also propelling travel stocks, following Russian remarks of a partial troop withdrawal from the border with Ukraine.  Here are some of the hottest stocks on the screen.",2022-02-15
1286,"Shares of American Express Co. advanced 2.93% to $197.98 Tuesday, on what proved to be an all-around favorable trading session for the stock market, with the...",2022-02-15
1287,"In partnership with Main Street America, the program is the latest effort in the company’s “Backing Small Initiative.”",2022-02-15
1288,,2022-02-15
1289,"American Express Company Fixed Income Investor Presentation FEBRUARY 2022 ... | February 15, 2022",2022-02-15
1290,"Item 7.01 Regulation FD DisclosureAmerican Express Company is hereby furnishing below delinquencyand write-off statistics for the U.S. Consumer Card Member lending portfolio ofits Global... | February 15, 2022",2022-02-15
1291,Reports January 30 days p... AXP,2022-02-15
1292,"Investors in American Express Co. (Symbol: AXP) saw new options become available today, for the November 18th expiration. One of the key data points that goes into the price an option buyer is willing to pay, is the time value, so with 276 days until expiration the newly avail",2022-02-15
1293,"New set of $5,000 grants open to help U.S. small businesses providing personal services as they continue to navigate the impacts of the pandemic ● The 'Services that Back... | February 15, 2022",2022-02-15
1294,Berkshire Hathaway (BRK.A) is in the news today following a recent 13F filing with the Securities and Exchange Commission that reveals trades,2022-02-15
1295,,2022-02-15
1296,U.S. stocks higher at close of trade; Dow Jones Industrial Average up 1.22%,2022-02-15
1297,"Berkshire Hathaway Inc said Tom Murphy, the former head of Capital Cities/ABC Inc and longtime friend of Warren Buffett, has resigned from its board of directors after a bout with COVID-19.",2022-02-14
