,summary,date
1781,"NEW YORK, December 02, 2021--American Express Company (NYSE: AXP) today announced that on Thursday, December 16, 2021, Chairman and CEO Stephen J. Squeri will participate in Delta Air Lines’ Capital Markets Day in New York. Mr. Squeri will join Delta CEO Ed Bastian for an in-person fireside chat from 11:40 a.m. to 12:25 p.m. (ET).",2021-12-02
1782,"The Dow and the S&P 500 rebounded on Thursday, boosted by financial shares and Boeing in a week so far marked by wild swings on rising angst about the spread of the new Omicron coronavirus variant globally.",2021-12-02
1783,"Shares of Boeing and American Express are seeing positive gains Thursday morning, leading the Dow Jones Industrial Average rally. Shares of Boeing and...",2021-12-02
1784,"American Express Company today announced that on Thursday, December 16, 2021, Chairman and CEO Stephen J. Squeri will participate in Delta Air Lines’ Capital Markets Day in New York. Mr.... | December 2, 2021",2021-12-02
1785,"Strategists who watch stock charts say the market is at a pivotal point, and the action Thursday and Friday could be important for market direction.",2021-12-02
1786,"American Express (AXP) closed at $150.06 in the latest trading session, marking a -1.47% move from the prior day.",2021-12-01
1787,"(Opy), a diversified global fintech company and its parent company Openpay Pty Ltd (ASX: OPY) (Openpay), today announced a Card acceptance agreement with American Express (NYSE: AXP). The agreement allows Card Members to use their American Express Cards to make installment payments with participating Healthcare and Auto Repair & Maintenance merchants via Opy's 2.0 version of BNPL, a Buy Now, Pay Smarter (BNPS) solution. In addition, American Express will help support merchants in these industrie",2021-12-01
1788,The rollout will be with healthcare and auto repair/maintenance merchants.,2021-12-01
1789,"Australian shares fell at open on Thursday, as concerns over the new Omicron coronavirus variant kept investors jittery, while Afterpay fell over 5% after postponing meeting to vote on its $29 billion deal with Jack Dorsey-led Square Inc.",2021-12-01
1790,"It could be time to do some shopping in the stock market this holiday season, opines this veteran strategist.",2021-12-01
1791,"Openpay Group Ltd will allow American Express card holders to fund their purchases with its buy now, pay later (BNPL) services, the Australian company said on Thursday.",2021-12-01
1792,Recap of the best stock picks on CNBC Wednesday,2021-12-01
1793,"NEW YORK, December 01, 2021--American Express Company (NYSE: AXP) (""American Express"") today announced the expiration and final results of its previously announced offer to exchange (the ""Exchange Offer"") all validly tendered and accepted 3.300% Senior Notes due May 3, 2027 (the ""Credco Notes"") issued by American Express Credit Corporation (""Credco""), a wholly-owned subsidiary of American Express, for new notes to be issued by American Express (the ""AXP Notes"") and Credco’s related solicitation",2021-12-01
1794,"Jim Cramer, Stephanie Link of Hightower, Karen Firestone of Aureus Asset Management, Brian Belski of BMO, Mark Mahaney of Evercore ISI, Jeff Mills of BMT Wealth Management, and Jason Seidl of Cowen Group explain why they are buying, selling, or holding specific stocks and ETFs",2021-12-01
1795,"Shares of American Express Co. slid 1.47% to $150.06 Wednesday, on what proved to be an all-around rough trading session for the stock market, with the S&P...",2021-12-01
1796,"Gabelli Dividend & Income Trust provides exposure to large-cap equity positions, though the largest sector exposure is financials. Read more on GDV here.",2021-12-01
1797,"American Express Company Announces Expiration and Final Results of the Exchange Offer and Consent Solicitation for Certain American Express Credit Corporation... | December 1, 2021",2021-12-01
1798,"Item 8.01 Other Events.On December 1, 2021, American Express Company announced theexpiration and final results of its previously announced exchange offer pursuantto which it offered to issue its... | December 1, 2021",2021-12-01
1799,"Buoyed by positive gains for shares of American Express and Goldman Sachs, the Dow Jones Industrial Average is rallying Wednesday morning. The Dow is trading...",2021-12-01
1800,American Express Company ( NYSE:AXP ) shareholders might be concerned after seeing the share price drop 12% in the last...,2021-12-01
1801,The Dow Jones Industrial Average is climbing Wednesday morning with shares of Caterpillar and American Express leading the way for the index. The Dow is...,2021-12-01
1802,"Mastercard stock (NYSE: MA) has lost around 6.9% in the last week, underperforming the S&P 500 (down 2.3%). Further, if you look at the change over the last one month (21 trading days), the stock has decreased 3.4% vs a 1.1% rise in the S&P500. MA is the second lar",2021-12-01
1803,"Despite the pandemic, the stock market has had a decent year so far. Right now, the Dow Jones Industrial Average is up 14% year-to-date (YTD) while the S&P 500 is up over 23% YTD. But with the threat of inflation currently stoking fears in the fourth quarter, now is the time to start considering inflation stocks. Inflation stocks provide some protection when prices begin to skyrocket. In October, the consumer price index rose 6.2% from a year ago, which is the biggest increase in 30 years. Core",2021-11-30
1804,Recap of the best stock picks on CNBC Tuesday,2021-11-30
1805,"With Colleague Contributions and Global Match Program, Amex Campaign Results in $8.9 Million in Community Giving In American Express' annual Give2Gether campaign, more than... | November 30, 2021",2021-11-30
1806,"Jim Cramer, Degas Wright of Decatur Capital Management, Stephanie Link of Hightower, Josh Brown of Ritholtz Wealth Management, Jon Najarian of Marketrebellion.com, Sarat Sethi of DCLA, and Anton Schutz of Mendon Capital Advisors explain why they are buying, selling, or holding specific stocks and ETFs",2021-11-30
1807,"Shares of American Express Co. slid 3.52% to $152.30 Tuesday, on what proved to be an all-around rough trading session for the stock market, with the S&P 500...",2021-11-30
1808,"Behind declines for shares of Salesforce.com Inc. and American Express, the Dow Jones Industrial Average is seeing a selloff Tuesday afternoon. The Dow was...",2021-11-30
1809,"The selloff in the Dow Jones Industrial Average is including all 30 of the index's components in premarket trading Tuesday, amid growing worries about the effect of the omicron variant of COVID. Dow futures tumbled 423 points, or 1.2% ahead of the open. Among the biggest decliners, shares of American Express Co. fell 2.5%, Boeing Co. shed 2.3%, Goldman Sachs Group Inc. gave up 2.2% and Travelers Companies Inc. lost 2.0%. Meanwhile, the best performer was Microsoft Corp.'s stock , which slipped j",2021-11-30
1810,"American Express risks ""cutting off"" vulnerable cardholders after it announced it would no longer accept cash payments, experts have warned.",2021-11-30
1811,"In early trading on Tuesday, shares of Apple topped the list of the day's best performing Dow Jones Industrial Average components, trading up 1.1%.  Year to date, Apple registers a 22.0% gain.",2021-11-30
1812,"Dragged down by negative returns for shares of American Express and Verizon Communications Inc., the Dow Jones Industrial Average is falling Tuesday morning....",2021-11-30
1813,"""I'm not necessarily saying the economy will be able to keep on chugging without overheating now ... but it's a real possibility,"" the ""Mad Money"" host said. ",2021-11-29
1814,The early morning action came after a broad-based comeback that saw the S&P 500 jump 1.3% with all 11 sectors registering gains. ,2021-11-29
1815,"Retailers enter Cyber Monday with good sales momentum, according to new data from Black Friday.",2021-11-29
1816,Recap of the best stock picks on CNBC Monday,2021-11-29
1817,"American Express (AXP) witnesses robust U.S. consumer spending at small businesses on the recent Small Business Saturday, which marked the 12th year of the campaign.",2021-11-29
1818,"Jim Cramer, Helane Becker of Cowen, Gene Munster of Loup Ventures, Joanne Feeney of Advisors Capital Management, Savanthi Syth of Raymond James, Brent Hill of Jefferies, Josh Brown of Ritholtz Wealth Management, Krish Sankar of Cowen, Tom Lee of Fundstrat Global Advisors, Brenda Vingiello of Sand Hill Global Advisors, and Jim Lebenthal of Cerity explain why they are buying, selling, or holding specific stocks and ETFs",2021-11-29
1819,"Shares of American Express Co. inched 0.66% higher to $157.86 Monday, on what proved to be an all-around great trading session for the stock market, with the...",2021-11-29
1820,"Mastercard's (MA) deal with Jeeves to provide clients with easy solutions, cashback opportunities and secure cross-border transactions.",2021-11-29
1821,"Benchmarks recorded the worst Black Friday performance in decades, as reports of a new COVID variant spooked investors raising concerns on economic recovery.",2021-11-29
1822,"Looking at the underlying holdings of the ETFs in our coverage universe at ETF Channel, we have compared the trading price of each holding against the average analyst 12-month forward target price, and computed the weighted average implied analyst target price for the ETF itsel",2021-11-29
1823,"NEW YORK, November 29, 2021--As consumer spending continues to rebound, U.S. shoppers showed up in a big way for the small businesses in their communities during this year’s Small Business Saturday on November 27, positioning American Express’ (NYSE: AXP) 12th annual event to be one of the most impactful shopping days of the holiday season. The results of the American Express 2021 Small Business Saturday Consumer Insights Survey show that total reported projected spending among U.S. consumers wh",2021-11-29
1824,"In this article, we discuss Tom Gayner’s Markel Gayner Asset Management’s top 10 finance stocks. If you want to skip our detailed analysis of these stocks, go directly to Tom Gayner’s Markel Gayner Asset Management Portfolio: Top 5 Finance Stocks. Tom Gayner has been the head of the investment division at Markel Gayner Asset Management […]",2021-11-28
1825,"Here are two sample Breakout Stocks for Week 48 with better than 10% short-term upside potential. Following the Daily Momentum Gauges®, the portfolio is up +70.5% YTD.",2021-11-28
1826,"""These names appear underappreciated by the market and could generate alpha for investors with a contrarian view,"" Goldman told clients. ",2021-11-28
1827,"This year's Small Business Saturday comes at a crucial time for many small businesses in the U.S., as many are still recovering from widespread shutdowns at the height of the coronavirus pandemic in 2020.",2021-11-27
1828,"The stock market was definitely not in a holiday mood on the day after Thanksgiving, as news of the new Omicron variant of COVID-19 led to widespread concerns about a possible return to lockdown conditions.  Because of the Dow's price-weighted nature, a few stocks had a disproportionate influence on the average's moves.  Below, we'll look at how American Express (NYSE: AXP), Boeing (NYSE: BA), and Goldman Sachs (NYSE: GS) combined to lop about 250 points off the Dow by themselves.",2021-11-26
1829,Buffett is taking profits off the table. It might be time to do the opposite.,2021-11-26
1830,American Express' (AXP) management remains optimistic about strong Q4 results and expects the momentum to continue into next year.,2021-11-26
1831,The Arcus buyout is likely to enable Mastercard (MA) to tap into its vast network and offer Bill Pay solutions and real-time payment applications across markets.,2021-11-26
1832,Wall Street skidded lower on Black Friday as investors reacted to fresh travel bans related to a variant of the coronavirus that causes COVID-19 called...,2021-11-26
1833,"Shares of American Express and Boeing are trading lower Friday afternoon, leading the Dow Jones Industrial Average slump. The Dow was most recently trading...",2021-11-26
1834,"American Express Company is currently at $157.76, down $13.85 or 8.07% -- Would be lowest close since May 21, 2021, when it closed at $156.87 -- On pace for largest percent decrease since... | November 26, 2021",2021-11-26
1835,"Dragged down by losses for shares of American Express and Boeing, the Dow Jones Industrial Average is slumping Friday morning. Shares of American Express and...",2021-11-26
1836,"Shares of American Express and Boeing are posting losses Friday morning, sending the Dow Jones Industrial Average into a slump. Shares of American Express...",2021-11-26
1837,"Jeremy Grantham’s 13F portfolio value increased from $20.05B to $20.22B this quarter. The largest three positions are Microsoft, Alphabet and Apple.",2021-11-26
1838,"In this article, we discuss the 10 stocks that Warren Buffett is selling. If you want to skip our detailed analysis of these stocks, go directly to Warren Buffett is Selling These 5 Stocks. Warren Buffett, also known as the Oracle of Omaha, is one of the most well-known and successful investors of all time. […]",2021-11-25
1839,"In this article, we discuss the 10 latest stock picks of billionaire Ray Dalio. You can skip our detailed analysis of Ray Dalio’s hedge fund and his investment strategies, and go directly to read the 5 Latest Stock Picks of Billionaire Ray Dalio. Ray Dalio is accredited with founding one of the largest hedge funds […]",2021-11-24
1840,"Steve Squeri, American Express chairman and CEO, join 'Closing Bell' to discuss the company's quarterly earnings results. Squeri discusses where consumers are spending their money.",2021-11-24
1841,"Steve Squeri, American Express chairman and CEO, and Lin Manuel Miranda, a Broadway actor and director, join Sara Eisen to discuss the importance of small businesses as the country emerges from the pandemic.",2021-11-24
1842,"Investors in American Express Co. (Symbol: AXP) saw new options become available today, for the January 2022 expiration.   At Stock Options Channel, our YieldBoost formula has looked up and down the AXP options chain for the new January 2022 contracts and identified one put and",2021-11-24
1843,CNBC's Sara Eisen sits down with American Express CEO Steve Squeri and 'Hamilton' creator Lin-Manuel Miranda to discuss small businesses and payment stocks ahead of the busy holiday shopping weekend.,2021-11-24
1844,"Small businesses are facing hefty challenges during the 2021 holiday season. Here's what you should expect, and how small-business owners say you can support them.",2021-11-24
1845,This year's Small Business Saturday is shaping up to be pivotal for many entrepreneurs in 2021. Consumers are on board.,2021-11-24
1846,"I cover V's price action over several different timeframes. I explore the competition, inflation and V's business results. I show P/E compression in light of a growth to value rotation.",2021-11-23
1847,Mastercard (MA) teams up with MyBank and Network International for launching a debit card for popularizing digital payments throughout Somalia.,2021-11-23
1848,"Shares of American Express Co. slumped 0.03% to $170.85 Tuesday, on what proved to be an all-around great trading session for the stock market, with the S&P...",2021-11-23
1849,Nearly 80 percent of small business merchants said holiday sales will impact ability to stay open next year.,2021-11-23
1850,"The ""Halftime Report"" traders give their top picks to watch for the second half.",2021-11-23
1851,"The Zacks Analyst Blog Highlights: Alibaba, Lowe's, American Express, Boeing and Moderna",2021-11-23
1852,"Amex Trendex and American Express Shop Small Impact Survey Find Support for Small Businesses With Unique Offerings and Ethical Sourcing Shopping at a small business is on the... | November 23, 2021",2021-11-23
1853,"Recently, Visa (V) has issued disappointing cross-border travel guidance. See why I believe there is a valuable opportunity for buying Visa stock currently.",2021-11-23
1854,"Indian payments firm MobiKwik has delayed its plans to proceed with an initial public offering (IPO) of shares this month, its CEO said on Tuesday, in an anticipated move following the dismal market debut of larger rival Paytm earlier this month.",2021-11-23
1855,"American Express Co said on Monday it had terminated some employees of its global commercial services division for inappropriately pitching some products, with respect to tax benefits.",2021-11-22
1856,"American Express Co said on Monday it had terminated some employees of its global commercial services division for inappropriately pitching some products, with respect to tax benefits.  The company said the issue primarily involved Premium Wire, which enables businesses to send wire payments globally, and that it had hired a law firm to investigate its small business sales practices in the United States, including sales of Premium Wire.  The Wall Street Journal had earlier reported https://www.wsj.com/articles/amex-pitched-business-customers-a-tax-break-that-doesnt-add-up-11637587980 that some of the company's salespeople had pitched a strategy to business owners, relying on a shaky interpretation of how tax law treats rewards points.",2021-11-22
1857,"American Express Co pitched its business clients a tax break which may have skirted tax laws, the Wall Street Journal reported on Monday, citing people familiar with the matter and documents reviewed by it.  The tax break strategy was based on a ""shaky interpretation"" of how tax law applies to reward points, the report said, adding that the pitch helped the credit card issuer earn billions of dollars in transaction volume since at least 2018.  AmEx did not immediately respond to a Reuters request for comment.",2021-11-22
1858,"Today's Research Daily features new research reports on 16 major stocks, including Alibaba Group Holding Limited (BABA), Lowe's Companies, Inc. (LOW), and American Express Company (AXP).",2021-11-22
1859,"The Citi Premier has a $95 annual fee, but is it worth it? Select analyzed the card for its benefits to see if it measures up.",2021-11-22
1860,Mastercard (MA) collaborates with TTIFC with an aim to roll out solutions for boosting digital growth across Trinidad & Tobago and more broadly in the Caribbean.,2021-11-22
1861,"Shares of American Express Co. slid 1.52% to $170.90 Monday, on what proved to be an all-around mixed trading session for the stock market, with the Dow...",2021-11-22
1862,"American Express (AXP) has seen solid earnings estimate revision activity over the past month, and belongs to a strong industry as well.",2021-11-22
1863,Businesses were told they could deduct transaction fees while earning tax-free cash rewards.,2021-11-22
1864,"The payment processor and credit card issuer American Express (NYSE: AXP) has long been one of Warren Buffett's favorite stocks.  Just last year, Buffett called the brand special, and American Express is currently one of Berkshire Hathaway's (NYSE: BRK.A)(NYSE: BRK.B) top holdings in its equities portfolio.  With a lot of business in the travel and entertainment (T&E) and retail sectors, American Express was certainly affected by the pandemic, which hit many of those sectors hard.",2021-11-21
1865,"These two stocks have totally recovered from the pandemic, and they have the tools to stay in growth mode.",2021-11-21
1866,The MDA breakout picks completed 2020 up +73.4%. Check out the two new Breakout Stocks for Week 47 with better than 10% short-term upside potential.,2021-11-21
1867,"Euronet (EEFT) launches payments platform called Dandelion, which is equipped with an expansive global reach and has the ability to ease cross-border payments for businesses and consumers.",2021-11-19
1868,"Shares of American Express Co. slid 1.52% to $173.54 Friday, on what proved to be an all-around poor trading session for the stock market, with the S&P 500...",2021-11-19
1869,"American Express announces $1 million sponsorship to museum and its work to highlight artists of African descent American Express hosted artists Julie Mehretu and Kehinde Wiley... | November 19, 2021",2021-11-19
1870,"If you're doing your holiday shopping through Amazon, consider one of the two unsecured Amazon credit cards for your wallet.",2021-11-19
1871,"Shares of American Express Co. slid 1.89% to $176.21 Thursday, on what proved to be an all-around mixed trading session for the stock market, with the S&P...",2021-11-18
1872,"Among the underlying components of the S&P 500 index, we saw noteworthy options trading volume today in Blackrock Inc (Symbol: BLK), where a total of 1,943 contracts have traded so far, representing approximately 194,300 underlying shares.  That amounts to about 47% of BLK'",2021-11-18
1873,"NEW YORK, November 18, 2021--American Express (NYSE:AXP) today announced artistic collaborations with world-renowned artists Julie Mehretu and Kehinde Wiley to reimagine and create new designs of the iconic Consumer Platinum Card. The company will also provide $1 million in sponsorship to The Studio Museum in Harlem (the Studio Museum) to support its work as the nexus for artists of African descent, locally, nationally, and internationally. Early in their careers, both Mehretu and Wiley particip",2021-11-18
1874,"Investors in American Express Co. (Symbol: AXP) saw new options begin trading today, for the July 2022 expiration.  One of the key data points that goes into the price an option buyer is willing to pay, is the time value, so with 239 days until expiration the newly trading cont",2021-11-18
1875,Banks are spending big on mailers and generous rewards to lure cardholders  and get them borrowing again.,2021-11-18
1876,"BRITISH Airways yesterday announced a collaboration with American Airlines and American Express to provide free Covid-19 tests to business travellers flying between the UK and the US.Ensuring... | November 18, 2021",2021-11-18
1877,"The report outlines its progress toward its $1 Billion Action Plan to promote racial, ethnic and gender equity for its colleagues, customers and communities.",2021-11-17
1878,Visa has a strong earnings track record and is making more moves in digital payments. Is the stock a buy right now?,2021-11-17
1879,"Shares of American Express Co. slipped 0.72% to $179.61 Wednesday, on what proved to be an all-around rough trading session for the stock market, with the...",2021-11-17
1880,Analysts at Cowen said with Amazon still accepting Visa debit cards they expect any financial impact to Visa to be minimal.,2021-11-17
1881,"The Dow Jones Industrial Average fell 150 points Wednesday, as Lucid Motors and Rivian skidded. Nvidia earnings are due out late.",2021-11-17
1882,The recently launched Capital One Venture X comes with a premium annual fee of $395. Is it worth it?,2021-11-17
1883,"Small Business Saturday, started by the American Express credit card company 12 years ago, will return Nov. 27, bolstered by an increase in OOH advertising, according to a company press release.The... | November 17, 2021",2021-11-17
1884,"What happened
Shares of the payment processor Mastercard (NYSE: MA) had fallen nearly 5% as of 12:30 p.m. EST for no obvious reason, although it likely has something to do with the news that came out today about its rival Visa (NYSE: V).",2021-11-17
1885,"Looking today at week-over-week shares outstanding changes among the universe of ETFs covered at ETF Channel, one standout is the The Financial Select Sector SPDR— Fund (Symbol: XLF) where we have detected an approximate $126.3 million dollar outflow -- that's a 0.3% decr",2021-11-17
1886,"Amazon has told some customers that, from Jan. 19 2022 onward, the company will no longer accept Visa credit cards issued in Britain.",2021-11-17
1887,Berkshire Hathaway's (BRK.A) (BRK.B) 13F stock portfolio value remained almost steady at ~$293B. Their largest 3 holdings are at two-thirds of the entire portfolio.,2021-11-16
1888,"Shares of American Express Co. shed 1.21% to $180.92 Tuesday, on what proved to be an all-around positive trading session for the stock market, with the S&P...",2021-11-16
1889,"The Dow Jones Industrial Average rallied 75 points Tuesday, as Home Depot and Walmart reported earnings. CEO Elon Musk sold more Tesla shares.",2021-11-16
1890,Accelerating the supply and use of sustainable aviation fuels (SAFs) is crucial to reaching net zero emissions in the travel industry. As we work to advance innovative climate solutions and help bu...,2021-11-16
1891,"NEW YORK, November 16, 2021--American Express Company (NYSE: AXP) (""American Express"") today announced that, as of 5:00 p.m., New York City time, on November 15, 2021 (the ""Early Participation Date""), the aggregate principal amount listed in the table below of the 3.300% Senior Notes due May 3, 2027 (the ""Credco Notes"") issued by American Express Credit Corporation (""Credco""), a wholly-owned subsidiary of American Express, has been validly tendered and not validly withdrawn in connection with Am",2021-11-16
1892,"Dow Jones futures were higher late Monday, as President Biden met with with Chinese President Xi, while CEO Elon Musk sold more Tesla stock.",2021-11-16
1893,"American Express Company Announces Extension of Early Participation Date and Preliminary Results of the Exchange Offer and Consent Solicitation for Certain ... | November 16, 2021",2021-11-16
1894,"Item 8.01 Other Events.On November 16, 2021, American Express Company announced theextension of the early participation date and preliminary results of itspreviously announced exchange offer... | November 16, 2021",2021-11-16
1895,"Dow Jones futures were lower early Tuesday, as President Biden met with with Chinese President Xi, while CEO Elon Musk sold more Tesla stock.",2021-11-16
1896,Dow Jones futures were little changed Monday ahead of President Biden's meeting with Chinese President Xi.,2021-11-16
