,summary,date
514,"Travellers embarking on solo adventures around the world can now enjoy new benefits from their Companion Voucher, British Airways and American Express have announced.From today, Cardmembers who have... | June 14, 2022",2022-06-14
515,"V stock has rewarded its investors well over the years. It is now facing another test of support, so it's an opportunity to base and bounce.",2022-06-14
516,"American Express might face short-term headwinds. So, why do I think a time horizon of 5 years or greater will yield phenomenal returns for AXP stock? Find out.",2022-06-14
517,"It was more of the same with U.S. stock markets in May, meaning that investors won’t be getting much reprieve from volatility in the near future. Virtually every U.S. stock index has more or less succumbed to bear markets. Hence, investors gravitate towards safe stocks that provide a hedge against troubling market conditions. You invariably think about dividends with safe stocks, which have been an investing staple for the past several years. Dividends offer investors a consistent income stream,",2022-06-13
518,"The $400 billion portfolio, led by Apple and Bank of America, is down in line with the S&P 500.",2022-06-13
519,Looking for stock market analysis and research with proves results? Zacks.com offers in-depth financial research with over 30years of proven results.,2022-06-13
520,"Shares of American Express Co. slid 5.26% to $146.29 Monday, on what proved to be an all-around dismal trading session for the stock market, with the S&P 500...",2022-06-13
521,"In this article, we will look at 10 blue-chip stocks to buy according to billionaire Ken Fisher. If you want to skip reading about Ken Fisher’s insights on the current market situation and his hedge fund’s recent performance, you can go directly to 5 Blue Chip Stocks to Buy According to Billionaire Ken Fisher. Ken […]",2022-06-13
522,"The stock market is a mess right now, with the S&P 500 index on the verge of entering a bear market defined as a decline of 20% or more from recent highs. The technology heavy Nasdaq-100 index is already in bear market territory having fallen nearly 30% so far this year. Volatility has been the only constant as investors dump equities with interest rates on the rise and as fears grow that the global economy will fall into a recession in this year’s second half. So, what’s an investor to do amid",2022-06-13
523,What's an investor to do amid all the market churn and damage? The best strategy for long-term investors is to take positions in stable blue-chip stocks that can weather the current volatility and emerge stronger on the other side.,2022-06-13
524,U.S. stocks lower at close of trade; Dow Jones Industrial Average down 2.79%,2022-06-13
525,"""Jurassic World: Dominion"" roared to the top of the domestic box office over the weekend, generating more than $143 million in ticket sales during its debut.",2022-06-12
526,"In this article, we discuss two new Breakout Stocks for Week 24 with better than 10% short-term upside potential and an additional Dow 30 Pick. Read more here.",2022-06-12
527,"Catch up on the weekend&#... PFE, BNTX, MCD, INTC, AMD, AAPL, CMCSA, CMCSK, GBTG, EOG, ENLAY, RUN, PSX, SHEL, LBRT, AXP, MAR, LUV, ASO, AZO, COST, DG, HD, LIN",2022-06-12
528,Generally speaking the aim of active stock picking is to find companies that provide returns that are superior to the...,2022-06-11
529,"Business travel will take... AXP, MAR, LUV",2022-06-11
530,"American Express Global B... GBTG, AXP, APO, EXPE",2022-06-11
531,"American Express Global Business Travel has good clients, bright prospects, a No.1 market share, and a cheap stock.",2022-06-10
532,"Wall Street analysts like American Express, Marriott International, and Southwest Airlines to gain as the pandemic fades and corporate jet-setters hit the road again.",2022-06-10
533,"Airlines, hotels, and convention centers will slowly and unevenly return to pre-Covid levels, most observers say. But forces from hybrid work to inflation to ESG have reshaped the look of corporate travel.",2022-06-10
534,"""Jurassic World: Dominion"" may score to top spot at the domestic box office this weekend, but lackluster critical reviews and word of mouth could stall its potential haul.",2022-06-09
535,"Universal's ""Jurassic World: Dominion"" enters domestic theaters Friday, and it will snag the majority of premium format screens from ""Top Gun: Maverick.""",2022-06-09
536,"Boom Supersonic, the Colorado company planning a superfactory at PIedmont Triad International Airport for a fleet of jets for commercial faster-than-sound flights, is convening another event to draw attention to one of its main promotional points: sustainable air travel.  The Denver company announced Wednesday that it’s convening its second Net Good Summit as the annual symposium for major airlines and others in the Sustainable Travel Forum.  Members include American Express, Japan Airlines, engine maker Rolls-Royce, and United Airlines.",2022-06-09
537,,2022-06-09
538,"FinTech Virtual Bus Tour ... JKHY, SOFI, STNE, CTLP, ACIW, PAYO, AXP",2022-06-09
539,Looking for stock market analysis and research with proves results? Zacks.com offers in-depth financial research with over 30years of proven results.,2022-06-08
540,"In this article, we discuss 10 stocks to brace yourself for recession. If you want to see more stocks in this selection, check out ‘More Pain Likely Ahead’: 5 Stocks to Brace Yourself for Recession. Merrill, an American investment and wealth management division of Bank of America, disclosed its capital market report on May 31, […]",2022-06-08
541,"Berkshire Hathaway (NYSE: BRK.A)(NYSE: BRK.B) CEO Warren Buffett has a knack for making money.  Since taking the reins of Berkshire Hathaway in 1965, he's led the company's Class A shares (BRK.A) to an annualized return of 20.1%.  Although there are a number of factors that play an important role in the Oracle of Omaha's success, a strong case can be made that his willingness to hold onto his winners for extended periods is the foundation that Buffett's massive outperformance has been built upon.",2022-06-08
542,U.S. stocks lower at close of trade; Dow Jones Industrial Average down 0.81%,2022-06-08
543,"FinTech Virtual Bus Tour ... JKHY, SOFI, STNE, CTLP, ACIW, PAYO, AXP",2022-06-08
544,"Lagos and San Francisco-based Klasha has received an additional $2.1 million to complete its $4.5 million seed round. The startup, which provides multiple products for the cross-border commerce space... | June 8, 2022",2022-06-08
545,Klasha's cross-border app allows African consumers to shop internationally.,2022-06-07
546,"AFRM stock is retreating after Apple unveiled its buy now, pay later service yesterday at its developers' conference. ",2022-06-07
547,"FinTech Virtual Bus Tour ... JKHY, SOFI, STNE, CTLP, ACIW, PAYO, AXP",2022-06-07
548,Berkshire's interest in the financial services company is going to edge above 20%,2022-06-07
549,"American Express (AXP) closed the most recent trading day at $167.02, moving +0.11% from the previous trading session.",2022-06-06
550,"Ownership Submission FORM 4 Check this box if no longer... | June 6, 2022",2022-06-06
551,Visa has a strong earnings track record and is making more moves in digital payments. Is the stock a buy right now?,2022-06-06
552,"The pandemic caused some changes in how people pay, but cash and in-person shopping still haven’t been pushed aside completely.",2022-06-06
553,T. Rowe Price is debt-free and undervalued with high-quality fundamentals,2022-06-06
554,"Five top five lists with the news and calls moving stocks, powered by The Fly. AAPL, JBLU, SAVE, ULCC, TSLA, TWTR, SBUX, DIDI, SPOT, CRWD, AXP, FSTR, DASH, SOL, CSIQ, ARRY, SPWR, FSLR, JKS, SEDG, MAXN, SHLS, FTCI, QTWO, GOOG, GOOGL, ABT, NIO, FCEL, PRAX, VERU, SAIL, PLAN, PK, SAIC, SRAX, ASPN, ESS",2022-06-06
555,"Few investors have a more impressive track record than Berkshire Hathaway (NYSE: BRK.A)(NYSE: BRK.B) CEO Warren Buffett.  Buffett has long believed that diversification is only necessary if you don't know what you're doing.  Despite Buffett's company having stakes in more than four dozen securities, 91% of Berkshire Hathaway's $347.6 billion investment portfolio, including holdings from New England Asset Management, is tied up in the following four sectors, as of June 1, 2022.",2022-06-06
556,"Spotify upgrade, Edison International downgrade, and DoorDash initiation among today's top calls on Wall Street SPOT, CRWD, LULU, DASH, ACB, AXP, TPTX, BMY, PMVP, SWTX, RVMD, FSTR, EIX, DNB, GDRX, KR, BLCO, SEMR, HNVR, SLGBF",2022-06-06
557,"FinTech Virtual Bus Tour ... JKHY, SOFI, STNE, CTLP, ACIW, PAYO, AXP",2022-06-06
558,"In a regulatory filing, A... AXP",2022-06-06
559,Edward Jones analyst Kyle... AXP,2022-06-06
560,"Five top five lists with the news and calls moving stocks, powered by The Fly. AAPL, JBLU, SAVE, ULCC, TSLA, TWTR, SBUX, SOL, CSIQ, ARRY, SPWR, FSLR, JKS, SEDG, MAXN, SHLS, FTCI, SPOT, CRWD, AXP, FSTR, DASH, DIDI, QTWO, GOOG, GOOGL, ABT, NIO, FCEL, PRAX, VERU, SAIL, PLAN, PK, SAIC, SRAX, ASPN, ESS",2022-06-06
561,"Financial stocks haven't fared well this year, with the KBW Bank stock Index dropping 15.5% year to date.",2022-06-03
562,"Shares of American Express Co. shed 1.37% to $166.83 Friday, on what proved to be an all-around rough trading session for the stock market, with the S&P 500...",2022-06-03
563,"Does the June share price for Group 1 Automotive, Inc. ( NYSE:GPI ) reflect what it's really worth? Today, we will...",2022-06-03
564,The U.S. Women's Open in Southern Pines this week is about more than just golf. It's also an opportunity to showcase some of the region's small businesses.,2022-06-03
565,"Visa’s stock (NYSE: V) has marginally decreased YTD, as compared to the 13% drop in the S&P500 over the same period. Further, at its current price of $212 per share, it is trading 21% below its fair value of $268 – Trefis’ estimate for Visa’s",2022-06-02
566,"Shares of American Express Co. advanced 2.04% to $169.14 Thursday, on what proved to be an all-around favorable trading session for the stock market, with...",2022-06-02
567,"NEW YORK, June 02, 2022--American Express (NYSE: AXP) today announced it is adding three new participating partners, Goldbelly, Wine.com and Milk Bar to the $120 Dining Credit on the Gold Card. These are in addition to existing Dining Credit partners and Card Member favorites, which include Grubhub, The Cheesecake Factory and select Shake Shack locations. Once enrolled, American Express Gold Card Members can earn up to $10 in statement credits monthly when they pay with their Card at these parti",2022-06-02
568,Analysts at Wells Fargo found opportunities despite a less-than-rosy outlook for the sector. Bank of America is their top pick among large U.S. banks.,2022-06-02
569,"Staff article entitled Interesting AXP Put And Call Options For July 22nd, about stock options, from Stock Options Channel.",2022-06-02
570,Analysts at Wells Fargo found opportunities despite a less-than-rosy outlook for the sector. Bank of America is their top pick among large U.S. banks.,2022-06-02
571,"These retirement stocks provide shareholders with reliable returns in good times and bad, enabling investors to sleep soundly at night.",2022-06-02
572,"In this article, we discuss the 5 stocks that Warren Buffett was right about. If you want to read about some more stocks that Warren Buffett was right about, check out Warren Buffett Was Right About These 3 Stocks. There are very few investors who buy when everyone is selling. Those that actively wait for […]",2022-06-01
573,"Visa (V) partners with Fundbox to offer the Fundbox Flex Visa Debit Card and a payment offering suite, comprising a BNPL solution and instant disbursement, to small business clients.",2022-06-01
574,"Shares of American Express Co. shed 1.81% to $165.76 Wednesday, on what proved to be an all-around rough trading session for the stock market, with the S&P...",2022-06-01
575,"Dragged down by declines for shares of Goldman Sachs and American Express, the Dow Jones Industrial Average is in selloff mode Wednesday morning. The Dow was...",2022-06-01
576,"The cryptocurrency exchange platform, little known in Western markets, is a departure from previous presenting Tribeca sponsors American Express and AT&T.",2022-06-01
577,U.S. stocks lower at close of trade; Dow Jones Industrial Average down 0.54%,2022-06-01
578,"In the latest trading session, American Express (AXP) closed at $168.82, marking a -0.46% move from the previous day.",2022-05-31
579,"Shares of American Express Co. slipped 0.46% to $168.82 Tuesday, on what proved to be an all-around rough trading session for the stock market, with the S&P...",2022-05-31
580,"American Express’ stock (NYSE: AXP) is down 2% YTD, outperforming the 17% drop in the S&P500 over the same period. Further, it is currently trading at $161 per share, which is 18% below its fair value of $196 – Trefis’ estimate for American Express",2022-05-31
581,"In this article, we discuss 10 dividend stocks to buy according to Tom Russo’s Gardner Russo & Gardner. You can skip the latest developments of the hedge fund and our detailed analysis of Russo’s investment philosophy, and go directly to read 5 Best Dividend Stocks According to Tom Russo’s Gardner Russo & Gardner. Tom Russo, […]",2022-05-30
582,"Although some positive sessions in the equities sector have optimists excited about the red ink coming to an end, investors should approach this dynamic conservatively. True, no one wants to be around negative people spreading negative energy. At the same time, we need to be realistic about the economic underpinnings, meaning that it’s time to focus on safe stocks to buy. For one thing, the inflation rate has gotten out of control in this country. Still extremely elevated at 8.3% in April 2022,",2022-05-30
583,,2022-05-30
584,Netflix's fall from grace has ended the first act of the streaming wars. Act two will determine whether the industry can right itself.,2022-05-29
585,"In times of market volatility, investors should pay close attention to Warren Buffett stocks that may offer investment opportunities. Amazon (AMZN): Hiccup in Q1 results and market headwinds have created a better buying opportunity. American Express (AXP): As the world begins to normalize and spend more, the financial giant could be on track for a big comeback. Apple (AAPL): The tech powerhouse is enjoying record revenue with its well-received new products. Berkshire Hathaway (BRK-A, BRK-B): War",2022-05-28
586,"Shares of American Express Co. advanced 2.56% to $169.60 Friday, on what proved to be an all-around great trading session for the stock market, with the S&P...",2022-05-27
587,"After eight years, the United States Golf Association is once again ready to showcase the Pinehurst and Southern Pines area to the world with a top-tier golf tournament that will add fuel to the region's economic engine.",2022-05-27
588,Investors should study why the guru isn't selling his holdings rather than speculate on what he's buying,2022-05-27
589,"axp-20220526 UNITED STATES SECURITIES AND EXCHANGE COMMISSION Washington, D.C. 20549 ... | May 26, 2022",2022-05-26
590,"Item 8.01 Other Events.Exhibits are filed herewith in connection with the issuance by American ExpressCompany , on May 26, 2022, of $750,000,000 aggregate principalamount of 4.989%... | May 26, 2022",2022-05-26
591,"Shares of American Express Co. rallied 3.03% to $165.37 Thursday, on what proved to be an all-around favorable trading session for the stock market, with the...",2022-05-26
592,Mastercard (MA) launches the Cyber Front platform with the help of a minority investment in Picus. The platform tends to empower organizations to take prudent cybersecurity decisions.,2022-05-26
593,"Thursday, May 26, 2022The Zacks Research Daily presents the best research output of our analyst team. Today's Research Daily features new research reports on 16 major stocks, including Tesla, Inc. (TSLA), The Procter & Gamble Company (PG), and Bristol-Myers Squibb Com",2022-05-26
594,"Shares of American Express Co. advanced 3.14% to $160.51 Wednesday, on what proved to be an all-around great trading session for the stock market, with the...",2022-05-25
595,"In this article, we discuss Warren Buffett’s dividend portfolio. You can skip our detailed analysis of Berkshire Hathaway’s top 10 dividend stocks, and go directly to read Warren Buffett’s Dividend Portfolio: 5 Stocks to Watch. Warren Buffett’s repute as one of the Wall Street’s most successful investors is due to his distinct investment strategies that […]",2022-05-25
596,The Dow Jones Industrial Average is climbing Wednesday afternoon with shares of American Express and Home Depot seeing positive growth for the blue-chip...,2022-05-25
597,The Dow Jones Industrial Average is trading up Wednesday afternoon with shares of American Express and Salesforce Inc. leading the way for the index. Shares...,2022-05-25
598,The Dow Jones Industrial Average is climbing Wednesday afternoon with shares of American Express and Boeing seeing positive growth for the blue-chip average....,2022-05-25
599,"In early trading on Wednesday, shares of Salesforce topped the list of the day's best performing Dow Jones Industrial Average components, trading up 1.5%. Year to date, Salesforce has lost about 37.3% of its value.",2022-05-25
600,"Led by strong returns for shares of Salesforce Inc. and American Express, the Dow Jones Industrial Average is climbing Wednesday morning. The Dow was most...",2022-05-25
601,Discussion of markets and holdings,2022-05-25
602,Discussion of markets and holdings,2022-05-25
603,Guru stock highlight,2022-05-25
604,U.S. stocks higher at close of trade; Dow Jones Industrial Average up 0.60%,2022-05-25
605,,2022-05-25
606,"Shares of American Express Co. shed 2.14% to $155.63 Tuesday, on what proved to be an all-around mixed trading session for the stock market, with the Dow...",2022-05-24
607,"Former White House press secretary Jen Psaki will join MSNBC this fall in time for the 2022 midterm elections, NBCUniversal confirmed.",2022-05-24
608,These passive income powerhouses will bring in between $101 million and $904 million annually for Berkshire Hathaway.,2022-05-24
609,"Payments fintech Finix has moved into its new San Francisco headquarters, even as other startups — most recently, IKEA’s TaskRabbit — shed their headquarters and other commercial real estate here.  Finix recently leased 42,349 square feet at 631 Howard St., where it occupies the ground floor, basement and a mezzanine level featuring several conference rooms.  The company’s previous office was smaller and located at 480 2nd St. in San Francisco.",2022-05-23
610,"Shares of American Express Co. rose 3.78% to $159.04 Monday, on what proved to be an all-around favorable trading session for the stock market, with the S&P...",2022-05-23
611,The Dow Jones Industrial Average is rallying Monday afternoon with shares of JPMorgan Chase and American Express delivering strong returns for the...,2022-05-23
612,"In this article, we discuss 10 stocks that Ray Dalio is buying in 2022. If you want to see more additions to the billionaire’s portfolio, click Ray Dalio is Buying These 5 Stocks in 2022. Ray Dalio is an American billionaire investor and hedge fund manager, who founded Bridgewater Associates in 1985 and has served […]",2022-05-23
613,"Shares of JPMorgan Chase and American Express are seeing positive gains Monday morning, leading the Dow Jones Industrial Average rally. Shares of JPMorgan...",2022-05-23
614,"Shares of American Express Co. slid 0.49% to $153.24 Friday, on what proved to be an all-around positive trading session for the stock market, with the S&P...",2022-05-20
615,"The current market downturn provides a viable opportunity to invest in these best long-term stocks for the future. American Express (AXP): A new all-digital checking account will likely expand the company’s consumer base. Caterpillar (CAT): The recent purchase of an energy-as-a-service provider could improve efficiency, reduce costs, and provide an additional source of revenue. Coca-Cola (KO): Management has launched a new division tasked with the creation of limited-edition flavors. General Mot",2022-05-19
616,"In this article, we discuss 10 financial stocks that Warren Buffett is buying in 2022. If you want to see more financial stock picks of the billionaire, click Warren Buffett is Buying and Holding These 5 Financial Stocks in 2022. Warren Buffett follows the Benjamin Graham school of thought, picking value plays with prices that […]",2022-05-19
617,"Shares of American Express Co. shed 1.35% to $154.00 Thursday, on what proved to be an all-around poor trading session for the stock market, with the S&P 500...",2022-05-19
618,"In this article, we discuss 10 stocks to buy now according to billionaire Ken Fisher. If you want to skip our detailed analysis of Fisher’s history, investment philosophy, and hedge fund performance, go directly to 5 Best Stocks to Buy Now According to Billionaire Ken Fisher. Ken Fisher is a billionaire hedge fund manager and […]",2022-05-19
619,"Like a puppy chasing its tail, some new investors often chase 'the next big thing', even if that means buying 'story...",2022-05-19
620,"Berkshire's equity portfolio could be down $45 billion this quarter, depressing book value.",2022-05-19
621,"Shares of American Express Co. slipped 3.55% to $156.10 Wednesday, on what proved to be an all-around rough trading session for the stock market, with the...",2022-05-18
622,Could these top fintech stocks be good value buys right now?,2022-05-18
623,"Mastercard (MA) launches the Biometric Checkout Program, which empowers consumers to make biometric payments without mobile wallets or cards to ensure accelerated checkout experiences.",2022-05-18
624,"Howard University is creating a new endowed chair at its law school, through a new $2 million donation in honor of Vernon Jordan.  Kenneth and Kathryn Chenault donated the funds to celebrate the life of Jordan, the university said Wednesday.  Jordan, who died at the age of 85 in March 2021, earned his law degree from Howard and grew to be a powerful activist and leader in Washington circles and civil rights movements, including leading the United Negro College Fund and National Urban League.",2022-05-18
625,Looking for stock market analysis and research with proves results? Zacks.com offers in-depth financial research with over 30years of proven results.,2022-05-18
626,"Berkshire Hathaway started buying shares of Citigroup during the first quarter, while dumping Wells Fargo.",2022-05-17
627,"Shares of American Express Co. advanced 3.46% to $161.85 Tuesday, on what proved to be an all-around favorable trading session for the stock market, with the...",2022-05-17
628,By Liz Moyer,2022-05-17
629,Yahoo Finance's Jared Blikre breaks down the stocks Warren Buffett's Berkshire Hathaway is buying and selling.,2022-05-17
630,The Dow Jones Industrial Average is rallying Tuesday afternoon with shares of Boeing and American Express leading the way for the index. The Dow was most...,2022-05-17
631,"In this article, we discuss Warren Buffett’s 8 new stock picks in 2022. If you want to read about some more Buffett stock picks, go directly to ‘Greedy When Others are Fearful’: Warren Buffett’s 4 New Stock Picks in 2022. There are few value investors who have accumulated as much fame as Warren Buffett of […]",2022-05-17
632,"Buoyed by strong returns for shares of Boeing and American Express, the Dow Jones Industrial Average is climbing Tuesday afternoon. Shares of Boeing and...",2022-05-17
633,Looking for stock market analysis and research with proves results? Zacks.com offers in-depth financial research with over 30years of proven results.,2022-05-17
634,U.S. stocks higher at close of trade; Dow Jones Industrial Average up 1.34%,2022-05-17
635,Citi Surges After Nod from Buffett's Berkshire Hathaway,2022-05-17
636,The loss of the famed investor as a major shareholder might take away some of the luster and prestige that Wells Fargo once enjoyed.,2022-05-17
637,"Berkshire Hathaway Inc on Monday said it added new investments in Citigroup Inc and several other companies in the first quarter, as Warren Buffett's conglomerate took advantage of volatile stock markets to invest $51.1 billion that had largely been sitting in cash.",2022-05-16
638,The Oracle of Omaha knows how to beat inflation. So ride his coattails.,2022-05-16
639,"Shares of American Express Co. shed 1.46% to $156.43 Monday, on what proved to be an all-around mixed trading session for the stock market, with the Dow...",2022-05-16
640,Leslie Picker joins the 'Halftime Report' to discuss what to expect from the SEC 13-F filings.,2022-05-16
641,The Dow Jones Industrial Average is down Monday afternoon with shares of Salesforce Inc. and American Express delivering the stiffest headwinds for the...,2022-05-16
642,"Item 7.01 Regulation FD DisclosureAmerican Express Company is hereby furnishing below delinquencyand write-off statistics for the U.S. Consumer Card Member lending portfolio ofits Global... | May 16, 2022",2022-05-16
643,The Dow Jones Industrial Average is falling Monday morning with shares of American Express and Salesforce Inc. seeing the biggest losses for the index. The...,2022-05-16
644,"Dragged down by declines for shares of Home Depot and American Express, the Dow Jones Industrial Average is declining Monday morning. The Dow was most...",2022-05-16
645,"In early trading on Monday, shares of Chevron topped the list of the day's best performing Dow Jones Industrial Average components, trading up 1.8% - Year to date, Chevron registers a 45.6% gain - AXP,CVX,CRM,BA.",2022-05-16
