,summary,date
271,"Shares of Duke Realty Corp. sank 0.21% to $53.01 Wednesday, on what proved to be an all-around favorable trading session for the stock market, with the S&P...",2022-05-04
272,"Amazon.com Inc., the undisputed king of the U.S. industrial market since well before the Covid-19 pandemic, may finally have reached max capacity on warehouse and fulfillment space.",2022-05-04
273,"IRVINE, Calif. - The Southern California office of Duke Realty Corporation , the leading domestic only, pure-play logistics property REIT in the United States, preleases 148,078-square-foot... | May 4, 2022",2022-05-04
274,"Shares of Duke Realty Corp. inched 0.25% higher to $53.12 Tuesday, on what proved to be an all-around favorable trading session for the stock market, with...",2022-05-03
275,"Shares of Duke Realty Corp. shed 3.21% to $52.99 Monday, on what proved to be an all-around favorable trading session for the stock market, with the S&P 500...",2022-05-02
276,"Comcast and Charter's joint venture to challenge Roku, Amazon and other streaming platforms may signal cable's long-game strategy.",2022-05-01
277,"Shares of Duke Realty Corp. slipped 8.67% to $54.75 Friday, on what proved to be an all-around grim trading session for the stock market, with the S&P 500...",2022-04-29
278,"In trading on Friday, the Invesco China Technology ETF is outperforming other ETFs, up about 8.2% on the day. Components of that ETF showing particular strength include shares of Hello Group, up about 17.8% and shares of Weibo, up about 11.1% on the day.",2022-04-29
279,"In trading on Friday, reits shares were relative laggards, down on the day by about 1.7%. Helping drag down the group were shares of Duke Realty, off about 6.8% and shares of First Industrial Realty Trust off about 6.7% on the day.",2022-04-29
280,"In trading on Friday, reits shares were relative laggards, down on the day by about 1.7% - Helping drag down the group were shares of Duke Realty, off about 6.8% and shares of First Industrial Realty Trust off about 6.7% on the day - DRE,FR,TDUP,DBI.",2022-04-29
281,"Iron Mountain Incorporated IRM shares gained 2.4% in response to better-than-anticipated first-quarter 2022 results.The adjusted funds from operations (AFFO) per share totaled 91 cents, which surpassed the Zacks Consensus Estimate of 70 cents. This figure was 11.4% higher",2022-04-29
282,"The following Management's Discussion and Analysis of Financial Condition andResults of Operations is intended to help the reader understand our operationsand our present business environment.... | April 29, 2022",2022-04-29
283,"dividend channel,DRE,",2022-04-29
284,"Shares of Duke Realty Corp. rallied 1.23% to $59.95 Thursday, on what proved to be an all-around favorable trading session for the stock market, with the S&P...",2022-04-28
285,These are the stocks posting the largest moves in midday trading. ,2022-04-28
286,"Duke Realty's (DRE) first-quarter 2022 core FFO is driven by growth in rental rates, occupancy and leasing activity.",2022-04-28
287,"CNBC's 'Squawk Box' team break down the latest first-quarter earnings results from Comcast, which beat analysts' expectations on the top and bottom lines.",2022-04-28
288,"All eyes will be on Comcast's broadband division, which is expected to add 229,000 new high-speed internet customers during the first quarter. ",2022-04-28
289,"Duke Realty (DRE) delivered FFO and revenue surprises of 0% and 1.85%, respectively, for the quarter ended March 2022. Do the numbers hold clues to what lies ahead for the stock?",2022-04-27
290,"49.2 Percent Growth in Net Effective Rents on Leasing Activity Record Occupancy Levels 2022 Guidance Updated INDIANAPOLIS, April 27, 2022 (GLOBE NEWSWIRE) -- Duke Realty Corporation (NYSE: DRE), the largest domestic-only logistics REIT, today reported results for the first quarter of 2022. ""We completed the first quarter of 2022 with record levels of in-service and stabilized occupancy and made significant leasing progress in our development pipeline,"" said Jim Connor, Chairman and Chief Executi",2022-04-27
291,"Item 2.02. Results of Operations and Financial Condition.On April 27, 2022, Duke Realty Corporation, an Indiana corporation , the sole general partner of Duke Realty Limited... | April 27, 2022",2022-04-27
292,"Shares of Duke Realty Corp. inched 0.95% higher to $59.22 Wednesday, on what proved to be an all-around favorable trading session for the stock market, with...",2022-04-27
293,"INDIANAPOLIS _ Duke Realty Corp. on Wednesday reported a key measure of profitability in its first quarter. The results matched Wall Street expectations. The Indianapolis-based... | April 27, 2022",2022-04-27
294,"2022 Range of Estimates $2.25 $1.65 Key Assumptions ... | April 27, 2022",2022-04-27
295,Consensus $1.90. The comp... DRE,2022-04-27
296,Reports Q1 revenue $278.1... DRE,2022-04-27
297,"Shares of Duke Realty Corp. slid 1.13% to $58.66 Tuesday, on what proved to be an all-around poor trading session for the stock market, with the S&P 500...",2022-04-26
298,"Alexandria Real Estate Equities, Inc. ARE reported first-quarter 2022 adjusted funds from operations (FFO) per share of $2.05, surpassing the Zacks Consensus Estimate of $2.00. The reported FFO per share also compared favorably with the year-ago quarter’s $1.91.",2022-04-26
299,"Shares of Duke Realty Corp. dropped 0.92% to $59.33 Monday, on what proved to be an all-around positive trading session for the stock market, with the S&P...",2022-04-25
300,"Netflix doesn't plan to shut down password sharers overnight. Rather, it intends to bill shared accounts an extra fee in a global rollout that may take a year.",2022-04-23
301,"Shares of Duke Realty Corp. slid 1.85% to $59.88 Friday, on what proved to be an all-around poor trading session for the stock market, with the S&P 500 Index...",2022-04-22
302,Duke Realty's (DRE) Q1 results are likely to reflect the benefits of the company's efforts to leverage the industrial real estate market's healthy fundamentals.,2022-04-22
303,"Michael Morris, Guggenheim Partners, joins 'TechCheck' to dicsuss Snap's Q1 earnings results, where his forecast currently is and whether investors are too bearish on the streaming service industry.",2022-04-22
304,"Shares of Duke Realty Corp. slid 0.85% to $61.01 Thursday, on what proved to be an all-around poor trading session for the stock market, with the S&P 500...",2022-04-21
305,SL Green's (SLG) first-quarter 2022 performance reflects a better-than-expected top line and healthy leasing activity.,2022-04-21
306,Dissolving the district would mean Reedy Creek employees and infrastructure would be absorbed by the local counties.,2022-04-21
307,"Real estate earnings season kicks off and we'll hear results from 175 equity REITs, 40 mortgage REITs, and housing industry companies. See which ones to watch.",2022-04-21
308,"Crown Castle (CCI) delivered FFO and revenue surprises of 3.89% and 2.38%, respectively, for the quarter ended March 2022. Do the numbers hold clues to what lies ahead for the stock?",2022-04-20
309,"Shares of Duke Realty Corp. advanced 2.19% to $61.53 Wednesday, on what proved to be an all-around mixed trading session for the stock market, with the Dow...",2022-04-20
310,"Instead of legacy media shares soaring as they imitate Netflix, the industry has brought Netflix down to a degree.",2022-04-20
311,Duke Realty's (NYSE:DRE) stock up by 3.9% over the past month. Given that the market rewards strong financials in the...,2022-04-19
312,"Netflix has been willing to turn a blind eye toward password sharing when it was growing subscribers, but losing customers can change behavior quickly.",2022-04-19
313,"Shares of Duke Realty Corp. advanced 2.96% to $60.21 Tuesday, on what proved to be an all-around favorable trading session for the stock market, with the S&P...",2022-04-19
314,The state had accused Fontana officials of violating the environmental review process when it approved a large warehouse next to a high school.,2022-04-19
315,"Shares of Duke Realty Corp. inched 0.39% higher to $58.48 Monday, on what proved to be an all-around dismal trading session for the stock market, with the...",2022-04-18
316,"Item 5.07. Submission of Matters to a Vote of Security Holders.At the Annual Meeting of Shareholders of Duke Realty Corporation, an Indianacorporation , held on April 14, 2022 , theshareholders of... | April 15, 2022",2022-04-15
317,"Shares of Duke Realty Corp. shed 1.04% to $58.25 Thursday, on what proved to be an all-around poor trading session for the stock market, with the S&P 500...",2022-04-14
318,"SEATTLE ‒ April 14, 2022 ‒ The Seattle office of Duke Realty , the leading domestic-only, pure-play logistics property REIT in the United States, announces the opening of a new... | April 14, 2022",2022-04-14
319,"Shares of Duke Realty Corp. dropped 0.05% to $58.86 Wednesday, on what proved to be an all-around favorable trading session for the stock market, with the...",2022-04-13
320,"Susan Bergdoll, senior vice president of leasing and development Susan Bergdoll will be the first one to tell you she fell into real estate by chance. It's a... | April 13, 2022",2022-04-13
321,"Shares of Duke Realty Corp. inched 0.29% higher to $58.89 Tuesday, on what proved to be an all-around rough trading session for the stock market, with the...",2022-04-12
322,"Crown Castle International (CCI): A wireless infrastructure provider in perfect position for 5G build out. CubeSmart (CUBE): A smaller self-storage player that has plenty of growth potential in this kind of market. Extra Space Storage (EXR): A larger self-storage player that also has a reinsurance business. Lamar Advertising (LAMR): This is a 120-year-old advertising company that specializes in billboards, benches, and airports. Prologis (PLD): One of the key global supply chain players focusing",2022-04-12
323,Terreno Realty's (TRNO) recent spate of the acquisitions of industrial properties is likely to aid it in riding robust industrial real estate market tailwinds.,2022-04-12
324,"Point West 400 in the Dallas market DALLAS - April 12, 2022 -The Texas office of Duke Realty Corporation , the leading domestic only, pure-play logistics... | April 12, 2022",2022-04-12
325,"The publicly traded Santa Clara company leased 210,000 square feet of space in Fremont last year. Now its plans for the site are coming into focus.",2022-04-11
326,"Shares of Duke Realty Corp. shed 1.34% to $58.72 Monday, on what proved to be an all-around rough trading session for the stock market, with the S&P 500...",2022-04-11
327,"Reflecting healthy demand for its properties, Terreno Realty (TRNO) witnesses a rise in quarter-end occupancy and an increase in cash rents on new and renewed leases in Q1.",2022-04-11
328,"Duke Realty has been an active participant in the CREW Network community at the national level and the local chapter level. The company signed the CREW Network CREW Pledge for Action committing... | April 11, 2022",2022-04-11
329,"Global supply-chain disruptions have become an ongoing issue that does not appear to be going away anytime soon. Persistent obstacles such as port congestion and container shortages are exacerbating the problem. Furthermore, global aviation and maritime freight routes have become more expensive and less reliable as a result of the pandemic. Additionally, China's new Covid-19 lockdowns, as well as looming wage negotiations with West Coast dockworkers in the United States, suggest further difficulty ahead. These issues may eventually push businesses to stockpile more items to avoid missing out on sales due to freight delays. This will very likely increase the need for warehouses. Soaring Rental Rates Rental rates have reached new highs due to a perfect storm of limited supply and strong demand. Last year, warehouse rents in the United States jumped by 11%. Then, in certain markets, annual lease increases were considerably larger. According to Segro (GB:SGRO), a European warehouse owner, rents in some parts of London soared as much as 30% last year. Given the increased demand for distribution space due to a shortage of availability, leasing rates are projected to remain high in 2022. As a result, warehousing companies are currently well-positioned to profit from rising rental costs. Below, we've highlighted two warehousing stocks that are well-positioned to profit from current market conditions. Prologis (PLD) Prologis is a leading industrial real estate investment trust (REIT) with operations and management across the Americas, Asia, and Europe. The industrial real estate market is booming, with strong demand, rising rents, and new pipelines breaking records. Prologis is ideally-positioned to take advantage of its ability to provide modern logistics facilities at critical sites. Furthermore, due to supply-chain disruptions, demand for warehouse space and lease activity is increasing. This could be beneficial to Prologis. In 2022, the business aims to boost rents by around 11% again. The company will report its first-quarter earnings on April 19. According to experts, Prologis is expected to announce adjusted earnings of $0.68 per share for the first quarter. The figures represent a 41.7% increase from the year-ago quarter. With a market capitalization of $124.8 billion, Prologis is up 56% over the last year. The company's upcoming earnings results could provide a catalyst for the stock price to move higher. Turning to Wall Street, Prologis stock earns a Strong Buy consensus rating based on 10 Buys and three Holds. The average PLD price target of $173.38 implies 2.8% upside potential over the next 12 months. Duke Realty (DRE) Duke Realty specializes in warehouse space and has a market capitalization of $23 billion. The company recently began six speculative developments totaling 1.47 million square feet. With its solid ability to offer high-quality logistics facilities, the company is set to capitalize on the growing need for incremental inventory storage resulting from supply-chain interruptions. Also, investors appear to be upbeat about DRE stock. According to TipRanks' Stock Investors tool, investors currently have a Very Positive view of Duke Realty, with 8.4% of investors increasing their exposure to DRE stock over the past 30 days. On TipRanks, Duke Realty has received a Moderate Buy consensus recommendation from Wall Street analysts based on four Buys and three Holds. The stock is currently trading at $59.52, with an average DRE price target of $64.83, representing a potential 9% increase from current levels. Duke Realty is expected to report its first-quarter earnings on April 27. Wall Street analysts forecast Duke Realty to report adjusted earnings of $0.19 per share in the upcoming quarter, up 10% year-over-year.  A strong earnings report could act as a positive catalyst for the stock. Conclusion In the face of growing inflation and supply-chain bottlenecks, the logistics market should remain strong. As a result, both Prologis and Duke Realty stocks could be solid investments over the near term, as rising rents and strong worldwide trade could benefit both companies. Download the TipRanks mobile app now. Discover new investment ideas with data you can trust.  Read full Disclaimer & Disclosure",2022-04-11
330,"Shares of Duke Realty Corp. slid 1.39% to $59.52 Friday, on what proved to be an all-around mixed trading session for the stock market, with the Dow Jones...",2022-04-08
331,"""Sonic the Hedgehog 2"" is the first major family film released in 2022 and is expected to signal if this demographic is finally ready to return to theaters.",2022-04-08
332,"Shares of Duke Realty Corp. slipped 0.35% to $60.36 Thursday, on what proved to be an all-around great trading session for the stock market, with the S&P 500...",2022-04-07
333,"Niche sports organizations such as UFC, WWE and Formula 1 could be alluring acquisition targets for big streaming companies like Disney and Netflix.",2022-04-07
334,"Shares of Duke Realty Corp. rose 2.14% to $60.57 Wednesday, on what proved to be an all-around poor trading session for the stock market, with the S&P 500...",2022-04-06
335,"The ""Halftime Report"" traders give their top picks to watch for the second half.",2022-04-06
336,"As tensions rise between Disney and Florida lawmakers, the company will air new a new public service announcement from GLAAD featuring a transgender teen.",2022-04-06
337,"Shares of Duke Realty Corp. inched 0.80% higher to $59.30 Tuesday, on what proved to be an all-around rough trading session for the stock market, with the...",2022-04-05
338,"'Mad Money' host Jim Cramer and the 'Squawk on the Street' team break down shares of AT&T, Discovery and CNBC parent company Comcast.",2022-04-05
339,Charles Schwab US REIT ETF has been providing a steady dividend yield around 5%. Click here to know why I'll keep SCHH stock in my portfolio of investments.,2022-04-05
340,"Duke Realty Corp. wants to build two warehouses in the Palm Beach Logistics Center near West Palm Beach.  The Palm Beach County Zoning Commission will consider on April 7 the application by Indianapolis-based Duke Realty (NYSE: DRE).  It concerns the 24-acre property at 849 and 759 N. Benoist Farms Road, plus 8210 Eighth Road North, a few minutes from the Southern Boulevard exit of Florida’s Turnpike.",2022-04-04
341,"Shares of Duke Realty Corp. slipped 0.68% to $58.83 Monday, on what proved to be an all-around favorable trading session for the stock market, with the S&P...",2022-04-04
342,Industrial REITs have become M&A targets. STAG Industrial could potentially be next in line. Check out why we are buying STAG stock.,2022-04-03
343,U.S. equity markets advanced for the third-straight week as solid employment data relieved some immediate recession concerns. Read more here.,2022-04-03
344,"Shares of Duke Realty Corp. advanced 2.02% to $59.23 Friday, on what proved to be an all-around great trading session for the stock market, with the S&P 500...",2022-04-01
345,"The staggering growth of e-commerce over recent years accelerated even more during the pandemic, adding more fuel to the fire for distributors of all kinds needing to tie down logistics space they can use for storage and shipping.",2022-04-01
346,"Shares of Duke Realty Corp. slid 1.78% to $58.06 Thursday, on what proved to be an all-around grim trading session for the stock market, with the S&P 500...",2022-03-31
347,"The pipeline of industrial development in the East Bay has hit a historic low, feeding a supply-constrained market dynamic real estate observers say is unlikely to resolve itself any time soon.  The East Bay has 1.55 million square feet of warehouse and distribution space under construction, according to data from brokerage firm JLL.  Developers, he said, began building industrial projects on a speculative basis around 2014, and since then most of the vacant land eligible for new industrial development has been bought up and built out.",2022-03-31
348,"Duke Realty: Has an occupancy rate of 98%, driven primarily by the rise in e-commerce. EPR Properties: Enjoys a total rent collection at 97% of contractual levels. VICI Properties: Close to all rental agreements have automatic escalators based on the consumer price index (CPI), so when the CPI rises, so do rents. Source: Vitalii Vodolazskyi / Shutterstock Real estate investment trusts (REITs) offer a safe haven for investors concerned about soaring inflation. Numbers released by the U.S. Bureau",2022-03-31
349,"INDIANAPOLIS, March 30, 2022 (GLOBE NEWSWIRE) -- In a release issued under the same headline earlier today by Duke Realty Corporation (NYSE: DRE) please note that in the first paragraph of the release, the call date should be ""Thursday, April 28th"" rather than ""Thursday, May 28th."" The corrected release follows: Duke Realty Corporation (NYSE: DRE) today announced that the company will release its first quarter 2022 operating results on Wednesday, April 27th, after the market close. The company w",2022-03-30
350,"INDIANAPOLIS, March 30, 2022 (GLOBE NEWSWIRE) -- Duke Realty Corporation (NYSE: DRE) today announced that the company will release its first quarter 2022 operating results on Wednesday, April 27th, after the market close. The company will host its quarterly earnings conference call on Thursday, May 28th, at 12:00 p.m. Eastern Time. The public may access the conference call through a live audio webcast available on the investor relations section of Duke Realty’s website at www.dukerealty.com. Sup",2022-03-30
351,"Shares of Duke Realty Corp. inched 0.70% higher to $59.11 Wednesday, on what proved to be an all-around grim trading session for the stock market, with the...",2022-03-30
352,"Amid a surge in demand for its high-quality space at convenient locations in the South Florida industrial market, Duke Realty (DRE) secures lease deal with FedEx Ground.",2022-03-30
353,"FedEx picked this site because of its ease of access to major highways, proximity to customers' distribution centers and a strong local community workforce for recruiting employees.",2022-03-29
354,"The facility, sued twice in recent months for allegedly illegally emitting carcinogenic toxins, is expected to shutter by the spring of next year.",2022-03-29
355,"Shares of Duke Realty Corp. rose 1.84% to $58.70 Tuesday, on what proved to be an all-around positive trading session for the stock market, with the S&P 500...",2022-03-29
356,"WESTON, Florida - March 29, 2022 - The South Florida office of Duke Realty Corporation , the leading domestic only, pure-play logistics property REIT in the United States, secured a long-term... | March 29, 2022",2022-03-29
357,"Shares of Duke Realty Corp. rose 1.57% to $57.64 Monday, on what proved to be an all-around favorable trading session for the stock market, with the S&P 500...",2022-03-28
358,"Rexford Realty dominates industrial warehouse space in Southern California market. Read more to see REXR's growth catalysts, challenges, and our recommendation.",2022-03-28
359,,2022-03-28
360,"""CODA"" won Best Picture at the Oscars. ""Dune"" won the most awards. Will Smith smacked Chris Rock for insulting Jada Pinkett-Smith.",2022-03-27
361,RWR is an ETF which invests in equity shares of various types of REITs. Click here to read about RWR's portfolio holdings and their performance.,2022-03-26
362,"Shares of Duke Realty Corp. advanced 1.18% to $56.75 Friday, on what proved to be an all-around positive trading session for the stock market, with the S&P...",2022-03-25
363,"Duke Realty (NYSE: DRE) often seems overshadowed.  While it's the second-largest real estate investment trust (REIT) focused on industrial properties, its market cap is $100 billion less than sector behemoth Prologis (NYSE: PLD).  Further, some of its smaller rivals seem to get more attention from investors due to their faster growth rates or market focus.",2022-03-25
364,"Owning real estate is one of humanity's most established and reliable wealth-building tools. You had to be rich back in the day to own investment property, but that's no longer the case.",2022-03-25
365,"Shares of Duke Realty Corp. inched 0.14% higher to $56.09 Thursday, on what proved to be an all-around great trading session for the stock market, with the...",2022-03-24
366,"Looking at the underlying holdings of the ETFs in our coverage universe at ETF Channel, we have compared the trading price of each holding against the average analyst 12-month forward target price, and computed the weighted average implied analyst target price for the ETF itsel",2022-03-24
367,"Shares of Duke Realty Corp. shed 0.12% to $56.01 Wednesday, on what proved to be an all-around dismal trading session for the stock market, with the S&P 500...",2022-03-23
368,"Cannabis REITs have stumbled in early 2022, pressured by the broader growth-to-value rotation and uncertainty over federal legalization. See more here.",2022-03-23
369,"It is expected to be completed in early 2023, bringing Duke’s Puget Sound-area portfolio to 4 million square feet.",2022-03-23
370,"Shares of Duke Realty Corp. inched 0.04% higher to $56.08 Tuesday, on what proved to be an all-around favorable trading session for the stock market, with...",2022-03-22
371,"Image credit: Nelson Architect SEATTLE ‒ March 22, 2022 ‒ The Seattle office of Duke Realty , the leading domestic-only, pure-play logistics property... | March 22, 2022",2022-03-22
372,"Shares of Duke Realty Corp. dropped 0.39% to $56.06 Monday, on what proved to be an all-around grim trading session for the stock market, with the S&P 500...",2022-03-21
373,"Duke Realty is considered a leader in the commercial real estate industry - a top industrial REIT with an expansive portfolio across the U.S. As a leader, we have a responsibility to lead in... | March 21, 2022",2022-03-21
374,"dividend channel,DRE,",2022-03-21
375,A Rocky Mountain mansion owned by Russian oligarch Roman Abramovich would likely be among the first assets frozen by the U.S. government if he is sanctioned.,2022-03-20
376,Real estate equities delivered muted gains. New home construction rebounded in February to the strongest pace since 2006. Click here to read more.,2022-03-20
377,"Shares of Duke Realty Corp. inched 0.99% higher to $56.28 Friday, on what proved to be an all-around favorable trading session for the stock market, with the...",2022-03-18
378,"ARLINGTON, Virginia - The Washington, D.C./Baltimore office of Duke Realty Corporation , the nation's leading domestic-focused, industrial-only property REIT , announces that a current tenant, Ace... | March 18, 2022",2022-03-18
379,"Shares of Duke Realty Corp. rallied 1.57% to $55.73 Thursday, on what proved to be an all-around favorable trading session for the stock market, with the S&P...",2022-03-17
