,summary,date
142,"La Yaqui Grande opening ceremony La Yaqui Grande opening ceremony La Yaqui Grande's first bar of gold La Yaqui Grande's first bar of gold TORONTO, June 20, 2022 (GLOBE NEWSWIRE) -- Alamos Gold Inc. (TSX:AGI; NYSE:AGI) (“Alamos” or the “Company”) is pleased to announce initial gold production from the La Yaqui Grande mine, following the completion of construction this month, ahead of schedule. Stacking rates continue to ramp up with leaching activities beginning earlier in June. To mark the occas",2022-06-20
143,"Duke Realty entered into an agreement to be acquired by Prologis for $26 billion. Continental Resources received a proposal from its founder, Harold Hamm, to acquire all outstanding shares.",2022-06-20
144,"Pixar's ""Lightyear"" rocketed to a $51 million domestic opening, the best performance of an animated feature since the pandemic began.",2022-06-19
145,"A wave of REIT dividend hikes was a bright spot amid the carnage this week, as four equity REITs and four mortgage REITs hiked their dividends. Read more here.",2022-06-19
146,"Listen on the go! A daily podcast of Wall Street Breakfast will be available this morning on Seeking Alpha, iTunes, Stitcher and Spotify.",2022-06-18
147,"Staff article entitled August 19th Options Now Available For Duke Realty (DRE), about stock options, from Stock Options Channel.",2022-06-16
148,AWP & RNP are well known CEFs for REITs. One of the two has delivered better returns with less risk. Click here to learn more about both of these CEFs.,2022-06-15
149,"Netflix disrupted traditional TV by releasing entire seasons of shows all at once. Now, the model is under scrutiny as the streamer deals with big losses.",2022-06-15
150,Prologis (PLD) announced the terms for its acquisition of Duke Realty (DRE). Read more to see why PLD stock will remain on my watchlist for now.,2022-06-15
151,"FREL is a fully diversified REIT ETF, and has not invested heavily in industrial REITs. See why I won’t be interested in including FREL ETF in my portfolio.",2022-06-15
152,One day I’ll be able to tell my grandson about Industrial REITs. See why I will be adding Prologis and STAG to my grandson's portfolio.,2022-06-15
153,Robert W. Baird analyst Dave Rodgers</a...,2022-06-15
154,"""Scale has never been the objective,"" CEO Hamid Moghadam said of the acquisition, which will grow Prologis's portfolio by roughly 15%.",2022-06-15
155,RFI CEF is very close to its initial share price and distribution. Why do I think RFI offers better protection against erosion & inflation? Find out.,2022-06-15
156,"Both companies are major players in the Puget Sound region, where the industrial market is supercharged.",2022-06-14
157,Prologis (PLD) inks deal to acquire Duke Realty (DRE) in an all-stock transaction valued at $26 billion.,2022-06-14
158,"Former Attorney General of Louisiana Charles C. Foti, Jr., Esq. and the law firm of Kahn Swick & Foti, LLC are investigating the proposed sale of Duke Realty Corporation to Prologis, Inc. .... | June 14, 2022",2022-06-14
159,,2022-06-14
160,Analysts have been eager to weigh in on the Financial sector with new ratings on Duke Realty (<a ...,2022-06-14
161,"Prologis' (NYSE: PLD) perseverance has paid off.  After months of failed negotiations, the company finally persuaded smaller rival Duke Realty (NYSE: DRE) to agree to a merger deal.  The combination will create an even larger behemoth in the real estate investment trust (REIT) sector.",2022-06-14
162,"Edward Jones analyst Kyle... DRE, PLD",2022-06-14
163,"The S&P 500 is officially in a bear market. 73% of stocks are down 20% or more, with the median stock down -29.4%. The causes of today's rout were an inflation hangover and recession fears.",2022-06-14
164,"While the e-commerce industry has cooled and faces strong headwinds, one player is keeping the faith. Or, should we say, keeping the space. On...",2022-06-13
165,"Prologis Inc, a warehouse-focused real estate income trust (REIT), said on Monday it would acquire peer Duke Realty Corp for about $26 billion, including debt, in an all-stock deal, making it one of the largest transactions in the booming REIT sector.",2022-06-13
166,Prologis is expanding its considerable reach in industrial real-estate as enthusiasm in the market is starting to recede and the tight capacity that has driven up leasing prices shows signs of opening up.,2022-06-13
167,"Prologis Inc will acquire Duke Realty Corp in a nearly $26 billion all-stock deal, including debt, the companies said on Monday, as the world's largest warehouse owner seeks to bolster its portfolio amid concerns over cooling demand.",2022-06-13
168,Looking for stock market analysis and research with proves results? Zacks.com offers in-depth financial research with over 30years of proven results.,2022-06-13
169,"Prologis has agreed to buy Duke Realty for $26 billion, the companies announced today, concluding a protracted courtship that saw the Indianapolis-based company rebuff repeated overtures from its fellow giant industrial REIT.  The all-stock deal adds some key puzzle pieces to San Francisco-based Prologis’ sprawling portfolio, including properties in Southern California, Chicago, Dallas, New Jersey, Atlanta and South Florida.  The combination, which takes a major competitor off the board, creates an industrial real estate powerhouse with more than 150 million square feet of space with another 11 million square feet under development.",2022-06-13
170,The Nasdaq composite lost 3.5% as it undercut the year's lows and sank to the lowest level since November 2020.,2022-06-13
171,Yahoo Finance reports on Prologis acquiring Duke Realty Corporation in an all-stock transaction value of roughly $26 billion.,2022-06-13
172,"The combination of logistics REITs Prologis and Duke Realty will immediately save as much as $370 million in costs, the companies say.",2022-06-13
173,"Prologis to Combine with Duke Realty in $26 Billion All-Stock Transaction Portfolio addition will drive long-term shareholder growth SAN... | June 13, 2022",2022-06-13
174,"Shares of Duke Realty Corp. jumped 4.5% in premarket trading Monday, after the owner of rentable industrial assets in logistics markets agreed to be acquired by fellow real estate investment trust (REIT) Prologis Inc. in an all-stock deal valued at about $26 billion, including debt. Prologis shares shed 4.1% ahead of the open. Under terms of the deal, Duke Realty shareholders will receive 0.475 Prologis shares for each Duke Realty share they own. Based on Friday's closing prices, that values Duk",2022-06-13
175,"Prologis Inc said on Monday it would acquire Duke Realty Corp in an all-stock deal valued at about $26 billion, including debt. (Reporting by Aishwarya Nair in Bengaluru; Editing by Sriraj Kalluvila)",2022-06-13
176,"Prologis, Inc. (NYSE: PLD) and Duke Realty Corporation (NYSE: DRE) today announced that the two companies have entered into a definitive merger agreement by which Prologis will acquire Duke Realty in an all-stock transaction, valued at approximately $26 billion, including the assumption of debt. The respective board of directors for Prologis and Duke Realty have unanimously approved the transaction.",2022-06-13
177,"Halper Sadeh LLP, an investor rights law firm, is investigating whether the sale of Duke Realty Corporation to Prologis, Inc. for 0.475x of a Prologis share for each Duke Realty share is fair to... | June 13, 2022",2022-06-13
178,"Notable gainers among liq... DRE, MMM, CMA",2022-06-13
179,"By Chris Wack Prologis Inc. is buying Duke Realty Corp. in a deal with $26 billion, including the assumption of debt, the companies said Monday. The respective boards of directors for... | June 13, 2022",2022-06-13
180,Looking for stock market analysis and research with proves results? Zacks.com offers in-depth financial research with over 30years of proven results.,2022-06-13
181,"By Chris Wack Prologis Inc. is buying Duke Realty Corp. in an all-stock transaction valued at $26 billion, including the assumption of debt, the companies...",2022-06-13
182,"By Chris Wack Prologis Inc. is buying Duke Realty Corp. in an all-stock transaction valued at $26 billion, including the assumption of debt, the companies...",2022-06-13
183,"Item 1.01 Entry into a Material Definitive Agreement.On June 11, 2022, Duke Realty Corporation and Duke RealtyLimited Partnership (Duke Realty OP and, together with Duke Realty, the DukeRealty... | June 13, 2022",2022-06-13
184,"Shares of Prologis are do... PLD, DRE",2022-06-13
185,"Prologis (PLD) and Duke R... PLD, DRE",2022-06-13
186,U.S. stocks lower at close of trade; Dow Jones Industrial Average down 2.79%,2022-06-13
187,"""Jurassic World: Dominion"" roared to the top of the domestic box office over the weekend, generating more than $143 million in ticket sales during its debut.",2022-06-12
188,,2022-06-10
189,"""Jurassic World: Dominion"" may score to top spot at the domestic box office this weekend, but lackluster critical reviews and word of mouth could stall its potential haul.",2022-06-09
190,"Duke Realty (DRE) is poised to gain from its capacity to offer modern facilities in key locations amid healthy industrial real estate market fundamentals. However, a development boom is a concern.",2022-06-09
191,"Universal's ""Jurassic World: Dominion"" enters domestic theaters Friday, and it will snag the majority of premium format screens from ""Top Gun: Maverick.""",2022-06-09
192,The following slide deck was published by Duke Realty Corporation in conjunction with this event.,2022-06-08
193,"Performance and Strategy Update Forward-Looking Statement This... | June 7, 2022",2022-06-07
194,"The project is one of several in the Bay Area Duke has said it will build without a tenant in hand. Demolition work could begin as soon as July, the developer said ahead of the approval last week.",2022-06-06
195,"INDIANAPOLIS, June 06, 2022 (GLOBE NEWSWIRE) -- Duke Realty Corporation (NYSE: DRE and the “company”), a leader in sustainable industrial real estate development and the largest domestic-only logistics REIT (Real Estate Investment Trust), announced today its management will attend NAREIT’s REITweek: 2022 Virtual Investor Conference being held June 7th to 9th, 2022. Management will deliver a webcast presentation on Wednesday, June 8th from 2:15 p.m. to 2:45 p.m. Eastern Time. To access the live w",2022-06-06
196,"INDIANAPOLIS, June 06, 2022 -- Duke Realty Corporation , a leader in sustainable industrial real estate development and the largest domestic-only logistics REIT , announced today its management... | June 6, 2022",2022-06-06
197,"Prologis offered to acquire Duke Realty at a premium of 29%, which was rejected by the board members of DRE. Read more on DRE stock and the acquisition here.",2022-06-06
198,"Shares of Duke Realty Corp. dropped 0.93% to $53.27 Friday, on what proved to be an all-around grim trading session for the stock market, with the S&P 500...",2022-06-03
199,Host Hotels (HST) reported earnings 30 days ago. What's next for the stock? We take a look at earnings estimates for some clues.,2022-06-03
200,"Shares of Duke Realty Corp. rose 2.15% to $53.77 Thursday, on what proved to be an all-around great trading session for the stock market, with the S&P 500...",2022-06-02
201,"Shares of Duke Realty Corp. dropped 0.36% to $52.64 Wednesday, on what proved to be an all-around grim trading session for the stock market, with the S&P 500...",2022-06-01
202,"INDIANAPOLIS, June 01, 2022 (GLOBE NEWSWIRE) -- Duke Realty Corporation (NYSE: DRE), a leader in sustainable industrial real estate development and the largest domestic-only logistics REIT (Real Estate Investment Trust), announces the addition of Scott P. Anderson to its board of directors. Mr. Anderson was the chairman and CEO of Patterson Companies Inc., a distributor of dental and animal health products and technologies in North America and the United Kingdom, before his retirement in 2017. M",2022-06-01
203,"Duke Realty Corporation (... DRE, PDCO",2022-06-01
204,"In this article, we discuss 10 best real estate stocks to buy in 2022 according to Eduardo Abush’s Waterfront Capital Partners. If you want to skip our detailed analysis of Abush’s history, investment philosophy, and hedge fund performance, go directly to 5 Best Real Estate Stocks to Buy in 2022 According to Eduardo Abush’s Waterfront Capital […]",2022-05-31
205,"Shares of Duke Realty Corp. shed 1.10% to $52.83 Tuesday, on what proved to be an all-around rough trading session for the stock market, with the S&P 500...",2022-05-31
206,Truist analyst Ki Bin Kim... DRE,2022-05-31
207,Netflix's fall from grace has ended the first act of the streaming wars. Act two will determine whether the industry can right itself.,2022-05-29
208,"Former White House press secretary Jen Psaki will join MSNBC this fall in time for the 2022 midterm elections, NBCUniversal confirmed.",2022-05-24
209,"RALEIGH, N.C. - May 24, 2022 - The Raleigh/Washington, D.C. office of Duke Realty Corporation , a leader in sustainable industrial real estate development and the largest domestic-only... | May 24, 2022",2022-05-24
210,"Shares of Duke Realty Corp. dropped 0.31% to $50.91 Friday, on what proved to be an all-around positive trading session for the stock market, with the S&P...",2022-05-20
211,"As unfavored as recessions are, they are a part of the economic cycle, and right now there are some factors indicating that a potential recession is looming. Savvy investors are taking the time right now to stock up on recession-resilient assets, including real estate investments",2022-05-20
212,"Amid a demand spike for its well-located industrial spaces along the New Jersey Turnpike corridor, Duke Realty (DRE) secures a lease with the global e-commerce giant, JD.com.",2022-05-19
213,"Shares of Duke Realty Corp. slipped 1.29% to $51.07 Thursday, on what proved to be an all-around poor trading session for the stock market, with the S&P 500...",2022-05-19
214,"Shares of Duke Realty Corp. slipped 5.06% to $51.74 Wednesday, on what proved to be an all-around poor trading session for the stock market, with the S&P 500...",2022-05-18
215,"JERSEY CITY, N.J. - The New Jersey office of Duke Realty Corporation , a leader in sustainable industrial real estate development and the largest domestic-only logistics REIT , announces that it has... | May 18, 2022",2022-05-18
216,"Shares of Duke Realty Corp. rallied 1.98% to $54.50 Tuesday, on what proved to be an all-around great trading session for the stock market, with the S&P 500...",2022-05-17
217,"Rising occupancy, higher dividend yields and solid future growth prospects make these REITs to buy attractive investment propositions.",2022-05-17
218,Mizuho analyst Vikram Mal... DRE,2022-05-17
219,"Shares of Duke Realty Corp. dropped 0.34% to $53.44 Monday, on what proved to be an all-around mixed trading session for the stock market, with the Dow Jones...",2022-05-16
220,Leslie Picker joins the 'Halftime Report' to discuss what to expect from the SEC 13-F filings.,2022-05-16
221,"Prologis (NYSE: PLD) was a standout performer in 2021. The logistics-focused real estate investment trust (REIT) gained nearly 70% last year, outpacing the REIT sector's roughly 40% average. However, shares have tumbled 26% from their peak this year. Most of that damage has happe",2022-05-16
222,"BMO Capital analyst John ... DRE, PLD",2022-05-16
223,,2022-05-13
224,"The First Trust Horizon Managed Volatility Domestic ETF is seeing unusually high volume in afternoon trading Thursday, with over 271,000 shares traded versus three month average volume of about 33,000. Shares of HUSV were down about 0.9% on the day.",2022-05-12
225,"After Duke Realty (DRE) r... PLD, DRE",2022-05-12
226,"Corrections & Amplifications for the edition of May 12, 2022",2022-05-12
227,Duke Realty rejected a takeover offer that Prologis made public on Tuesday. The deal would have combined the two real-estate investment trusts.,2022-05-11
228,Duke Realty called the unsolicited offer insufficient. Prologis on Tuesday made its all-stock offer for Duke Realty public following more than five months of private overtures.,2022-05-11
229,"Shares of Duke Realty Corp. shot up 8.5% in morning trading Wednesday, after the logistics real estate investment trust said the recent buyout proposal from fellow REIT Prologis Inc. was ""insufficient."" Prologis shares gained 2.5%. Prologis had said on Tuesday that it proposed to buy Duke Realty in a stock deal that valued Duke Realty shares at the time at $61.68, a 29% premium. That price implied a market capitalization for Duke Realty of about $23.7 billion. ""As we have repeatedly made clear t",2022-05-11
230,"(Bloomberg) -- US warehouse landlord Duke Realty Corp. responded to a $24 billion takeover offer by Prologis Inc., saying the all-stock proposal is “insufficient.”Most Read from BloombergDon’t Bother Paying Off Student Loan Debt Right Now, Advisers SayTerraUSD Stablecoin Plunges as Crypto Market Awaits RescuePrices in US Outstrip Forecasts in Sign of Inflation PersistingValue Stocks Power Gains Amid Peak-Inflation Views: Markets WrapNike Escalates Feud with StockX, Says Site is Selling Fake Shoe",2022-05-11
231,"Duke Realty Corp on Wednesday rejected a $23.7 billion all-stock deal from warehouse real estate company Prologis Inc, and said the offer was ""insufficient"".",2022-05-11
232,"Duke Realty Corp on Wednesday rejected a $23.7 billion all-stock deal from warehouse real estate company Prologis Inc, and said the offer was ""insufficient"".  Prologis on Tuesday had offered Duke $61.68 per share, an over 29% premium to the stock's closing price on Monday, as the company looked to benefit from booming demand for industrial space.  San Francisco-based Prologis, which leases logistics facilities to about 5,800 customers including Amazon.com Inc , BMW AG and FedEx Corp, said it had previously offered to buy Duke privately.",2022-05-11
233,"INDIANAPOLIS, May 11, 2022 (GLOBE NEWSWIRE) -- Duke Realty Corporation (NYSE: DRE) (“Duke Realty” or “the Company”), the largest domestic-only logistics REIT, today responded to Prologis, Inc.’s (NYSE: PLD) (“Prologis”) non-binding proposal to acquire the Company in an all-stock transaction. Under the terms of Prologis’ May 10, 2022 proposal, Duke Realty shareholders would receive 0.466 shares of Prologis common stock for each share of Duke Realty common stock they own. “As we have repeatedly ma",2022-05-11
234,"In early trading on Wednesday, shares of Electronic Arts, topped the list of the day's best performing components of the S&P 500 index, trading up 10.8%. Year to date, Electronic Arts, has lost about 6.3% of its value.",2022-05-11
235,Duke Realty called the unsolicited offer insufficient. Prologis on Tuesday made its all-stock offer for Duke Realty public following more than five months of private overtures.,2022-05-11
236,"Prologis Inc (NYSE: PLD) proposed to acquire Duke Realty Corporation (NYSE: DRE) in an all-stock transaction valued at $61.68 per Duke Realty share. Under the terms of the proposal, each Duke Realty share would receive 0.466 shares of Prologis common stock, equivalent to a deal value of $23.7 billion. Prologis' proposal represents a premium of 29% to Duke Realty's closing price on May 9. Prologis made its unsolicited all-stock offer of $23.7 billion for Duke after more than five months of trying",2022-05-11
237,"dividend channel,DRE,JEF,SII,",2022-05-11
238,"By Chris Wack Duke Realty Corp. said Wednesday it believes the buyout offer made by Prologis Inc. on Tuesday is insufficient. We believe the latest offer, virtually unchanged from its... | May 11, 2022",2022-05-11
239,"Item 7.01. Regulation FD Disclosure.On May 11, 2022, Duke Realty Corporation, an Indiana corporation , issued a press release responding to Prologis,Inc.'s non-binding proposal to... | May 11, 2022",2022-05-11
240,"Notable gainers among liq... EA, DRE, MRO, APA, DVN",2022-05-11
241,"Duke Realty (DRE) respond... DRE, PLD",2022-05-11
242,U.S. stocks bounce in choppy trading Wednesday after an eagerly awaited consumer price index reading shows U.S. inflation slowed less than expected in April.,2022-05-11
243,U.S. stocks lower at close of trade; Dow Jones Industrial Average down 1.02%,2022-05-11
244,What would the deal mean for Duke's shareholders? What happens now? Here's what you need to know about Prologis's now-public proposal.,2022-05-11
245,The warehouse owner’s all-stock proposal aims to add more space serving the e-commerce market.,2022-05-10
246,"Prologis made an offer to buy Duke Realty in an all-stock deal valuing Duke at $61.68 a share, or about $23.71 billion. ",2022-05-10
247,"(Bloomberg) -- Prologis Inc., the giant global warehouse owner, unveiled a roughly $24 billion all-stock offer to acquire Duke Realty Corp., taking its bid public after months of private pushback from the Indianapolis-based real estate investment trust. Most Read from BloombergMarcos Jr. Leads With 61% of Votes Counted: Philippines UpdateStocks Sink to 13-Month Low as U.S. Curve Steepens: Markets WrapDay Trader Army Loses All the Money It Made in Meme-Stock EraBiden Team Sees China Tilt Aided as",2022-05-10
248,"Duke Realty is in play, with giant peer Prologis looking to swallow up one of its most notable competitors.",2022-05-10
249,"Real-estate investment trust Prologis disclosed a revised offer to buy Duke Realty in an all-stock deal. Because of the divergence in their share performance, the new premium for Duke has increased.",2022-05-10
250,"Prologis Inc, a warehouse real estate company, said on Tuesday it had offered to buy its smaller peer Duke Realty Corp in an all-stock deal valued at $23.7 billion, as it looks to benefit from the booming demand for industrial space.",2022-05-10
251,"Prologis Inc, a warehouse real estate company, said on Tuesday it had offered to buy its smaller peer Duke Realty Corp in an all-stock deal valued at $23.7 billion, as it looks to benefit from the booming demand for industrial space.  The deal comes at a time when Prologis is struggling to keep up with an uptick in demand from companies looking to park their finished products in warehouses amid a supply chain crunch.  Storage space requirement, especially from e-commerce firms including Amazon.com Inc, has seen a jump as the pandemic has prompted consumers to switch to online shopping.",2022-05-10
252,"Prologis Inc. said Tuesday it is proposing to acquire Duke Realty Corp. for $61.68 a share in an all-stock deal. Under the terms of the offer, Duke Realty shareholders would receive 0.466 shares of Prologis, valued at $61.68, or a premium of 29% over Duke's closing price on Monday. Prologis, a logistics real estate company, said it made an earlier offer in November of 2021 after dialogue between the executive teams offering an exchange ratio of 0.465 shares, equal to a 20% premium at that time.",2022-05-10
253,"Prologis, Inc. (NYSE: PLD) (""Prologis""), the global leader in logistics real estate, today sent a letter to James B. Connor, Chairman and Chief Executive Officer of Duke Realty Corporation (NYSE: DRE) (""Duke Realty"") proposing to acquire Duke Realty in an all-stock transaction.",2022-05-10
254,"Truist analyst Ki Bin Kim... PLD, DRE, EGP, FR",2022-05-10
255,"In early trading on Tuesday, shares of Duke Realty topped the list of the day's best performing components of the S&P 500 index, trading up 11.4%. Year to date, Duke Realty has lost about 19.0% of its value.",2022-05-10
256,"Five top five lists with the news and calls moving stocks, powered by The Fly. BHVN, PFE, PTON, UPST, MTCH, GOOG, GOOGL, PLD, DRE, MO, PLTR, ALV, TSLA, EBS, C, NFLX, FB, APPN, PEGA, AHCO, AUPH, CRON, UWMC, DM, EYE, PLNT, GDRX, BHC, REYN, FOX, FOXA",2022-05-10
257,"Prologis Inc. said it has made an offer to buy Duke Realty Corp. in an all-stock deal valuing Duke at $61.68 a share. Prologis Offers to Buy Duke Realty in Nearly $24 Billion Deal, at 0850 ET,... | May 10, 2022",2022-05-10
258,"Wall Street Opens Sharply Higher, Rebounding from Monday Rout; Dow up 410 Points",2022-05-10
259,"JERSEY CITY, N.J. - The New Jersey office of Duke Realty , a leader in sustainable industrial real estate development and the largest domestic-only logistics REIT , has hired Mikki Columbus as vice... | May 10, 2022",2022-05-10
260,"Notable gainers among liq... DRE, MOS, IFF, SYY, SPG",2022-05-10
261,"Duke Realty is up 15.3%, ... DRE",2022-05-10
262," DRE, PLD",2022-05-10
263,"Prologis (PLD) sent a let... PLD, DRE",2022-05-10
264,The Fly is a leading digital publisher of real-time financial news. The Fly team scours all sources of company news and delivers short-form stories consisting of only market moving content.,2022-05-10
265,"Five top five lists with the news and calls moving stocks, powered by The Fly. PFE, BHVN, PTON, GOOG, GOOGL, MTCH, PLD, DRE, SOFI, UPST, MO, PLTR, ALV, TSLA, C, NFLX, TEVA, ABBV, AAPL, APPN, AHCO, PEGA, AUPH, CRON, UWMC, DM, EYE, BHC, PLNT, GDRX, REYN",2022-05-10
266,"The news means that tens of millions of households could receive high-speed internet at no cost, according to the White House.",2022-05-09
267,"The warehouses are owned by Duke Realty, which purchased the properties in a $450 million mega deal.",2022-05-06
268,"Shares of Duke Realty Corp. slipped 2.47% to $49.76 Friday, on what proved to be an all-around poor trading session for the stock market, with the S&P 500...",2022-05-06
269,"Shares of Duke Realty Corp. shed 3.75% to $51.02 Thursday, on what proved to be an all-around poor trading session for the stock market, with the S&P 500...",2022-05-05
270,"ATLANTA - The Atlanta office of Duke Realty Corporation , the leading domestic only, pure-play logistics property REIT in the United States, announces a lease deal for a 113,400-square-foot facility... | May 5, 2022",2022-05-05
