,summary,date
155,"DXC Technology to Participate in Cowen Technology Conference.DXC Technology , a leading Fortune 500 global technology services company, will participate in the Cowen Technology Conference on June 2,... | May 30, 2022",2022-05-30
156,Netflix's fall from grace has ended the first act of the streaming wars. Act two will determine whether the industry can right itself.,2022-05-29
157,"DXC Technology (NYSE: DXC) a leading Fortune 500 global technology services company, will participate in the Cowen Technology Conference on June 2, 2022. Ken Sharp, Chief Financial Officer, is scheduled to participate in a fireside chat at 9:40 AM ET.",2022-05-27
158,"Shares of DXC Technology Co. rallied 2.69% to $35.08 Friday, on what proved to be an all-around great trading session for the stock market, with the S&P 500...",2022-05-27
159,"Shares of DXC Technology  have soared sharply higher in recent days.  In the daily bar chart of DXC, below, we can see that the shares have shot dramatically higher this month crossing above the 50-day moving average line and the 200-day moving average line.  The daily On-Balance-Volume (OBV) line shows a fresh rise from early March signaling a turn towards more aggressive buying by traders.",2022-05-27
160,"DXC Technology , Lloyd's and the International Underwriting Association , have announced a $465 million USD contract extension to ensure seamless continuity for the activities of London insurance... | May 27, 2022",2022-05-27
161,"In this article, we will take a look at the 11 stocks drawing attention on quarterly results. You can skip our detailed analysis of these companies and go directly to the 5 Stocks Drawing Attention on Quarterly Results. Notable tech stocks, including NVIDIA Corporation (NASDAQ:NVDA), Snowflake Inc. (NYSE:SNOW), Splunk Inc. (NASDAQ:SPLK) and Nutanix, Inc. (NASDAQ:NTNX), […]",2022-05-26
162,Investors are looking past a lackluster quarter to focus on the company's bigger-picture overhaul.,2022-05-26
163,"Shares of DXC Technology Co. jumped 15.99% to $34.16 Thursday, on what proved to be an all-around great trading session for the stock market, with the S&P...",2022-05-26
164,"Analysts cut their price targets on DXC Technology Co (NYSE: DXC) post Q4 earnings miss. RBC Capital analyst Daniel Perlin reiterated DXC with an Outperform and lowered the price target from $47 to $39 (17.9% upside). While Q4/22 results were lower than expected and FY23 guidance is light, Perlin believes DXC is generally progressing toward a more digitally focused, consistent and transparent operator. The Outperform rating is based on: 1) management achieving its financial targets as it execute",2022-05-26
165,"DXC Technology's (DXC) Q4 earnings benefit from margin expansion, lower interest expenses and outstanding common stocks, which more than offset the negative impact of reduced revenues.",2022-05-26
166,"DXC Technology , Lloyd's and the International Underwriting Association , have announced a $465 million USD contract extension to ensure seamless continuity for the activities of London insurance... | May 26, 2022",2022-05-26
167,"DXC Technology, Lloyd... DXC",2022-05-26
168,"Notable gainers among liq... DLTR, DG, DXC, CZR, NCLH",2022-05-26
169,RBC Capital analyst Danie... DXC,2022-05-26
170,Cowen analyst Bryan Bergi... DXC,2022-05-26
171,"IntroductionThe purpose of the MD&A is to present information that management believes isrelevant to an assessment and understanding of our results of operations andcash flows for the fiscal... | May 26, 2022",2022-05-26
172,Deutsche Bank analyst Bry... DXC,2022-05-26
173,Susquehanna analyst James... DXC,2022-05-26
174,"Ladies and gentlemen, thank you for standing by, and welcome to the DXC Technology's fourth-quarter fiscal year 2022 earnings call.  John Sweeney, vice president of investor relations, you may begin your conference.",2022-05-26
175,U.S. stocks higher at close of trade; Dow Jones Industrial Average up 1.61%,2022-05-26
176,"In trading on Thursday, shares of DXC Technology Co (DXC) crossed above their 200 day moving average of $32.90, changing hands as high as $34.27 per share - DXC Technology Co shares are currently trading up about 16.1% on the day. - DXC.",2022-05-26
177,"DXC Technology Reports Fourth Quarter Fiscal Year 2022 Results •Revenues of $4.01 billion for Q4 FY22, down 8.6% as compared to prior year period, and down... | May 26, 2022",2022-05-26
178,"DXC Technology Company. (DXC) delivered earnings and revenue surprises of -16% and 2.96%, respectively, for the quarter ended March 2022. Do the numbers hold clues to what lies ahead for the stock?",2022-05-25
179,DXC Technology (NYSE: DXC) today reported results for the fourth quarter and full fiscal year 2022.,2022-05-25
180,"Shares of DXC Technology Co. inched 0.03% higher to $29.45 Wednesday, on what proved to be an all-around favorable trading session for the stock market, with...",2022-05-25
181,"Item 2.02 Results of Operations and Financial Condition.On May 25, 2022, DXC Technology Company issued a press releasereporting its financial results for the fourth quarter of fiscal 2022... | May 25, 2022",2022-05-25
182,"Notable companies reporti... NVDA, SNOW, SPLK, WSM, DXC, NTNX, BOX",2022-05-25
183,Sees FY23 revenue $14.9B-... DXC,2022-05-25
184,Sees Q1 revenue $3.7B-$3.... DXC,2022-05-25
185,Reports Q4 revenue $4.01B... DXC,2022-05-25
186,"Shares of DXC Technology Co. slipped 2.06% to $29.44 Tuesday, on what proved to be an all-around mixed trading session for the stock market, with the Dow...",2022-05-24
187,"Former White House press secretary Jen Psaki will join MSNBC this fall in time for the 2022 midterm elections, NBCUniversal confirmed.",2022-05-24
188,"Luxoft, a DXC Technology (NYSE: DXC) company, is working with CARIAD, the automotive software company of Volkswagen Group, to provide vehicle software development, testing, and integration services.",2022-05-24
189,"Shares of DXC Technology Co. rose 1.55% to $30.06 Monday, on what proved to be an all-around positive trading session for the stock market, with the S&P 500...",2022-05-23
190,"Though price concessions and business terminations are likely to have hurt DXC Technology's (DXC) Q4 top line, cost-saving initiatives and lower interest expenses might have aided the bottom line.",2022-05-23
191,Looking for stock market analysis and research with proves results? Zacks.com offers in-depth financial research with over 30years of proven results.,2022-05-23
192,"Shares of DXC Technology Co. sank 0.13% to $29.60 Friday, on what proved to be an all-around favorable trading session for the stock market, with the S&P 500...",2022-05-20
193,"Shares of DXC Technology Co. advanced 1.72% to $29.64 Thursday, on what proved to be an all-around grim trading session for the stock market, with the S&P...",2022-05-19
194,"Shares of DXC Technology Co. slipped 5.05% to $29.14 Wednesday, on what proved to be an all-around rough trading session for the stock market, with the S&P...",2022-05-18
195,"DXC Technology's (NYSE: DXC) Board of Directors today announced the appointment of president and CEO Mike Salvino to the additional position of board chairman and David Herzog as the lead independent director effective after the Company's Annual Meeting of Stockholders on July 26, 2022. Mr. Salvino succeeds Ian Read, who will be retiring from the board on that date.",2022-05-17
196,"Item 5.02 Departure of Directors or Certain Officers; Election of Directors;Appointment of Certain Officers; Compensatory Arrangements of Certain Officers.On May 17, 2022, the board of directors ... | May 17, 2022",2022-05-17
197,"Shares of DXC Technology Co. advanced 3.58% to $30.69 Tuesday, on what proved to be an all-around great trading session for the stock market, with the S&P...",2022-05-17
198,DXC Technology's boa... DXC,2022-05-17
199,"Shares of DXC Technology Co. slumped 0.13% to $29.63 Monday, on what proved to be an all-around mixed trading session for the stock market, with the Dow...",2022-05-16
200,Leslie Picker joins the 'Halftime Report' to discuss what to expect from the SEC 13-F filings.,2022-05-16
201,"ASHBURN, Va., May 09, 2022--DXC Technology (NYSE: DXC) today announced that it will release financial results for the fourth quarter and full year of fiscal 2022 on Wednesday, May 25, 2022, at approximately 4:15 p.m. Eastern Daylight Time (EDT).",2022-05-09
202,"The news means that tens of millions of households could receive high-speed internet at no cost, according to the White House.",2022-05-09
203,"Shares of DXC Technology Co. slid 1.04% to $29.42 Friday, on what proved to be an all-around grim trading session for the stock market, with the S&P 500...",2022-05-06
204,"Shares of DXC Technology Co. slid 3.76% to $29.73 Thursday, on what proved to be an all-around rough trading session for the stock market, with the S&P 500...",2022-05-05
205,"Momentive (MNTV) delivered earnings and revenue surprises of 100% and 0.76%, respectively, for the quarter ended March 2022. Do the numbers hold clues to what lies ahead for the stock?",2022-05-04
206,"Shares of DXC Technology Co. rose 3.35% to $30.89 Wednesday, on what proved to be an all-around favorable trading session for the stock market, with the S&P...",2022-05-04
207,"Shares of DXC Technology Co. rallied 1.77% to $29.89 Tuesday, on what proved to be an all-around great trading session for the stock market, with the S&P 500...",2022-05-03
208,"Looking at DXC Technology Company's ( NYSE:DXC ) insider transactions over the last year, we can see that insiders were...",2022-05-03
209,"Shares of DXC Technology Co. advanced 2.33% to $29.37 Monday, on what proved to be an all-around positive trading session for the stock market, with the S&P...",2022-05-02
210,"Comcast and Charter's joint venture to challenge Roku, Amazon and other streaming platforms may signal cable's long-game strategy.",2022-05-01
211,"Shares of DXC Technology Co. shed 2.97% to $28.70 Friday, on what proved to be an all-around poor trading session for the stock market, with the S&P 500...",2022-04-29
212,"Shares of DXC Technology Co. advanced 2.53% to $29.58 Thursday, on what proved to be an all-around positive trading session for the stock market, with the...",2022-04-28
213,These are the stocks posting the largest moves in midday trading. ,2022-04-28
214,"CNBC's 'Squawk Box' team break down the latest first-quarter earnings results from Comcast, which beat analysts' expectations on the top and bottom lines.",2022-04-28
215,"All eyes will be on Comcast's broadband division, which is expected to add 229,000 new high-speed internet customers during the first quarter. ",2022-04-28
216,"Shares of DXC Technology Co. slipped 1.06% to $28.85 Wednesday, on what proved to be an all-around positive trading session for the stock market, with the...",2022-04-27
217,"MADRID, April 27, 2022--MRW has awarded DXC Technology and Nutanix a five-year contract to transform MRW’s IT systems with hybrid cloud technologies.",2022-04-27
218,"Shares of DXC Technology Co. shed 3.25% to $29.16 Tuesday, on what proved to be an all-around grim trading session for the stock market, with the S&P 500...",2022-04-26
219,"Shares of DXC Technology Co. advanced 2.41% to $30.14 Monday, on what proved to be an all-around favorable trading session for the stock market, with the S&P...",2022-04-25
220,Looking for stock market analysis and research with proves results? Zacks.com offers in-depth financial research with over 30years of proven results.,2022-04-25
221,"Netflix doesn't plan to shut down password sharers overnight. Rather, it intends to bill shared accounts an extra fee in a global rollout that may take a year.",2022-04-23
222,"Shares of DXC Technology Co. slipped 4.17% to $29.43 Friday, on what proved to be an all-around dismal trading session for the stock market, with the S&P 500...",2022-04-22
223,"Michael Morris, Guggenheim Partners, joins 'TechCheck' to dicsuss Snap's Q1 earnings results, where his forecast currently is and whether investors are too bearish on the streaming service industry.",2022-04-22
224,"Shares of DXC Technology Co. shed 3.70% to $30.71 Thursday, on what proved to be an all-around rough trading session for the stock market, with the S&P 500...",2022-04-21
225,Dissolving the district would mean Reedy Creek employees and infrastructure would be absorbed by the local counties.,2022-04-21
226,"ASHBURN, Va., April 21, 2022--DXC Technology’s Board of Directors announced the appointment of Carrie W. Teffner to the company’s board effective April 20, 2022.",2022-04-21
227,"DXC Technology Adds Carrie Teffner to Board of Directors ASHBURN, Va., April 21, 2022 - DXC Technology's Board of Directors today announced the appointment of Carrie W. Teffner... | April 21, 2022",2022-04-21
228,"Item 5.02 Departure of Directors or Certain Officers; Election of Directors;Appointment of Certain Officers; Compensatory Arrangements of Certain Officers.On April 20, 2022, the board of directors ... | April 21, 2022",2022-04-21
229,"Shares of DXC Technology Co. rallied 1.53% to $31.89 Wednesday, on what proved to be an all-around mixed trading session for the stock market, with the Dow...",2022-04-20
230,"Instead of legacy media shares soaring as they imitate Netflix, the industry has brought Netflix down to a degree.",2022-04-20
231,Citi analyst Ashwin Shirv... DXC,2022-04-20
232,"Netflix has been willing to turn a blind eye toward password sharing when it was growing subscribers, but losing customers can change behavior quickly.",2022-04-19
233,"Shares of DXC Technology Co. inched 0.71% higher to $31.41 Tuesday, on what proved to be an all-around favorable trading session for the stock market, with...",2022-04-19
234,"Shares of DXC Technology Co. dropped 0.19% to $31.19 Monday, on what proved to be an all-around rough trading session for the stock market, with the S&P 500...",2022-04-18
235,"Shares of DXC Technology Co. inched 0.77% higher to $31.25 Thursday, on what proved to be an all-around dismal trading session for the stock market, with the...",2022-04-14
236,"Investors in DXC Technology Co (Symbol: DXC) saw new options become available today, for the December 16th expiration. One of the key data points that goes into the price an option buyer is willing to pay, is the time value, so with 246 days until expiration the newly availabl",2022-04-14
237,"Shares of DXC Technology Co. rallied 1.01% to $31.01 Wednesday, on what proved to be an all-around favorable trading session for the stock market, with the...",2022-04-13
238,"Shares of DXC Technology Co. slumped 0.58% to $30.70 Tuesday, on what proved to be an all-around poor trading session for the stock market, with the S&P 500...",2022-04-12
239,"Shares of DXC Technology Co. inched 0.55% higher to $30.88 Monday, on what proved to be an all-around grim trading session for the stock market, with the S&P...",2022-04-11
240,"Shares of DXC Technology Co. inched 0.99% higher to $30.71 Friday, on what proved to be an all-around mixed trading session for the stock market, with the...",2022-04-08
241,"""Sonic the Hedgehog 2"" is the first major family film released in 2022 and is expected to signal if this demographic is finally ready to return to theaters.",2022-04-08
242,"Shares of DXC Technology Co. inched 0.03% higher to $30.41 Thursday, on what proved to be an all-around favorable trading session for the stock market, with...",2022-04-07
243,"Niche sports organizations such as UFC, WWE and Formula 1 could be alluring acquisition targets for big streaming companies like Disney and Netflix.",2022-04-07
244,"Shares of DXC Technology Co. slipped 1.20% to $30.40 Wednesday, on what proved to be an all-around dismal trading session for the stock market, with the S&P...",2022-04-06
245,"The ""Halftime Report"" traders give their top picks to watch for the second half.",2022-04-06
246,"As tensions rise between Disney and Florida lawmakers, the company will air new a new public service announcement from GLAAD featuring a transgender teen.",2022-04-06
247,"ASHBURN, Va., April 06, 2022--DXC named a Leader in Everest PEAK Matrix® for Life and Pensions Insurance BPS/TPA Service Provider 2022 report.",2022-04-06
248,"DXC Technology , a leading Fortune 500 global technology services provider, has been named a Leader by research firm Everest Group in its PEAK Matrix® for Life and Pensions Insurance Business... | April 6, 2022",2022-04-06
249,"Shares of DXC Technology Co. shed 3.42% to $30.77 Tuesday, on what proved to be an all-around poor trading session for the stock market, with the S&P 500...",2022-04-05
250,"ASHBURN, Va., April 05, 2022--DXC Technology announced its commitment to set near-term company-wide emission reductions in line with the Science Based Targets initiative (SBTi).",2022-04-05
251,"'Mad Money' host Jim Cramer and the 'Squawk on the Street' team break down shares of AT&T, Discovery and CNBC parent company Comcast.",2022-04-05
252,"Shares of DXC Technology Co. rallied 1.63% to $31.86 Monday, on what proved to be an all-around favorable trading session for the stock market, with the S&P...",2022-04-04
253,"Shares of DXC Technology Co. shed 3.92% to $31.35 Friday, on what proved to be an all-around favorable trading session for the stock market, with the S&P 500...",2022-04-01
254,"LONDON, United Kingdom - DXC Technology , a leading Fortune 500 global IT services provider, has been selected to transform and run the mission-critical IT infrastructure for Her Majesty's Passport... | April 1, 2022",2022-04-01
255,"Shares of DXC Technology Co. slipped 1.42% to $32.63 Thursday, on what proved to be an all-around poor trading session for the stock market, with the S&P 500...",2022-03-31
256,"LONDON, March 31, 2022--DXC Technology (NYSE: DXC), a leading Fortune 500 global IT services provider, has been selected to transform and run the mission-critical IT infrastructure for Her Majesty’s Passport Office (HMPO) in the U.K.",2022-03-31
257,DXC Technology has been s... DXC,2022-03-31
258,"$37 million agreement with HMPO enables more user-centric passport services... | March 31, 2022",2022-03-31
259,"Shares of DXC Technology Co. slipped 2.45% to $33.10 Wednesday, on what proved to be an all-around grim trading session for the stock market, with the S&P...",2022-03-30
260,"Shares of DXC Technology Co. rallied 3.04% to $33.93 Tuesday, on what proved to be an all-around positive trading session for the stock market, with the S&P...",2022-03-29
261,"Shares of DXC Technology Co. slid 1.82% to $32.93 Monday, on what proved to be an all-around positive trading session for the stock market, with the S&P 500...",2022-03-28
262,"""CODA"" won Best Picture at the Oscars. ""Dune"" won the most awards. Will Smith smacked Chris Rock for insulting Jada Pinkett-Smith.",2022-03-27
263,"Shares of DXC Technology Co. rose 2.35% to $33.54 Friday, on what proved to be an all-around great trading session for the stock market, with the S&P 500...",2022-03-25
264,"Shares of DXC Technology Co. advanced 1.55% to $32.77 Thursday, on what proved to be an all-around positive trading session for the stock market, with the...",2022-03-24
265,Harris Associates’ 13F portfolio value increased from $62.77B to $64.23B this quarter. They increased Fiserv and Visa while dropping Alibaba Group Holdings and Cenovus Energy.,2022-03-23
266,"Shares of DXC Technology Co. slid 3.56% to $32.27 Wednesday, on what proved to be an all-around grim trading session for the stock market, with the S&P 500...",2022-03-23
267,"Shares of DXC Technology Co. rallied 1.42% to $33.46 Tuesday, on what proved to be an all-around favorable trading session for the stock market, with the S&P...",2022-03-22
268,"Shares of DXC Technology Co. dropped 0.63% to $32.99 Monday, on what proved to be an all-around dismal trading session for the stock market, with the S&P 500...",2022-03-21
269,DXC Technology (DXC) to migrate Societe Generale's GEFA Bank services to Microsoft's Azure cloud platform under the G-Rocket Program.,2022-03-21
270,"Looking at the underlying holdings of the ETFs in our coverage universe at ETF Channel, we have compared the trading price of each holding against the average analyst 12-month forward target price, and computed the weighted average implied analyst target price for the ETF itsel",2022-03-21
271,"Societe Generale's GEFA BANK Taps DXC Technology in Journey to Public Cloud.GEFA BANK, a leading financing partner for German SMEs and subsidiary of Societe Generale, has selected DXC Technology ... | March 21, 2022",2022-03-21
272,A Rocky Mountain mansion owned by Russian oligarch Roman Abramovich would likely be among the first assets frozen by the U.S. government if he is sanctioned.,2022-03-20
273,"Shares of DXC Technology Co. rallied 1.81% to $33.20 Friday, on what proved to be an all-around favorable trading session for the stock market, with the S&P...",2022-03-18
274,"Shares of DXC Technology Co. slipped 0.46% to $32.61 Thursday, on what proved to be an all-around favorable trading session for the stock market, with the...",2022-03-17
275,"BÖBLINGEN, Germany, March 17, 2022--GEFA BANK has selected DXC Technology for a ground-breaking digital transformation project, named the ""G-Rocket"" program.",2022-03-17
276,"DXC helps GEFA prepare for the future of banking... | March 17, 2022",2022-03-17
277,"Shares of DXC Technology Co. advanced 5.27% to $32.76 Wednesday, on what proved to be an all-around positive trading session for the stock market, with the...",2022-03-16
278,"MADRID, March 16, 2022--DXC Technology will transform PreZero Group's IT systems, enabling it to develop innovative approaches to waste recycling across Spain and Portugal.",2022-03-16
279,"Shares of DXC Technology Co. advanced 2.03% to $31.12 Tuesday, on what proved to be an all-around great trading session for the stock market, with the S&P...",2022-03-15
280,"Glenview Capital’s 13F portfolio value dropped from $5.46B to $4.69B. The top 3 stakes are Tenet Healthcare, McKesson and Bausch Health, adding up to ~29%.",2022-03-14
281,"Shares of DXC Technology Co. dropped 0.20% to $30.50 Monday, on what proved to be an all-around mixed trading session for the stock market, with the Dow...",2022-03-14
282,"With over 130,000 workforces in 70 countries, DXC Technology Company serves more than 240 companies on the Fortune 500 list. Read more about DXC here.",2022-03-14
283,Netflix's stock has now given up all its pandemic gains. Shares were down more than 50% since their mid-November high.,2022-03-14
284,"China's latest Covid outbreak is prompting a round of business restrictions, while Russian and Ukrainian officials held another peace discussion.",2022-03-14
285,VMware (VMW) and Amazon's strategic alliance will now allow customers to purchase and use VMWare Cloud on Amazon Web Services.,2022-03-11
286,"Shares of DXC Technology Co. rose 1.49% to $30.56 Friday, on what proved to be an all-around rough trading session for the stock market, with the S&P 500...",2022-03-11
287,"Shares of DXC Technology Co. inched 0.43% higher to $30.11 Thursday, on what proved to be an all-around rough trading session for the stock market, with the...",2022-03-10
288,The Russian attack on Ukraine has put especially pronounced pressure on expectations for economic growth in Europe.,2022-03-10
289,"Shares of DXC Technology Co. shed 2.85% to $29.98 Wednesday, on what proved to be an all-around positive trading session for the stock market, with the S&P...",2022-03-09
290,"Five top five lists with the news and calls moving stocks, powered by The Fly. NFLX, BMBL, MTCH, PYPL, DXC, PLTR, GE, XPO, AMZN, BTC, $BTC, BITCOIN, MSTR, RIOT, MARA, COIN, $ETH, ASTS, NTCO, FIGS, DADA, MDB, NTRA, CRCT, YEXT, SFIX, CPB, OTLY, PLCE, VRA",2022-03-09
291,"Netflix upgrade, PayPal downgrade and Palantir Technologies initiation among today's top calls on Wall Street NFLX, DLTR, BKNG, MTCH, PAYX, PYPL, ADP, BMBL, FL, NKE, DPZ, SFIX, DXC, PLTR, BA, NRGV, TSHA, VSTM",2022-03-09
292,BofA analyst Jason Kupfer... DXC,2022-03-09
293,BofA analyst Jason Kupfer... DXC,2022-03-09
294,"Five top five lists with the news and calls moving stocks, powered by The Fly. NFLX, BMBL, MTCH, PYPL, DXC, PLTR, GE, XPO, AMZN, BTC, $BTC, BITCOIN, MSTR, RIOT, MARA, COIN, $ETH, ASTS, FIGS, DADA, MDB, NTRA, CRCT, YEXT, SFIX, CPB, OTLY, PLCE, VRA, BP, CVX, COP, XOM, TTE, SHEL, CANO",2022-03-09
295,"Shares of DXC Technology Co. rallied 6.60% to $30.86 Tuesday, on what proved to be an all-around rough trading session for the stock market, with the S&P 500...",2022-03-08
296,Researchers help explain the wide disconnect between executives and employees about their excitement to return to the office.,2022-03-08
297,"ASHBURN, Va., March 07, 2022--DXC Technology has appointed Raymond August as President, Insurance Software and Business Process Solutions, effective March 7, 2022.",2022-03-07
298,"Shares of DXC Technology Co. slid 3.50% to $28.95 Monday, on what proved to be an all-around grim trading session for the stock market, with the S&P 500...",2022-03-07
299,"Following economic and financial sanctions imposed by the US, several big tech companies including AAPL, MSFT, INTC and DXC have announced exiting the Russian market in support of Ukraine.",2022-03-07
300,"Ashburn IT services giant DXC Technology Co. (NYSE: DXC) said Friday it is ending its work in Russia following the country’s invasion of Ukraine and is making efforts to protect and relocate workers impacted by the conflict.  “Based on the aggression from the Russian government, we are no longer pursuing business in Russia and have committed to exit this market,” DXC said in a statement.  The company condemned the “unwarranted aggression from the Russian government that is leading to death, injury and displacement of innocent civilians in Ukraine.”",2022-03-07
