,summary,date
0,"DXC Technology Co is working with financial advisers after receiving takeover interest from at least one private equity firm, Bloomberg News reported on Wednesday, citing people familiar with the matter.",2022-09-21
1,"(Bloomberg) -- Information-technology services provider DXC Technology Co. is working with advisers after receiving takeover interest, according to people familiar with the matter. The stock rose more than 9% on the news. Most Read from BloombergPutin Calls Up More Troops, Resumes Nuclear Threat Over UkrainePowell Signals More Pain to Come With Fed Sending Rates HigherCitadel’s Griffin Brings Billions to Miami With Political Winds at His BackUkraine Seizes Dozens of Russian Tanks Left by Fleeing",2022-09-21
2,DXC Technology has tapped... DXC,2022-09-21
3, DXC,2022-09-21
4, DXC,2022-09-21
5,"Shares of DXC Technology Co. shed 2.52% to $27.05 Tuesday, on what proved to be an all-around grim trading session for the stock market, with the S&P 500...",2022-09-20
6,"Shares of DXC Technology Co. rallied 2.63% to $27.75 Monday, on what proved to be an all-around great trading session for the stock market, with the S&P 500...",2022-09-19
7,"Shares of DXC Technology Co. slid 1.57% to $27.04 Friday, on what proved to be an all-around dismal trading session for the stock market, with the S&P 500...",2022-09-16
8,Susquehanna analyst James... DXC,2022-09-16
9,Susquehanna analyst James... DXC,2022-09-16
10,"Shares of DXC Technology Co. slipped 0.58% to $27.47 Thursday, on what proved to be an all-around grim trading session for the stock market, with the S&P 500...",2022-09-15
11,"Shares of DXC Technology Co. rallied 1.39% to $27.63 Wednesday, on what proved to be an all-around favorable trading session for the stock market, with the...",2022-09-14
12,"Shares of DXC Technology Co. slipped 3.91% to $27.25 Tuesday, on what proved to be an all-around grim trading session for the stock market, with the S&P 500...",2022-09-13
13,DXC Technology Company. (DXC) saw its shares surge in the last session with trading volume being higher than average. The latest trend in earnings estimate revisions could translate into further price increase in the near term.,2022-09-13
14,Glenview Capital's 13F portfolio value decreased from $4.94B to $4B this quarter. Click to read more about Larry Robbins' holdings and trades for Q2 2022.,2022-09-12
15,"Shares of DXC Technology Co. rallied 5.98% to $28.36 Monday, on what proved to be an all-around favorable trading session for the stock market, with the S&P...",2022-09-12
16,"DXC is guiding for $1.5b in FCF in the next fiscal year. Management is deploying capital well, with effective divestitures and heavy stock buybacks. Read more about DXC stock here.",2022-09-12
17,Wix.com (WIX) reported earnings 30 days ago. What's next for the stock? We take a look at earnings estimates for some clues.,2022-09-09
18,"Shares of DXC Technology Co. slumped 0.23% to $26.60 Thursday, on what proved to be an all-around positive trading session for the stock market, with the S&P...",2022-09-08
19,"DXC Technology (NYSE: DXC), a leading Fortune 500 global technology services provider, has been named a Leader for the second consecutive time in the Everest Group ServiceNow Services PEAK Matrix® Assessment 2022.",2022-09-07
20,"Staff article entitled Interesting DXC Put And Call Options For October 2023, about stock options, from Stock Options Channel.",2022-09-06
21,"Listen on the go! A daily podcast of Wall Street Breakfast will be available this morning on Seeking Alpha, iTunes, Stitcher and Spotify.",2022-09-03
22,"Shares of DXC Technology Co. rallied 2.92% to $27.48 Friday, on what proved to be an all-around rough trading session for the stock market, with the S&P 500...",2022-09-02
23,DXC Technology Company. (DXC) reported earnings 30 days ago. What's next for the stock? We take a look at earnings estimates for some clues.,2022-09-02
24,"Shares of DXC Technology Co. rallied 7.75% to $26.70 Thursday, on what proved to be an all-around favorable trading session for the stock market, with the...",2022-09-01
25,"DXC Technology , a leading Fortune 500 global technology services partner, has partnered with solution provider Temenos to lead the digital transformation of critical IT architecture for FCM Bank,... | September 1, 2022",2022-09-01
26,"The Betaville blog, which... DXC",2022-09-01
27,"Shares of DXC Technology Co. advanced 1.10% to $24.78 Wednesday, on what proved to be an all-around rough trading session for the stock market, with the S&P...",2022-08-31
28,"Shares of DXC Technology Co. inched 0.49% higher to $24.51 Tuesday, on what proved to be an all-around rough trading session for the stock market, with the...",2022-08-30
29,GuruFocus Article or News written by Sydnee Gatewood and the topic is about: Guru releases 2nd-quarter portfolio,2022-08-30
30,"Shares of DXC Technology Co. inched 0.25% higher to $24.39 Monday, on what proved to be an all-around dismal trading session for the stock market, with the...",2022-08-29
31,"Shares of DXC Technology Co. slipped 4.85% to $24.33 Friday, on what proved to be an all-around rough trading session for the stock market, with the S&P 500...",2022-08-26
32,"Shares of DXC Technology Co. rallied 2.16% to $25.57 Thursday, on what proved to be an all-around positive trading session for the stock market, with the S&P...",2022-08-25
33,"Shares of DXC Technology Co. slid 0.32% to $25.03 Wednesday, on what proved to be an all-around favorable trading session for the stock market, with the S&P...",2022-08-24
34,"With U.S. stock markets set to open in two hours, (GETY) was up 9.6% in pre-market trading, and (INTU) was up 5.9%. (SOFI), (HST), and (CCJ) were all posting...",2022-08-24
35,"Shares of DXC Technology Co. rose 1.70% to $25.11 Tuesday, on what proved to be an all-around rough trading session for the stock market, with the S&P 500...",2022-08-23
36,Europe is fast descending in what looks like it will be a long and significant economic contraction.,2022-08-23
37,"ASHBURN, Va., August 22, 2022--DXC Technology (NYSE: DXC), a leading Fortune 500 global technology services company, will participate in Deutsche Bank’s 2022 Technology Conference on September 1, 2022. John Sweeney, Head of Marketing & Investor Relations, is scheduled to conduct an investor presentation at 11:00 AM EDT.",2022-08-22
38,"DXC Technology , a leading Fortune 500 global technology services company, will participate in Deutsche Bank’s 2022 Technology Conference on September 1, 2022. John Sweeney, Head of Marketing... | August 22, 2022",2022-08-22
39,"Shares of DXC Technology Co. slipped 4.78% to $24.69 Monday, on what proved to be an all-around grim trading session for the stock market, with the S&P 500...",2022-08-22
40,"Shares of DXC Technology Co. slipped 1.14% to $25.93 Friday, on what proved to be an all-around rough trading session for the stock market, with the S&P 500...",2022-08-19
41,"Shares of DXC Technology Co. advanced 1.20% to $26.23 Thursday, on what proved to be an all-around favorable trading session for the stock market, with the...",2022-08-18
42,"If you want to know who really controls DXC Technology Company ( NYSE:DXC ), then you'll have to look at the makeup of...",2022-08-18
43,"Shares of DXC Technology Co. slipped 2.85% to $25.92 Wednesday, on what proved to be an all-around grim trading session for the stock market, with the S&P...",2022-08-17
44,"Shares of DXC Technology Co. sank 0.07% to $26.68 Tuesday, on what proved to be an all-around great trading session for the stock market, with the S&P 500...",2022-08-16
45,"Shares of DXC Technology Co. inched 0.23% higher to $26.70 Monday, on what proved to be an all-around favorable trading session for the stock market, with...",2022-08-15
46,Cowen analyst Bryan Bergi... DXC,2022-08-15
47,"During Q2 2022, the Miller Opportunity Trust Class I shares generated a total return of -29.45% excluding sales charges. Click here to read the full fund letter.",2022-08-06
48,"Listen on the go! A daily podcast of Wall Street Breakfast will be available this morning on Seeking Alpha, iTunes, Stitcher and Spotify.",2022-08-06
49,"In a report released yesterday, Bryan Ke...",2022-08-05
50,What happened Shares of information technology outfit DXC Technology Company (NYSE: DXC) are down 19.9% as of 1:35 p.m. ET on Thursday. The decline follows a disappointing fiscal first-quarter report and similarly disappointing guidance for the quarter now underway.,2022-08-04
51,These are the stocks posting the largest moves midday.,2022-08-04
52,"While forex headwinds hurt DXC Technology's (DXC) first-quarter fiscal 2023 top line, a higher tax rate, increased investments and costs weigh on the bottom line.",2022-08-04
53,"In early trading on Thursday, shares of Ceridian HCM Holding topped the list of the day's best performing components of the S&P 500 index, trading up 10.3% - Year to date, Ceridian HCM Holding has lost about 38.0% of its value - DXC,CDAY,FTNT,EPAM.",2022-08-04
54,"London, UK - Finastra announced that The Co-operative Bank has selected Finastra Kondor in the cloud, available via Microsoft Azure, to upgrade its treasury infrastructure and automate manual... | August 4, 2022",2022-08-04
55,Morgan Stanley analyst Ja... DXC,2022-08-04
56,"IntroductionThe purpose of the Management's Discussion and Analysis of Financial Conditionand Results of Operations is to present information that managementbelieves is relevant to an assessment... | August 4, 2022",2022-08-04
57,Citi analyst Ashwin Shirv... DXC,2022-08-04
58,RBC Capital analyst Danie... DXC,2022-08-04
59,There&#8217;s a lot to be optimistic about in the Technology sector as 2 analysts just weighed in on DXC Technology (<span class='tr-stock-ticker' style='color:blue...,2022-08-04
60,"Image source: The Motley Fool.  DXC Technology Company (NYSE: DXC)Q1 2023 Earnings CallAug 03, 2022, 5:00 p.m. ETContents:  Prepared Remarks Questions and Answers Call Participants  Prepared Remarks:  OperatorGood day, everyone.",2022-08-04
61,"DXC Technology Company. (DXC) delivered earnings and revenue surprises of -8.54% and 0.15%, respectively, for the quarter ended June 2022. Do the numbers hold clues to what lies ahead for the stock?",2022-08-03
62,"DXC Technology Company (NYSE:NYSE:DXC) Q1 2023 Earnings Conference Call August 3, 2022 17:00 ET Corporate Participants John Sweeney - Head of Marketing and Investor Relations Mike Salvino -...",2022-08-03
63,The following slide deck was published by DXC Technology Company in conjunction with their 2023 Q1 earnings call.,2022-08-03
64,DXC Technology (NYSE: DXC) today reported results for the first quarter of fiscal year 2023.,2022-08-03
65,"DXC Technology Reports First Quarter Fiscal Year 2023 Results •Revenues of $3.71 billion for Q1 FY23, down 10.5% as compared to prior year period, and down... | August 3, 2022",2022-08-03
66,"Healthcare providers may find that supporting their care team and managing the larger healthcare workforce is challenging, particularly during times of high stress and peak demand. Frost & Sullivan, the Growth Pipeline Company™, has published a panel-based Think Tank to explore these challenges and discuss how to focus efforts on improving the care team's work-life balance and well-being. This is expected to improve outcomes and the safety of care provided.",2022-08-03
67,Looking for stock market analysis and research with proves results? Zacks.com offers in-depth financial research with over 30years of proven results.,2022-08-03
68,Sees FY23 revenue $14.6B-... DXC,2022-08-03
69,Sees Q2 revenue $3.55B-$3... DXC,2022-08-03
70,Reports Q1 revenue $3.71B... DXC,2022-08-03
71,"Ernst & Young LLP (EY US) announced today that a highly skilled team of Americas Microsoft Dynamics professionals from DXC Technology (NYSE: DXC) is joining the EY Microsoft Services Group. The combined team will help clients modernize their finance and operations, enterprise resource planning (ERP) and supply chain management by designing, developing and implementing custom solutions using Microsoft technologies.",2022-08-02
72,"Statistically speaking, long term investing is a profitable endeavour. But no-one is immune from buying too high. For...",2022-08-01
73,"In a report issued on July 29, Daniel ...",2022-08-01
74,,2022-07-31
75,These are the stocks posting the largest moves in midday trading. ,2022-07-28
76,"Investment management company Miller Value Partners recently released its Q2, 2022 investment letter, a copy of which can be downloaded here. The firm faced notable challenges due to continued volatility in the last couple of years. In the second quarter, Miller Opportunity fund was down by -29.3%, extending its first half return to -31.08% net of […]",2022-07-28
77,"DXC Technology's (DXC) first-quarter fiscal 2023 performance is likely to have been negatively impacted by the business operation closure in Russia, the strong U.S. dollar and divestitures.",2022-07-28
78,GuruFocus Article or News written by insider and the topic is about: ,2022-07-28
79,"Item 5.07 Submission of Matters to a Vote of Security Holders.DXC Technology Company's 2022 Annual Meeting of Stockholders was held on July 26, 2022. The Company previously... | July 28, 2022",2022-07-28
80,"CNBC's 'Squawk Box' team breaks down the latest earnings results from Comcast, which beat analysts' expectations on the top and bottom lines.",2022-07-28
81,"The stocks making the biggest moves in premarket trading include Stanley Black & Decker, Southwest Airlines, Harley-Davidson, and more.",2022-07-28
82,DXC Technology Company. (DXC) doesn't possess the right combination of the two key ingredients for a likely earnings beat in its upcoming report. Get prepared with the key expectations.,2022-07-27
83,Miller Opportunity Equity was down 31.8% net of fees in the first half vs. the S&P 500âs 20.0% decline. Click here to read the full fund letter.,2022-07-26
84,"Sesame sells the systems for anywhere from $100,000 to $300,000, or more for larger installations like a full medical clinic. ",2022-07-25
85,"Staff article entitled October 21st Options Now Available For DXC Technology (DXC), about stock options, from Stock Options Channel.",2022-07-25
86,"There's a head spinning amount of news for markets to navigate in the week ahead, the biggest of which will be the Federal Reserve's mid-week meeting.",2022-07-22
87,"State Street (STT) announ... STT, DXC",2022-07-21
88,"DXC Technology (NYSE: DXC) today announced that it will release financial results for the first quarter of fiscal year 2023 on Wednesday, August 3, 2022, at approximately 4:15 p.m. Eastern Daylight Time (EDT).",2022-07-20
89,JPMorgan analyst Tien-tsi... DXC,2022-07-20
90,"Notable gainers among liq... CCL, RCL, PVH, ON, DXC",2022-07-19
91,"""Knock at the Cabin,"" a new film by director M. Night Shyamalan, is the first adaptation of one of Paul Tremblay's horror novels.",2022-07-16
92,"Shares of DXC Technology Co. rallied 2.83% to $28.74 Friday, on what proved to be an all-around great trading session for the stock market, with the S&P 500...",2022-07-15
93,"Ride-related injuries dropped by more than 60% between 2004 and 2019, according to the International Association of Amusement Parks and Attractions.",2022-07-15
94,"Shares of DXC Technology Co. slid 2.10% to $27.95 Thursday, on what proved to be an all-around poor trading session for the stock market, with the S&P 500...",2022-07-14
95,"CNBC obtained a list of nearly 20 corporations and trade groups that RSVP'd to attend a swanky, three-day retreat at the Breakers resort starting Sunday.",2022-07-14
96,"Shares of DXC Technology Co. slumped 0.38% to $28.55 Wednesday, on what proved to be an all-around poor trading session for the stock market, with the S&P...",2022-07-13
97,The streamer announced in April that it was planning on rolling out an ad-supported tier after years of resisting the move.,2022-07-13
98,"Shares of DXC Technology Co. shed 2.05% to $28.66 Tuesday, on what proved to be an all-around poor trading session for the stock market, with the S&P 500...",2022-07-12
99,"""Succession"" tops the 2022 Emmy Award nominations followed by ""Ted Lasso"" and ""The White Lotus.""",2022-07-12
100,"The Oakmark Fund returned -17.8% during the second quarter, underperforming the S&P 500 Indexâs return. Click here to read the full fund letter.",2022-07-11
101,"Moviegoers aren't just returning to cinemas, they are spending more on premium tickets and concessions.",2022-07-11
102,"Shares of DXC Technology Co. slipped 2.04% to $29.26 Monday, on what proved to be an all-around dismal trading session for the stock market, with the S&P 500...",2022-07-11
103,Investors need to pay close attention to DXC Technology (DXC) stock based on the movements in the options market lately.,2022-07-11
104,"""Thor: Love and Thunder"" tallied $143 million during its domestic debut, pushing the overall weekend haul to more than $200 million.",2022-07-10
105,"A movie industry panel discusses how it assigns ratings to newly released films, including details about what constitutes an R rating.",2022-07-09
106,"Shares of DXC Technology Co. were unchanged Friday, on what proved to be an all-around dismal trading session for the stock market, with the S&P 500 Index...",2022-07-08
107,"Shares of DXC Technology Co. advanced 1.88% to $29.87 Thursday, on what proved to be an all-around great trading session for the stock market, with the S&P...",2022-07-07
108,"DXC Technology (DXC) partners with Manchester United to scale the club's digital transformation, enhancing experiences for its global fan base.",2022-07-07
109,"Listen on the go! A daily podcast of Wall Street Breakfast will be available by 8:00 a.m. on Seeking Alpha, iTunes, Stitcher and Spotify.",2022-07-07
110,"DXC Technology's margins are improving, primarily from the cost side. So, why do I think DXC stock seems to be an unnecessary exposure? Click here to find out.",2022-07-07
111,"Shares of DXC Technology Co. slid 1.91% to $29.32 Wednesday, on what proved to be an all-around positive trading session for the stock market, with the S&P...",2022-07-06
112,"IT and consulting services provider DXC has signed a deal with Manchester United to become the Premier League club's sleeve sponsor, manage its digital presence and use data analytics to deliver a more personalized experience for fans.",2022-07-06
113,"DXC Technology (DXC) is likely to continue gaining from the ongoing digital transformation around the globe. However, stiff competition from tech giants and weak liquidity position remain headwinds.",2022-07-06
114,"DXC Technology (NYSE: DXC) and Manchester United (NYSE: MANU) have signed a major, multiyear partnership agreement as the football club turns to technology to transform its operations and enhance the football experience for its global fanbase.",2022-07-06
115,"In an era of flagship streaming services like Disney+ and Peacock, Hulu is caught in the middle. ",2022-07-06
116,Looking for stock market analysis and research with proves results? Zacks.com offers in-depth financial research with over 30years of proven results.,2022-07-06
117,"DXC Technology (DXC) and ... DXC, MANU",2022-07-06
118,"Manchester United (MANU) ... MANU, DXC",2022-07-06
119,"Shares of DXC Technology Co. slid 0.17% to $29.89 Tuesday, on what proved to be an all-around mixed trading session for the stock market, with the S&P 500...",2022-07-05
120,"'Minions' and 'Toy Story' are among the most popular and profitable franchises for their respective studios — so why did ""Minions"" soar and ""Lightyear"" flop?
",2022-07-05
121,"""Minions: The Rise of Gru"" generated more than $108 million in ticket sales during its domestic opening weekend.",2022-07-03
122,A publicly traded Starz may look to increase in size by targeting other subscale media and entertainment companies.,2022-06-29
123,A string of solid theatrical performances coupled with a strong slate of upcoming films has left most box office analysts optimistic.,2022-06-29
124,Cerence (CRNC) witnessed a jump in share price last session on above-average trading volume. The latest trend in earnings estimate revisions for the stock doesn't suggest further strength down the road.,2022-06-27
125,"Shares of DXC Technology Co. rose 6.14% to $32.15 Friday, on what proved to be an all-around great trading session for the stock market, with the S&P 500...",2022-06-24
126,DXC Technology Company. (DXC) reported earnings 30 days ago. What's next for the stock? We take a look at earnings estimates for some clues.,2022-06-24
127,"Shares of DXC Technology Co. slid 0.82% to $30.29 Thursday, on what proved to be an all-around great trading session for the stock market, with the S&P 500...",2022-06-23
128,"Shares of DXC Technology Co. dropped 0.46% to $30.54 Wednesday, on what proved to be an all-around grim trading session for the stock market, with the S&P...",2022-06-22
129,"William Nygren's Harris Associates filed its regulatory 13F Form on 5/16. Click here for the latest update on his stake increases, decreases and top holdings.",2022-06-21
130,"Shares of DXC Technology Co. rallied 1.62% to $30.68 Tuesday, on what proved to be an all-around positive trading session for the stock market, with the S&P...",2022-06-21
131,"Pixar's ""Lightyear"" rocketed to a $51 million domestic opening, the best performance of an animated feature since the pandemic began.",2022-06-19
132,"Shares of DXC Technology Co. advanced 1.48% to $30.19 Friday, on what proved to be an all-around mixed trading session for the stock market, with the S&P 500...",2022-06-17
133,"With its stock down 14% over the past week, it is easy to disregard DXC Technology (NYSE:DXC). However, the company's...",2022-06-17
134,"Shares of DXC Technology Co. slid 8.01% to $29.75 Thursday, on what proved to be an all-around rough trading session for the stock market, with the S&P 500...",2022-06-16
135,"Shares of DXC Technology Co. rose 3.92% to $32.34 Wednesday, on what proved to be an all-around favorable trading session for the stock market, with the S&P...",2022-06-15
136,"Netflix disrupted traditional TV by releasing entire seasons of shows all at once. Now, the model is under scrutiny as the streamer deals with big losses.",2022-06-15
137,"Shares of DXC Technology Co. rallied 3.22% to $31.12 Tuesday, on what proved to be an all-around rough trading session for the stock market, with the S&P 500...",2022-06-14
138,"Shares of DXC Technology Co. slid 7.91% to $30.15 Monday, on what proved to be an all-around rough trading session for the stock market, with the S&P 500...",2022-06-13
139,"""Jurassic World: Dominion"" roared to the top of the domestic box office over the weekend, generating more than $143 million in ticket sales during its debut.",2022-06-12
140,"Staff article entitled August 19th Options Now Available For DXC Technology (DXC), about stock options, from Stock Options Channel.",2022-06-10
141,"""Jurassic World: Dominion"" may score to top spot at the domestic box office this weekend, but lackluster critical reviews and word of mouth could stall its potential haul.",2022-06-09
142,DXC Technology (DXC) signs a contract with the Paris-headquartered European Space Agency to scale network and security services for better connectivity and collaboration among the agency's workforce.,2022-06-09
143,"Universal's ""Jurassic World: Dominion"" enters domestic theaters Friday, and it will snag the majority of premium format screens from ""Top Gun: Maverick.""",2022-06-09
144,"DXC Technology (NYSE: DXC) has been awarded a multi-year contract to deliver network and security services to provide the European Space Agency (ESA)'s international workforce of scientists, engineers and IT specialists with scalable and secure network services enabling them to collaborate seamlessly from anywhere on their space activities.",2022-06-08
145,DXC Technology has been a... DXC,2022-06-08
146,"DXC Technology (NYSE: DXC), a leading Fortune 500 global technology services provider, has been named a Leader in the IDC MarketScape Worldwide Cloud Professional Services 2022 Vendor Assessment. The report recognizes DXC's distinct Cloud Right™ approach to guiding large enterprises through cloud and IT modernization efforts.",2022-06-07
147,Glenview Capital Management’s 13F portfolio value increased from $4.69B to $4.94B this quarter. The number of positions increased from 57 to 60.,2022-06-07
148,Looking for stock market analysis and research with proves results? Zacks.com offers in-depth financial research with over 30years of proven results.,2022-06-06
149,DXC Technology (DXC) to enhance and modernize DIRECTV's IT infrastructure to facilitate the distributor's accelerated digital transformation process.,2022-06-06
150,"DXC Technology (NYSE: DXC), a leading Fortune 500 global technology services company, will participate in the Baird Global Consumer, Technology, and Service Conference on Monday, June 6, 2022. John Sweeney, Vice President of Investor Relations, is scheduled to present at 10:15 AM EDT.",2022-06-03
151,"How are your mutual funds doing this year? Look under the hood of Towle Deep Value Fund. It's not only outperforming the broad market, but it is up.",2022-06-03
152,"DXC Technology (NYSE: DXC), a leading Fortune 500 global technology services provider, has been awarded a multiyear contract to enhance and modernize mission-critical IT systems for DIRECTV, America's leading video entertainment provider. DXC will deliver IT outsourcing services to enhance program management and modernize DIRECTV's infrastructure, enabling the delivery of new and innovative entertainment experiences to its customers.",2022-06-02
153,DXC Technology has been a... DXC,2022-06-02
154,"The S&P 500 logged in its best week of the year, jumping 6.5% and wiping out its losses in May.",2022-05-31
