,summary,date
301,"""Given the circumstances on the ground, we have decided to suspend our service in Russia,"" a spokesperson said Sunday afternoon.",2022-03-06
302,"Shares of DXC Technology Co. slipped 4.28% to $30.00 Friday, on what proved to be an all-around rough trading session for the stock market, with the S&P 500...",2022-03-04
303,DXC Technology Company. (DXC) reported earnings 30 days ago. What's next for the stock? We take a look at earnings estimates for some clues.,2022-03-04
304,"DXC Technology Co. said Friday that it will no longer pursue business in Russia and has committed to leaving that market, given Russian military aggression against Ukraine. The Virginia-based technology consulting and outsourcing services company said it has about 4,000 employees in Russia, and will continue to provide support for those employees. The company added that it will match employees donations to the Red Cross at a 200% rate, which includes providing financial support to its employees",2022-03-04
305,"ASHBURN, Va., March 04, 2022--DXC condemns the unwarranted aggression from the Russian Government in Ukraine; we are no longer pursuing business and have committed to exit Russia.",2022-03-04
306,Disney announced a new ad-supported tier for its Disney+ streaming service on Friday.,2022-03-04
307,"(RTTNews) - Based on the aggression from the Russian Government, DXC Technology Co. (DXC) confirmed Friday that they are no longer pursuing business in Russia and have committed to exit this market. The company has approximately 4,000 colleagues in Russia and are supporting them",2022-03-04
308,By Chris Wack DXC Technology Co. said Friday it will no longer pursue business in Russia and has committed to leaving that market. The Virginia-based...,2022-03-04
309,Batman has been a staple on the big screen since Tim Burton's 1989 superhero film. A look at how past Batman films have fared at the global box office.,2022-03-03
310,"Shares of DXC Technology Co. slid 0.85% to $31.34 Thursday, on what proved to be an all-around rough trading session for the stock market, with the S&P 500...",2022-03-03
311,"Shares of DXC Technology Co. advanced 5.05% to $31.61 Wednesday, on what proved to be an all-around great trading session for the stock market, with the S&P...",2022-03-02
312,"Shares of DXC Technology Co. plunged 11.58% to $30.09 Tuesday, on what proved to be an all-around grim trading session for the stock market, with the S&P 500...",2022-03-01
313,"Looking today at week-over-week shares outstanding changes among the universe of ETFs covered at ETF Channel, one standout is the Invesco S&P 500— Equal Weight Technology ETF (Symbol: RYT) where we have detected an approximate $368.3 million dollar outflow -- that's a",2022-03-01
314,U.S. stocks lower at close of trade; Dow Jones Industrial Average down 1.7600%,2022-03-01
315,"Disney, Sony and Warner Bros. have halted future theatrical film releases in Russia following the country's attack on Ukraine. ",2022-02-28
316,"Shares of DXC Technology Co. slid 4.22% to $34.03 Monday, on what proved to be an all-around rough trading session for the stock market, with the S&P 500...",2022-02-28
317,"Shares of DXC Technology Co. rallied 1.34% to $35.53 Friday, on what proved to be an all-around great trading session for the stock market, with the S&P 500...",2022-02-25
318,"In trading on Friday, shares of DXC Technology Co (Symbol: DXC) crossed above their 200 day moving average of $35.52, changing hands as high as $35.75 per share. DXC Technology Co shares are currently trading up about 1.4% on the day. The chart below shows the one year perfor",2022-02-25
319,"In this article, we discuss 10 stocks to invest in according to Bart Baum’s Ionic Capital. If you want to skip our detailed analysis of Baum’s history, investment philosophy, and hedge fund performance, go directly to 5 Stocks to Invest In According to Bart Baum’s Ionic Capital. Bart Baum holds a bachelor’s degree in political science […]",2022-02-25
320,"Shares of DXC Technology Co. advanced 1.80% to $35.06 Thursday, on what proved to be an all-around favorable trading session for the stock market, with the...",2022-02-24
321,"It was a strong quarter for Disney, HBO Max and Paramount+ as streaming leader Netflix acknowledged competition may be hurting its growth on the margins.",2022-02-24
322,"Shares of DXC Technology Co. shed 1.99% to $34.44 Wednesday, on what proved to be an all-around grim trading session for the stock market, with the S&P 500...",2022-02-23
323,"In the latest look at stocks ordered by largest market capitalization, Russell 3000 component Biohaven Pharmaceutical Holding Co Ltd (Symbol: BHVN) was identified as having a larger market cap than the smaller end of the S&P 500, for example DXC Technology Co (Symbol: DXC),",2022-02-22
324,"Shares of DXC Technology Co. slipped 1.35% to $35.14 Tuesday, on what proved to be an all-around poor trading session for the stock market, with the S&P 500...",2022-02-22
325,"Shares of DXC Technology Co. dropped 0.47% to $35.62 Friday, on what proved to be an all-around dismal trading session for the stock market, with the S&P 500...",2022-02-18
326,"Shares of DXC Technology Co. slid 4.18% to $35.79 Thursday, on what proved to be an all-around rough trading session for the stock market, with the S&P 500...",2022-02-17
327,The recent market rout offers an opportune entry point to these seven robust stocks. These are good stocks to buy at their bottom now.,2022-02-17
328,"Shares of DXC Technology Co. sank 0.03% to $37.35 Wednesday, on what proved to be an all-around mixed trading session for the stock market, with the S&P 500...",2022-02-16
329,,2022-02-16
330,"DXC Technology Named a Leader in Everest Group's Cloud Services PEAK Matrix Assessment 2022.DXC Technology , a leading Fortune 500 global technology services provider, has been named a Leader in two... | February 16, 2022",2022-02-16
331,"Shares of DXC Technology Co. advanced 1.85% to $37.36 Tuesday, on what proved to be an all-around favorable trading session for the stock market, with the...",2022-02-15
332,"ASHBURN, Va., February 15, 2022--DXC Technology has been named a Cloud Leader in two technology industry analyst reports recently published by Everest Group.",2022-02-15
333,"DXC Technology , a leading Fortune 500 global technology services provider, has been named a Leader in two technology industry analyst reports recently published by Everest Group, “Cloud... | February 15, 2022",2022-02-15
334,"DXC Technology (DXC) to manage the University of Newcastle's core campus application, Oracle's PeopleSoft Campus Solutions while enabling the university to deliver high-quality digital education.",2022-02-14
335,"Shares of DXC Technology Co. slipped 0.43% to $36.68 Monday, on what proved to be an all-around poor trading session for the stock market, with the S&P 500...",2022-02-14
336,,2022-02-14
337,"Shares of DXC Technology Co. slid 2.57% to $36.84 Friday, on what proved to be an all-around dismal trading session for the stock market, with the S&P 500...",2022-02-11
338,"SYDNEY, Australia, February 10, 2022--DXC Technology announced a multi-year Managed Services agreement with the University of Newcastle to manage Oracle’s PeopleSoft Campus Solutions.",2022-02-10
339,"Shares of DXC Technology Co. slipped 2.12% to $37.81 Thursday, on what proved to be an all-around poor trading session for the stock market, with the S&P 500...",2022-02-10
340,,2022-02-10
341,Analysts across Wall Street sang the praises of Disney after a quarterly print showing a stunning recovery in its parks business.,2022-02-10
342,"Shares of DXC Technology Co. sank 0.49% to $38.63 Wednesday, on what proved to be an all-around great trading session for the stock market, with the S&P 500...",2022-02-09
343,"The Super Bowl commercial is part of Tonal's broader ""Strength Made Me"" campaign, which celebrates women being strong both physically and mentally. ",2022-02-09
344,"Shares of DXC Technology Co. rose 3.99% to $38.82 Tuesday, on what proved to be an all-around positive trading session for the stock market, with the S&P 500...",2022-02-08
345,Insider Monkey has processed numerous 13F filings of hedge funds and successful value investors to create an extensive database of hedge fund holdings. The 13F filings show the hedge funds’ and successful investors’ positions as of the end of the third quarter. You can find articles about an individual hedge fund’s trades on numerous financial […],2022-02-07
346,"Shares of DXC Technology Co. rallied 3.61% to $37.33 Monday, on what proved to be an all-around mixed trading session for the stock market, with the Dow...",2022-02-07
347,"Looking at options trading activity among components of the S&P 500 index, there is noteworthy activity today in Tyson Foods Inc (Symbol: TSN), where a total volume of 30,697 contracts has been traded thus far today, a contract volume which is representative of approximatel",2022-02-07
348,The recent sell-off presents long-term investors with many robust stocks to buy on the dip. These seven provide a start.,2022-02-07
349,"DXC Technology Co (DXC) shares closed this week 21.5% higher than it did at the end of last week. The stock is currently up 11.9% year-to-date, up 36.3% over the past 12 months, and down 36.9% over the past five years. This we",2022-02-05
350,"Listen on the go! A daily podcast of Wall Street Breakfast will be available every morning on Seeking Alpha, iTunes, Stitcher and Spotify.",2022-02-05
351,It's nice to see the DXC Technology Company ( NYSE:DXC ) share price up 20% in a week. But over the last half decade...,2022-02-04
352,Expunging the excessive valuations of growth stocks will weigh on major market indexes like the S&P 500.,2022-02-04
353,"In a sea of red linked to major earnings concerns, ""not so bad"" becomes the basis for bullishness.",2022-02-03
354,"DXC Technology's (DXC) Q3 earnings benefit from margin expansion, lower interest expenses and outstanding common stocks, which more than offset the negative impact of reduced revenues.",2022-02-03
355,The following slide deck was published by DXC Technology Company in conjunction with their 2022 Q3 earnings call.,2022-02-03
356,Image source: The Motley Fool.,2022-02-03
357,"Technology stocks were retreating Thursday, with Facebook parent company Meta (FB) weighing on the sector and other social media firms after reporting below-consensus Q4 earnings and forecasting Q1 revenue also lagging Wall Street expectations.",2022-02-03
358,"In trading on Thursday, the Invesco S&P 500 QVM Multi-factor ETF is outperforming other ETFs, up about 1.1% on the day.  Components of that ETF showing particular strength include shares of Dxc Technology, up about 11.6% and shares of T-mobile, up about 10.7% on the day.",2022-02-03
359,"In trading on Thursday, the Invesco S&P 500 QVM Multi-factor ETF is outperforming other ETFs, up about 1.1% on the day - Components of that ETF showing particular strength include shares of Dxc Technology, up about 11.6% and shares of T-mobile, up about 10.7% on the day - DXC,TMUS,FB,SNAP,PNQI,QVML.",2022-02-03
360,"In early trading on Thursday, shares of DXC Technology topped the list of the day's best performing components of the S&P 500 index, trading up 11.5%.  Year to date, DXC Technology registers a 6.3% gain.",2022-02-03
361,"Notable gainers among liq... DXC, TMUS, HUM, RL, PENN",2022-02-03
362,Cowen analyst Bryan Bergi... DXC,2022-02-03
363,"IntroductionThe purpose of the Management's Discussion and Analysis of Financial Conditionand Results of Operations is to present information that managementbelieves is relevant to an assessment... | February 3, 2022",2022-02-03
364,U.S. stocks lower at close of trade; Dow Jones Industrial Average down 1.45%,2022-02-03
365,Citi analyst Ashwin Shirv... DXC,2022-02-03
366,"DXC Technology Company. (DXC) delivered earnings and revenue surprises of 0% and 0.17%, respectively, for the quarter ended December 2021. Do the numbers hold clues to what lies ahead for the stock?",2022-02-02
367,"ASHBURN, Va., February 02, 2022--DXC Technology (NYSE: DXC) today reported results for the third quarter fiscal year 2022.",2022-02-02
368,"DXC Technology Company (NYSE:DXC) Q3 2022 Earnings Conference Call February 2, 2022, 05:00 PM ET Company Participants John Sweeney - VP, IR Mike Salvino - CEO Ken Sharp - CFO Conference...",2022-02-02
369,"(RTTNews) - While reporting its results for the third quarter on Wednesday, DXC Technology Company (DXC) revised its full-year outlook. The company increased its adjusted earnings guidance, but lowered its revenue guidance range.",2022-02-02
370,"Shares of DXC Technology Co. sank 0.32% to $30.69 Wednesday, on what proved to be an all-around favorable trading session for the stock market, with the S&P...",2022-02-02
371,(RTTNews) - DXC Technology Company (DXC) announced earnings for third quarter that decreased from last year but  beat the Street estimates.,2022-02-02
372,"Item 2.02 Results of Operations and Financial Condition.On February 2, 2022, DXC Technology Company issued a pressrelease reporting its financial results for the third quarter of fiscal 2022ended... | February 2, 2022",2022-02-02
373,"(RTTNews) - DXC Technology Company (DXC) will host a conference call at 5:00 PM ET on February 2, 2022, to discuss Q3 22 earnings results.",2022-02-02
374,FY22 EPS consensus $3.67.... DXC,2022-02-02
375,Sees Q4 revenue $4.11B-$4... DXC,2022-02-02
376,Reports Q3 revenue $4.089... DXC,2022-02-02
377,"Shares of DXC Technology Co. advanced 2.36% to $30.79 Tuesday, on what proved to be an all-around favorable trading session for the stock market, with the...",2022-02-01
378,Bud Light Seltzer is hoping that a Super Bowl ad starring celebrity chef Guy Fieri will help jump-start sales of its new hard soda line.,2022-02-01
379,"Shares of DXC Technology Co. rose 1.42% to $30.08 Monday, on what proved to be an all-around favorable trading session for the stock market, with the S&P 500...",2022-01-31
380,"DXC Technology's (DXC) Q3 results are likely to reflect improvements in organic revenue growth and sequential margin expansions. However, a couple of non-recurring payments might weigh on free cash flow.",2022-01-31
381,Investors' sudden change of heart on Netflix puts entire streaming wars narrative into question for 2022.,2022-01-29
382,"Shares of DXC Technology Co. rose 2.31% to $29.66 Friday, on what proved to be an all-around positive trading session for the stock market, with the S&P 500...",2022-01-28
383,The Federal Communications Commission does not yet have the majority it would need to reinstate net neutrality on the federal level.,2022-01-28
384," 
Over the past three months, shares of DXC Technology (NYSE:DXC) fell by 12.10%. Before we understand the importance of debt, let us look at how much debt DXC Technology has...",2022-01-28
385,"Shares of DXC Technology Co. slid 1.13% to $28.99 Thursday, on what proved to be an all-around poor trading session for the stock market, with the S&P 500...",2022-01-27
386,"Casey Newton, The Platformer editor and CNBC contributor, joins 'Power Lunch' to discuss the streaming landscape and recent developments in the space.",2022-01-27
387,Dow futures turned positive Thursday after falling more than 500 points overnight.,2022-01-27
388,DXC Technology Company. (DXC) doesn't possess the right combination of the two key ingredients for a likely earnings beat in its upcoming report. Get prepared with the key expectations.,2022-01-26
389,"Shares of DXC Technology Co. slid 0.41% to $29.32 Wednesday, on what proved to be an all-around grim trading session for the stock market, with the S&P 500...",2022-01-26
390,"Shares of DXC Technology Co. shed 2.90% to $29.44 Tuesday, on what proved to be an all-around dismal trading session for the stock market, with the S&P 500...",2022-01-25
391,BMO Capital analyst Keith... DXC,2022-01-25
392,"Investment company Boundary Creek Advisors LP (Current Portfolio) buys Altice USA Inc, DXC Technology Co, SunCoke Energy Inc, Xerox Holdings Corp, Urban One Inc, sells Ingles Markets Inc, Lumen Technologies Inc, Cooper-Standard Holdings Inc, ADT Inc, Cedar Fair LP during the 3-months ended 2021Q4, according to the most recent filings of the investment company, Boundary Creek Advisors LP.",2022-01-24
393,"Shares of DXC Technology Co. slipped 0.72% to $30.32 Monday, on what proved to be an all-around great trading session for the stock market, with the S&P 500...",2022-01-24
394,Netflix tumbled for a second day on Monday after the company's weaker-than-expected subscriber forecast. ,2022-01-24
395,These are the stocks posting the largest moves in midday trading. ,2022-01-24
396,,2022-01-24
397,CNBC's Julia Boorstin reports on legal media companies which are ticking higher despite a broader sell-off. (Comcast is CNBC's parent company.),2022-01-24
398,U.S. stock futures indicated more losses to start the new week following the Nasdaq's and the S&P 500's worst weeks since March 2020.,2022-01-24
399,"The stocks making the biggest moves in premarket trading include Kohl's, Snap, Peloton, and more.",2022-01-24
400,"Microsoft, Tesla and Apple will release quarterly results, alongside a handful of other tech firms. McDonald's and Boeing will also offer updates.",2022-01-23
401,"Last November, IBM (NYSE: IBM) completed its spin-off of Kyndryl (NYSE: KD), the managed infrastructure services segment of its Global Technology Services segment. Each IBM shareholder received one new share of Kyndryl for every five shares of IBM they held.",2022-01-22
402,"Shares of DXC Technology Co. shed 4.65% to $30.54 Friday, on what proved to be an all-around dismal trading session for the stock market, with the S&P 500...",2022-01-21
403,DXC Technology (DXC) to accelerate enterprise management services by expanding global partnership with ServiceNow by providing support with its Platform X automation solutions.,2022-01-21
404,"The Federal Reserve's meeting trumps everything else for markets in the week ahead, as investors await any new clues on its plans to raise interest rates.",2022-01-21
405,"Netflix added a line in its quarterly shareholder letter acknowledging streaming competition is affecting its ""marginal growth.""",2022-01-20
406,"Shares of DXC Technology Co. inched 0.06% higher to $32.03 Thursday, on what proved to be an all-around grim trading session for the stock market, with the...",2022-01-20
407,"DXC Technology Expands Global Partnership with ServiceNow to Accelerate Enterprise Service Management and Operational Transformation, Underpinned by DXC Platform X.New DXC ServiceNow Strategic... | January 20, 2022",2022-01-20
408,"ASHBURN, Va., January 19, 2022--DXC announces the formation of a new global DXC ServiceNow Strategic Business Group.",2022-01-19
409,"Shares of DXC Technology Co. slid 1.72% to $32.01 Wednesday, on what proved to be an all-around dismal trading session for the stock market, with the S&P 500...",2022-01-19
410,"DXC Technology (DXC) anno... DXC, NOW",2022-01-19
411,"Shares of DXC Technology Co. shed 4.18% to $32.57 Tuesday, on what proved to be an all-around dismal trading session for the stock market, with the S&P 500...",2022-01-18
412,Microsoft takes big $68.7 billion swing on video game company Activision Blizzard while legacy media stays on sidelines,2022-01-18
413,"The big shareholder groups in DXC Technology Company (NYSE:DXC) have power over the company.  Institutions often own shares in more established companies, while it's not unusual to see insiders own a fair bit of smaller companies.   Companies that have been privatized tend to ha",2022-01-17
414,"Shares of DXC Technology Co. slipped 0.29% to $33.99 Friday, on what proved to be an all-around mixed trading session for the stock market, with the S&P 500...",2022-01-14
415,"Cincinnati, OH, based Investment company Gateway Investment Advisers Llc (Current Portfolio) buys Danaher Corp, Consolidated Edison Inc, Exxon Mobil Corp, Moderna Inc, Match Group Inc, sells AT&T Inc, Allstate Corp, Fidelity National Information Services Inc, Phillips 66, Simon Property Group Inc during the 3-months ended 2021Q4, according to the most recent filings of the investment company, Gateway Investment Advisers Llc.",2022-01-14
416,"DXC Technology (DXC) is set to modernize the information technology infrastructure of Lloyd's of London, reflecting the reliability of the company's cloud solutions.",2022-01-14
417,"Shares of DXC Technology Co. advanced 1.82% to $34.09 Thursday, on what proved to be an all-around poor trading session for the stock market, with the S&P...",2022-01-13
418,President Biden urged companies to voluntarily impose Covid vaccination rules on workers after the Supreme Court blocked a government order to do that.,2022-01-13
419,"ASHBURN, Va., January 13, 2022--DXC was recognized by analyst firm NelsonHall as a Leader in five insurance categories in its NEAT™ 2021 report.",2022-01-13
420,"Lloyd's and London Market Insurance Companies Tap DXC Technology to Transform the World's Largest Insurance Marketplace.Agreement to support Lloyd's strategic objective of building the 'most... | January 13, 2022",2022-01-13
421,"Investment company Engrave Wealth Partners LLC (Current Portfolio) buys Phillips 66, Oracle Corp, Bank of America Corp, Lowe's Inc, Vanguard Health Care ETF, sells Janus Henderson Small Cap Growth Alpha ETF, Nucor Corp, DXC Technology Co, Marathon Oil Corp, Diamondback Energy Inc during the 3-months ended 2021Q4, according to the most recent filings of the investment company, Engrave Wealth Partners LLC.",2022-01-12
422,"ASHBURN, Va., January 12, 2022--DXC Technology (NYSE: DXC) today announced that it will release financial results for the third quarter of fiscal 2022 on Wednesday, February 2, 2022, at approximately 4:15 p.m. Eastern Daylight Time (EDT).",2022-01-12
423,"Shares of DXC Technology Co. rose 1.24% to $33.48 Wednesday, on what proved to be an all-around positive trading session for the stock market, with the S&P...",2022-01-12
424,"LONDON, January 12, 2022--DXC announces agreement to support Lloyd’s strategic objective of building the ‘most technologically advanced insurance marketplace in the world.’",2022-01-12
425," 
Shares of DXC Technology (NYSE:DXC) fell by 4.64% in the past three months. Before having a look at the importance of debt, let us look at how much debt DXC Technology has...",2022-01-12
426,"- Agreement to support Lloyd’s strategic objective of building the ‘most technologically advanced insurance marketplace in the world’- Cloud and automation technologies to... | January 12, 2022",2022-01-12
427,"Shares of DXC Technology Co. inched 0.52% higher to $33.07 Tuesday, on what proved to be an all-around positive trading session for the stock market, with...",2022-01-11
428,Two of Sen. Kyrsten Sinema's former aides have become key aides for corporate giants looking to impact President Joe Biden's agenda. ,2022-01-11
429,"Shares of DXC Technology Co. slipped 1.32% to $32.90 Monday, on what proved to be an all-around rough trading session for the stock market, with the S&P 500...",2022-01-10
430,Former aides to Sen. Joe Manchin who are now lobbyists are scoring big clients as their ex-boss battles President Biden's agenda,2022-01-10
431,"Shares of DXC Technology Co. slipped 1.16% to $33.34 Friday, on what proved to be an all-around dismal trading session for the stock market, with the S&P 500...",2022-01-07
432,"""Turning Red"" is the third Pixar film to transition to Disney's streaming platform during the pandemic.",2022-01-07
433,"The P/B ratio helps to identify low-priced stocks that have high-growth prospects. Ford Motor Company (F), General Motors Company (GM), Invesco (IVZ), DXC Technology Company (DXC) and Atlas Corp. (ATCO) are some such picks.",2022-01-07
434,"Jim Cramer, Dan Ives of Wedbush Securities, Gene Munster of Loup, Aaron Kessler of Raymond James, Dan Niles of Satori Fund, Darrin Peller of Wolfe Research, Josh Brown of Ritholtz Wealth Management, Brenda Vingiello of Sand Hill Global Advisors, Sarat Sethi of DCLA, and Steve Weiss of Short Hills Capital explain why they are buying, selling, or holding specific stocks and ETFs",2022-01-06
435,"Shares of DXC Technology Co. inched 0.78% higher to $33.73 Thursday, on what proved to be an all-around poor trading session for the stock market, with the...",2022-01-06
436,"Sarat Sethi, DCLA managing partner and portfolio manager, joins the 'Halftime Report' to discuss his top stock picks for 2022, which include Uber, Morgan Stanley, and Comcast.",2022-01-06
437,"Shares of DXC Technology Co. shed 1.88% to $33.47 Wednesday, on what proved to be an all-around poor trading session for the stock market, with the S&P 500...",2022-01-05
438,"Value investing is essentially about selecting stocks that are usually cheap but fundamentally sound. Kohl's Corporation (KSS), Berry Global (BERY), Atlas Corp. (ATCO) and DXC Technology (DXC) boast low P/CF ratio.",2022-01-05
439,Here is how DXC Technology Company. (DXC) and Fair Isaac (FICO) have performed compared to their sector so far this year.,2022-01-05
440,"In this article, we discuss the 10 best stocks to buy according to billionaire Larry Robbins. If you want to skip our detailed analysis of these stocks, go directly to 5 Best Stocks To Buy According to Billionaire Larry Robbins. Larry Robbins is an American hedge fund manager who founded Glenview Capital in 2000, which […]",2022-01-04
441,"Shares of DXC Technology Co. advanced 2.65% to $34.11 Tuesday, on what proved to be an all-around mixed trading session for the stock market, with the Dow...",2022-01-04
442,"Shares of DXC Technology Co. rallied 3.23% to $33.23 Monday, on what proved to be an all-around great trading session for the stock market, with the S&P 500...",2022-01-03
