,summary,date
500,Truist analyst Scot Cicca... GPC,2022-01-12
501,Truist analyst Scot Cicca... GPC,2022-01-12
502,"Shares of Genuine Parts Co. slid 0.46% to $137.41 Tuesday, on what proved to be an all-around great trading session for the stock market, with the S&P 500...",2022-01-11
503,Two of Sen. Kyrsten Sinema's former aides have become key aides for corporate giants looking to impact President Joe Biden's agenda. ,2022-01-11
504,"Genuine Parts Company (NYSE:GPC)    saw a double-digit share price rise of over 10% in the past couple of months on the NYSE.    As a large-cap stock with high coverage by analysts, you could assume any recent changes in the company’s outlook is already priced into the stock.  H",2022-01-11
505,"2021 was another great year for the DG50, with the income stream growing more than 7%. Big income gainers included Aflac, Deere and Target. Read more here.",2022-01-11
506,"Shares of O'Reilly Automotive Inc. shed 1.05% to $675.08 Monday, on what proved to be an all-around dismal trading session for the stock market, with the S&P...",2022-01-10
507,"Shares of LKQ Corp. shed 1.01% to $57.68 Monday, on what proved to be an all-around rough trading session for the stock market, with the S&P 500 Index...",2022-01-10
508,"Item 1.01 Entry into a Material Definitive AgreementOn January 10, 2022, Genuine Parts Company issued $500 millionin aggregate principal amount of the Company's 1.750% Senior Notes due 2025... | January 10, 2022",2022-01-10
509,"Shares of Genuine Parts Co. sank 0.65% to $138.04 Monday, on what proved to be an all-around dismal trading session for the stock market, with the S&P 500...",2022-01-10
510,"Shares of Advance Auto Parts Inc. slipped 1.66% to $234.13 Monday, on what proved to be an all-around dismal trading session for the stock market, with the...",2022-01-10
511,Former aides to Sen. Joe Manchin who are now lobbyists are scoring big clients as their ex-boss battles President Biden's agenda,2022-01-10
512,Genuine Parts Company (GPC) to raise $1 billion in senior notes to fund a significant portion of its recently completed acquisition of KDG.,2022-01-10
513,"Shares of Genuine Parts Co. slipped 0.97% to $138.94 Friday, on what proved to be an all-around poor trading session for the stock market, with the S&P 500...",2022-01-07
514,"""Turning Red"" is the third Pixar film to transition to Disney's streaming platform during the pandemic.",2022-01-07
515,"Genuine Parts Company (NYSE: GPC), a leading distributor of automotive and industrial replacement parts, announced today the pricing of an aggregate $1 billion of senior notes, consisting of $500 million of 1.750% senior notes due 2025 issued at a price equal to 99.721% of the face value of the notes, and $500 million of 2.750% senior notes due 2032 issued at a price equal to 98.810% of the face value of the notes. The offering is expected to settle on January 10, 2022, and the closing of the of",2022-01-07
516,"Genuine Parts Co. (GPC) shares closed today at 1.9% below its 52 week high of $142.97, giving the company a market cap of $19B. The stock is currently down 0.9% year-to-date, up 43.6% over the past 12 months, and up 65.9% over",2022-01-06
517,"Jim Cramer, Dan Ives of Wedbush Securities, Gene Munster of Loup, Aaron Kessler of Raymond James, Dan Niles of Satori Fund, Darrin Peller of Wolfe Research, Josh Brown of Ritholtz Wealth Management, Brenda Vingiello of Sand Hill Global Advisors, Sarat Sethi of DCLA, and Steve Weiss of Short Hills Capital explain why they are buying, selling, or holding specific stocks and ETFs",2022-01-06
518,"Shares of Genuine Parts Co. inched 0.98% higher to $140.30 Thursday, on what proved to be an all-around dismal trading session for the stock market, with the...",2022-01-06
519,"Rating Action: Moody's assigns Baa1 rating to Genuine Parts proposed $1.0 billion notes offeringGlobal Credit Research - 06 Jan 2022New York, January 06, 2022 -- Moody's Investors Service (""Moody's"") today assigned a Baa1 rating to Genuine Parts Company's (Genuine Parts) proposed $1.0 billion senior unsecured notes rating.  Proceeds from the proposed $1.0 billion notes will be used to refinance existing debt used to fund the acquisition of Kaman Distribution Company (Kaman).Assignments:..Issuer: Genuine Parts Company....Senior Unsecured Notes, Assigned Baa1RATINGS RATIONALEGenuine Parts' Baa1 senior unsecured rating reflects the company's leading position in the auto parts sub-segment, with significant brand awareness and equity, its large network of NAPA-affiliated repair shops for which it supplies parts, and its store affiliate program, both of which broaden the reach of its proprietary products that account for around 90% of total US sales.",2022-01-06
520,"Sarat Sethi, DCLA managing partner and portfolio manager, joins the 'Halftime Report' to discuss his top stock picks for 2022, which include Uber, Morgan Stanley, and Comcast.",2022-01-06
521,"Shares of Genuine Parts Co. slipped 1.00% to $138.94 Wednesday, on what proved to be an all-around poor trading session for the stock market, with the S&P...",2022-01-05
522,"Birmingham, Ala. - Motion Industries, Inc., a leading distributor of maintenance, repair, and operation replacement parts, and a premier provider of industrial technology solutions, has completed the... | January 5, 2022",2022-01-05
523,"Genuine Parts Co. (GPC) shares closed today at 0.7% below its 52 week high of $141.29, giving the company a market cap of $19B. The stock is currently down 1.6% year-to-date, up 41.1% over the past 12 months, and up 66.5% over",2022-01-05
524,"Shares of Genuine Parts Co. rose 1.75% to $140.34 Tuesday, on what proved to be an all-around mixed trading session for the stock market, with the Dow Jones...",2022-01-04
525,"Dividend Kings are companies that are part of the S&P 500 index and have increased their annual payouts to shareholders annually for at least 50 years.  Providing a half-century of annual payout growth signals that a company has a relatively strong underlying business and has been able to survive and thrive through big changes and shakeups along the way.  If you're seeking companies that can reliably increase their dividend payouts, read on for a look at five top Dividend King stocks to buy in 2022 and hold for the long term.",2022-01-04
526,"Genuine Parts Company (NYSE: GPC) (""GPC""), a leading distributor of automotive and industrial replacement parts, announced today that its wholly-owned subsidiary, Motion Industries, Inc. (""Motion"") has completed the purchase of Kaman Distribution Group (""KDG"") for a purchase price of approximately $1.3 billion in cash, effective January 3, 2022.",2022-01-04
527,"Genuine Parts Company Completes Acquisition of Kaman Distribution Group, Creating a Premier Leader in Industrial Solutions ATLANTA, GA -- Genuine Parts Company ... | January 4, 2022",2022-01-04
528,"Item 2.01 Completion of Acquisition or Disposition of AssetsOn January 3, 2022, Genuine Parts Company , through itswholly-owned subsidiary, Motion Industries, Inc. , completed thepreviously... | January 4, 2022",2022-01-04
529,"Shares of Genuine Parts Co. shed 1.62% to $137.93 Monday, on what proved to be an all-around positive trading session for the stock market, with the S&P 500...",2022-01-03
530,AutoZone's (AZO) revenue growth is likely to accelerate beyond the historical 2-5% range. See why I think analysts are underestimating AZO’s growth potential.,2022-01-03
531,,2022-01-02
532,"Shares of Genuine Parts Co. inched 0.59% higher to $140.20 Friday, on what proved to be an all-around dismal trading session for the stock market, with the...",2021-12-31
533,"Shares of Genuine Parts Co. slipped 0.16% to $139.38 Thursday, on what proved to be an all-around dismal trading session for the stock market, with the S&P...",2021-12-30
534,"Genuine Parts (GPC) is at a 52-week high, but can investors hope for more gains in the future? We take a look at the company's fundamentals for clues.",2021-12-30
535,"In recent trading, shares of Genuine Parts Co. (Symbol: GPC) have crossed above the average analyst 12-month target price of $139.50, changing hands for $139.60/share.  When a stock reaches the target an analyst has set, the analyst logically has two ways to react: downgrade on v",2021-12-30
536,"Genuine Parts Co. (GPC) shares closed today at 0.4% below its 52 week high of $138.58, giving the company a market cap of $19B. The stock is currently up 41.2% year-to-date, up 41.7% over the past 12 months, and up 65.4% over",2021-12-29
537,"Investment company BlackRock Funds IV (Current Portfolio) buys International Business Machines Corp, Abbott Laboratories, Union Pacific Corp, United Parcel Service Inc, Southern Co, sells Republic Services Inc, Oracle Corp, Juniper Networks Inc, Houlihan Lokey Inc, Assurant Inc during the 3-months ended 2021Q3, according to the most recent filings of the investment company, BlackRock Funds IV.",2021-12-28
538,The big shareholder groups in Genuine Parts Company ( NYSE:GPC ) have power over the company. Large companies usually...,2021-12-27
539,"Genuine Parts Company (GPC) has seen a solid 2021, amidst a recovery in automotive and industrial end markets. Check out why I am not inclined to chase the momentum here.",2021-12-27
540,These auto industry players are returning meaningful cash to investors today.,2021-12-26
541,"""West Side Story"" is a box office bomb, having only generated around $36 million in ticket sales on a $100 million production budget.",2021-12-26
542,"""Spider-Man: No Way Home"" proves that audiences are ready to return to movie theaters, but the industry still faces major obstacles.",2021-12-21
543,"As the Senate weighs whether to confirm Gigi Sohn to the FCC, President Biden's efforts to reinstate net neutrality are taking shape.",2021-12-21
544,"Every investor in Genuine Parts Company (NYSE:GPC) should be aware of the most powerful shareholder groups.  Large companies usually have institutions as shareholders, and we usually see insiders owning shares in smaller companies.   We also tend to see lower insider ownership i",2021-12-20
545,"Announcement: Moody's says Genuine Parts acquisition of Kaman currently has no impact on ratings or outlookGlobal Credit Research - 17 Dec 2021New York, December 17, 2021 -- Moody's Investors Service (""Moody's"") says Genuine Parts Company's (Genuine Parts) announcement that it entered into an agreement to acquire Kaman Distribution Company (Kaman) for approximately $1.3 billion has no current impact on the company's ratings or outlook.",2021-12-17
546,"Genuine Parts (GPC) is set to acquire Kaman Distribution Group in a $1.3-billion deal, set for closure in the first quarter of 2022.",2021-12-17
547,"Tens of thousands of companies have gone public over the years, so when we look at the few hundred dividend stocks that increase their payout annually, it's a small club. Most exclusive of all are the Dividend Kings, companies that have paid and increased their dividend annually",2021-12-17
548,"Global service organization Genuine Parts Co. (GPC) has signed an agreement to acquire Connecticut-based Kaman Distribution Group (KDG) for approximately $1.3 billion in cash. Motion Industries, a subsidiary of GPC, will acquire KDG from investment firm Littlejohn & Co.



Following the announcement on Thursday, shares of GPC rose 2.3% to close at $136.01. The stock gained another 0.4% in the after-hours trading session to end the day at $136.56.



About KDG



Kaman Distribution provides power transmission, automation and fluid power industrial distributor and solutions across the U.S. It supplies electro-mechanical products, bearings, power transmission, motion control and electrical and fluid power components to MRO and OEM customers.



The company expects to generate revenue of around $1.1 billion next year.



Strategic Impact



Genuine Parts expects the acquisition to contribute to its adjusted EPS within the first year of closing, which is expected in the first quarter of 2022. Further, it anticipates achieving annual synergies of more than $50 million over the next three years



CEO Comments



Commenting on the deal, GPC’s Chairman and CEO, Paul Donahue, said, “Motion's highly synergistic acquisition of KDG significantly enhances our scale and further strengthens our market-leading position. In addition, this combination creates opportunities for accelerated long-term growth, profitability and cash flow.”



Analyst Ratings



Overall, the stock has a Moderate Sell consensus rating based on 2 Holds and 1 Sell. The average Genuine Parts Co. price target of $136.33 implies 0.2% upside potential. Shares have gained 40.3% over the past year.







Related News:FedEx Posts Better-than-Expected Q2 Results; Shares GainFMC Hikes Dividend by 10.4%; Street Says BuyAdobe Drops 10% on Disappointing Guidance Despite Q4 Revenue Beat",2021-12-17
549,"GREENWICH, Conn., December 16, 2021--Littlejohn & Co., LLC (""Littlejohn"") announced today that an affiliate has signed a definitive agreement to sell Kaman Distribution Group (""KDG"" or the ""Company""), a leading distributor of highly engineered products and provider of related services, to Motion Industries, Inc. (""Motion""), a subsidiary of Genuine Parts Company (NYSE: GPC), for $1.3 billion in cash.",2021-12-16
550,"Genuine Parts Company said Thursday its Motion Industries Inc. unit will pay about $1.3 billion for Kaman Distribution Group, a 1,700-employee power transmission, automation and fluid power industrial distributor founded in 1971. Private equity firm Littlejohn & Co. LLC is the seller on the deal, which is expected to close in the first quarter of 2022. Genuine Parts Company said KDG is expected to generate about $1.1 billion of revenue in 2022. KDG is expected to add to GPC's adjusted earnings i",2021-12-16
551,"Genuine Parts Company (NYSE: GPC) (""GPC""), a leading distributor of automotive and industrial replacement parts, announced today that it has entered into a definitive agreement under which its wholly-owned subsidiary, Motion Industries, Inc. (""Motion"") will acquire Kaman Distribution Group (""KDG"") from private investment firm Littlejohn & Co., LLC. The acquisition is valued at a total purchase price of approximately $1.3 billion in cash. The transaction is expected to close in the first quarter",2021-12-16
552,"Genuine Parts Co's (NYSE: GPC) wholly-owned subsidiary, Motion Industries Inc, will acquire Kaman Distribution Group (KDG) from private investment firm...",2021-12-16
553,"Genuine Parts Company Enters Definitive Agreement to Acquire Kaman Distribution Group Strategic and Highly Synergistic Transaction Creates a... | December 16, 2021",2021-12-16
554,"(RTTNews) - Genuine Parts Co. (GPC), a leading distributor of automotive and industrial replacement parts, announced Thursday that it has entered into a definitive agreement under which its wholly-owned subsidiary, Motion Industries, Inc. will acquire Kaman Distribution Group (KD",2021-12-16
555,"Item 1.01 Entry Into A Material Definitive AgreementOn December 15, 2021, Genuine Parts Company , and itswholly-owned subsidiary, Motion Industries, Inc. , entered into aninterest purchase... | December 16, 2021",2021-12-16
556,"Hedge funds and large money managers usually invest with a focus on the long-term horizon and, therefore, short-lived dips or bumps on the charts usually don’t make them change their opinion towards a company. This time it may be different. The coronavirus pandemic destroyed the high correlations among major industries and asset classes. We are […]",2021-12-15
557,"Investment company Ohio National Fund Inc (Current Portfolio) buys Procter & Gamble Co, Booking Holdings Inc, NVIDIA Corp, Equifax Inc, Fidelity National Information Services Inc, sells Qualcomm Inc, Morgan Stanley, Accenture PLC, PPG Industries Inc, DexCom Inc during the 3-months ended 2021Q3, according to the most recent filings of the investment company, Ohio National Fund Inc.",2021-12-13
558,The following slide deck was published by Genuine Parts Company in conjunction with this event.,2021-12-13
559,"Investment company Penn Series Mid Core Value Fund (Current Portfolio) buys Devon Energy Corp, Cracker Barrel Old Country Store Inc, BorgWarner Inc, Koninklijke Philips NV, iShares Russell Mid-Cap Value ETF, sells Republic Services Inc, Hubbell Inc, Johnson Controls International PLC, , The Hartford Financial Services Group Inc during the 3-months ended 2021Q3, according to the most recent filings of the investment company, Penn Series Mid Core Value Fund.",2021-12-11
560,"In this piece, we will take a look at the 10 industrial stocks to buy according to billionaire Ray Dalio. If you want to skip our brief introduction about Mr. Dalio and his investment firm and jump ahead to the top five stocks in this list, then head on over to 5 Industrial Stocks To […]",2021-12-08
561,"Shares of Genuine Parts Co. rallied 2.15% to $131.96 Monday, on what proved to be an all-around favorable trading session for the stock market, with the S&P...",2021-12-06
562,"Shares of Genuine Parts Co. slid 0.53% to $129.18 Friday, on what proved to be an all-around poor trading session for the stock market, with the S&P 500...",2021-12-03
563,"Ownership Submission FORM 4 Check this box if no longer... | December 3, 2021",2021-12-03
564,"Genuine Parts Co. (Symbol: GPC) has been named to the Dividend Channel ''S.A.F.E. 25'' list, signifying a stock with above-average ''DividendRank'' statistics including a strong 2.5% yield, as well as a superb track record of at least two decades of dividend growth, according t",2021-12-03
565,"Shares of Genuine Parts Co. rose 3.43% to $129.87 Thursday, on what proved to be an all-around favorable trading session for the stock market, with the S&P...",2021-12-02
566,"Sonos, The Gap, Genuine Parts, Target and A. O. Smith highlighted as Zacks Bull and Bear of the Day",2021-12-02
567,"Shares of Genuine Parts Co. shed 1.06% to $126.38 Wednesday, on what proved to be an all-around rough trading session for the stock market, with the S&P 500...",2021-12-01
568,"Genuine Parts Investor Presentation December 2021 GPC INVESTOR PRESENTATION | 1 Safe... | December 1, 2021",2021-12-01
569,"Genuine Parts Company (GPC) will begin trading ex-dividend on December 02, 2021. A cash dividend payment of $0.815 per share is scheduled to be paid on January 04, 2022.  Shareholders who purchased GPC prior to the ex-dividend date are eligible for the cash dividend payment.  Thi",2021-12-01
570,"Shares of Genuine Parts Co. slid 3.89% to $127.74 Tuesday, on what proved to be an all-around dismal trading session for the stock market, with the S&P 500...",2021-11-30
571,"Shares of Genuine Parts Co. inched 0.40% higher to $132.91 Monday, on what proved to be an all-around great trading session for the stock market, with the...",2021-11-29
572,"Genuine Parts Investor Presentation November 2021 GPC INVESTOR PRESENTATION | 1 Safe... | November 29, 2021",2021-11-29
573,A weekly summary of dividend activity for Dividend Champions and Contenders. Companies which changed their dividends. Companies with upcoming ex-dividend dates.,2021-11-28
574,"Readers hoping to buy Genuine Parts Company ( NYSE:GPC ) for its dividend will need to make their move shortly, as the...",2021-11-27
575,"Readers hoping to buy Genuine Parts Company (NYSE:GPC) for its dividend will need to make their move shortly, as the stock is about to trade ex-dividend.  Typically, the ex-dividend date is one business day before the record date which is the date on which a company determines t",2021-11-27
576,A quality safe and growing dividend is a primary goal for a stock inclusion in “RIG” /Rose’s Income Garden.,2021-11-26
577,"Shares of Genuine Parts Co. slipped 1.09% to $136.36 Wednesday, on what proved to be an all-around mixed trading session for the stock market, with the S&P...",2021-11-24
578,"Shares of Genuine Parts Co. inched 0.73% higher to $137.86 Tuesday, on what proved to be an all-around favorable trading session for the stock market, with...",2021-11-23
579,"Shares of Genuine Parts Co. rallied 1.20% to $136.86 Monday, on what proved to be an all-around mixed trading session for the stock market, with the Dow...",2021-11-22
580,"Shares of Genuine Parts Co. slumped 0.58% to $135.24 Friday, on what proved to be an all-around grim trading session for the stock market, with the S&P 500...",2021-11-19
581,"Looking at options trading activity among components of the S&P 500 index, there is noteworthy activity today in Advanced Micro Devices Inc (Symbol: AMD), where a total volume of 324,929 contracts has been traded thus far today, a contract volume which is representative of",2021-11-19
582,,2021-11-19
583,"Shares of Genuine Parts Co. dropped 0.52% to $136.03 Thursday, on what proved to be an all-around mixed trading session for the stock market, with the S&P...",2021-11-18
584,"Shares of Genuine Parts Co. slumped 0.08% to $136.74 Wednesday, on what proved to be an all-around poor trading session for the stock market, with the S&P...",2021-11-17
585,"Shares of Genuine Parts Co. slumped 0.12% to $136.85 Tuesday, on what proved to be an all-around great trading session for the stock market, with the S&P 500...",2021-11-16
586,"Genuine Parts (GPC) is at a 52-week high, but can investors hope for more gains in the future? We take a look at the company's fundamentals for clues.",2021-11-16
587,Genuine Parts Company (NYSE: GPC) announced today its Board of Directors declared a regular quarterly cash dividend of eighty-one and one-half cents ($0.815) per share on the Company's common stock.,2021-11-15
588,"Genuine Parts Company Declares Regular Quarterly Dividend ATLANTA - Genuine Parts Company announced today its Board of Directors declared a regular quarterly cash dividend of... | November 15, 2021",2021-11-15
589,"Item 8.01 Other EventsOn November 15, 2021, the Board of Directors of the Company declared a regularquarterly cash dividend of eighty-one and one-half cents per share onthe Company's common... | November 15, 2021",2021-11-15
590,"Shares of Genuine Parts Co. inched 0.80% higher to $137.01 Monday, on what proved to be an all-around poor trading session for the stock market, with the S&P...",2021-11-15
591,"If you're not sure where to start when looking for the next multi-bagger, there are a few key trends you should keep an...",2021-11-15
592,"Shares of Genuine Parts Co. inched 0.59% higher to $135.92 Friday, on what proved to be an all-around favorable trading session for the stock market, with...",2021-11-12
593,"Shares of Genuine Parts Co. inched 0.69% higher to $135.12 Thursday, on what proved to be an all-around mixed trading session for the stock market, with the...",2021-11-11
594,"Shares of Genuine Parts Co. slumped 0.40% to $134.19 Wednesday, on what proved to be an all-around poor trading session for the stock market, with the S&P...",2021-11-10
595,"Shares of Genuine Parts Co. slipped 0.29% to $134.73 Tuesday, on what proved to be an all-around rough trading session for the stock market, with the S&P 500...",2021-11-09
596,"In October, we received $596.63 in dividend income! This was a 17.2% year over year increase compared to last year. Our largest dividend payment came from Canadian Imperial.",2021-11-09
597,"Shares of Genuine Parts Co. shed 0.91% to $135.12 Monday, on what proved to be an all-around great trading session for the stock market, with the S&P 500...",2021-11-08
598,GPC vs. CARG: Which Stock Is the Better Value Option?,2021-11-08
599,"Shares of Genuine Parts Co. advanced 1.96% to $136.36 Friday, on what proved to be an all-around positive trading session for the stock market, with the S&P...",2021-11-05
600,"Chip shortages have applied the brakes on revenue for many major automakers, but at least one related company is thriving amid 2020's and 2021's auto sector disruptions -- car part seller Genuine Parts Company (NYSE: GPC).  The company posted excellent third-quarter (Q3) 2021 results on Oct. 21, prompting a share-price boost as traders responded positively.  Zooming out to the bigger picture, Genuine Parts may have several more years of growth ahead, with conditions favorable to other sector companies, too.",2021-11-05
601,"If you're looking for a multi-bagger, there's a few things to keep an eye out for.  Typically, we'll want to notice a trend of growing return on capital employed (ROCE) and alongside that, an expanding base of capital employed.   Basically this means that a company has profitabl",2021-11-05
602,"Arrival Global Service Network Program The Program will enable a repair and maintenance network for Van and Bus customers that utilizes in-house developed digital Service Platform The Program will enable a repair and maintenance network for its Van and Bus customers that utilizes the company’s in-house developed digital Service PlatformThe Program will launch with four initial partners in the US: Amerit Fleet Solutions, Bridgestone, NAPA AUTO PARTS, and ValvolineAnd four initial partners in the",2021-11-04
603,"Shares of Genuine Parts Co. inched 0.22% higher to $134.21 Wednesday, on what proved to be an all-around great trading session for the stock market, with the...",2021-11-03
604,"Shares of Genuine Parts Co. advanced 1.66% to $133.92 Tuesday, on what proved to be an all-around favorable trading session for the stock market, with the...",2021-11-02
605,"Shares of Genuine Parts Co. inched 0.47% higher to $131.73 Monday, on what proved to be an all-around positive trading session for the stock market, with the...",2021-11-01
606,"We have narrowed down our search to six large-cap momentum stocks that have strong upside left for the rest of 2021. These are: BX, Ce, CLR, XLNX, BG, GPC.",2021-11-01
