,summary,date
156,"Dividend stocks offer investors a way to earn a steady income from their investments without selling their shares. Investors may also use them as long-term investments for retirement. There are many different types of dividend stocks, but some popular ones include utilities, real estate investment trusts (REITs), healthcare providers and consumer staples companies. 7 Oversold Value Stocks to Buy for June Here’s a list of companies you can invest in. They’ve got an excellent track record and a st",2022-06-08
157,"Genuine Parts Company (NYSE: GPC) announced today that Paul Donahue, Chairman and CEO, and Bert Nappier, EVP & CFO, will present virtually at the Evercore ISI Consumer and Retail Conference at 11:00 a.m. ET on Thursday, June 9, 2022.",2022-06-06
158,"Shares of Genuine Parts Co. slid 0.61% to $135.95 Friday, on what proved to be an all-around dismal trading session for the stock market, with the S&P 500...",2022-06-03
159,"Staff article entitled GPC Named Top 25 SAFE Dividend Stock Increasing Payments For Decades, about ETFs, from ETF Channel.",2022-06-03
160,"Genuine Parts Company Investor Presentation June 2022 Safe Harbor Statement ... | June 2, 2022",2022-06-02
161,"Shares of Genuine Parts Co. rose 1.37% to $136.78 Thursday, on what proved to be an all-around favorable trading session for the stock market, with the S&P...",2022-06-02
162,Standard Motor Products (SMP) reported earnings 30 days ago. What's next for the stock? We take a look at earnings estimates for some clues.,2022-06-02
163,"Whether you're a value, growth, or momentum investor, finding strong stocks becomes easier with the Zacks Style Scores, a top feature of the Zacks Premium research service.",2022-06-02
164,"Shares of Genuine Parts Co. dropped 0.67% to $135.82 Wednesday, on what proved to be an all-around poor trading session for the stock market, with the S&P...",2022-06-01
165,"Shares of Genuine Parts Co. slid 1.76% to $136.73 Tuesday, on what proved to be an all-around grim trading session for the stock market, with the S&P 500...",2022-05-31
166,"Automotive battery manufacturer Clarios International signed an agreement to supply automotive, heavy duty and OPTIMA batteries for NAPA Auto Parts stores.",2022-05-30
167,Netflix's fall from grace has ended the first act of the streaming wars. Act two will determine whether the industry can right itself.,2022-05-29
168,"Shares of Genuine Parts Co. rallied 2.31% to $139.18 Friday, on what proved to be an all-around great trading session for the stock market, with the S&P 500...",2022-05-27
169,"Hyliion (HYLN) secures order for 10 Hypertruck ERX units from Holcim, as the latter advances toward its net zero commitment.",2022-05-27
170,"As the bear market intensifies, more sectors of the economy are seeing equity valuations tumble.  A Dividend King is an S&P 500 component that has paid and raised its dividend for at least 50 years.  At a minimum, that means members of this coveted cohort raised their payouts through most of the high-inflation 1970s, the bear market of the early 1980s, the dot-com bubble burst, the great financial crisis, the worst of the U.S.-China trade war, and the peak of the COVID-19 pandemic.",2022-05-27
171,"Shares of Genuine Parts Co. advanced 2.16% to $136.04 Thursday, on what proved to be an all-around great trading session for the stock market, with the S&P...",2022-05-26
172,"In this article, we will look at 10 dividend stocks billionaire Mario Gabelli loves. If you want to see more dividend stocks that are dear to the legendary value investor, you can also see 5 Dividend Stocks Billionaire Mario Gabelli Loves. Mario Gabelli is one of the most prominent investors in the world. Mr. Gabelli […]",2022-05-26
173,Genuine Parts Company ( NYSE:GPC ) saw a decent share price growth in the teens level on the NYSE over the last few...,2022-05-26
174,Malibu Boats and Align Technology have been highlighted as Zacks Bull and Bear of the Day.,2022-05-26
175,"Shares of Genuine Parts Co. rallied 1.71% to $133.17 Wednesday, on what proved to be an all-around positive trading session for the stock market, with the...",2022-05-25
176,"Shares of Genuine Parts Co. inched 1.00% higher to $130.93 Tuesday, on what proved to be an all-around mixed trading session for the stock market, with the...",2022-05-24
177,"The Consumer Price Index increased 8.3% in April with food prices soaring 10.8%, the biggest spike since November 1980.  While rampant inflation exacts a tragic human toll, it has also been unrelenting in its impact on Wall Street with the S&P 500 poised to dip into bear market territory and possibly trigger a recession.  Tech stocks are already deep into a steep correction.",2022-05-24
178,"Advance Auto (AAP) now envisions adjusted EPS in the band of $13.30-$13.85, up from the previously guided range of $13.20-$13.75.",2022-05-24
179,"Former White House press secretary Jen Psaki will join MSNBC this fall in time for the 2022 midterm elections, NBCUniversal confirmed.",2022-05-24
180,"Genuine Parts, RingCentral, Waters, PBF Energy and Arthur J. Gallagher have been highlighted in this Screen of The Week article.",2022-05-24
181,"Shares of Genuine Parts Co. inched 0.86% higher to $129.64 Monday, on what proved to be an all-around great trading session for the stock market, with the...",2022-05-23
182,"Shares of Genuine Parts Co. slid 2.62% to $128.54 Friday, on what proved to be an all-around positive trading session for the stock market, with the S&P 500...",2022-05-20
183,"Ford Motor F recently issued a series of three recalls covering 350,000 vehicles on separate issues.The first recall includes 39,000 vehicles that face the risk of engine fires, and owners have been instructed to park the vehicles outdoors. The company stated that the fir",2022-05-20
184,"Shares of Genuine Parts Co. inched 0.40% higher to $132.00 Thursday, on what proved to be an all-around poor trading session for the stock market, with the...",2022-05-19
185,"Shares of Genuine Parts Co. shed 4.45% to $131.48 Wednesday, on what proved to be an all-around poor trading session for the stock market, with the S&P 500...",2022-05-18
186,"Aside from its market-beating payout and track record as a Dividend King, there are other reasons to like Genuine Parts.",2022-05-18
187,"Shares of Genuine Parts Co. inched 0.98% higher to $137.61 Tuesday, on what proved to be an all-around positive trading session for the stock market, with...",2022-05-17
188,Looking for stock market analysis and research with proves results? Zacks.com offers in-depth financial research with over 30years of proven results.,2022-05-17
189,"Shares of Genuine Parts Co. rose 1.11% to $136.27 Monday, on what proved to be an all-around mixed trading session for the stock market, with the Dow Jones...",2022-05-16
190,Leslie Picker joins the 'Halftime Report' to discuss what to expect from the SEC 13-F filings.,2022-05-16
191,"Seeking out dividend growth stocks can be a wonderful way to invest for the long term.  With that in mind, one company has stood out among dividend growth businesses for being an investment that has brought home the bacon for 66 years and counting.  What makes Genuine Parts such a standout company?",2022-05-15
192,"Whether you're a value, growth, or momentum investor, finding strong stocks becomes easier with the Zacks Style Scores, a top feature of the Zacks Premium research service.",2022-05-13
193,"RingCentral upgrade, Altria Group downgrade and Tesla initiations among today's top calls on Wall Street RNG, ORLY, GPC, PGR, LPSN, GT, MO, SWMAY, PM, RIDE, UPST, AFRM, GDRX, MEOH, TSLA, F, GM, RBLX, BZH, SATL, DEN",2022-05-10
194,BofA analyst Elizabeth Su... GPC,2022-05-10
195,BofA analyst Elizabeth Su... GPC,2022-05-10
196,"The news means that tens of millions of households could receive high-speed internet at no cost, according to the White House.",2022-05-09
197,"Catch up on the weekend&#... F, RIVN, SWX, TWTR, TSLA, UBER, GRAB, GPC, ORLY, MNRO, UTI, CPRT, SNA, DIS, FBHS, FWONA, BP, SHEL",2022-05-08
198,"One might think, from the... TWTR, TSLA, UBER, GRAB, GPC, ORLY, MNRO, UTI, CPRT, SNA",2022-05-07
199,"Our roundtable panelists discuss what’s ahead for EVs, autonomous driving, and more. Plus, four upstarts to watch.",2022-05-06
200,"Shares of Genuine Parts Co. inched 0.38% higher to $130.79 Friday, on what proved to be an all-around dismal trading session for the stock market, with the...",2022-05-06
201,"Shares of Genuine Parts Co. slipped 3.61% to $130.30 Thursday, on what proved to be an all-around grim trading session for the stock market, with the S&P 500...",2022-05-05
202,"When a stock breaks out above the 20-day simple moving average, good things could be on the horizon. How should investors react?",2022-05-05
203,"Shares of Genuine Parts Co. rallied 2.59% to $135.18 Wednesday, on what proved to be an all-around great trading session for the stock market, with the S&P...",2022-05-04
204,"See how CEO-to-worker pay ratio at 40 of the state's biggest public companies — including the United Parcel Service, Aflac, Southern Co., PulteGroup, Norfolk Southern Corp., and Delta Air Lines. — compares.",2022-05-04
205,"Shares of Genuine Parts Co. inched 0.98% higher to $131.77 Tuesday, on what proved to be an all-around great trading session for the stock market, with the...",2022-05-03
206,"Shares of Genuine Parts Co. inched 0.34% higher to $130.49 Monday, on what proved to be an all-around positive trading session for the stock market, with the...",2022-05-02
207,"Comcast and Charter's joint venture to challenge Roku, Amazon and other streaming platforms may signal cable's long-game strategy.",2022-05-01
208,"After a massive hiring spree, Delta Air Lines Inc. has released its median employee wage, and it's down for the year.",2022-04-29
209,"At least 10 companies pay their employees more than the city of Atlanta’s median household income. There are also a handful median annual salaries of below $30,000",2022-04-29
210,"Item 5.07 Submission of Matters to a Vote of Security Holders.The 2022 Annual Meeting of Shareholders of Genuine Parts Company was held on April 28, 2022. At the Annual Meeting, the Company's... | April 29, 2022",2022-04-29
211,Genuine Parts Company (NYSE: GPC) announced today its Board of Directors declared a regular quarterly cash dividend of eighty-nine and one-half cents ($0.895) per share on the Company's common stock.,2022-04-28
212,"Item 8.01 Other EventsOn April 28, 2022, the Board of Directors of the Company declared a regularquarterly cash dividend of eighty-nine and one-half cents per share onthe Company's common stock.... | April 28, 2022",2022-04-28
213,"Genuine Parts (GPC) is well positioned to outperform the market, as it exhibits above-average growth in financials.",2022-04-28
214,These are the stocks posting the largest moves in midday trading. ,2022-04-28
215,"CNBC's 'Squawk Box' team break down the latest first-quarter earnings results from Comcast, which beat analysts' expectations on the top and bottom lines.",2022-04-28
216,"All eyes will be on Comcast's broadband division, which is expected to add 229,000 new high-speed internet customers during the first quarter. ",2022-04-28
217,"Shares of Genuine Parts Co. dropped 0.16% to $133.94 Tuesday, on what proved to be an all-around dismal trading session for the stock market, with the S&P...",2022-04-26
218,"The first-quarter earnings season for the Auto-Tires-Trucks sector kicked off last week. So far this earnings season, three S&P sector components, namely Tesla TSLA, Genuine Parts Company GPC and PACCAR Inc. PCAR, have come up with quarterly numbers. Despite the indus",2022-04-26
219,"Shares of Genuine Parts Co. inched 0.39% higher to $134.16 Monday, on what proved to be an all-around positive trading session for the stock market, with the...",2022-04-25
220,"In this article, we will take a look at the 11 stocks catching investors’ eyes after earnings reports. You can skip our detailed analysis of these companies and go directly to the 5 Stocks Catching Investors’ Eyes After Earnings Reports. Notable companies from the communication services and healthcare sectors, including AT&T Inc. (NYSE:T), Verizon Communications […]",2022-04-25
221,"While Tesla (TSLA), Genuine Parts (GPC), Lithia Motors (LAD) and AutoNation (AN) manage to pull off a comprehensive beat, Carvana (CVNA) posts a wider-than-expected loss.",2022-04-25
222,"LKQ Corporation LKQ is slated to release first-quarter 2022 results on Apr 28, before market open. The Zacks Consensus Estimate for the quarter’s earnings and revenues is pegged at 91 cents per share and $3.28 billion, respectively.",2022-04-25
223,"At a time when inflation is skyrocketing, it's particularly hard for many people's salaries to keep up with their most basic costs. A great alternative approach to cover those costs, without having to work more or wait on tough-to-get raises, is to build a passive income stream t",2022-04-24
224,"Netflix doesn't plan to shut down password sharers overnight. Rather, it intends to bill shared accounts an extra fee in a global rollout that may take a year.",2022-04-23
225,"Shares of Genuine Parts Co. slipped 3.25% to $133.64 Friday, on what proved to be an all-around poor trading session for the stock market, with the S&P 500...",2022-04-22
226,"When you buy and hold a stock for the long term, you definitely want it to provide a positive return. Furthermore...",2022-04-22
227,"Michael Morris, Guggenheim Partners, joins 'TechCheck' to dicsuss Snap's Q1 earnings results, where his forecast currently is and whether investors are too bearish on the streaming service industry.",2022-04-22
228,"Shares of Genuine Parts Co. inched 0.33% higher to $138.13 Thursday, on what proved to be an all-around rough trading session for the stock market, with the...",2022-04-21
229,"Genuine Parts (GPC) expects full-year adjusted EPS in the band of $7.70-$7.85, higher than the previous forecast of $7.45-$7.60.",2022-04-21
230,"Genuine Parts Company (NYSE:NYSE:GPC) Q1 2022 Earnings Conference Call April 21, 2022 11:00 AM ET Company Participants Sid Jones - Senior Vice President-Investor Relations Paul Donahue -...",2022-04-21
231,"The following discussion should be read in conjunction with the unauditedcondensed consolidated financial statements and accompanying notes containedherein and with the audited consolidated... | April 21, 2022",2022-04-21
232,"Genuine Parts (GPC) delivered earnings and revenue surprises of 9.41% and 3.19%, respectively, for the quarter ended March 2022. Do the numbers hold clues to what lies ahead for the stock?",2022-04-21
233,Dissolving the district would mean Reedy Creek employees and infrastructure would be absorbed by the local counties.,2022-04-21
234,"Shares of Genuine Parts Co. jumped 2.4% into record territory in premarket trading Thursday, after the automotive and industrial replacement parts seller reported first-quarter earnings that beat expectations, amid a double-digit increase in same-store sales, and raised its full-year outlook. Net income rose to $245.8 million, or $1.72 a share, from $217.7 million, or $1.50 a share, in the year-ago period. Excluding nonrecurring items, adjusted earnings per share of $1.86 beat the FactSet consen",2022-04-21
235,"Genuine Parts Company (NYSE: GPC) announced today its results for the first quarter ended March 31, 2022.",2022-04-21
236,The following slide deck was published by Genuine Parts Company in conjunction with their 2022 Q1 earnings call.,2022-04-21
237,"(RTTNews) - Genuine Parts Co. (GPC) will host a conference call at 11:00 AM ET on April 21, 2022, to discuss Q1 22 earnings results.",2022-04-21
238,By Dean Seal Genuine Parts Co. raised its guidance for the year after reporting its first quarter of 2022 saw stronger-than-expected profit and record sales....,2022-04-21
239,By Dean Seal Genuine Parts Co. reported higher profit and sales for the first quarter of the year due to revenue growth in its automotive and industrial...,2022-04-21
240,"Genuine Parts Company Reports First Quarter 2022 Results •Record Sales of $5.3 Billion, Up 18.6% •Diluted EPS of... | April 21, 2022",2022-04-21
241,"Q1 2022 Earnings Presentation April 21, 2022 Genuine Parts Company Snapshot Key Statistics1 ... | April 21, 2022",2022-04-21
242,"(RTTNews) - While reporting financial results for the first quarter on Thursday, Genuine Parts Co. (GPC) raised its earnings, adjusted earnings and total net sales growth guidance for the full-year 2022.",2022-04-21
243,"ATLANTA _ Genuine Parts Co. on Thursday reported first-quarter earnings of $245.8 million. On a per-share basis, the Atlanta-based company said it had profit of $1.72. Earnings,... | April 21, 2022",2022-04-21
244,(RTTNews) - Genuine Parts Co (GPC) released a profit for its first quarter that increased from the same period last year and beat the Street estimates.,2022-04-21
245,FY22 consensus $7.59. Rai... GPC,2022-04-21
246,"Reports Q1 revenue $5.3B,... GPC",2022-04-21
247,"Shares of Genuine Parts Co. advanced 2.88% to $137.67 Wednesday, on what proved to be an all-around mixed trading session for the stock market, with the Dow...",2022-04-20
248,Cabot (CCMP) has an impressive earnings surprise history and currently possesses the right combination of the two key ingredients for a likely beat in its next quarterly report.,2022-04-20
249,"The Zacks Consensus Estimate for Genuine Parts' (GPC) Q1 earnings and revenues is pegged at $1.70 and $5.13 billion, respectively.",2022-04-20
250,"Instead of legacy media shares soaring as they imitate Netflix, the industry has brought Netflix down to a degree.",2022-04-20
251,"If you are looking for a stock that has a solid history of beating earnings estimates and is in a good position to maintain the trend in its next quarterly report, you should consider Genuine Parts (GPC). This company, which is in the Zacks Automotive - Replacement Parts",2022-04-20
252,Evercore ISI analyst Greg... GPC,2022-04-20
253,"Netflix has been willing to turn a blind eye toward password sharing when it was growing subscribers, but losing customers can change behavior quickly.",2022-04-19
254,"Shares of Genuine Parts Co. advanced 2.04% to $133.82 Tuesday, on what proved to be an all-around positive trading session for the stock market, with the S&P...",2022-04-19
255,Investors looking for stocks in the Automotive - Replacement Parts sector might want to consider either Genuine Parts (GPC) or CarGurus (CARG). But which of these two stocks is more attractive to value investors? We'll need to take a closer look to find out.,2022-04-19
256,"Shares of Genuine Parts Co. inched 0.15% higher to $131.14 Monday, on what proved to be an all-around grim trading session for the stock market, with the S&P...",2022-04-18
257,Dividend Aristocrats are a great starting point if you're looking for long-term winners to build a portfolio around. These companies are S&P 500 members that have paid and raised their dividend for at least 25 consecutive years.,2022-04-15
258,"Shares of Genuine Parts Co. dropped 0.44% to $130.94 Thursday, on what proved to be an all-around rough trading session for the stock market, with the S&P...",2022-04-14
259,"Staff article entitled GPC June 17th Options Begin Trading, about stock options, from Stock Options Channel.",2022-04-14
260,"Genuine Parts Company (NYSE: GPC) announced today an acquisition for its European Automotive business. Effective April 12, 2022, Alliance Automotive Group (AAG), the Company's wholly-owned automotive distribution company based in London, U.K., acquired Lausan Group (Lausan).",2022-04-13
261,"Shares of Genuine Parts Co. sank 0.13% to $131.52 Wednesday, on what proved to be an all-around favorable trading session for the stock market, with the S&P...",2022-04-13
262,"Whether you're a value, growth, or momentum investor, finding strong stocks becomes easier with the Zacks Style Scores, a top feature of the Zacks Premium research service.",2022-04-13
263,"It doesn't matter your age or experience: taking full advantage of the stock market and investing with confidence are common goals for all investors. Luckily, Zacks Premium offers several different ways to do both.",2022-04-13
264,Genuine Parts announced a... GPC,2022-04-13
265,"Shares of Genuine Parts Co. inched 0.79% higher to $131.69 Tuesday, on what proved to be an all-around poor trading session for the stock market, with the...",2022-04-12
266,"Shares of Genuine Parts Co. shed 1.03% to $130.66 Monday, on what proved to be an all-around rough trading session for the stock market, with the S&P 500...",2022-04-11
