,summary,date
562,"The oldest advice in the markets is, buy low and sell high. The hardest trick in the markets is knowing how to recognize a low-cost stock that is poised to bring strong gains. It’s a trick because, in truth, low cost is a relative description. A stock can have a triple-digit price tag, and still be selling for a discount if it’s off a recent high point.



The upshot is, investors looking to buy low can use sharp declines in fundamentally sound stocks as a deciding factor. Wall Street’s analysts aren’t shy about pointing out deals in the market, and a review of their notes will point investors toward stocks that have hit a hurdle, lost share price, but retained the strengths that got them that peak in the first place.



We’ve used the TipRanks platform to pull up details on three stocks that meet this profile. These are an interesting lot, coming from several market niches, but all are Strong Buys with plenty of upside potential and they are all down at least 30% from peak values reached earlier this year. Let’s take a deeper dive in, and check them out.



Open Lending Corporation (LPRO)



First up is Open Lending, a loan financing company in the automotive sector. Financing has been the engine of car sales – for new and used – in recent years, and it will likely be more important going forward as inflation pushes up prices in the car markets. Open Lending, a Texas-based company, makes the decision process easy, with loan analytics, risk modeling and risk-based pricing, and automated decision making. The company went public last year through a SPAC transaction.



Open Lending works with automotive lending companies, offering a platform to streamline their lending process. The company’s services allow lenders to make the best use of their assets and to maximize the repayment rates. The result is lower risk and higher yields, a win for everyone, including the end customer who drives off in a newly purchased car.



Despite some volatility through 2021, the company’s stock generally stayed elevated – until September of this year, when it started falling form its peak. From that peak, the stock is down 43%.



Even though the stock is down, company management described the recent 3Q21 report as a ‘record.’ Revenue came in at $58.9 million, down slightly from the $61.1 million in 2Q21, but up an impressive 97% year-over-year. The company facilitated over 49,000 certified loans during the quarter, up  138% yoy. EPS was positive, at 23 cents per share, compared to the 62-cent EPS loss in the year-ago quarter.



Writing on this stock for Canaccord Genuity, 5-star analyst Joseph Vafi sees the company in a sound position despite inflationary headwinds. 



“Another all-time record quarter, bucking Covid, global chip shortages and rising car prices and underscoring how resilient the Open Lending platform is against such macro headwinds…. the LPRO business model is still expanding, with solid execution in credit union refi, potentially launching new products in the short term, and importantly moving forward with auto OEM relationships in addition to the two already in hand. Even during a tough quarter in auto transactions, the company signed 16 new customers, four of which had assets of $1B or greater,” Vafi noted.



To this end, Vafi gives LPRO shares a Buy rating, with a $55 price target that implies a 12-month upside potential of a huge 130%. (To watch Vafi’s track record, click here)



Overall, it’s clear that Wall Street likes the prospects on this stock. Of the 8 recent reviews, 7 are to Buy against 1 Hold, for a Strong Buy consensus rating. The shares are priced at $23.90, and the average price target of $38.57 suggests a gain of 61% in the year ahead. (See LPRO stock analysis at TipRanks)







Five9 (FIVN)



Next up is Five9, an AI cloud company offering a scalable contact center platform. Five9 has a smart product in a crowded industry, but online contact is a growth industry. The company’s software uses AI to allow faster data analysis with greater accuracy and efficiency. Contact center customers can use the AI to track and route calls, direct callers and service agents, and process information.



The big news recently on Five9 was the collapse of the company’s talks with Zoom. The two companies had been in negotiations over a Zoom offer to acquire Five9. The offer, for an all-stock deal, was worth $14.7 billion, but Five9’s shareholders rejected the deal on the last day of September. It is highly unusual for company shareholders to reject a merger deal in this fashion.



Five9’s stock, which had been volatile this year, had been slipping since its August peak. It fell further after the rejection of the Zoom offer; currently, FIVN shares are down 32% from that peak value.



Despite nixing Zoom’s offer in the third quarter, Five9 reported record revenue and beat the EPS estimates in the Q3 financial release. The company’s top line hit $154.3 million, up 38% yoy, and EPS, at 28 cents, was 12% better than the 25-cent forecast.



Terry Tillman, 5-star analyst with Truist, was impressed by Five9’s quarter – and by the company’s outlook going into next year. He writes, “FIVN returned to its regularly scheduled quarterly call without missing a beat. The company delivered record bookings in 3Q, and sounded confident about ongoing strong momentum in enterprise growth, while confirming 2026 revenue ($2.4 billion) and EBITDA margin (~23%) as potential targets laid out in recent SEC filings. Given the stock underperformance since the Zoom deal was terminated, we believe this is a good entry opportunity for investors as fundamental momentum remains strong.”



In line with his optimistic approach, Tillman gives LIFE shares a Buy rating and his $210 price target suggests a 48% potential upside for the coming year. (To watch Tillman’s track record, click here)



Like Tillman, Wall Street is confident on Five9’s prospects, and that can be seen in the 16 reviews on record. These break down to 14 Buys and just 2 Holds, to support the Strong Buy consensus. The average price target of $199.25 implies a one-year upside of 40% from the current trading price. (See FIVN stock analysis on TipRanks)







Annexon Biosciences (ANNX) 



The last stock we'll look at, Annexon, is a clinical-stage researcher, focused on C1q, an initiating molecule of the classical complement pathway – and one that is implicated in a number of auto-immune and neurodegenerative diseases that affect the body, brain, and eye. The company’s development pipeline features drug candidates designed to act as potent, selective inhibitors of C1q, to prevent tissue damage and antibody-mediated autoimmune response, as well as to preserve function in synapses associated with cognitive decline complement-mediated degenerative disease. The company’s drug candidates have broad application to multiple complement-mediated conditions. 



All of that’s a mouthful, but what it comes down to is, Annexon is developing drug candidates with multiple indications. The autoimmune program, for example, has 3 drug candidates under investigation for five different conditions. The most advanced of these tracks, featuring ANX005 as a treatment for Guillain-Barré syndrome, is enrolling patients in a Phase 2/3 clinical trial, with completion projected for 2023. Earlier data, from the drug-drug interaction study and the Phase 1b trial, was presented this year, and showed an acceptable tolerability profile along with positive therapeutic action. 



The company recently completed a Phase 2 trial of ANX005 in the treatment of Huntington’s disease (HD), and initiated dosing in a Phase 2 trial of the drug against amyotrophic lateral sclerosis (ALS). Data releases on these trials are expected in 4Q21 and during 2022 respectively. Annexon recently expanded its development program with ANX009, a new drug candidate aimed at treating lupus. 



Despite this active pipeline, the company has seen its stock fall 61% from its peak, reached this past March. 



However, JPMorgan analyst Anupam Rama remains bullish on Annexon, taking particular note of the company’s multiple shots on goal. 



“In a win scenario, we are looking for a clean safety profile for ANX005 and positive directional trends on key biomarkers (particularly on neurofilament light chain or NfL), with a homerun scenario showing initial / early trends of functional benefit... While we acknowledge that the HD data will be early stage, we note upside scenarios likely will have sentiment pull-through to the broader neurodegeneration efforts (i.e., platform value). Importantly, from current levels, we see upside in ANNX shares on Guillain-Barré Syndrome (GBS) alone (into the mid~$20s) and the broader pipeline, including the phase 2 HD readout, as providing pipeline optionality,” the analyst opined.



Rama rates ANNX shares as Overweight (i.e., a Buy), with a $37 price target to indicate room for 170% appreciation in the next 12 months. (To watch Rama’s track record, click here) 



The JPM view is hardly an outlier here, as the stock’s Strong Buy consensus rating is unanimous, based on 4 positive reviews. Shares are priced at $13.7 and the $38 average price target suggests a one-year upside potential of a very strong 177% from current trading levels. (See ANNX stock analysis on TipRanks) 







To find good ideas for stocks trading at attractive valuations, visit TipRanks’ Best Stocks to Buy, a newly launched tool that unites all of TipRanks’ equity insights.



Disclaimer: The opinions expressed in this article are solely those of the featured analysts. The content is intended to be used for informational purposes only. It is very important to do your own analysis before making any investment.",2021-11-28
563,I went bargain hunting last week. I bought shares of Dick's Sporting Goods (NYSE: DKS) and added to my existing position in Genius Sports (NYSE: GENI) on Tuesday. The two stocks were falling after posting fresh quarterly results.,2021-11-28
564,Black Friday wasn't kind to U.S. stocks. Every major U.S. stock index fell by more than 2% on the holiday-shortened trading session due to concerns about the omicron coronavirus variant. Although it is still too early to tell if this latest variant will disrupt global commerce in,2021-11-28
565,The newly emerged omicron coronavirus variant sent shockwaves through U.S. stock markets last Friday. Omicron has the world on edge because of its unique combination of mutations that might significantly reduce the effectiveness of first-generation COVID-19 vaccines.,2021-11-28
566,"Biopharmaceutical stocks are slated to end the year on a sour note. Apart from top COVID-19 vaccine players like Pfizer, Moderna, and Novavax, investors have shown little to no interest in owning these growth-oriented equities in 2021. As proof, the SPDR S&P Biotech ETF has l",2021-11-28
567,"Wall Street analysts set stock price targets and provide detailed insights on companies. However, their views are often short-sighted, capped by what they can put into their models. As a result, they can struggle analyzing growth-oriented companies.Still, analysts' views are resp",2021-11-28
568,"For better or worse, social media is a huge part of society. Billions of people interact with it daily, so advertisers spend heavily to better reach their intended audiences. Because of this, social media companies often make great potential investments.Snapchat is a popular plat",2021-11-28
569,Rivian Automotive (NASDAQ: RIVN) burst on the scene earlier this month. The electric vehicle developer was worth more than $150 billion at one point despite not generating any meaningful revenue. The driving factor is the increasing investor interest in companies working to addre,2021-11-28
570,"Last December, I compared two of the market's hottest semiconductor stocks: Nvidia (NASDAQ: NVDA) and Advanced Micro Devices (NASDAQ: AMD).",2021-11-28
571,"Roche (OTC: RHHBY) is considering a launch of its Alzheimer's disease drug, gantenerumab, at a price that could undercut competition from Biogen's (NASDAQ: BIIB) Aduhelm. In this Motley Fool Live video recorded on Nov. 15, Motley Fool contributors Keith Speights and Brian Orelli",2021-11-28
572,"Weighing anchor on a successful, profitable third quarter, dry bulk shipping company Golden Ocean Group (NASDAQ: GOGL) isn't really a household name -- but the stock price skyrocketed close to 15% after an upbeat Q3 earnings release on Nov. 24. A large boost to its dividend also",2021-11-28
573,"Okta (NASDAQ: OKTA) investors are in for more stock price volatility over the next few days. The software specialist's stock, which has been left out of the 2021 rally, should move in response to the upcoming earnings report, set for Wednesday, Dec. 1.",2021-11-28
574,"Robert Califf has been nominated as the next Food and Drug Administration (FDA) Commissioner, despite some expectations that the choice would be the current acting commissioner Janet Woodcock. Both had seemed well qualified for the position.",2021-11-28
575,"Palo Alto Networks' (NASDAQ: PANW) terrific quarterly report and guidance prompted a spate of price target upgrades by Wall Street analysts, who believe that the company's outstanding growth is sustainable thanks to its presence in several hot cybersecurity niches.",2021-11-28
576,"SoFi Technologies (NASDAQ: SOFI) went public in June 2021 following a SPAC merger orchestrated by venture capitalist Chamath Palihapitiya. Since then, the stock has underperformed the broader market, and the share price has fallen 31% from its all-time high. Even so, investors sh",2021-11-28
577,"Pure Storage's (NYSE: PSTG) stock price soared 13% to an all-time high on Nov. 24 after the data storage company posted its third-quarter earnings.Its revenue rose 37% year over year to $562.7 million, beating estimates by $32.1 million. Its adjusted net income jumped from $1.8 m",2021-11-28
578,"A top aim of investing is to grow your wealth over time to enjoy a comfortable retirement. To do so, it's important to select businesses that cannot just grow steadily, but also remain resilient during tough times. Some key characteristics include having a strong franchise, a stu",2021-11-28
579,"Are These The Best Infrastructure Stocks To Invest In Right Now?As investors digest a wide spread of economic data alongside their Thanksgiving meals, infrastructure stocks continue to gain traction. For the most part, this area of the stock market today stands to benefit from se",2021-11-28
580,"If you invest in fintech stocks, as I do, then you likely have been feeling the sting over the past few weeks as the market has sold off the sector aggressively. Up until recently, big players like Upstart (NASDAQ: UPST), Affirm (NASDAQ: AFRM), and SoFi (NASDAQ: SOFI) had run up",2021-11-28
581,The new covid variant and quick imposition of travel restrictions on several countries in Southern Africa have injected a new dynamic into the mix.,2021-11-28
582,"Apple's global battery development chief, Ahn Soonho, has moved to Volkswagen to lead the automaker's development of electric vehicle batteries, according to his Linkedin profile.",2021-11-26
583,Novavax Inc said on Friday it had started working on a version of its COVID-19 vaccine to target the variant detected in South Africa and would have the shot ready for testing and manufacturing in the next few weeks.,2021-11-26
584,"What happened
Shares of all the major U.S. bank stocks struggled today, along with the Dow Jones Industrial Average, which at one point fell 1,000 points on this shortened day of trading -- the worst drop for the index in all of 2021.",2021-11-26
585,"What happened 
Shares of Moderna (NASDAQ: MRNA) soared on Friday as fears surrounding a worrisome new coronavirus variant spread among investors. By the close of the holiday-shortened trading day, the biotech's stock price was up more than 20%.",2021-11-26
586,"What happened
The price of gold is dipping a little lower today (about 0.1% as of this writing), but shares of the gold mining company Sibanye Stillwater (NYSE: SBSW) are plunging. As of 12:15 p.m. EDT on Friday, the stock was down 8.7%.",2021-11-26
587,"What happened
Here we go again.",2021-11-26
588,"Spain's bad bank said on Friday it had sued Spanish lenders, such as Caixabank and Sabadell in a Madrid court, seeking to recoup negative interest payments on its 34.5 billion euros senior debt portfolio.",2021-11-26
589,"What happened
Here we go again.",2021-11-26
590,"U.S. stocks closed lower on Friday, with the Dow and S&P 500 suffering their biggest one-day percentage drops in months, and pandemic-hit sectors that had gained from a reopening falling sharply after a new coronavirus mutation was found.",2021-11-26
591,"What happened
Shares of automotive marketplace platform Cars.com (NYSE: CARS) are bucking the trend in the markets today. While the Dow Jones Industrial Average is dropping almost 1,000 points, or 2.75%, Cars.com stock is soaring. As of 11:39 a.m. ET, Cars.com shares were trading",2021-11-26
592,"What happened
It may be Black Friday, but investors are seeing red. Fears of a new COVID-19 variant discovered in South Africa shook the markets Friday, and hydrogen and fuel cell stocks were caught up in the pessimism.",2021-11-26
593,"WhatsApp has won regulatory approval to double the number of users on its payments service in India to 40 million, a source with direct knowledge told Reuters on Friday.",2021-11-26
594,"What happened
On Thursday, the airline industry was hit by fresh bad news, and stocks of companies that rely on airlines for profits are taking it on the chin on Friday. Shares of Spirit AeroSystems Holdings (NYSE: SPR) fell as much as 14% on concerns a new COVID-19 variant could",2021-11-26
595,"Health care stocks were mostly lower this afternoon but outperforming most other sectors, with the NYSE Health Care Index falling 0.5% while the SPDR Health Care Select Sector ETF (XLV) was down 0.6%.",2021-11-26
596,(RTTNews) - Qiagen N.V. (QGEN) Friday announced its polymerase chain reaction (PCR) tests remain accurate and effective in detecting SARS-CoV-2 infections in light of the emergence of a new variant of concern detected in South Africa.,2021-11-26
597,"Technology stocks were falling hard this afternoon, with the SPDR Technology Select Sector ETF (XLK) Friday slipping 2.0% while the Philadelphia Semiconductor Index was falling 2.3% this afternoon.",2021-11-26
598,Blue Prism shareholder Coast Capital said on Friday it will not support private equity firm Vista Equity's final takeover offer of 1.22 billion pounds ($1.62 billion) for the British software firm on grounds it undervalues the company.,2021-11-26
599,"U.S. stocks dropped on Friday, with the Dow and S&P 500 suffering their biggest one-day percentage drops in months, and pandemic-hit sectors that have benefited from a reopening falling sharply after a new and potentially vaccine-resistant coronavirus mutation was found.",2021-11-26
600,"Consumer stocks were sliding in Friday trading, with the SPDR Consumer Staples Select Sector ETF (XLP) dropping 1.0% while the SPDR Consumer Discretionary Select Sector ETF (XLY) was sinking 2.1%.",2021-11-26
601,"Energy stocks were sharply lower this afternoon, with the NYSE Energy Sector Index falling 4.6% while the SPDR Energy Select Sector ETF (XLE) was down 4.2%. The Philadelphia Oil-Service Sector index was posting a 6.0% decline and the Dow Jones US Utilities Index was sinking 1.4%",2021-11-26
602,"Mario Draghi has seemed to work his economic magic on the Italian economy, producing a performance greater than expected with a further good outcome forecast for next year.",2021-11-26
603,The ECB sticks to its guns even as stricter containment measures loom large as the fourth pandemic wave sweeps over Europe.,2021-11-26
604,"One of Asia's largest airlines, Cathay Pacific, is facing a revolt from pilots who say Hong Kong's tough quarantine rules under its zero-COVID policies are endangering their mental health, leading to rising stress and resignations.",2021-11-25
605,"Australian shares slipped on Friday and were set for a third consecutive weekly loss, dragged down by energy stocks as oil prices dipped in thin trading on the U.S. Thanksgiving holiday.",2021-11-25
606,"KKR & Co and CVC Capital Partners are considering teaming up on a bid for Italy-based Telecom Italia SpA, Bloomberg News reported on Thursday, citing people with knowledge of the matter.",2021-11-25
607,"Renewable energy stocks have had a wild year, jumping early in the year as the market pushed the entire sector higher. But values fell as the euphoria wore off and companies had to start proving they were worth high valuations.",2021-11-25
608,New Zealand media firm NZME on Friday said it may opt to engage directly with Google and Facebook for fair payment for its news content even as the country's news publishers association sought regulatory approval for collective bargaining with the digital platforms.,2021-11-25
609,"In a surprise move, Canada has told Boeing Co that its contender for a multi-billion dollar fighter jet contract does not meet the required standard, a defense source said on Thursday.",2021-11-25
610,"Investors will be following up Thanksgiving week with a packed schedule, with little time to waste before the end of 2021. Next week is filled to the brim with economic indicators, and marks the beginning of the last month of the year. The earnings calendar appears quite full as",2021-11-25
611,"Canada has formally excluded Boeing Co from a multi-billion contract to supply 88 new fighter jets, the Canadian Press said on Thursday, citing industry and government sources.",2021-11-25
612,"KKR & Co and CVC Capital Partners are considering teaming up on a bid for Italy-based Telecom Italia SpA, Bloomberg News reported on Thursday, citing people with knowledge of the matter.",2021-11-25
613,"British robotics software company Blue Prism has agreed to a 1.22 billion pound ($1.63 billion) final takeover offer from U.S. private equity firm Vista Equity, the parties said on Thursday, topping a proposal from SS&C Technologies.",2021-11-25
614,A former Apple Inc employee who had filed a whistleblower complaint related to Apple's use of non-disclosure agreements (NDAs) has inspired draft legislation in Washington state that seeks to restrict companies' use of NDAs in settlements of workplace harassment and discrimination claims.,2021-11-25
615,"Spain's government plans to extend by six months voluntary write-offs of state-backed loans as part of a debt restructuring plan to help companies cope with the COVID-19 pandemic, three sources with knowledge of the matter told Reuters.",2021-11-25
616,"Are These The Best Health Care Stocks To Buy Right Now?Whether it is health care stocks, vaccine stocks, or telehealth stocks, investors appear to be eyeing the health care world. For the most part, this would be the case in the stock market today as Covid-19 appears to be return",2021-11-25
617,Are you looking for an underrated stock that could make for a good contrarian bet in the next year? Two stocks you should consider taking a chance on today are American Well (NYSE: AMWL) and Alibaba Group Holdings (NYSE: BABA).,2021-11-25
618,"Pakistan's largest e-commerce retail platform Daraz aims to host up to 300,000 small to medium enterprises (SMEs) in two years, its CEO said, as the firm seeks to bolster its position in its home market in the face of potential competition from global giant Amazon.",2021-11-25
619,"Earnings season is winding down, and there was lots of good news as well as some surprises. Many retailers that benefited from last year's pandemic-related, sales spurt continued to see strong earnings -- much to the delight of their shareholders. Even better, some of these retai",2021-11-25
620,"If you're like 92% of U.S. consumers recently polled by Feedvisor, Amazon.com (NASDAQ: AMZN) is your go-to choice when shopping online. In fact, odds are good that you shop at the behemoth of web-based marketplaces on a rather regular basis. Digital Commerce 360 estimates that Am",2021-11-25
