,summary,date
0,"The new regime of macro volatility is playing out with weaker growth, persistent inflation and volatile markets. We stick with our dialed-down risk stance and favor credit over equities.",2022-09-20
1,The median economist forecast is for more inflation and higher unemployment than the Fed's median projection in June. Read more here.,2022-09-17
2,World's major central banks grew increasingly united in their resolve to bring inflation under control. How did major indices react? Click here to find out.,2022-09-17
3,"Hotter-than-expected August CPI and quarterly options/derivatives expiration made for a toxic mix. âCoreâ CPI was reported up 0.6% for the month (7% annualized!), double estimates.",2022-09-17
4,UK prime minister Liz Truss announced a price cap on natural gas to shelter households from the 80% increase scheduled for next month and more price resets slated for January and April 2023.,2022-09-17
5,"The US CPI reading kicked off the latest curve flattening leg, but the coordinated hawkishness of ECB officials is helping to extend it. Read more here...",2022-09-16
6,"Citing economic sanctions imposed by the West, Russia has closed the taps to its Nord Stream 1 pipeline, throwing Europe into its biggest energy crisis in decades.",2022-09-14
7,"Today, every major part of the world economy is seemingly prone to a serious economic crisis. European economy is perhaps the most immediate cause for concern.",2022-09-13
8,"The green revolution will continue, but with barely 3% of US electricity production originating from solar and wind sources, fossil fuels will dominate energy production. Read more here...",2022-09-13
9,We think the energy crisis will spur a recession in Europe. The ECB is trying to fight inflation without recognizing the costs. Read more here...,2022-09-12
10,Russia cuts off natural-gas flows to Europe indefinitely. UK unveils plan to cap energy prices for businesses and consumers. Read more here.,2022-09-10
11,We continue to believe that large cap US equities should be the outsize bedrock asset on the growth side of long-term portfolios.,2022-09-10
12,The hawks won the front-loading argument and the ECBâs council unanimously decided to raise all key rates by 75bp.,2022-09-10
13,"The week ahead is going to be mainly about inflation, BOE decision, and Xi's meeting with Putin. Click here for a more detailed peek into next week.",2022-09-09
14,We believe the ECB will aim to bring its interest rates into neutral territory reasonably quickly following its decision to raise its policy rate by 75 bps at its September meeting.,2022-09-09
15,"Listen on the go! A daily podcast of Wall Street Breakfast will be available by 8:00 a.m. on Seeking Alpha, iTunes, Stitcher and Spotify.",2022-09-08
16,"Global economic output contracted in August for the first time since June 2020, according to the latest PMI survey data.",2022-09-08
17,"Weâre in a new macro regime, and we think getting inflation back to central bank targets means crushing demand with a recession. Thatâs bad news for risk assets in the near term.",2022-09-06
18,"Over the coming several weeks, the market will provide us with the structure as to which direction the next 500+ point move will take us.",2022-09-06
19,Most countries/regions around the world have monetary inflation rates that peaked at extraordinary heights in early 2021 and have since crashed. Read more.,2022-09-06
20,The indefinite shut down of natural gas flows via the Nord Stream 1 pipeline will trigger a severe recession in Germany and Europe.,2022-09-06
21,European curves react to higher energy prices and to news of fiscal support by bear-flattening. More yield upside is to be expected when more spending is announced. Read more here...,2022-09-06
22,"The Reserve Bank of Australia makes its announcement early Tuesday, September 6. One of the challenges for policymakers and investors is that Australia reports inflation quarterly.",2022-09-03
23,"The JPMorgan Global Manufacturing Purchasing Managers' Index, compiled by S&P Global, fell from 51.1 in July to 50.3 in August, its lowest since June 2020. Click here to read more.",2022-09-03
24,"S&P Global Eurozone Manufacturing PMI fell to 49.6 in August, down from 49.8 and further beneath the 50.0 mark that separates growth from contraction. Read more.",2022-09-02
25,"In a paradigm shift, central banks are trying to break inflation, accepting the potential costs of pushing economies further into recession. The ECB has fallen in step. Read more here...",2022-09-02
26,Market rates are set to rise as financial conditions are not tight enough in the US; the US 10yr yield could even go as far as topping 3.5% again. Read more.,2022-09-01
27,Employment expectations from businesses are dropping moderately and the economy is moving towards recession at the moment. Read more.,2022-09-01
28,"Despite recent outperformance of US based companies and US investorsâ home-country bias, we believe investors will still benefit from proper diversification for a well-balanced portfolio.",2022-08-31
29,"The latest inflation data suggests that although the rate of rising has slowed, inflation is not going away just yet as the post-pandemic and war in Ukraine era evolves.",2022-08-30
30,The Food and Drug Administration is expected to authorize new COVID-19 booster shots this week that target the latest versions of the omicron variant but...,2022-08-29
31,"Policymakers have spent weeks trying to convince investors that there was no dovish pivot, to no avail.",2022-08-26
32,"Global securities finance revenues reached $6.1bn in H1 2022, up 12% YoY. Increasing balances across main asset classes were the key linchpin to a strong H1 2022.",2022-08-25
33,"With global demand cooling and supply disruptions easing, global inflation is expected to moderate in 2023 and 2024.",2022-08-25
34,"Equities rebounded in recent weeks as investors considered the prospects of a possible pivot by major central banks, especially after Chinaâs central bank unexpectedly cut interest rates.",2022-08-24
35,"Supply shocks continue to plague the eurozone economy, causing inflation to show few signs of abating in the short run.",2022-08-23
36,"Last quarter, we discussed the ongoing trends of sticky inflation and a hawkish Federal Reserve. These trends accelerated in Q2 as the U.S. Consumer Price Index rose again to 9.1% in June.",2022-08-23
37,"Interest rate volatility has been high, and rotations between value and growth in equities have been sharp. Read more.",2022-08-22
38,What are the odds of a recession? What are the risks that inflation will stay elevated? How are housing markets evolving in a rising rate environment?,2022-08-20
39,Jackson Hole has been heavily discussed since the Fedâs supposed âdovish pivotâ last month when it adopted a more data-dependent stance.,2022-08-19
40,"While today may prove a quiet session, the summer holiday is drawing to a close. Read more here.",2022-08-19
41,Inflationary pressures have eased in recent months thanks to reduced supply-chain frictions and the commodity market coming off the boil. Read more.,2022-08-19
42,"Even before the onset of winter, the German economy is in poor shape.",2022-08-16
43,"We doubt European markets would react well to either a more hawkish or more dovish European Central Bank. Curve flattening, and lower Bund yields, is our base case for now. Read more here...",2022-08-16
44,"While the interest rate-sensitive housing sector may still feel the squeeze, we note that activity is at historically strong levels. Existing home sales have come off a bit more.",2022-08-13
45,"The global business climate is deteriorating in mid-2022, putting forecasters on recession watch.",2022-08-11
46,"European earnings and revenue growth continue to be resilient in 22Q2 in the face of recession worries, higher inflation and interest rates and concerns around energy security.",2022-08-11
47,"Almost every month this year, discounts on financial assets from their year-end 2021 prices have gotten larger, leaving S&P 500 with its worst first half-of-the-year return since 1962.",2022-08-10
48,The European Central Bank (ECB) is set to tilt its monetary policy strategy towards corporate bond issuers with âbetter climate performanceâ.,2022-08-10
49,July was the highest revenue generating month of 2022. The US hard to borrow equity market pushes revenues higher. Fixed income continues to see strong demand.,2022-08-09
50,"Elevated inflation, slowing global economic growth expectations, and reduced central bank liquidity remain the key economic considerations. Read more here.",2022-08-08
51,"US & European markets trailed global index for the year through July end, while UK & Japan held their YTD & 12-month leadership, despite losing ground to world index in July.",2022-08-06
52,"As USD strength continued & inflation expectations softened, gold price fell, gold ETFs lost 81t ($4.5bn), & speculative positions in gold futures turned net short for 5th time since 2006.",2022-08-06
53,Europe agreed on an investment fund for energy transformation and digitization of the economy. The investment regime weâve been putting in place over the past year may have profound effects.,2022-08-06
54,Why European countries like Germany may be facing a natural gas crisis this coming winter. Europe's natural gas crunch as countries rethinking their production strategies.,2022-08-05
55,"Global economic growth slowed to a crawl in July, according to the latest PMI survey data, led by the developed world falling into contraction for the first time in two years.",2022-08-04
56,"Central banks retain a heavy hand. Fed is pushing back against dovish interpretation of the July meeting, while ECB started peripheral bond market intervention through PEPP reinvestments.",2022-08-03
57,"Global equity markets went into a protective crouch last quarter, and factor performance followed suit. Read more.",2022-08-03
58,"Output fell in the United States, Eurozone, UK and Japan, while mainland China saw a reduced rate of expansion and the rest of Asia as a whole likewise mustered only modest growth.",2022-08-03
59,"The risks of a recession may be on the rise, but if one does strike the global economy in the next year or two, most equity managers donât expect it to be severe.",2022-08-03
60,We donât expect the slowdown in economies to result in a deep global recession. A repeat of the big increases in bond yields we saw in the first half of the year is unlikely.,2022-08-02
61,Central banks in major economies expected as recently as a few months ago that they could tighten monetary policy very gradually.,2022-08-02
62,"European gas demand curtailment would have major adverse impacts on the industrial sector, particularly the refining, chemicals, plastic, glass, ceramic, and metal industries. Read more.",2022-08-02
63,"US companies see strong food grocery sales as consumers focus on essentials. Consumer food price inflation ticked higher in June, reaching 10.4% in the US and eurozone and 9.8% in the UK.",2022-08-02
64,Many of the downside risks flagged in our April World Economic Outlook have begun to materialize.,2022-08-02
65,Ever-lower interest rates are driving greater appetite for risk assets. In the case of eurozone sovereign spreads this tightening is on the back of hopes for a less-fraught Italian election.,2022-08-02
66,The market has abandoned any thought of a 75 bp move and finished last week with a nearly 75% chance of a 50 bp hike. Read more.,2022-07-30
67,Is a Fed neutral interest rate enough to pause further hikes? How is Europe coping with its natural gas shortage? China lifts tech restrictions and supports property developers.,2022-07-30
68,Last week was action-packed and itâs not likely to ease up with attention now shifting from the Fed and the âtechnical recessionâ in the US to the labour market.,2022-07-30
69,"High inflation and low unemployment will push up wage growth in 2022 and 2023. At the same time, labour productivity growth is expected to come down significantly.",2022-07-29
70,These are the stocks posting the largest moves in midday trading. ,2022-07-28
71,"CNBC's 'Squawk Box' team breaks down the latest earnings results from Comcast, which beat analysts' expectations on the top and bottom lines.",2022-07-28
72,"The stocks making the biggest moves in premarket trading include Stanley Black & Decker, Southwest Airlines, Harley-Davidson, and more.",2022-07-28
73,"Signs of slowing economic growth abound, but they only seem to affect EUR rates. USD rates are more circumspect heading into todayâs FOMC meeting, where a 75bp hike is probable.",2022-07-27
74,"In all fairness to the Atlanta Fed, some of last weekâs statistical releases indicate an economic slowdown, but at a very slow pace. Read more.",2022-07-26
75,"As inflation raged, central banks accelerated the pace of monetary policy tightening, aiming to slow the growth of aggregate demand and calm price pressures. Read more here.",2022-07-26
76,The eurozone economy looks set to contract in Q3 as business activity slipped into decline in July and forward-looking indicators hint at worse to come in the months ahead. Read more.,2022-07-26
77,"If demand for workers persists, wage growth will stay higher and so will inflation. Read more.",2022-07-26
78,Most major economies are dealing with inflation highs not seen in decades. Read more.,2022-07-26
79,German Bund yields holding on to last weekâs gains confirm the marketâs recessionary mood. US data should add to the economic gloom. Read more here...,2022-07-26
80,Markets are pricing another 0.75% rate rise by the Fed this week. We see more volatility ahead as long as central banks think they can curb inflation without crushing growth. Read more here.,2022-07-25
81,The outcome of the Federal Reserve Open Market Committee meeting on July 27 is the most important event in the last week of July. Read more.,2022-07-23
82,Unpacking the initial results from second-quarter earnings season. European Central Bank raises rates for first time in 11 years.,2022-07-23
83,Europe took centre stage last week as leaders waited nervously to see if gas would start flowing through Nord Stream 1 again following scheduled maintenance.,2022-07-23
84,"There's a head spinning amount of news for markets to navigate in the week ahead, the biggest of which will be the Federal Reserve's mid-week meeting.",2022-07-22
85,"The credit cocktail has changed after the ECB announced a 50bp rate hike. Thus, credit is now looking more attractive due to lower rates and the value priced in. Read more here...",2022-07-22
86,ECB surprised markets by hiking 50bp and going against Juneâs guidance of a 25bp hike. This has signalled a willingness to front-load tightening. Curves flattened in reaction to the hike.,2022-07-22
87,"The UK economy surprised in May with robust growth following three months of stagnation, but that reading was distorted by holiday dates.",2022-07-21
88,"Instead of rising unemployment, the eurozone is currently facing labour shortages. With firmsâ employment expectations remaining historically high, tight labour markets look set to continue.",2022-07-20
89,The key to the price outlook will be the supply situation. Read more.,2022-07-20
90,"Two opposing forces appear to be dominating the market currently, with investors polarized between recession fears and bargain hunting following this yearâs large equity selloff.",2022-07-20
91,"There has been a dramatic fall in Treasury yields in the past month and an equally dramatic fall in energy, metals, and agricultural commodities.",2022-07-19
92,"The global economy and financial markets have had a dreadful H1 2022, and H2 looks tough too. Investors would do well to refocus on high quality, with assets that can deliver stable earnings",2022-07-19
93,"Inflation has been a global issue, with food and energy especially affecting emerging local markets given their large proportion of the Consumer Price Index basket.",2022-07-19
94,Europe is facing the risk of an energy shock-driven recession and periphery stress. Thatâs why we think the ECB will stop hiking earlier than the Fed. Read more here...,2022-07-18
95,"The US and eurozone June composite PMI had nearly converged at 52.3 and 52.0, respectively. The BOJ saw the economy expanding 2.9% this year and slowing to 1.9% next and 1.1% in 2024.",2022-07-17
96,We now expect U.S. inflation to peak later than we originally expected and to roll over much more gradually than previously expected. Read more.,2022-07-16
97,"""Knock at the Cabin,"" a new film by director M. Night Shyamalan, is the first adaptation of one of Paul Tremblay's horror novels.",2022-07-16
98,"K2 Advisors team is monitoring economic growth, earnings, supply chains, and inflation for clues as to whether central banks can achieve the elusive soft landing. Read more.",2022-07-16
99,"Next week offers a plethora of monetary policy meetings with the ECB, BoJ, CBRT, SARB and CBR among those.",2022-07-16
100,"Ride-related injuries dropped by more than 60% between 2004 and 2019, according to the International Association of Amusement Parks and Attractions.",2022-07-15
101,"CNBC obtained a list of nearly 20 corporations and trade groups that RSVP'd to attend a swanky, three-day retreat at the Breakers resort starting Sunday.",2022-07-14
102,"At the heart of this market volatility is inflation uncertainty, which results in policy uncertainty. The U.S. Click here to read more.",2022-07-14
103,"The market now has more than a 50% probability attached to a 100bp hike from the Fed in July. We think this is overdone, and we think the bond market agrees with us. Read more here...",2022-07-14
104,Private market valuations are not immune to this new regime of higher volatility. Click here to know more...,2022-07-14
105,"An investment in Nigeria or Turkey clearly exposes a firm or investor to more risks than an otherwise similar investment in Germany or Canada, but why?",2022-07-14
106,The streamer announced in April that it was planning on rolling out an ad-supported tier after years of resisting the move.,2022-07-13
107,"Last quarter, the Asset Allocation Committee adopted an underweight view on global equities and leaned more heavily into cash, commodities and other alternative, diversifying assets.",2022-07-13
108,Forward 12-month net profit margin for the STOXX 600 is currently at an all-time high of 10.0% and has increased by 220 basis points (bps) over last 2 years. Read more here.,2022-07-13
109,"""Succession"" tops the 2022 Emmy Award nominations followed by ""Ted Lasso"" and ""The White Lotus.""",2022-07-12
110,"The EU and the U.S. are placing more energy sanctions on the Russian Federation, but it looks like they are self-defeating in nature. Click here to know more...",2022-07-12
111,"Between 2009 and 2012, the euro area experienced a sovereign debt crisis. The European Central Bank is ending its bond-buying program and prepping to raise rates.",2022-07-11
112,"Moviegoers aren't just returning to cinemas, they are spending more on premium tickets and concessions.",2022-07-11
113,Klarna Bank AB said Monday it has raised $800 million in financing at a valuation of $6.7 billion. The Swedish buy-now-pay-later payments provider said it...,2022-07-11
114,"""Thor: Love and Thunder"" tallied $143 million during its domestic debut, pushing the overall weekend haul to more than $200 million.",2022-07-10
115,"Last month, when the Fed hiked 75 bp instead of the 50 it had signaled, Chair Powell cited the unexpectedly strong CPI and elevated University of Michigan consumer inflation expectations.",2022-07-09
116,"A movie industry panel discusses how it assigns ratings to newly released films, including details about what constitutes an R rating.",2022-07-09
117,Key highlights from the June Fed meeting minutes. Is eurozone growth decelerating? China considers $220 billion stimulus plan.,2022-07-09
118,"It will be a busy week for Fed speak as Williams talks about LIBOR on Monday, Barkin discusses recession on Tuesday, Waller speaks on Thursday and Bostic talks on Friday.",2022-07-09
119,"Despite a challenging outlook for the eurozone, the prospect of another debt crisis seems unlikely. But speculation about a crisis can be self-fulfilling, and much will depend on politics.",2022-07-08
120,"Euro rates and German Bund yields are on a downward path, justified by recession risks and declining inflation fears.",2022-07-07
121,The rise in bond spreads in most eurozone countries could be a problem.,2022-07-07
122,Global economic growth accelerated in June thanks primarily to rebounding business activity in mainland China after lockdowns related to the Omicron wave were eased.,2022-07-07
123,Global cost pressures eased in June albeit remaining elevated. Click here to know more...,2022-07-07
124,"In an era of flagship streaming services like Disney+ and Peacock, Hulu is caught in the middle. ",2022-07-06
125,"As European spot prices for gas break new records, it is becoming clear that natural gas will be one of the major battlefields of the geoeconomic war between Russia and the West.",2022-07-06
126,"At the G7 meeting, the group agreed on banning Russian gold imports, while working on a mechanism to cap the price of Russian crude oil. Read more here...",2022-07-06
127,The latest PMI data suggest that risks have increasingly tilted towards the economy slipping into a downturn at the same time that inflationary pressures moderate but remain elevated.,2022-07-06
128,"Earnings expectations have remained resilient across U.S., Europe, and Canada as we enter the second half of the year with most global benchmarks down 15-20%.",2022-07-06
129,"'Minions' and 'Toy Story' are among the most popular and profitable franchises for their respective studios — so why did ""Minions"" soar and ""Lightyear"" flop?
",2022-07-05
130,All risky assets remain vulnerable to recession and generalized negative sentiment - including Italian government bonds. Click here to know more...,2022-07-04
131,"""Minions: The Rise of Gru"" generated more than $108 million in ticket sales during its domestic opening weekend.",2022-07-03
132,"The JPMorgan Manufacturing Purchasing Managers' Index, compiled by S&P Global, nudged lower in June, down from 52.3 in May to 52.2, its lowest since August 2020.",2022-07-02
133,"The S&P Global Eurozone Manufacturing PMIÂ® fell from 54.6 in May to 52.1 in June, its lowest reading since August 2020 and a fifth consecutive month of decline in the headline measure.",2022-07-02
134,"A shortened trading week on Wall Street will have traders focusing on the FOMC minutes, a few Fed speakers, and the June nonfarm payroll report.",2022-07-02
135,We have upgraded inflation forecasts - and downgraded growth - and now expect global GDP to expand at a rate well below potential in 2023.,2022-07-01
136,The global economic outlook has deteriorated sharply; we now expect GDP growth to be well below potential in 2023. Read more here.,2022-07-01
137,"Food price inflation in May reaches 10.1% in the US, 8.9% in the Eurozone. Eurozone sees higher inflation rates for wheat, fats and oils, commodities affected by the war in Ukraine.",2022-07-01
138,"Global equity markets outside of the United States are completing a second negative quarter, with the MSCI ACWI ex US IMI Index down 11.33% in the three months through June 24.",2022-07-01
139,"The tone has become markedly risk-off, bonds rallying as risk assets sell off. The US curve starts signalling a looming cycle change as recession fears take over. Read more here...",2022-07-01
140,A publicly traded Starz may look to increase in size by targeting other subscale media and entertainment companies.,2022-06-29
141,A string of solid theatrical performances coupled with a strong slate of upcoming films has left most box office analysts optimistic.,2022-06-29
142,Recession fears and central-bank tightening are driving market volatility. We think equity markets are oversold and believe U.S. core inflation has likely peaked.,2022-06-29
143,We expect elevated inflation to continue into 2023 due to the lagged impact of food supply disruption and elevated energy costs.,2022-06-29
144,"Recession fears have injected much-needed two-way risks in rates markets. Inflation swaps suggest expectations are anchored, but swaptions betray a record-low degree of conviction.",2022-06-28
145,"Global growth and inflation concerns are keeping investors up at night. At the BlackRock Outlook Forum, we made the case weâre entering a new macro and market regime. Read more here...",2022-06-27
146,Pendulum of market sentiment swings dramatically. It swung from nearly everyone & their sister complaining that the Federal Reserve was lagging behind surge in prices to fear of a recession.,2022-06-25
147,The probability for high inflation coupled with low or negative growth to persist in Europe for some time seems to be increasing.,2022-06-25
148,Recessions have gone from being a potential consequence of high inflation and rapid monetary tightening to an increasingly likely scenario.,2022-06-25
149,"Federal Reserve wants to hit the brakes, a 180-degree reversal from the recent two-year effort to turbo-stimulate the U.S. economy.",2022-06-24
150,Market consensus expectations for real GDP growth rates in the EU and eurozone through 2023 look increasingly unrealistic. Read more here.,2022-06-24
151,"Eurozone economic growth deteriorated sharply to a 16-month low in June, according to preliminary PMI data, reflecting a stalling of demand growth. Click to read more.",2022-06-24
152,"Growth is slowing, but itâs slowing to trend at this point. So not to zero, not to negative, but something like the trend that weâve experienced over the last couple of decades.",2022-06-24
