,summary,date
465,Major central bank decisions this week will show policymakers are changing course with monetary policy. The main event on Wall Street will be the FOMC policy decision.,2021-12-13
466,Norway's Norges Bank is the most likely major central bank to hike its key (deposit) rate. Click here to read more.,2021-12-12
467,"The year ahead will feel quite different to the year just gone. So there are lots of moving parts for 2022, and many of them are conflicting.",2021-12-12
468,"2022 is the year EUR rates wake up and smell the coffee. We think EUR curve developments stand a chance to escape the monetary tightening steamroller for one more quarter, two at best.",2021-12-12
469,"With peak liquidity reached, we expect the market will pay closer attention to fundamentals heading into 2022.",2021-12-11
470,"2021 has been a record year for European securitization. We are thus expecting light growth in new ABS deals for next year, with, again, the strong participation of CLOs.",2021-12-10
471,Global economic growth will be slower but still above trend in 2022. This forecast should allow equities to outperform bonds,2021-12-09
472,The US Census Bureau today reported that US imports of goods and services reached a record monthly high of $290.7 billion in October 2021.,2021-12-09
473,"As we look ahead to 2022, our base case is for positive global growth and elevated inflation in the near term.",2021-12-08
474,"Central banks bringing forward the date of the first hike also sees markets contemplating the prospect of subsequent cuts, something also visible on the US curve. Click here to know more...",2021-12-07
475,There still is a bias in the currency market of talking about the Japanese yen or Swiss franc as safe-havens.,2021-12-05
476,The past week has been dominated by Omicron news as we all try to piece together the limited information we have and determine what it all means for the coming months.,2021-12-04
477,"(RTTNews) - Tech giant Google (GOOGL) is reportedly getting ready to launch its Pixel Watch as early as 2022. The watch is also thought to be integrated with Fitbit's Wear OS.    
  
As most other major smartphone makers are trying to create an ecosystem of wearables with the hel",2021-12-02
478,"NASA announced on Thursday it has awarded $415.6 million to billionaire Jeff Bezos' Blue Origin, stalwart contractor Northrop Grumman Corp and venture-backed Nanoracks to develop privately-owned and operated commercial space stations.",2021-12-02
479,Image source: The Motley Fool.,2021-12-02
480,"Despite big rallies over the past year, mall real estate investment trusts (REITs) have been suffering since around 2016 or so. It's important to understand the reasons why and even more important to grasp the vital nuances of the big picture. Both of these will help to explain w",2021-12-02
481,"What happened 
Shares of Snowflake (NYSE: SNOW) jumped 15.9% on Thursday after the cloud-data leader delivered outstanding growth metrics in its fiscal 2022 third-quarter report.",2021-12-02
482,"What happened
Shares of enterprise search, cloud observability, and security outfit Elastic (NYSE: ESTC) fell 15% today. The business reported a fantastic second quarter for its 2022 fiscal year (the three months ended Oct. 31), but such is life for investors in high-growth techn",2021-12-02
483,"Toyota Motor Corp will launch an all-electric small sedan in China late next year, having turned to local partner BYD for key technology to finally make an affordable yet roomy runaround, four sources told Reuters.",2021-12-02
484,Image source: The Motley Fool.,2021-12-02
485,"What happened
Shares of Teladoc Health (NYSE: TDOC) were tumbling 12.1% this week as of the market close on Thursday, according to data from S&P Global Market Intelligence. The decline came as the stock market fell over the past few days.",2021-12-02
486,"Ride hailing firm Lyft Inc said on Thursday it had hired Amazon.com Inc's executive Elaine Paul as its new chief financial officer to replace Brian Roberts, who is stepping down after seven years in the role.",2021-12-02
487,"Canada's main stock index rebounded on Thursday from a seven-week low hit in the previous session, with financials contributing to broad-based gains as major lenders boosted their dividends.",2021-12-02
488,"What happened
On a pretty ""up"" day for the stock market in general, shares of credit card giant Visa (NYSE: V) were up even more than most -- up nearly three times as much as the S&P 500, in fact. By the time trading closed for the day, Visa stock had gained 4.3%.",2021-12-02
489,"What happened
Shares of cryptocurrency mining company Hut 8 Mining (NASDAQ: HUT) fell on Thursday after the company gave its monthly update on operations. The company reported numbers for November, but it appears some confusion on October's results caused today's sell-off. As of",2021-12-02
490,Image source: The Motley Fool.,2021-12-02
491,"A broad rally sent Wall Street to a sharply higher close on Thursday, recovering ground lost over recent sessions as market participants snapped up bargains while digesting the implications of a shifting pandemic.",2021-12-02
492,"What happened
ESS Tech (NYSE: GWH) has taken its investors on a roller-coaster ride over the past couple of months. The battery storage company completed its business combination with special purpose acquisition company (SPAC) ACON S2 Acquisition Corp. on Oct. 11, becoming the fi",2021-12-02
493,"Members of the United Auto Workers union have voted to change the union's election method from the current delegate system to a direct election model, a court-appointed monitor said.",2021-12-02
494,"What happened 
Shares of travel and leisure stocks were up broadly on Thursday as investors piled back into the industry. The omicron variant-related sell-off last week appears to have been overdone and now investors are moving back into stocks that sold off.",2021-12-02
495,"Technology stocks were mostly higher in late trade, with the SPDR Technology Select Sector ETF (XLK) Thursday rising 1.3% and the Philadelphia Semiconductor Index was gaining 0.5% this afternoon, reversing a midday slide.",2021-12-02
496,"What happened
Shares of travel-reservations specialist Booking Holdings (NASDAQ: BKNG) popped in Thursday trading, rising 5.9% through 3 p.m. ET. You can thank UBS for that.",2021-12-02
497,The discovery of the Omicron COVID-19 variant has resulted in surging market volatility and declines in global equity markets. Click here to know more...,2021-12-02
498,Worldwide manufacturing output growth remained subdued in November as ongoing near-record supply shortages were accompanied by a slowing of demand growth.,2021-12-02
499,"What happened
After starting the day with a gain, shares of Delta Air Lines (NYSE: DAL), American Airlines Group (NASDAQ: AAL), and United Airlines Holdings (NASDAQ: UAL) all ended Wednesday's trading session firmly in the red. The first confirmed case of the omicron variant of C",2021-12-01
500,"What happened
Shares of TV streaming platform Roku (NASDAQ: ROKU) cratered 8.8% today, building on the stock's negative 37% return so far in 2021 with just a month left until the new year. Roku is now more than 50% off its all-time high it last reached over the summer.",2021-12-01
501,"ViacomCBS Inc Chair Shari Redstone, who in the past has hinted at more deals to bulk up the media empire, said on Wednesday the company will focus on organic growth and seek global expansion opportunities.",2021-12-01
502,Jack Dorsey-led payments company Square Inc said on Wednesday it was changing its name to Block Inc.,2021-12-01
503,"The U.S. International Trade Commission on Wednesday said it would initiate an investigation of certain integrated circuits, chipsets and electronic devices, based on a complaint filed by NXP Semiconductors NV of Taiwan and its U.S. unit.",2021-12-01
504,"Copper mining giant Freeport-McMoRan Inc is converting its fleet of diesel trucks and other machinery to electric or hydrogen power, a transition required to fight climate change even though the costs are not yet known, Chief Executive Richard Adkerson said in an interview at the Reuters Next conference.",2021-12-01
505,Canadian National Railway Co said on Wednesday that it was aiming to re-open its track in the crucial Kamloops-to-Vancouver corridor in the flood-hit province of British Columbia this weekend.,2021-12-01
506,"What happened
Shares of Micron Technology (NASDAQ: MU) were up as much as 6% Wednesday, although it finished the day up only about 1.4%, still well ahead of the market in a volatile trading session.",2021-12-01
507,Wall Street's major averages fell more than 1% on Wednesday after a morning rally faded as investor angst about the latest coronavirus variant soared with the first U.S. case confirmation while the market also digested Fed comments on inflation.,2021-12-01
508,"What happened
Easy come, easy go. After soaring 13% Monday on the back of an optimistic note from analysts at National Bank Financial, shares of lithium mining stock Lithium Americas Corp (NYSE: LAC) came crashing back down to Earth on Wednesday, falling 8.6% through 3 p.m. ET.",2021-12-01
509,"San Francisco's public transit operator has challenged an application by Cruise to charge for robotaxi rides, saying on Wednesday promotional videos from the General Motors Co unit show Cruise passengers illegally hopping in and out of vehicles in the middle of the street instead of at the curb.",2021-12-01
510,"What happened 
Shares of Box (NYSE: BOX) jumped 10% on Wednesday, following the release of the cloud-based data storage specialist's fiscal 2022 third-quarter results.",2021-12-01
511,"Canada has formally excluded Boeing Co from a multi-billion-dollar contract to supply 88 new fighter jets, the federal government said on Wednesday, but did not give a direct explanation.",2021-12-01
512,"Do You Have These Top Cybersecurity Stocks On Your Watchlist?Cybersecurity stocks have been a hot sector to invest in the stock market over the past few years. As organizations worldwide shift to the new normal of maintaining business continuity during the pandemic, more of their",2021-12-01
513,"What happened
Shares of BioXcel Therapeutics (NASDAQ: BTAI) were down by 11.6% as of 3:08 p.m. ET Wednesday. The biotech's shares are retreating today in response to the Food and Drug Administration's decision to extend the review date under the Prescription Drug User Fee Act (PD",2021-12-01
514,"It is time again to review three of our five-stock samplers from the past three years: 5 Stocks That Will Press On, 5 Stocks for Conscious Capitalism, and 5 Stocks That Got Trouble.",2021-12-01
515,"Health care stocks escaped the brunt of Wednesday's late selloff, with the NYSE Health Care Index still rising 0.8% while the Health Care Select Sector SPDR ETF (XLV) gained 0.3%.",2021-12-01
516,"The following companies are expected to report earnings prior to market open on 12/02/2021.  Visit our Earnings Calendar for a full list of expected earnings releases.Toronto Dominion Bank  (TD)is reporting for the quarter ending October 31, 2021. The bank (foreign) company's con",2021-12-01
517,Wall Street closed lower on Wednesday after a morning rally faded as investors fretted about the latest coronavirus variant and the first evidence of its U.S. arrival while they also digested Federal Reserve Chair Jerome Powell's comments on surging inflation.,2021-12-01
518,,2021-12-01
519,The Omicron variant and the winter wave underway in many countries do not subtract from inflation worries - they add to them.,2021-12-01
520,"Wall Street's main indexes closed lower on Tuesday after Federal Reserve Chair Jerome Powell signaled that the U.S. central bank would consider speeding up its withdrawal of bond purchases as inflation risks increase, piling pressure onto a market already nervous about the latest COVID-19 variant.",2021-11-30
521,"What happened
Shares of retailer American Eagle Outfitters (NYSE: AEO) and casino operator MGM Resorts International (NYSE: MGM) both fell as much as 5% in morning trading on Tuesday. Groupon (NASDAQ: GRPN), which describes itself as an ""experiences marketplace,"" fell even more,",2021-11-30
522,"What happened
On yet more worrying news about the omicron variant of the coronavirus, the fortunes of coronavirus stocks were mixed on Tuesday. Some of the ones doing particularly well in midafternoon trading were Novavax (NASDAQ: NVAX), up nearly 7%, and bellwether Pfizer (NYSE:",2021-11-30
523,The World Health Organization warned countries on Tuesday not to impose blanket travel bans over the new Omicron coronavirus variant as governments and scientists tried to figure how much protection current vaccines would offer against the strain.,2021-11-30
524,"(RTTNews) - Athletic apparel retailer Lululemon Athletica Inc. (LULU), has filed a lawsuit against the fitness company Peloton Interactive Inc. (PTON), on patent infringement allegations related to the designs of a new line of leggings and sports bras.",2021-11-30
525,"Wall Street's main indexes fell more than 1% on Tuesday after Federal Reserve Chair Jerome Powell signaled that the U.S. central bank would consider speeding up its withdrawal of bond purchases as inflation risks increase, piling pressure onto a market already nervous about the latest COVID-19 variant.",2021-11-30
526,"Exxon Mobil will brief Wall Street on Wednesday on its future spending plans, with investors looking for how it will balance oil and low-carbon initiatives without compromising shareholder returns.",2021-11-30
527,"The emergence of a worrisome coronavirus variant is benefiting shares of vaccine makers Moderna Inc, BioNTech and Pfizer as investors search for winning bets in markets roiled by uncertainty in recent days.",2021-11-30
528,"Top Performing Levered/Inverse ETFs Last Week These were last week’s top performing leveraged and inverse ETFs. Note that because of leverage, these kinds of funds can move quickly. Always do your homework. Ticker Name 1 Week Return (UVXY B-) ProShares Ultra VIX Short-Term Futures ETF 32.96% (GDXD) MicroSectors Gold Miners -3X Inverse Leveraged ETNs 16.77% (JDST ) [...] Read more at ETFtrends.com.",2021-11-30
529,"What happened
Shares of uranium mining companies Denison Mines (NYSEMKT: DNN), Energy Fuels (NYSEMKT: UUUU), and Uranium Energy (NYSEMKT: UEC) all crashed in Tuesday trading, falling 7%, 8.6%, and a disheartening 11.9%, respectively, through 1:25 p.m. ET.",2021-11-30
530,"What happened
Electric-vehicle (EV) stock Nio (NYSE: NIO) plunged on Tuesday, dropping as much as 5% by 12:10 p.m. ET. As if the new, potentially more dangerous COVID-19 variant, Omicron, wasn't enough to spook the markets, latest comments from the Federal Reserve and particularl",2021-11-30
531,"The chair of the U.S. Senate Commerce Committee, concerned about worker shortages at airlines that received billions of dollars in government assistance, has invited CEOs of seven major U.S. carriers to testify at a Dec. 8 hearing, airlines and a committee official told Reuters.",2021-11-30
532,"The worst performing sector as of midday Tuesday is the Materials sector, showing a 2.4% loss.  Within that group, Celanese Corp (Symbol: CE) and WestRock Co (Symbol: WRK) are two large stocks that are lagging, showing a loss of 5.1% and 4.8%, respectively.  Among the high volu",2021-11-30
533,"Looking at the sectors faring best as of midday Tuesday, shares of Utilities companies are outperforming other sectors, losing just 1.1%.  Within the sector, American Water Works Co, Inc. (Symbol: AWK) and NextEra Energy Inc (Symbol: NEE) are two large stocks leading the way, w",2021-11-30
534,"What happened
Hydrogen and fuel cell stocks crashed on Tuesday due to looming global concerns and their potential impact on the growth of companies just starting out. Here's how some of the hydrogen stocks were faring as of 12:10 p.m. ET today:",2021-11-30
535,"Should Investors Be Buying These Top EV Stocks Today?While investors consider what stocks to watch today, electric vehicle (EV) stocks continue to gain attention in the stock market. Namely, while the world refocuses on the pandemic with a new variant on the loose, EVs remain rel",2021-11-30
536,"Most Latin American currencies rallied on Tuesday as the dollar weakened, while stocks in the region fell sharply on fresh doubts of how effective COVID-19 vaccines are against the Omicron variant.",2021-11-30
537,Amazon.com Inc's cloud computing unit on Tuesday introduced two new custom computing chips aimed at helping its customers beat the cost of using chips from Intel Corp and Nvidia Corp.,2021-11-30
538,"In trading on Tuesday, shares of State Street Corp.'s Fixed-to-Floating Rate Non-Cumulative Perpetual Preferred Stock, Series D (Symbol: STT.PRD) were yielding above the 5.5% mark based on its quarterly dividend (annualized to $1.4748), with shares changing hands as low as $26.",2021-11-30
539,"What happened
Despite a brutal market sell-off, with the Dow Jones Industrial Average down more than 600 points as of 12:18 p.m. ET, shares of the government-sponsored entities (GSEs) are up nicely today. Shares of both Fannie Mae (OTC: FNMA) and Freddie Mac (OTC: FMCC) traded ab",2021-11-30
540,Eurozone inflation jumped to 4.9% in November on the back of energy and goods prices. Core inflation also increased. We haven’t seen inflation this high since the eighties.,2021-11-30
541,"Fidelity National Information Services, Inc. (FIS) shares closed today at 1.1% above its 52 week low of $104.29, giving the company a market cap of $65B. The stock is currently down 23.0% year-to-date, down 26.4% over the past",2021-11-29
542,"The judge hearing the U.S. Justice Department's antitrust lawsuit against American Airlines Group Inc and JetBlue Airways Corp said on Monday that the trial in the matter would begin on Sept. 26, 2022.",2021-11-29
543,"Invacare Corp. (IVC) shares closed 0.3% lower than its previous 52 week low, giving the company a market cap of $115M. The stock is currently down 63.0% year-to-date, down 62.4% over the past 12 months, and down 71.3% over the",2021-11-29
544,"HubSpot Inc (HUBS) shares closed today at 1.6% below its 52 week high of $866.00, giving the company a market cap of $37B. The stock is currently up 102.7% year-to-date, up 102.5% over the past 12 months, and up 1275.8% over t",2021-11-29
545,"CI&T Inc Class A (CINT) shares closed 3.0% lower than its previous 52 week low, giving the company a market cap of $0. The stock is currently down 31.3% year-to-date, down 31.3% over the past 12 months, and down 31.3% over",2021-11-29
546,"IHS Markit Ltd (INFO) shares closed today at 1.7% below its 52 week high of $132.35, giving the company a market cap of $53B. The stock is currently up 43.1% year-to-date, up 38.9% over the past 12 months, and up 265.4% over t",2021-11-29
547,"Coeur Mining Inc (CDE) shares closed today at 1.6% above its 52 week low of $5.58, giving the company a market cap of $1B. The stock is currently down 44.6% year-to-date, down 19.7% over the past 12 months, and down 41.6% over",2021-11-29
548,"Lannett Co., Inc. (LCI) shares closed today at 1.9% above its 52 week low of $1.62, giving the company a market cap of $73M. The stock is currently down 73.6% year-to-date, down 73.1% over the past 12 months, and down 92.4% ov",2021-11-29
549,"Waste Connections Inc (WCN) shares closed today at 1.2% below its 52 week high of $138.82, giving the company a market cap of $34B. The stock is currently up 31.8% year-to-date, up 29.5% over the past 12 months, and up 171.4%",2021-11-29
550,"Shift4 Payments Inc - Class A (FOUR) shares closed 1.5% lower than its previous 52 week low, giving the company a market cap of $2B. The stock is currently down 28.2% year-to-date, down 12.2% over the past 12 months, and up 61",2021-11-29
551,"Factset Research Systems Inc. (FDS) shares closed today at just slightly below its 52 week high of $469.53, giving the company a market cap of $17B. The stock is currently up 39.6% year-to-date, up 43.8% over the past 12 month",2021-11-29
552,"NextEra Energy Inc (NEE) shares closed 0.3% higher than its previous 52 week high, giving the company a market cap of $168B. The stock is currently up 13.2% year-to-date, up 16.2% over the past 12 months, and up 231.4% over th",2021-11-29
553,"CC Neuberger Principal Holdings III - Class A (PRPC) shares closed today at 1.8% above its 52 week low of $9.65, giving the company a market cap of $395M. The stock is currently up 0.9% year-to-date, up 0.9% over the past 12 m",2021-11-29
554,"Cars.com (CARS) shares closed 4.8% higher than its previous 52 week high, giving the company a market cap of $1B. The stock is currently up 42.7% year-to-date, up 42.7% over the past 12 months, and down 34.7% over the past fiv",2021-11-29
555,"Armstrong Flooring Inc (AFI) shares closed today at 0.5% above its 52 week low of $2.05, giving the company a market cap of $46M. The stock is currently down 44.0% year-to-date, down 43.7% over the past 12 months, and down 88.",2021-11-29
556,"What happened 
Shares of NRx Pharmaceuticals (NASDAQ: NRXP) surged on Monday after the healthcare company released promising clinical trial data for its investigational COVID-19 treatment, aviptadil. By the close of trading, NRx's stock price was up 20% after rising as much as 53",2021-11-29
557,"Skeena Resources Ltd (SKE) shares closed today at 0.7% above its 52 week low of $9.68, giving the company a market cap of $628M. The stock is currently up 11341.9% year-to-date, up 11341.9% over the past 12 months, and up 1134",2021-11-29
558,"What happened
Monday was not a good day to be an investor of African e-commerce specialist Jumia Technologies (NYSE: JMIA). In the wake of a disappointing earnings report published earlier this month, one analyst at a prominent investment bank has become more bearish on the stock",2021-11-29
559,"What happened
Shares of Meta Platforms (NASDAQ: FB) climbed higher on Monday, adding as much as 2.3% in early trading, though the stock ended the session up by just 1.5%.",2021-11-29
560,Image source: The Motley Fool.,2021-11-29
561,"Plenty of high-growth tech stocks have been hit hard in 2021 despite stellar business performances. Upstart was recently cut in half in a matter of weeks, while Pinterest has had a slow, painful drop this year. However, many of these stocks have been beating expectations and runn",2021-11-28
