,summary,date
306,"It’s been another week of significant volatility in financial markets, one in which European indices edged closer to bear market territory, oil prices hit a 10-year high around $120, and...",2022-03-04
307,Worldwide manufacturing growth picked up in February after being subdued to a 1.5-year low in January due to the Omicron wave. Read more.,2022-03-04
308,The invasion of Ukraine by the Russian military will cause many European countries to look urgently for new gas supply sources. Click for a detailed review...,2022-03-04
309,"Russian debt, both hard currency and local currency, is largely shut down for trading. Click here to know more...",2022-03-04
310,Disney announced a new ad-supported tier for its Disney+ streaming service on Friday.,2022-03-04
311,Batman has been a staple on the big screen since Tim Burton's 1989 superhero film. A look at how past Batman films have fared at the global box office.,2022-03-03
312,"Reactions to the Ukraine crisis have been quite stark. Russia is effectively in default territory, in part anticipating a forced exodus. Read more here.",2022-03-03
313,"The war in Ukraine could dampen the pace of the recovery in the eurozone, while inflation is likely to be close to 4% for the year.",2022-03-03
314,The current environment looks to be a realignment of geopolitical expectations across Europe. The rapid and coordinated efforts of Western nations demonstrate this realignment.,2022-03-03
315,The significant volatility seen in the stock market recently from the Russian war/invasion of Ukraine is further evidence of how this fear dynamic can create short-term panics.,2022-03-02
316,European equities are underperforming this week. Click here to know more...,2022-03-02
317,"Underinvestment in oil exploration and production means not only that prices are soaring, but also that companies are free to pay high dividends.",2022-03-02
318,The JPMorgan Global Manufacturing PMI rose from a 15-month low of 53.2 in January to 53.6 in February.,2022-03-02
319,"Foreign Ministry spokesperson Wang Wenbin on Tuesday reiterated China’s call for the “reasonable security concerns” of all countries to be respected, and...",2022-03-01
320,"A major disruption of Russia’s exports of crude oil, natural gas, and metals could raise prices of commodities further, which could further raise inflation pressures in other countries.",2022-03-01
321,A significant discount for Russian assets will persist even if hostilities cease. Click here to know more...,2022-03-01
322,"Financial markets are reacting as expected to the heightened uncertainty. In the first days of the invasion, global equities plunged while safe-haven assets rallied.",2022-03-01
323,"Despite sanctions, Russia has leverage, as it supplies nat gas to Europe and up to a million barrels of crude per day to the US. Central banks will increasingly hit ""pause” on rate increases",2022-02-28
324,Impact of sanctions against Russia. Boomerang effects of sanctions against Russia.,2022-02-28
325,"The Fed’s view last year that any inflation would be transitory was shown to be overly optimistic. It is now having to play catch-up. In any case, it is time to take the punch bowl away.",2022-02-28
326,"Valuation/sentiment reset make the case for an overweight to the Eurozone markets. Even on a sector-neutral valuation approach, European stocks are cheap vs. the US.",2022-02-28
327,"Disney, Sony and Warner Bros. have halted future theatrical film releases in Russia following the country's attack on Ukraine. ",2022-02-28
328,The volatility surrounding Russia’s invasion of Ukraine continues to evolve. Read more here.,2022-02-28
329,"The Russian invasion of Ukraine has reduced the risk of central banks slamming the brakes to contain inflation. We are tactically upgrading DM stocks as a result, and we downgrade credit.",2022-02-28
330,"The U.S. tally of daily cases of COVID-19 has returned to levels seen before the highly infectious omicron strain was discovered in November, helping to...",2022-02-28
331,"A hawkish Fed, surging inflation, slowing economic growth, and the war in Ukraine are formidable headwinds. Europe and Asia markets got hit the hardest as Russia-Ukraine tensions escalated.",2022-02-28
332,"Ukraine notwitstanding, the environment for investors didn’t change much last week. Stocks, commodities and real estate were higher, and bonds were down slightly. Foreign markets were down.",2022-02-28
333,Russia's invasion of Ukraine was well tipped by US intelligence. It's warning that an attack could take place at any time on Feb 11 turning a simmering issue into a generalized market force.,2022-02-26
334,There is a contrast between the ECB turning more cautious and the Fed's confidence. Fed officials expect that a March lift off is still very much the base case.,2022-02-25
335,"While the situation in Ukraine is both unique and developing, financial markets tend to recover quickly from geopolitical events. Read more.",2022-02-24
336,Russia's attack on Ukraine has caused a massive selloff. TD Asset Management Head of Asset Allocation and Derivatives Michael Craig discusses what’s at stake for investors.,2022-02-24
337,"The problem for Western leaders is that their governing elites have incoherent views towards Russia, and it is unclear how much this will change.",2022-02-24
338,"It was a strong quarter for Disney, HBO Max and Paramount+ as streaming leader Netflix acknowledged competition may be hurting its growth on the margins.",2022-02-24
339,"Russia’s overwhelming military force will eventually prevail, and Ukraine’s government and independence will succumb. Click here to know more...",2022-02-24
340,Russia's recognition of the Donetsk and Lugansk People's Republics (DLPR) has sparked global outrage and triggered the first tranche of sanctions. Read more.,2022-02-23
341,"As the West imposes sanctions on Russia, the potential for a severe supply shock lurks – particularly for oil and natural gas. Click here to know more...",2022-02-22
342,The economic hit of sanctions is undoubtedly highest for Russia. Click here to know more...,2022-02-22
343,"Geopolitical tensions may dominate other drivers in the near term, but sooner or later, bonds will have to contend with the looming monetary policy tightening.",2022-02-22
344,Eurozone business activity growth accelerated sharply in February as COVID-19 containment measures were relaxed. Click here for a detailed review...,2022-02-22
345,Current inflation is supply-led rather than demand-led. Click here to know...,2022-02-21
346,"Non-U.S. markets, including EM, DM, and Asia, are outperforming the U.S. markets after underperforming last year. Click here to know more...",2022-02-21
347,There’s been no shortage of volatility in the markets so far this year and it doesn’t look like that is going to change any time soon.,2022-02-18
348,"Looking at units outstanding versus one week prior within the universe of ETFs covered at ETF Channel, the biggest outflow was seen in the iShares Interest Rate Hedged Long-Term Corporate Bond ETF, where 13,200,000 units were destroyed, or a 38.4% decrease week over week.",2022-02-18
349,"In the US, the Fed mulling MBS sales offers an alternate tightening avenue, and in the UK, the BoE's pushback against aggressive pricing should find a more prominent platform next week.",2022-02-18
350,"Front-end valuations eased somewhat yesterday, but remain at extreme levels. When maximum optionality is the only guidance offered, then markets are left to trade off the data they see.",2022-02-17
351,Higher energy prices can impact companies in many ways. Click here for a detailed review...,2022-02-17
352,High inflation is putting the ECB under pressure to tighten monetary policy. The ECB seems bent on ending net asset purchases this year.,2022-02-15
353,"An added benefit should, in theory, be to ease fears in peripheral markets of an abrupt policy tightening, but it hasn’t played out this way so far. Read more.",2022-02-15
354,"I expect the ECB and Fed will keep interest rates artificially low relative to inflation. Thus, real estate and stocks should remain an oasis for investors, being great inflation hedges.",2022-02-15
355,"With inflation running at multi-decade highs, major central banks get ready to tighten monetary policy.",2022-02-15
356,"Thursday’s 7.5% U.S. inflation print reintroduced some volatility, but we still think the euro is building a base for a long-term relationship with its admirers.",2022-02-14
357,The focus shifts in the week ahead away from central banks directly and toward the macro data at the start of the year.,2022-02-13
358,Inflation and interest rates have been at the forefront of investors’ minds so far this year and that’s unlikely to change for some time yet.,2022-02-12
359,"An inversion on the 5/10yr tells us that we are at the beginning of serious rate hiking, and is indicative of a boom. Eurozone rates have shot higher in the slipstream of US market post CPI.",2022-02-11
360,Analysts across Wall Street sang the praises of Disney after a quarterly print showing a stunning recovery in its parks business.,2022-02-10
361,BoE raised its base rate by 25 bps to 0.50% as widely expected. ECB President Lagarde opened the door to a rate hike in 2022 by dropping language about the possibility of one being unlikely.,2022-02-10
362,The European Central Bank remains unwilling to cease its monthly purchase of securities and to raise interest rates in its domain. Learn more here.,2022-02-09
363,"The Super Bowl commercial is part of Tonal's broader ""Strength Made Me"" campaign, which celebrates women being strong both physically and mentally. ",2022-02-09
364,European Central Bank looks a lot closer to normalising or tightening policy. Click here to know more...,2022-02-08
365,Investors would be more than happy to see the end of the paradox of bonds with negative returns. Read more here.,2022-02-08
366,Major central bank policies are diverging. Elevated exchange rate volatility may reflect the intensifying divergences. Read more.,2022-02-08
367,The U.S. trade deficit jumped 27% in 2021 to a record $859 billion largely because a recovering economy gave Americans the means to buy more imports. Yet...,2022-02-08
368,Rising inflation is also broad-based geographically. Click here to know more...,2022-02-08
369,2022 has already started with a sharp reversal away from mega-cap and growth and toward value and high-dividend strategies.,2022-02-07
370,Markets are pricing in ever more rate hikes amid hawkish policy signals. We see the eventual outcome as more benign - but brace for volatility along the way.,2022-02-07
371,Stocks and bonds sold off in January as markets repriced for a more aggressive pace of central bank tightening and increased pressures on the global earnings recovery. Read here for more...,2022-02-07
372,"In the first few weeks of the year, there have been several breakouts in the foreign exchange market that have not been sustained. There are two important US data points next week.",2022-02-06
373,"The relatively calm conditions in US credit markets have been a distinct contrast to equities. This is somewhat surprising, given how negative yields are. But conditions might be changing.",2022-02-06
374,"The global central bank community has been wrong on inflation. Investment-grade bond funds saw outflows of $70 million, and junk bond funds posted negative flows of $4.043 billion.",2022-02-05
375,How are tech stocks faring during Q4 earnings season? BoE lifts key lending rate to 0.5%. Is growth cooling off in the U.S. manufacturing and services sectors?,2022-02-05
376,"It’s been an incredible couple of weeks where we’ve seen another hawkish move from multiple central banks, big swings in stocks on the back of earnings, and tensions around Ukraine intensify",2022-02-04
377,The head of the World Health Organization for Europe said Thursday that continent is entering a “plausible endgame” to the pandemic as the number of...,2022-02-03
378,EU headline inflation rate surprised with another increase. Core inflation decline is more in line with expectations and shows very little evidence of second-round effects in the eurozone.,2022-02-02
379,Average selling prices in the Eurozone were advancing at a record pace in January. Click here to know more...,2022-02-02
380,"The eurozone energy crisis lingers on as market gas prices remain elevated and Brent oil prices continue to trend higher. For the eurozone economy, this is bad news.",2022-02-01
381,Bud Light Seltzer is hoping that a Super Bowl ad starring celebrity chef Guy Fieri will help jump-start sales of its new hard soda line.,2022-02-01
382,German inflation has given financial markets another headache on top of Fed and BoE tightening ahead. Core bonds are the epicentre of market reaction but stress could spread to riskier debt.,2022-02-01
383,"Given steep losses many investors have experienced in recent weeks, many want to identify the culprit that is responsible. Franc rose to six-year highs against euro last week. Read more.",2022-01-29
384,Investors' sudden change of heart on Netflix puts entire streaming wars narrative into question for 2022.,2022-01-29
385,Changes to monetary policy loom large over financial markets as 2022 begins.,2022-01-29
386,"After a rollercoaster January, Wall Street is now expecting the Fed to aggressively raise interest rates over the course of the year as they scramble to control inflation.",2022-01-28
387,The Federal Communications Commission does not yet have the majority it would need to reinstate net neutrality on the federal level.,2022-01-28
388,"Information technology, utilities, and materials were the clear winners across most regions. Click here to know more...",2022-01-28
389,"Casey Newton, The Platformer editor and CNBC contributor, joins 'Power Lunch' to discuss the streaming landscape and recent developments in the space.",2022-01-27
390,"The U.S. average daily new case tally from COVID-19 is falling fast and hospitalizations appear to be close to a peak, bolstering hopes that the highly...",2022-01-27
391,Dow futures turned positive Thursday after falling more than 500 points overnight.,2022-01-27
392,Dow futures turned positive Thursday after falling more than 500 points overnight as the market's recent volatility persisted.,2022-01-27
393,These are the stocks posting the largest moves before the bell.,2022-01-27
394,"ECB's road to normalisation can be divided into three stages: tapering, the end of negative interest rates, and finally moving towards a more neutral monetary policy stance. Read more here.",2022-01-26
395,"Just as regions were rebounding from the Delta variant, the Omicron variant emerged, sending global COVID-19 infection rates to new highs.",2022-01-25
396,House prices in the eurozone increased by 8.8% y/y in Q3 2021. Click here for a detailed review...,2022-01-25
397,Netflix tumbled for a second day on Monday after the company's weaker-than-expected subscriber forecast. ,2022-01-24
398,These are the stocks posting the largest moves in midday trading. ,2022-01-24
399,CNBC's Julia Boorstin reports on legal media companies which are ticking higher despite a broader sell-off. (Comcast is CNBC's parent company.),2022-01-24
400,Eurozone business activity growth slowed for a second successive month in January. Click here to know more...,2022-01-24
401,U.S. stock futures indicated more losses to start the new week following the Nasdaq's and the S&P 500's worst weeks since March 2020.,2022-01-24
402,"The stocks making the biggest moves in premarket trading include Kohl's, Snap, Peloton, and more.",2022-01-24
403,"Microsoft, Tesla and Apple will release quarterly results, alongside a handful of other tech firms. McDonald's and Boeing will also offer updates.",2022-01-23
404,The collapse of December US retail sales (-1.9%) and the unexpected drop in industrial output give the world's largest economy little momentum.,2022-01-23
405,The Atlanta Federal Reserve (Fed) nowcast model currently estimates that the U.S. economy is expanding at a 6.8% quarter-over-quarter annualized rate.,2022-01-21
406,"Earnings season is off to a rocky start and not only are investors not comforted by what they’re seeing, but it’s also contributing to the unease in the markets.",2022-01-21
407,"The Federal Reserve's meeting trumps everything else for markets in the week ahead, as investors await any new clues on its plans to raise interest rates.",2022-01-21
408,The drums of war are beating for Europe. Europe has other problems to face. Read more to see why I think investors should consider exiting European stocks.,2022-01-21
409,"Netflix added a line in its quarterly shareholder letter acknowledging streaming competition is affecting its ""marginal growth.""",2022-01-20
410,"As we enter 21Q4 earnings season, market participants and analysts are noting the blistering pace of earnings growth and the record percentage of companies beating analyst expectations.",2022-01-20
411,"A combination of labour shortages, high inflation, and increased minimum wages means the eurozone is set for a decent recovery in nominal wage growth in 2022. Read more here...",2022-01-20
412,"Despite the disruption caused by the Omicron COVID-19 variant in December, consensus 2022 earnings forecasts have continued to rise over the past four weeks, albeit modestly.",2022-01-20
413,"Already caught in the slipstream of globally rising rates, a deteriorating overall net flow backdrop in eurozone government bonds should contribute to keeping the 10Y Bund yield above 0%.",2022-01-19
414,"While only a deterioration in risk sentiment might help boost demand for bonds, even this might not derail Fed hikes. Read more here...",2022-01-19
415,January's PMI data will provide the first broad insight into the economic impact of the Omicron variant across the globe.,2022-01-19
416,Microsoft takes big $68.7 billion swing on video game company Activision Blizzard while legacy media stays on sidelines,2022-01-18
417,Total loans and leases are rising at a good pace. Click here to know more...,2022-01-18
418,There is some evidence that out of all these pandemic upheavals Phillips Curve may be back. Click here to know more...,2022-01-18
419,"For the Asset Allocation Committee, 2022 is a year to focus on income from risky assets, while adjusting portfolios to help cushion against, and take advantage of, potential price volatility",2022-01-17
420,Our 2022 outlook reflects our belief that tighter monetary policy will have an impact on the global economy. Overall return levels are likely to be lower in 2022 compared to 2021.,2022-01-17
421,Five big transitions are likely to make 2022 a choppy and challenging year for equity investors. Click here for a detailed review...,2022-01-17
422,It’s been a turbulent start to the year in the markets and that’s unlikely to change as we move into earnings season.,2022-01-14
423,President Biden urged companies to voluntarily impose Covid vaccination rules on workers after the Supreme Court blocked a government order to do that.,2022-01-13
424,"The 7% figure comes as a confirmation that the Fed will have to embark on a significant policy tightening. Focus should shift to the balance sheet, bringing the long end into play again.",2022-01-13
425,Consumer balance sheets remain healthy in the United States and Europe. Click here to know more...,2022-01-12
426,"Our forecasting model predicts the real value of global trade to go up to USD 20,175 billion in 2021 and USD 21,038 billion in 2022.",2022-01-12
427,Two of Sen. Kyrsten Sinema's former aides have become key aides for corporate giants looking to impact President Joe Biden's agenda. ,2022-01-11
428,January is the busiest month of the year for syndicated bond sales. Click here for a detailed analysis...,2022-01-11
429,Global recovery slowed down significantly since the peak of the reopening effect in June 2021.,2022-01-11
430,"Powell’s hearing will be an opportunity to gauge the aggressiveness of the Fed’s tightening cycle, and it could see the curve front-load hikes further. Read more here...",2022-01-11
431,Former aides to Sen. Joe Manchin who are now lobbyists are scoring big clients as their ex-boss battles President Biden's agenda,2022-01-10
432,"The fresh virus wave comes at a time when the manufacturing sector is reporting an easing of supply constraints, which had helped raise production levels.",2022-01-10
433,"US - The coming week will include a very hot inflation report, the banks kicking off earnings season, US-Russia talks, and a bunch of Fed speak.",2022-01-08
434,"""Turning Red"" is the third Pixar film to transition to Disney's streaming platform during the pandemic.",2022-01-07
435,"Jim Cramer, Dan Ives of Wedbush Securities, Gene Munster of Loup, Aaron Kessler of Raymond James, Dan Niles of Satori Fund, Darrin Peller of Wolfe Research, Josh Brown of Ritholtz Wealth Management, Brenda Vingiello of Sand Hill Global Advisors, Sarat Sethi of DCLA, and Steve Weiss of Short Hills Capital explain why they are buying, selling, or holding specific stocks and ETFs",2022-01-06
436,"In the UK, half the current rate of monetary inflation for half the time - just for one year - led to gilt coupons of over 15%.",2022-01-06
437,"Sarat Sethi, DCLA managing partner and portfolio manager, joins the 'Halftime Report' to discuss his top stock picks for 2022, which include Uber, Morgan Stanley, and Comcast.",2022-01-06
438,So-called “safe” assets had a rougher time. Government and investment-grade corporate bonds and gold generally ended the year flat or lower.,2022-01-06
439,"We still expect good earnings growth, more moderate than the levels we've seen in 2021. Click here for a detailed review...",2022-01-06
440,"The JPMorgan Global Manufacturing PMI, compiled by IHS Markit from its proprietary business surveys, held steady at 54.2 for a third successive month in December.",2022-01-06
441,Rates markets remain on tenterhooks as persistent inflation forces central banks into singular focus on price dynamics. Both ends of the curve ratcheted higher over the Fed meeting minutes.,2022-01-06
442,"Rates markets seem to have acquired a good deal of Covid immunity. Focus turns to syndicated bond deals, with borrowers hoping for no new volatility from this week’s key economic releases.",2022-01-05
443,US large-caps led the gains and weren’t derailed in late December after the Federal Reserve unveiled plans to accelerate monetary policy tightening in 2022.,2022-01-05
444,,2022-01-03
445,"""West Side Story"" is a box office bomb, having only generated around $36 million in ticket sales on a $100 million production budget.",2021-12-26
446,"After reviewing the current year to gain a perspective for 2022, this article summarises the outlook for the dollar, the euro, and their financial systems.",2021-12-24
447,"Fueled by climate change and other environmental concerns, ESG-focused funds reached $3.9 trillion in AUM at the end of September 2021.",2021-12-23
448,Each boom-and-bust cycle has seen a progressively lower interest rate cycle with limbo-like lower highs and lower lows. Markets are pricing in baby steps in 2022 for rates hikes.,2021-12-22
449,Inflation and supply chain headwinds are expected to ease as the year progresses. And reopening trade will present select opportunities.,2021-12-21
450,"""Spider-Man: No Way Home"" proves that audiences are ready to return to movie theaters, but the industry still faces major obstacles.",2021-12-21
451,"As the Senate weighs whether to confirm Gigi Sohn to the FCC, President Biden's efforts to reinstate net neutrality are taking shape.",2021-12-21
452,"Uneven re-opening, supply chain disruptions, demand & consumption patterns shifts have been greater and lasted longer than projected. But it doesn't mean the US returns to 1970s inflation.",2021-12-20
453,"In response to persistent elevated inflation, central banks around the world are pivoting toward tighter policy. Read more.",2021-12-19
454,"With policymakers now in holiday mode, and many in the markets likely also, the calendar is looking a little thin.",2021-12-18
455,Central banks are responding to political pressure around price inflation with accelerated monetary tightening plans. Click here to read more...,2021-12-17
456,"The Bank of England hiked today, and the Fed’s dot plot yesterday indicated that rate hikes are expected to hit in 2022.",2021-12-17
457,,2021-12-17
458,"The eurozone economy is being dealt yet another blow from COVID-19, with rising infection levels dampening growth in service sector in particular to result in a disappointing end to 2021.",2021-12-17
459,"Importers of metals and metal components may be seeing a glimmer of light at the end of what has been a very long tunnel of logistics chaos, sky-high freight rates and shipping delays.",2021-12-15
460,The year 2022 will be marked by the Fed's tapering and fading fiscal stimulus. Click here to know more about the 2022 outlook...,2021-12-15
461,New therapies to prevent serious illness are promising but we should expect a focus on COVID and a return to normal life to continue in 2022.,2021-12-15
462,"Labour shortages are reported to be limiting production more than ever in the eurozone, according to a business survey by the European Commission.",2021-12-14
463,"House price growth in the eurozone is at its highest since 2006 as housing markets were supported by a limited impact of the pandemic on household finances, rising savings, historically...",2021-12-14
464,"We see 2022 delivering global stock gains and bond losses for a second year in a row. We see inflation settling above pre-Covid trends, and thus we favor equities over fixed income.",2021-12-13
