,summary,date
0,"Visa Inc. shares were off 0.7% in Thursday morning trading and on track to log their eighth-straight trading day of declines if the losses hold through the close. A close in the red Thursday would extend Visa's longest losing streak since Aug. 16, 2013, according to Dow Jones Market Data. Shares fell for nine consecutive sessions during that 2013 stretch. Visa's stock is off 10.0% during the current eight-session losing streak. Visa executives have maintained recently that spending trends remain",2022-09-22
1,The Lightning Network (a channel-based payment system that runs on top of Bitcoin) is starting to reach critical mass of liquidity and usability.,2022-09-22
2,"In this article, we discuss 15 best stocks to invest in right now. If you want to see some more stocks in this list, click 5 Best Stocks To Invest In Right Now. According to a Bloomberg report dated August 24, the Goldman Sachs Group noted that elite hedge funds are strengthening their stakes in […]",2022-09-21
3,"Shares of Visa Inc. Cl A slid 2.63% to $187.02 Wednesday, on what proved to be an all-around dismal trading session for the stock market, with the S&P 500...",2022-09-21
4,"GM Sectec, the global leader in cybersecurity, and Visa, global leader in digital payments, announced today the strengthening of their partnership to facilitate fraud prevention, cyber defense and cybersecurity best practices in the Latin America and Caribbean region. To this end, GM Sectec in partnership with Cybersource, a Visa solution, will now offer payment and risk management services supported by GM Sectec's cybersecurity expertise.",2022-09-21
5,"Visa Inc. Class A is currently at $190.97, down $1.10 or 0.57% --Would be lowest close since June 17, 2022, when it closed at $190.01 --Currently down seven consecutive days; down... | September 21, 2022",2022-09-21
6,"Two dozen Republican attorneys general are urging Visa, MasterCard, and American Express to drop their plans for a new store code for gun retailers.

",2022-09-21
7,"dividend channel,V,",2022-09-21
8,GM Sectec and Visa announ... V,2022-09-21
9,"BofA analysts added PayPa... PYPL, V",2022-09-21
10,"Shares of Visa Inc. Cl A shed 0.55% to $192.07 Tuesday, on what proved to be an all-around dismal trading session for the stock market, with the S&P 500...",2022-09-20
11,"Visa, Mastercard and Amex recently decided to adopt a merchant code for firearms retailers. Republican attorneys general across several states warned the plan could lead to the misuse of consumer data.",2022-09-20
12,Looking for stock market analysis and research with proves results? Zacks.com offers in-depth financial research with over 30years of proven results.,2022-09-20
13,"When close to half the companies in the United States have price-to-earnings ratios (or ""P/E's"") below 14x, you may...",2022-09-20
14,"PayPal stock has fallen from grace, with its multiple substantially compressing, but it's still growing its FCF at a rapid rate. Click here to read my analysis.",2022-09-20
15,I consider the industry in which Visa and PayPal operate as being highly attractive for investors. See which stock is the more attractive prospect at this time.,2022-09-20
16,U.S. stocks finish lower on Tuesday as Treasury yields climb and traders appear skittish about opening new long positions ahead of the conclusion of the...,2022-09-20
17,Information Technology has been the worst performing sector and energy up the most. Click here to read more about Rose's Income Garden portfolio.,2022-09-20
18,"Unusual Whales seeks to list the KRUZ ETF and NANC ETF, which would track the trades of Republicans and Democrats, respectively.",2022-09-20
19,"The severe macroeconomic climate has led investors toward defensive plays, creating buy opportunities in the following growth stocks.",2022-09-20
20,"Visa (V) closed the most recent trading day at $193.13, moving -0.09% from the previous trading session.",2022-09-19
21,"Shares of Visa Inc. Cl A sank 0.09% to $193.13 Monday, on what proved to be an all-around favorable trading session for the stock market, with the S&P 500...",2022-09-19
22,"While bear markets challenge investors, they offer an opportunity to add quality companies at lower prices.",2022-09-19
23,Halvorsen's 13F portfolio value decreased from $24.74B to $21.86B in Q2. Click to read more about Viking Global's holdings and trades for Q2 2022.,2022-09-19
24,"A bipartisan House bill introduced Monday calls for more competition in the credit-card market and takes aim at Visa and Mastercard. House Representatives Peter Welch (D., Vt.) and Lance Gooden (R., Texas) are sponsoring the bill, which follows an identical, bipartisan Senate bill introduced in July. You might not think about it when you’re buying groceries or paying for gas, but every time you pay with your credit card, the grocery store, gas station or other merchant pays fees to process that",2022-09-19
25,"The S&P 500, which is often viewed as the best barometer of stock market health, delivered its worst first-half return since Richard Nixon was president.  To boot, the technology-dependent Nasdaq Composite, which has been largely responsible for lifting the market to new highs over the past year, has firmly plunged into a bear market.  While periods of heightened volatility and uncertainty are unnerving for all walks of investors, it can be an especially trying time for retirees.",2022-09-18
26,"In this article, we discuss 10 Blue Chip Stocks To Buy Now According To Billionaire Andreas Halvorsen. You can skip our detailed analysis of Viking Global ‘s strategy and the current market outlook and go directly to 5 Blue Chip Stocks To Buy Now According To Billionaire Andreas Halvorsen. Worth $6.6 Billion, Andreas Halvorsen is […]",2022-09-16
27,"Facebook was a member of the exclusive $1 trillion club a year ago, but it's fallen a long way since then.",2022-09-16
28,"In this article, we will take a look at the 10 financial stocks to buy now according to billionaire Cliff Asness. To skip our analysis of Asness’s profile, investment strategy, and 13F holdings, you can go directly to see the 5 Financial Stocks to Buy Now According to Billionaire Cliff Asness. In the realm of […]",2022-09-16
29,These highly profitable companies offer sustainable competitive advantages that make them no-brainer buys.,2022-09-16
30,"Hardware and Telecom are undervalued relative to 11-year averages. Entertainment is unattractive regarding valuation and quality metrics. VGT, an alternative to XLK.",2022-09-16
31,"Visa Inc. (NYSE:V) and Mastercard Incorporated (NYSE:MA) could face a challenge from U.S. retailers, who wish to break the duopoly these credit card service provide...",2022-09-16
32,"Each month, I publish a report to show that it's possible to build a lasting portfolio during all market conditions. Click here to read my latest report.",2022-09-16
33,Lone Pine Capitalâs 13F portfolio value decreased from $16.80B to $10.61B. Click to see an update on the firm's holdings and trades for Q2 2022.,2022-09-15
34,"American Express rose 11% since July 3, outperforming the roughly flat Visa and Mastercard. Does this make AXP stock a Buy? Click here to find out.",2022-09-15
35,"In this article, we will be taking a look at the 10 Blue Chip Stocks to Buy According to Billionaire Steve Cohen. To skip our analysis of Steve Cohen’s profile, investment strategy, and 13F holdings, you can go directly to see the 5 Blue Chip Stocks to Buy According to Billionaire Steve Cohen. With a […]",2022-09-15
36,"Shares of Visa Inc. Cl A shed 2.03% to $195.37 Thursday, on what proved to be an all-around dismal trading session for the stock market, with the S&P 500...",2022-09-15
37,"Visa Inc. (NYSE:NYSE:V) Autonomous Research Virtual Annual Future of Commerce Symposium September 15, 2022 03:15 PM ET Company Participants Ryan McInerney - President Conference Call...",2022-09-15
38,"If you have a small business and don't want to pay an annual fee for a credit card, you can still earn valuable rewards with one of the cards listed.",2022-09-15
39,"In this article, we discuss 10 stocks to buy according to Peter Simmie’s Bristol Gate Capital Partners. If you want to skip our detailed analysis of Simmie’s history, investment philosophy, and hedge fund performance, go directly to 5 Stocks to Buy According to Peter Simmie’s Bristol Gate Capital Partners. Richard Hamm and Peter Simmie founded […]",2022-09-15
40,Wallace Weitz's 13F portfolio value decreased from $2.26B to $1.91B this quarter. Click here to see an update on Weitz Investment's portfolio for Q2 2022.,2022-09-15
41,"Visa and Mastercard control a majority, more than 80%, of the U.S. credit card market, according to the Merchants Payment Coalition.",2022-09-14
42,"Shares of Visa Inc. Cl A slipped 0.13% to $199.41 Wednesday, on what proved to be an all-around positive trading session for the stock market, with the S&P...",2022-09-14
43,"A 5% drop in energy prices was more than offset by higher shelter, food and medical care prices.",2022-09-14
44,"Visa Inc (NYSE: V) warned against the new system that gun-control proponents saw as restricting mass shootings, Bloomberg reports. The International Organization for Standardization approved a new merchant category code that banks will use when processing transactions for gun and ammunition stores. The MCC will likely help banks flag suspicious activity at these retailers. However, Visa found MCC lacks access to data showing what products consumers are buying. That means the network and its bank",2022-09-14
45,"Merchants such as Target Corp. [s] and Walmart Inc. signed on to a letter asking Congress to pass a law that would require options for the routing of credit-card transactions over alternative networks,",2022-09-14
46,"More than 1,600 merchants including Walmart and Target are urging U.S. lawmakers to pass legislation that aims to break the hold that Visa and Mastercard have over the credit-card market.",2022-09-14
47,"Dogged by competitive and macroeconomic threats, Meta Platforms Inc. is sinking down the ranks of the largest U.S. companies.",2022-09-13
48,"Shares of Visa Inc. Cl A shed 3.37% to $199.67 Tuesday, on what proved to be an all-around dismal trading session for the stock market, with the S&P 500...",2022-09-13
49,"Financial-technology stocks are among the biggest losers in the tech sector Tuesday after the August consumer-price index showed a surprise monthly increase,...",2022-09-13
50,"Staff article entitled Interesting V Put And Call Options For April 2023, about stock options, from Stock Options Channel.",2022-09-13
51,The stock market's largest companies by market cap could drastically change over the next 13 years.,2022-09-13
52,Executing a process for teaching investing without taking too much away from learning experience. Learn more about the basic principles on how to invest in stocks.,2022-09-13
53,"Visa (V) closed the most recent trading day at $206.63, moving +0.7% from the previous trading session.",2022-09-12
54,"Visa Inc. continues to see signals that consumer spending is holding up well despite economic pressures, its chief financial officer shared at a Monday...",2022-09-12
55,"Shares of Visa Inc. Cl A inched 0.70% higher to $206.63 Monday, on what proved to be an all-around positive trading session for the stock market, with the...",2022-09-12
56,"Blockchain application technology developer Future FinTech Group Inc (NASDAQ: FTFT) subsidiary FTFT Labs has teamed up with payment platform Currency Cloud Inc. Currencycloud, a subsidiary of Visa Inc.(NYSE: V), is licensed for money transmission in various states in the U.S. The parties will launch the remittance app Tempo to offer U.S.-based immigrants and others a secure and cost-effective way to send money from the U.S. to North America, Europe, Australia, India, and the Philippines. FTFT La",2022-09-12
57,Gun law advocates hail new credit card code as a way to cut down on suspicious sales,2022-09-12
58,"Visa Inc. (NYSE:NYSE:V) Goldman Sachs 2022 Communacopia + Technology Conference September 12, 2022 12:15 PM ET Company Participants Vasant Prabhu - Vice Chair &amp; Chief Financial Officer...",2022-09-12
59,"Zacks.com users have recently been watching Visa (V) quite a bit. Thus, it is worth knowing the facts that could determine the stock's prospects.",2022-09-12
60,"Buffett made great returns from holding AXP since the early 90s, but the game has changed for current potential investors. Read our analysis of the stock here.",2022-09-12
61,"The following analysis will explore opportunities spanning from each of Visa's three core growth engines, as well as offsetting risks to be aware of in the near-term.",2022-09-12
62,"Visa, Mastercard and American Express will officially begin tracking gun shops with a new merchant code. CNBC's 'Squawk Box' team breaks down the details.",2022-09-12
63,"Total consumer debt rose another $23.8 billion in July to a record $4.644 trillion, according to the latest data from the Federal Reserve. 
On an annual basis, consumer debt rose by 6.2%.",2022-09-12
64,"While JPMorgan is the world's biggest provider of merchant services, fast-growing upstarts including Stripe and Block have been climbing the rankings.",2022-09-12
65,"Visa Mastercard  and  American Express  will add a new merchant category for firearms retailers, a victory for gun-control advocates who have pressed the financial industry to do more to help curb mass shootings.  The new merchant-category code was recently approved by an international entity that sets standards for the payments industry.  Card networks assign specific codes to many kinds of specialty merchants, such as fast-food restaurants, bars and bicycle shops.",2022-09-11
66,"Payment processor Visa Inc. said Saturday that it plans to start separately categorizing sales at gun shops, a major win for gun control advocates who say it...",2022-09-11
67,"Visa (V), MasterCard (MA)... V, AXP, MA",2022-09-11
68,"Visa Inc, the world's largest payments processor, said on Saturday it will implement a new merchant category code for U.S. gun retailers, which will identify transactions at firearms stores.  The International Organization for Standardization (ISO) approved creation of the merchant code on Friday following pressure from gun-control activists who say it will help track suspicious weapons purchases.  ""Following ISO's decision to establish a new merchant category code, Visa will proceed with next steps, while ensuring we protect all legal commerce on the Visa network in accordance with our long-standing rules,"" Visa said in a statement.",2022-09-11
69,Generation Investment Managementâs 13F portfolio value decreased from $21.84B to $18.35B this quarter. Read more about Al Gore's holdings and trades for Q2 2022.,2022-09-11
70,"(Reuters) -Visa Inc, the world's largest payments processor, said on Saturday it will implement a new merchant category code for U.S. gun retailers, which will identify transactions at firearms stores.  The International Organization for Standardization (ISO) approved creation of the merchant code on Friday following pressure from gun-control activists who say it will help track suspicious weapons purchases.  ""Following ISO's decision to establish a new merchant category code, Visa will proceed with next steps, while ensuring we protect all legal commerce on the Visa network in accordance with our long-standing rules,"" Visa said in a statement.",2022-09-11
71,"Visa Inc, the world's largest payments processor, on Saturday said it will implement a new merchant category code for U.S. gun retailers, which will identify transactions at firearms stores.",2022-09-11
72,"NEW YORK — Payment processor Visa Inc. said Saturday that it plans to start separately categorizing sales at gun shops, a major win for gun control advocates who say it will help better track... | September 11, 2022",2022-09-10
73,"Shares of Visa Inc. Cl A advanced 2.24% to $205.20 Friday, on what proved to be an all-around great trading session for the stock market, with the S&P 500...",2022-09-09
74,My dividend income amounted to a YTD low of $337. Click here to see my dividend stock portfolio changes in August and what I look forward in September.,2022-09-09
75,The leading payments processing company and an iconic consumer staple both belong in Berkshire Hathaway's investment portfolio.,2022-09-09
76,"Shares of Visa Inc. Cl A inched 0.14% higher to $200.71 Thursday, on what proved to be an all-around favorable trading session for the stock market, with the...",2022-09-08
77,"The FTEC fund has a 43% allocation to Apple and Microsoft, two cash-rich companies that generate strong FCF. Click here to read why we believe FTEC is a buy.",2022-09-08
78,This month I had 3 transactions (all in European equities). My new forward dividend is approximately $1056. Click here to read more.,2022-09-08
79,We explain a well-balanced diversified portfolio make sense for many investors. Click here to read more about the ultimate $2 million retirement portfolio.,2022-09-08
80,"Staff article entitled Interesting V Put And Call Options For October 28th, about stock options, from Stock Options Channel.",2022-09-08
81,"Baron Funds, an asset management firm, published its “Baron Fintech Fund” second quarter 2022 investor letter – a copy of which can be downloaded here. In the quarter ended June 30, 2022, Baron FinTech Fund (the “Fund”) fell 22.40% (Institutional Shares) compared with a 16.10% decline for the S&P 500 Index (the “Benchmark”) and a […]",2022-09-08
82,"Shares of Visa Inc. Cl A inched 0.90% higher to $200.42 Wednesday, on what proved to be an all-around great trading session for the stock market, with the...",2022-09-07
83,"If you're a small business owner looking to save money on your purchases, consider signing up and using one of the cards below for your business expenses.",2022-09-07
84,"During the month of August, $54.40 in forward income was added and forward income was increased. Click to read more about my dividend income strategy.",2022-09-07
85,"Warren Buffett is a perfect example of how buying and holding for the long run can build colossal wealth.  Buffett has held many stocks for 10 years or more, but the four I want to focus on here are Visa (NYSE: V), Mastercard (NYSE: MA), Globe Life (NYSE: GL), and Moody's Corporation (NYSE: MCO).",2022-09-07
86,"The growing uptake of touchless payments and a solid M&A strategy might drive the Financial Transaction Services space. However, high technology investments will dampen margins. Stocks like V, MA, FIS, GPN and FLT will likely ride out the industry storms.",2022-09-07
87,"Visa, Broadcom, Medtronic, Walt Disney and BP are part of The Zacks top Analyst Blog.",2022-09-07
88,The Tech ETF has retraced most of its gains from July as the market parsed Fed Chair Powell's hawkish commentary at Jackson Hole.,2022-09-07
89,"Visa (V) closed at $198.64 in the latest trading session, marking a +0.44% move from the prior day.",2022-09-06
90,"Today's Research Daily features new research reports on 16 major stocks, including Visa Inc. (V), Broadcom Inc. (AVGO) and Medtronic plc (MDT).",2022-09-06
91,"Shares of Visa Inc. Cl A inched 0.44% higher to $198.64 Tuesday, on what proved to be an all-around poor trading session for the stock market, with the S&P...",2022-09-06
92,"Wondering how to pick strong, market-beating stocks for your investment portfolio? Look no further than the Zacks Style Scores.",2022-09-06
93,GuruFocus Article or News written by insider and the topic is about: ,2022-09-06
94,"After a volatile day of trading, stocks pulled back from their midday gains to finish firmly in the red. ",2022-09-06
95,"There are multiple indications that a bull market is coming. As a result, there are many good stocks to buy before the bull market returns.",2022-09-06
96,"Generation Investment Management bought Microsoft, Shopify, and Mastercard stock, and sold Visa in the second quarter.",2022-09-06
97,GuruFocus Article or News written by insider and the topic is about: ,2022-09-06
98,"Fundsmith filed their regulatory 13F Form on 8/15/2022. What were the latest stake disposals, increases and decreases? Click here to find out.",2022-09-06
99,A successful retirement can be attained by following some very simple suggestions. Click here for our all-weather ETF portfolio for retirement.,2022-09-06
100,"A strategy selecting 10 of the 50 stocks, equally weighted, would have increased total return to 178.0%, an active return of 61.6% vs. SPY.",2022-09-05
101,20 stocks on my dividend growth watchlist for September 2022. Click here to know them.,2022-09-04
102,"While more than half this collection of Dow Industrials is too pricey, 4 of the 5 lowest priced are ready to buy. Click to read which ones.",2022-09-03
103,The attorneys general of California and New York said credit-card companies should treat gun stores as a separate merchant category to help flag suspicious patterns of transactions.,2022-09-02
104,"While there are many new businesses taking on the payment processing industry, the two key established players may be primed to provide further investment return to investors as more people move from cash to online payments. In this analysis, we will compare the fundamentals between Visa Inc. ( NYSE:V ) and Mastercard ( NYSE:MA ).",2022-09-02
105,The attorneys general of California and New York said credit-card companies should treat gun stores as a separate merchant category to help flag suspicious patterns of transactions.,2022-09-02
106,"Shares of Visa Inc. Cl A slipped 1.18% to $197.76 Friday, on what proved to be an all-around poor trading session for the stock market, with the S&P 500...",2022-09-02
107,I present my top 15 high-growth dividend stocks to consider during the month of September. Read more to see all 15 dividend stocks.,2022-09-02
108,GuruFocus Article or News written by Jacob Wolinsky and the topic is about: Hedge Funds,2022-09-02
109,RiverPark Wedgewood Fund's declined -17.4% for Q2 2022. Who were the top contributors and detractors? Click here to find out.,2022-09-02
110,"Visa's business model is incredibly resilient, as the payment processer does not take on any credit risk. See why we like V stock here.",2022-09-02
111,"Shares of Visa Inc. Cl A inched 0.71% higher to $200.13 Thursday, on what proved to be an all-around great trading session for the stock market, with the S&P...",2022-09-01
112,Visa's (V) total cross-border volume increases 36% year over year in August.,2022-09-01
113,"In a report released on August 31, Bryan Keane from Deutsche Bank maintained a Buy rating on Visa (V &#8211; Research Report), with a price target of $270.00. The c...",2022-09-01
114,These three high-potential stocks could help you -- and the next generation -- attain financial freedom.,2022-09-01
115,"The effects of compounding should not be underestimated -- a combination of steady growth and rising dividends over the years can contribute to an impressive return.  The criteria that I look for include a strong brand and franchise, a track record of dividend increases, a culture of continuous improvement, and catalysts that enable the business to demonstrate steady, long-term growth.  Visa (NYSE: V) is one of the largest players in the payments industry and has a strong, recognizable brand.",2022-09-01
116,"Staff article entitled Interesting V Put And Call Options For October 14th, about stock options, from Stock Options Channel.",2022-09-01
117,"No matter what happens with the economy in the near term, these companies can produce good returns over time.",2022-09-01
118,"The Dow Jones, which is comprised of 30 multinational companies, has likely outperformed the other major indexes because it's packed with profitable, time-tested businesses.  What follows are three Dow stocks that are nothing short of screaming buys in September.  The first Dow stock that's begging to be bought by long-term investors in September is semiconductor stock Intel (NASDAQ: INTC).",2022-09-01
119,"In the latest trading session, Visa (V) closed at $198.71, marking a -1.33% move from the previous day.",2022-08-31
120,"Shares of Visa Inc. Cl A slipped 1.33% to $198.71 Wednesday, on what proved to be an all-around dismal trading session for the stock market, with the S&P 500...",2022-08-31
121,"Bread Financial (BFH) stands to gain from solid credit sales performance, proactive risk management, strong consumer payment behavior and a robust capital position.",2022-08-31
122,"Dan Dolev, Mizuho senior analyst and managing director, joins 'Power Lunch' to discuss why he favors newer payment companies over the legacy companies, Dolev's thoughts on the payment companies that he does like and more.",2022-08-31
123,"Visa Inc. (NYSE:NYSE:V) Deutsche Bank 2022 Technology Conference August 31, 2021 11:15 AM ET Company Participants Vasant Prabhu - Vice Chair and Chief Financial Officer Conference Call...",2022-08-31
124,Visa said its U.S. payment volume rose 11% in August year-over-year but were flat compared with July.,2022-08-31
125,"Visa (V) has received quite a bit of attention from Zacks.com users lately. Therefore, it is wise to be aware of the facts that can impact the stock's prospects.",2022-08-31
126,"London - Satago, a 3-in-1 cash flow management platform, has partnered with Visa, the world leader in digital payments, to provide Visa Business Classic and Visa Business Premium card users discounts... | August 31, 2022",2022-08-31
127,"This article discusses 8 best stocks to buy now according to an under-the-radar value investor. If you are interested in knowing only about the top four picks, you can check them here: 4 Best Stocks to Buy Now. The under-the-radar value investor we are talking about is Mark Massey (not the jazz pianist and composer). […]",2022-08-30
