,summary,date
2504,"Visa, the world's leader in digital payments, has today announced a new ecommerce security requirement to help Australian businesses combat a growing form of cybercrime and gain over 13,000 hours a year in otherwise lost time trading.[1]",2021-12-13
2505,"InvestorPlace - Stock Market News, Stock Advice & Trading Tips",2021-12-13
2506,There are 24 stocks on my dividend growth watchlist for December 2021. Nine of the stocks on my watchlist are currently undervalued based on dividend yield theory.,2021-12-13
2507,"If you currently have the Chase Sapphire Reserve, your $60 credit for the year will expire on Dec. 31. Here's what you need to know about redeeming the credit.",2021-12-13
2508,"InvestorPlace - Stock Market News, Stock Advice & Trading Tips",2021-12-13
2509,"InvestorPlace - Stock Market News, Stock Advice & Trading Tips",2021-12-13
2510,"While the Federal Reserve has kept interest rates at record lows during the pandemic, it's only a matter of time before they start to rise as the economy continues its recovery and policymakers wrap up the current bond-buying taper. How should investors approach building their po",2021-12-12
2511,"Though Omicron’s ultimate impact on travel and other big-ticket spending is still unclear, stocks are already moving on positive indications. ",2021-12-12
2512,This portfolio strategy uses the quarterly 13F filings to extract 50 consensus stocks from 40 large hedge funds that have more than $3.5 billion Assets Under Management.,2021-12-12
2513,"In 2015, Ethereum co-founder Charles Hoskinson and his colleague Jeremy Wood left the Ethereum Foundation to build their own company, Input Output. In 2017, that company launched Cardano (CRYPTO: ADA), a blockchain powered by the ADA token. Since its debut, its price has soared 4",2021-12-11
2514,Microsoft is on top once again in the Drucker Institute’s annual Management Top 250 ranking. Among the biggest losers this year: AT&T and ExxonMobil.,2021-12-11
2515,"Square has seen its shares come down in recent weeks. Shares are still pricey, however, and growth is slowing down. See if SQ stock is a buy or sell.",2021-12-11
2516,"Concern that Visa might move its headquarters out of California follows the loss in recent years of the headquarters of Tesla, Oracle, Charles Schwab and McKesson — all leaving for Texas.",2021-12-10
2517,The venerable San Francisco financial company has a bold new strategy for playing an even larger role in payments and global commerce.,2021-12-10
2518,"(Bloomberg) -- The U.S. has imposed sanctions on a former Angolan military general who has been a longstanding partner of Trafigura Group, accusing him of corruption and embezzlement.Most Read from BloombergAnatomy of a Bad RoadThe 15 Best Beers We Drank This YearSand and Soldiers Mix as Troops Move In to Protect Cancun TouristsThe World’s Relentless Demand for Chips Turns Deadly in MalaysiaFormer Oil Trader Is Now Betting on Lumber for SkyscrapersLeopoldino Fragoso do Nascimento, commonly known",2021-12-10
2519,"How do you know that a stock has truly made it? I would argue that reaching the $1 trillion market capitalization milestone is the telltale sign that a stock has achieved something very special. At present, there are just six such companies, but no doubt others will begin to reac",2021-12-10
2520,"InvestorPlace - Stock Market News, Stock Advice & Trading Tips",2021-12-10
2521,"Visa (V)  provides digital payment services, offering financial services products such as debit cards, credit cards, prepaid products, commercial payment solutions, and global ATMs. The company was founded in 1958 and is headquartered in San Francisco, California.



Visa reported strong revenue and earnings growth in the fiscal fourth quarter and full-year 2021 financial results in late October 2021. 



I am neutral on V stock, as despite its strong fundamentals it is now traded at a premium. (See Analysts’ Top Stocks on TipRanks) 



Visa Business Highlights



Visa makes its profits by selling services as an intermediary between financial institutions and merchants, whereas merchants need strong consumer spending and strong economic conditions to thrive. 



The company reported that the U.S. Spending Momentum Index (SMI) rose to 111.9 points in November, which was the second consecutive month of acceleration in consumer spending momentum. Levels of the SMI above 100 signal strong momentum. 



The SMI in October was reported to be 110.6, and was up 2.1 points from September.



Visa has developed a positive attitude towards the cryptocurrency ecosystem, and this is reflected by its decision to launch its Crypto Advisory Services, Global Crypto Advisory Practice, which falls within its Visa Consulting & Analytics (VCA) division, supporting the path to digital money. 



It was stated in this crypto-related announcement that “The case for crypto is getting stronger for financial institutions; new global research finds nearly 40% of crypto owners would be likely to switch primary banks to one that offers crypto products.”



Visa has an extensive partnership globally with more than 60 cryptocurrency platforms and a global network of both experts and consultants. These can help financial institutions offer their customers services such as NFTs, or exposure to digital currencies. Visa believes that the crypto market ecosystem may become mainstream.



This is however, a bold and risky business strategy especially as regulatory woes are lingering over the cryptocurrency market. Not just in the U.S. but on a global level, as most countries have yet to formally accept cryptocurrencies as an official means of payment, except for El Salvador, which was a pioneer in making Bitcoin legal tender.



The high volatility of the whole cryptocurrency market is a key risk to Visa.



Visa has been supporting the growth of Buy Now, Pay Later (BNPL) business solutions. In late October, it announced an expanding list of companies such as issuers, acquirers, and fintech firms that use its technology and network to offer these attractive BNPL options to their customers.



The leading global payments technology company has announced its “Visa Eco Benefits,” a “new package of sustainability-focused benefits for account issuers designed to enable and encourage their cardholders to engage in sustainable consumption behaviors.”



Not all business news is positive though, as Visa has a severe business issue with Amazon (AMZN) which intends to ban the U.K. from the usage of Visa’s credit cards next month, due to the rising cost of accepting credit card payments.



Visa: Strong Earnings



As a result of a strong full-year 2021, Visa in late October increased its quarterly dividend from $0.32 to $0.375 per share, a 17.18% increase. For the full-year 2021 net revenues increased 10% to $24.1 billion,  GAAP net income increased 13% to $12.3 billion, and GAAP earnings per share increased 15% to $5.63.



For Q4, Visa reported a year-over-year increase of 29% to net revenues ($6.6 billion), a 68% increase in GAAP net income to $3.6 billion, and a 70% increase of GAAP EPS to $1.65.



All key business drivers witnessed an increase for the full-year 2021, with Processed Transactions and Payments Volume rising 17% and 16% respectively, being the top performers. Cross-Border Volume Total rose 9%, whereas Cross-Border Volume Excluding Intra-Europe was a laggard, rising only 1%.



V Stock: Relatively Expensive



Data from Simply Wall Steet shows that V stock is relatively expensive based on its P/E Ratio (37.1x) compared to the U.S. IT industry average (35.9x). 



It is also expensive based on its P/EG Ratio (1.6x), and relatively overvalued based on its P/B Ratio (12.4x), compared to the U.S. IT industry average (4.8x).



Wall Street Take



Visa has a Consensus Rating of Strong Buy, based on 13 unanimous Buys. The average Visa price target of $276.46 represents 30.1% upside potential.







Disclosure: At the time of publication, Stavros Georgiadis, CFA did not have a position in any of the securities mentioned in this article.



Disclaimer: The information contained in this article represents the views and opinion of the writer only, and not the views or opinion of TipRanks or its affiliates  Read full disclaimer >",2021-12-10
2522,"The Zacks Analyst Blog Highlights: Visa, United Parcel Service, TotalEnergies, GlaxoSmithKline and Micron",2021-12-10
2523,"Investment company Madison Covered Call & Equity Strategy Fund (Current Portfolio) buys PayPal Holdings Inc, T-Mobile US Inc, Visa Inc, FedEx Corp, Freeport-McMoRan Inc, sells Lowe's Inc, Entergy Corp, Texas Instruments Inc, Microsoft Corp, NextEra Energy Inc during the 3-months ended 2021Q3, according to the most recent filings of the investment company, Madison Covered Call & Equity Strategy Fund.",2021-12-10
2524,"Investment company NVIT J.P. Morgan U.S. Equity Fund (Current Portfolio) buys Microsoft Corp, Deere, Centene Corp, PPG Industries Inc, Regeneron Pharmaceuticals Inc, sells Coca-Cola Co, Lam Research Corp, Crown Holdings Inc, Morgan Stanley, Cigna Corp during the 3-months ended 2021Q3, according to the most recent filings of the investment company, NVIT J.P.",2021-12-10
2525,"Visa (V) closed at $211.39 in the latest trading session, marking a +1.15% move from the prior day.",2021-12-09
2526,"The portfolio generated $1,067 in dividends during the month, an improvement over August. YTD, I've received $12,700. I closed out my positions in REM, DIS, MLPA, and SPYD.",2021-12-09
2527,"""Ask Halftime"" traders answer your questions about specific stocks and ETFs.",2021-12-09
2528,"CNBC's Halftime traders Jim Lebenthal of Cerity, Bryn Talkington of Requisite Capital Management, Karen Firestone of Aureus Asset Management, and Josh Brown of Ritholtz Wealth Management answer investment-related questions from CNBC Pro subscribers. Look out for an email where you can submit your questions directly to the Halftime team.",2021-12-09
2529,"Today's Research Daily features new research reports on 16 major stocks, including Visa Inc. (V), United Parcel Service, Inc. (UPS), and TotalEnergies SE (TTE).",2021-12-09
2530,Visa (V) introduces Crypto Advisory Practice to guide financial decision making of clients and partners inclined toward utilizing crypto products.,2021-12-09
2531,"Mastercard (MA) ties up with JKB to introduce the first World Elite card backed with biometric authentication in the MEA region, thereby leading to seamless and secured contactless payments.",2021-12-09
2532,"3 Top Fintech Stocks To Keep An Eye On TodayWhile investors consider why are stocks down today, fintech stocks continue to make plays in the stock market. Before going into the details, just what are fintech stocks might you ask? Well, for the most part, the industry is home to c",2021-12-09
2533,"Jason Ware, Albion Financial Group partner and CIO, joins 'Power Lunch' to discuss which stocks have growth opportunities in 2022, why these stocks are poised for growth.",2021-12-09
2534,"Investors in Visa Inc (Symbol: V) saw new options begin trading today, for the January 2022 expiration.   At Stock Options Channel, our YieldBoost formula has looked up and down the V options chain for the new January 2022 contracts and identified one put and one call contract",2021-12-09
2535,"Top news and what to watch in the markets on Thursday, December 9, 2021.",2021-12-09
2536,"U.S. stock indexes slipped on Thursday after three straight days of gains following positive updates on the Omicron coronavirus variant, with focus now turning towards economic data for clues on the Federal Reserve's policy decision.",2021-12-09
2537,"In early trading on Thursday, shares of Apple topped the list of the day's best performing Dow Jones Industrial Average components, trading up 0.6%.  Year to date, Apple registers a 32.7% gain.",2021-12-09
2538,"The market is not much more than a popularity contest, taking turns loving and hating stocks on any given day, for any reason. Instead of understanding the logic behind this (the market is irrational), focus on finding the unpopular stocks that could one day be the ""it"" stocks th",2021-12-09
2539,"Looking at the underlying holdings of the ETFs in our coverage universe at ETF Channel, we have compared the trading price of each holding against the average analyst 12-month forward target price, and computed the weighted average implied analyst target price for the ETF itsel",2021-12-09
2540,"In this article, we list out the seven blue chip stocks that has the best high-yield, dividend growth portfolio retirees can safely buy today. Read more here.",2021-12-09
2541,"Visa, the world's leader in digital payments, has today unveiled new research showing the case for crypto is getting stronger for financial institutions, with one in three (33%)[1] Australian crypto-owners saying they would be likely or very likely to switch their primary bank to one that offers crypto products in the next 12 months. The global study from Visa, ""The Crypto Phenomenon: Consumer Attitudes & Usage,"" found that digital currencies are taking greater hold in the popular consciousness",2021-12-09
2542,"(Bloomberg) -- Visa Inc. believes it can resolve its problems with Amazon.com Inc. as the e-commerce giant is planning to ban usage of the firm’s credit cards issued in the U.K. starting next month. Most Read from BloombergThe World’s Relentless Demand for Chips Turns Deadly in MalaysiaSand and Soldiers Mix as Troops Move In to Protect Cancun TouristsAnatomy of a Bad RoadEven in the Metaverse, Not All Identities Are Created EqualThe $300 Billion Plan to Bring Green Power to China’s MegacitiesThe",2021-12-08
2543,"San Francisco-based Visa said Wednesday it has created a crypto consulting practice to help banks, retailers and other clients navigate the increasingly popular world of cryptocurrencies and non-fungible tokens, or NFTs.  The new service — housed within Visa Consulting & Analytics, with more than 700 consultants in more than 75 cities around the world — allows Visa (NYSE: V) to leverage its work with more than 60 crypto platforms.  Visa seeks to help financial institutions assess opportunities tied to crypto, develop strategies and test new products and services such as crypto rewards programs.",2021-12-08
2544,"Visa Inc. (NYSE:V) UBS Global TMT Virtual Conference December 8, 2021 4:00 PM ET Company Participants Vasant Prabhu - Vice Chairman and Chief Financial Officer Conference Call Participants...",2021-12-08
2545,"The the world’s largest payments provider, Visa, is opening a consulting service catering to curious banks who need to know more crypto.",2021-12-08
2546,"The NASDAQ 100 After Hours Indicator is down -3.05 to 16,391.29.  The total After hours volume is currently 71,749,327 shares traded.The following are the most active stocks for the after hours session: Energy Transfer L.P. (ET) is +0.03 at $8.55, with 70,691,285 shares traded. A",2021-12-08
2547,Visa's Head of Crypto Cuy Sheffield examines the growing consumer base for cryptocurrencies and details the resources Visa has established to aid customers with crypto investments.,2021-12-08
2548,"SAN FRANCISCO, December 08, 2021--Visa (NYSE: V) today announced that the U.S. Spending Momentum Index (SMI) was 111.9 in November (seasonally adjusted), up 1.3 points from October, marking the second consecutive month of acceleration in consumer spending momentum. The SMI’s further increase above 100 signals that even more consumers are spending more than they did a year ago.",2021-12-08
2549,"Mastercard (MA) partners with ProgressSoft to smoothly integrate MA's cross-border platform into MENA's banks and consequently, speed up remittances throughout the region.",2021-12-08
2550,"Visa  said Wednesday that it would launch a crypto advisory services for its clients, in another sign that digital assets are becoming more mainstream.  One of its surveys has shown that nearly 40% of crypto owners would be likely to switch their primary bank to one that offers crypto-related products.  Visa (ticker: V) is targeting banks seeking to attract customers with crypto offerings, or retailers who want to find out more about the new assets.",2021-12-08
2551,"Looking today at week-over-week shares outstanding changes among the universe of ETFs covered at ETF Channel, one standout is the The Technology Select Sector SPDR— Fund (Symbol: XLK) where we have detected an approximate $741.8 million dollar inflow -- that's a 1.5% incr",2021-12-08
2552,Financial stocks were climbing pre-bell Wednesday with the Financial Select Sector SPDR (XLF) recently advancing by 0.25%. The Direxion Daily Financial Bull 3X shares (FAS) were 0.60% higher and its bearish counterpart Direxion Daily Financial Bear 3X shares (FAZ) were down 0.57,2021-12-08
2553,U.S. stock futures reversed higher and pointed to more gains after Pfizer said three doses of its Covid vaccine neutralized the omicron variant.,2021-12-08
2554,"Multinational financial services company Visa, Inc. (V) has launched Global Crypto Advisory Practice within its Visa Consulting & Analytics (VCA) division to help its partners and clients deal in crypto products.



Based out of California, Visa facilitates electronic funds transfers through its credit cards, debit cards and prepaid cards. (See Insiders’ Hot Stocks on TipRanks)



Visa Conducts Global Survey



The launch follows the company’s survey of over 6,000 financial decision makers across eight nations — Argentina, Australia, Brazil, Germany, Hong Kong, South Africa, the U.K. and the U.S. — about crypto awareness.



The survey found that nearly 33% of the respondents have dealt with crypto directly. It also found that around 40% of crypto owners are likely to change their primary bank in the next 12 months to the one that offers crypto-related products.



Management Comments



The European Head of Visa Consulting & Analytics, Claudio Di Nella, said, “We’ve seen a material shift in our clients’ mindset in the last year, from a desire to explore and experiment with crypto, to actually building a strategy and product roadmap.”



The Deputy CEO, Visa, Europe, Antony Cahill, said, “As consumers change their approach to investing, where they bank, and their views on the future of money, every financial institution will need a crypto strategy.”



Analysts’ Recommendation



Overall, the stock has a Strong Buy consensus rating based on 13 unanimous Buys. The average Visa price target of $276.46 implies 33.3% upside potential. Shares have lost 10.6% over the past six months.



Website Traffic



TipRanks’ Website Traffic Tool, which uses data from SEMrush Holdings (SEMR), the world’s biggest website usage monitoring service, offers insight into Visa’s performance.



According to the tool, compared to the previous year, the company’s website traffic registered a 12.4% decrease in global visits in November. Moreover, the website traffic has declined nearly 6% year-to-date against the same period last year.







Related News:Gitlab Rises 1.5% on Solid Q3 Results, Offers GuidanceDraftKings, NFLPA to Launch Gamified NFT; Shares Rise 2%Casey’s Falls 3.5% on Missed Q2 Earnings",2021-12-08
2555,"Visa Inc, the world's largest payment processor, launched a global crypto advisory service for its banking clients and merchants on Wednesday, as the adoption of digital currencies gains steam.",2021-12-08
2556,"Nubank has evolved in seven years from a fintech to one of Latin America's biggest credit card issuers, now on the brink of an IPO that could make it the region's largest listed bank.",2021-12-08
2557,"SAN FRANCISCO, December 08, 2021--Visa (NYSE: V), the world’s leader in digital payments, today announced the launch of Visa’s Global Crypto Advisory Practice, an offering within Visa Consulting & Analytics (VCA) designed to help clients and partners advance their own crypto journey. This comes at a moment when digital currencies are taking greater hold in the popular consciousness – according to research released today from Visa, awareness of crypto among financial decision makers surveyed is n",2021-12-08
2558,Visa is launching new consulting and advisory services to help its clients navigate the world of cryptocurrencies.,2021-12-08
2559,"Visa Inc, the world's largest payment processor, on Wednesday launched a global crypto advisory service for clients such as banks and also merchants, as the adoption of digital currencies gains steam.",2021-12-07
2560,"This month I started repositioning my portfolio, decreasing total holdings to 35. Dividend was almost double that of last November. Read to learn more.",2021-12-07
2561,"InvestorPlace - Stock Market News, Stock Advice & Trading Tips",2021-12-07
2562,"Wall Street's main indexes rallied strongly on Tuesday, with the Nasdaq surging 3% as investors piled onto beaten-down quality technology stocks, while Intel jumped after plans to take its self-driving car unit public.",2021-12-07
2563,"The Western Union Company stock (NYSE: WU) has gained 5.1% in the last week, outperforming the S&P 500 (down 1.2%). Further, the stock increased 2.3% in the last ten days vs a 3.5% fall in the broader markets. However, if you look at the change over the last one month, it t",2021-12-07
2564,"For beginners, it can seem like a good idea (and an exciting prospect) to buy a company that tells a good story to investors, even if it completely lacks a track record of revenue and profit.  But as Warren Buffett has mused, 'If you've been playing poker for half an hour and yo",2021-12-07
2565,"The Nasdaq rallied more than 2% on Tuesday as technology firms bounced back on easing concerns around the Omicron variant, while Intel jumped after plans to take its self-driving car unit public.",2021-12-07
2566,"As the stock market soured towards the end of November, gains were quickly erased. Check out my top 15 high-growth dividend stocks to consider in December.",2021-12-07
2567,"Investment company Reynolds Funds Inc (Current Portfolio) buys Costco Wholesale Corp, The Home Depot Inc, Visa Inc, Mastercard Inc, Lowe's Inc, sells Alibaba Group Holding, Zillow Group Inc, Expedia Group Inc, PayPal Holdings Inc, Roku Inc during the 3-months ended 2021Q3, according to the most recent filings of the investment company, Reynolds Funds Inc.",2021-12-07
2568,"Buffett prefers assets with clear, material use, and these definitely fit the bill.",2021-12-06
2569,"Investment company Oakmark Fund (Current Portfolio) buys PACCAR Inc, Intercontinental Exchange Inc, ConocoPhillips, Humana Inc, sells Visa Inc, Mastercard Inc during the 3-months ended 2021Q3, according to the most recent filings of the investment company, Oakmark Fund.",2021-12-06
2570,"At Insider Monkey, we pore over the filings of nearly 867 top investment firms every quarter, a process we have now completed for the latest reporting period. The data we’ve gathered as a result gives us access to a wealth of collective knowledge based on these firms’ portfolio holdings as of September 30th. In this […]",2021-12-06
2571,The payment processor has fallen out of favor with the market recently,2021-12-06
2572,"In this article, we discuss the 10 long-term stocks to buy according to Warren Buffett. If you want to skip our detailed analysis of these stocks, go directly to the 5 Long-Term Stocks to Buy According to Warren Buffett. There has been a lot written about the legendary investing prowess of Warren Buffett, the chief […]",2021-12-06
2573,Mastercard (MA) collaborates with Zucchetti for offering the digital solution of EMS aimed at efficient expense management of Italian SMEs.,2021-12-06
2574,"Among the underlying components of the S&P 500 index, we saw noteworthy options trading volume today in Eli Lilly (Symbol: LLY), where a total of 16,138 contracts have traded so far, representing approximately 1.6 million underlying shares.  That amounts to about 56.3% of L",2021-12-06
2575,"Visa has higher revenues, profitability, and valuation than Mastercard, but the latter has a higher revenue per share and higher EPS. See which stock to buy.",2021-12-06
2576,"Affirm (NASDAQ: AFRM), a provider of ""buy now, pay later"" (BNPL) services, has been a red-hot fintech stock this year. It went public in January at $49 per share, opened at $90.90 on the first day, and currently trades at nearly $120, which gives it a market cap of nearly $30 bil",2021-12-06
2577,I have been thinking about Bubble Risk. My view is that the Market has high risk of correction; this risk is not spread evenly across the 100 large caps.,2021-12-06
2578,"Dan Loeb's 13F portfolio value increased from $17.08B to $18.32B. The top 3 positions are at ~34% of the portfolio: Upstart Holdings, SentinelOne, and Danaher.",2021-12-05
2579,"In this article, we discuss the 10 stocks to buy according to Ian Simm’s Impax Management portfolio based on Q3 holdings of the fund. If you want to skip our detailed analysis of Simm’s history, investment philosophy, and hedge fund performance, go directly to the 5 Stocks to Buy According to Ian Simm’s Impax Management. […]",2021-12-05
2580,"Are These The Best Fintech Stocks To Buy Right Now?Fintech stocks have been one of the most lucrative sectors in the stock market this year. This should not come as a surprise as the sector continues to benefit from the shift to digital payments, which accelerated during the pand",2021-12-05
2581,This portfolio strategy uses the quarterly 13F filings to extract 50 consensus stocks from 40 large hedge funds that have more than $3.5 billion Assets Under Management.,2021-12-05
2582,"A weekly summary of dividend activity for Dividend Champions, Contenders, and Challengers. Companies which changed their dividends. Companies with upcoming ex-dividend dates.",2021-12-05
