,summary,date
816,"Since peaking in Nov. 2021 at close to $3 trillion, the cryptocurrency market has lost about 50% of its value. And Bitcoin (CRYPTO: BTC), the world's most valuable digital asset, with a market cap of $600 billion (as of May 9), has followed this trend. It's down 28% in 2022.",2022-05-11
817,These Warren Buffett stocks are helping the Oracle of Omaha be a winner even in a down market. All are generating solid returns in 2022.,2022-05-11
818,,2022-05-11
819,,2022-05-11
820,U.S. stocks lower at close of trade; Dow Jones Industrial Average down 1.02%,2022-05-11
821,,2022-05-11
822,"Shares of Visa Inc. Cl A inched 0.30% higher to $193.58 Tuesday, on what proved to be an all-around mixed trading session for the stock market, with the S&P...",2022-05-10
823,"In this article, we discuss the stock market recession theories and the 10 stocks to sell now according to analysts. If you want to see more stocks in this selection, click Stock Market Recession 2022: 5 Stocks to Sell Now According to Analysts. While the S&P 500 returned 27% to investors in 2021, the index […]",2022-05-10
824,"Visa is investing in the crypto space, which could drive long-term growth",2022-05-10
825,"These innovative, fast-paced stocks are historically cheap and ripe for the picking by opportunistic investors.",2022-05-10
826,,2022-05-10
827,,2022-05-10
828,"Cryptocurrency is a speculative asset class, but leading blockchains like Solana (CRYPTO: SOL) and Cardano (CRYPTO: ADA) have fundamental advantages over rivals in sophistication and potential uses. Let's explore why their innovative designs and technical capabilities could creat",2022-05-10
829,"In this article, we will discuss billionaire Ken Fisher’s 10 favorite tech stocks. If you want to skip reading our comprehensive analysis about Fisher’s history, investment philosophy, and hedge fund performance, you can go directly to Billionaire Ken Fisher’s 5 Favorite Tech Stocks. Tech stocks continue to face a bloodbath amid a rising interest rate […]",2022-05-09
830,"Shares of Visa Inc. Cl A slipped 4.84% to $193.00 Monday, on what proved to be an all-around grim trading session for the stock market, with the S&P 500...",2022-05-09
831,"Does the May share price for Visa Inc. ( NYSE:V ) reflect what it's really worth? Today, we will estimate the stock's...",2022-05-09
832,"Finding strong, market-beating stocks with a positive earnings outlook becomes easier with the Focus List, a top feature of the Zacks Premium portfolio service.",2022-05-09
833,"Visa, Mastercard, Fiserv, Fidelity National Information Services, and Global Payments are part of Industry Outlook article.",2022-05-09
834,"Today, Visa Canada announced the 10 recipients of the third round of its She's Next Grant Program in Canada. The She's Next Grant Program supports women entrepreneurship, empowering growth and innovation, through a grant of $10,000 CAD and one-year of business coaching, in partnership with IFundWomen. Through the grant program and IFundWomen's network of women-owned businesses and mentors, recipients will gain access to funding, coaching, and connections to help expand their businesses.",2022-05-09
835,"The news means that tens of millions of households could receive high-speed internet at no cost, according to the White House.",2022-05-09
836,"InvestorPlace - Stock Market News, Stock Advice & Trading Tips",2022-05-09
837,U.S. stocks lower at close of trade; Dow Jones Industrial Average down 1.99%,2022-05-09
838,,2022-05-08
839,"Few investors realize how much international travel can affect Mastercard (NYSE: MA). When governments worldwide imposed COVID-19 travel restrictions in 2020, Mastercard's revenue and profits suffered. A still-sluggish global travel recovery in 2021 helped to explain why Masterca",2022-05-07
840,"Price-wise, Bitcoin (BTC-USD) is provoking “Extreme Fear,” as reflected in the Bitcoin Fear and Greed Index. In the bigger picture, Bitcoin is also providing hope – as an alternative to the fiat economy run by a few old people in outdated suits that keep allowing the world to burn. Hope is exactly what citizens of (for example) the Central African Republic need. With an economy built on extractive industries like gold, diamonds, and timber, the CAR struggles with poverty, political corruption an",2022-05-06
841,"Looking at options trading activity among components of the Russell 3000 index, there is noteworthy activity today in Visa Inc (Symbol: V), where a total volume of 34,984 contracts has been traded thus far today, a contract volume which is representative of approximately 3.5 mi",2022-05-06
842,"While the rising uptake of digital payment methods will support the Financial Transaction Services industry, a tough market landscape and the mounting costs will erode margins. Stocks like V, MA, FISV, FIS and GPN will likely brave industry challenges.",2022-05-06
843,"After Russia invaded Ukraine in late February, many corporations suspended business operations in Russia in protest of the country's unprovoked attack.  One of those companies was the largest credit processing company in the world, Visa (NYSE: V).  Effective March 5, all transactions initiated with Visa credit cards issued in Russia no longer work outside the country, and any Visa cards issued outside of Russia no longer work within Russia.",2022-05-06
844,"Legendary investor Warren Buffett and his company Berkshire Hathaway have long valued stocks that can build an economic moat, which is a competitive advantage that enables a company to achieve superior profit margins and pricing power.  Few have been able to achieve a stronger moat than the largest payments rail in the world, Visa (NYSE: V).  In fact, I think it's fair to say that Visa has built the ultimate moat.",2022-05-06
845,"Looking today at week-over-week shares outstanding changes among the universe of ETFs covered at ETF Channel, one standout is the The Technology Select Sector SPDR Fund (Symbol: XLK) where we have detected an approximate $248.0 million dollar inflow -- that's a 0.6% increase we",2022-05-06
846,"Rampant inflation and rising interest rates have led to a significant sell-off across several asset classes, but crypto assets have been hit especially hard. Since peaking last November, the crypto market has fallen roughly 42%, and some analysts are now forecasting another crypt",2022-05-06
847,"Investors in Visa Inc (Symbol: V) saw new options become available today, for the June 24th expiration. At Stock Options Channel, our YieldBoost formula has looked up and down the V options chain for the new June 24th contracts and identified one put and one call contract of",2022-05-05
848,"The Chinese and Russian central banks will discuss the use and promotion of their respective national payment systems in both countries, Beijing's envoy to Moscow told the TASS news agency in an interview published on Thursday.",2022-05-05
849,"The Committee holds a hea... CBSH, MA, V",2022-05-04
850,"If 2022 has been a rough year on Wall Street, then April was the cruelest month so far for the Bay Area's biggest public companies. Here's how their shares performed last month and in the year-to-date.",2022-05-03
851,"In this article, we will discuss the 15 most valuable platform companies in the world. You can skip our detailed analysis of these companies, and go directly to 5 Most Valuable Platform Companies in the World. Platform companies, according to McKinsey, are ‘matchmakers [that link] people, organizations, and resources.’ These businesses essentially create value by […]",2022-05-03
852,Sector ETF report for IYJ,2022-05-03
853,"Spring is in the air, and people are itching to travel as COVID cases dwindle from their January 2022 peak. This past week, Mastercard and Visa reported better-than-expected earnings, partly due to a recovery in cross-border travel, an essential metric for both payment companies.",2022-05-03
854,Financial stocks were advancing pre-bell Tuesday as the Select Financial Sector SPDR (XLF) was recently climbing by 0.2%. The Direxion Daily Financial Bull 3X shares (FAS) were 0.6% higher and its bearish counterpart Direxion Daily Financial Bear 3X shares (FAZ) were down by 0.6,2022-05-03
855,"With further growth possible for spending, shares of companies that facilitate card usage are reasonably priced. ",2022-05-03
856,"Paysafe (PSFE) announced ... PSFE, V",2022-05-03
857,U.S. stocks higher at close of trade; Dow Jones Industrial Average up 0.20%,2022-05-03
858,Cronos prices are being buoyed today after a steep tumble to start the week. Crypto.com is not implementing its unpopular staking changes.,2022-05-03
859,"Wall Street's main indexes fell in volatile trading on Monday, dragged down by Amazon.com and financial stocks, with investor focus squarely on the Federal Reserve meeting this week where policymakers are widely expected to raise interest rates.",2022-05-02
860,"InvestorPlace - Stock Market News, Stock Advice & Trading Tips",2022-05-02
861,"These Warren Buffett stocks can keep a portfolio sailing smoothly through choppy economic waters. Bank of America (BAC) – American banks have improved greatly in quality since 2008 and are still relatively undervalued. Hershey (HSY) – The leading chocolate company has tremendous pricing power to fend off inflationary concerns. Verizon Communications (VZ) – The stable telecom operator now offers greater than 5% dividend yield. Chevron (CVX) – Energy has entered a new bull market, and Chevron is a",2022-05-02
862,,2022-05-02
863,"Mastercard (NYSE: MA) is scheduled to report its fiscal Q1 2022 results on Thursday, April 28. We expect Mastercard to top the consensus estimates of revenues and earnings. The company is the second-largest global payment solutions provider. It posted better than expected resul",2022-05-02
864,"Comcast and Charter's joint venture to challenge Roku, Amazon and other streaming platforms may signal cable's long-game strategy.",2022-05-01
865,"In this article, we discuss the top 11 stock picks of Jacob Rothschild’s RIT Capital Partners. If you want to see more of the hedge fund’s top stocks, click Top 5 Stock Picks of Jacob Rothschild’s RIT Capital Partners. Jacob Rothschild is a British investment banker and a notable member of the Rothschild banking family. […]",2022-04-30
866,"Visa CFO Vasant Prabhu sits down with Yahoo Finance Live to talk about the financial corporation's Q2 earnings beat, consumer spending habits, expansions into cryptocurrency, and technology acquisition prospects for crypto and digital currencies.",2022-04-29
867,"Shares of Visa Inc. Cl A slipped 3.41% to $213.13 Friday, on what proved to be an all-around rough trading session for the stock market, with the S&P 500...",2022-04-29
868,"Piper Sandler downgraded Mastercard and Visa to Underweight and Neutral, respectively, from Neutral and Overweight. Europe could enter a recession in 2023,...",2022-04-29
869,"Visa Inc. and Mastercard Inc. showed resilient spending trends in their latest earnings report, but one analyst worries that a gloomier chapter is on the...",2022-04-29
870,Inflation is everywhere. It's in our lives and in the news. Americans have become fixated on it. So has the financial media. And the companies that report earnings are now starting to outline just how much rising costs are affecting their businesses.,2022-04-29
871,"Visa, Walt Disney, Abbott Laboratories, Nike and United Parcel Service have been included in this Analyst Blog.",2022-04-29
872,"Roku upgrade, MasterCard downgrade, and Lululemon coverage initiation among today's top calls on Wall Street ROKU, MA, V, ACCD, CMCSA, LULU, SFM, FBHS, ROIV, FLWS, CROX, IQV, LUNMF, ZGN, CEG",2022-04-29
873,"A month ago, I warned that Visa (NYSE: V), Mastercard (NYSE: MA), American Express (NYSE: AXP), and Discover (NYSE: DFS) are in very real danger of losing their dominant position in the payments industry because of cryptocurrencies. The idea is that instead of ""rails"" created by",2022-04-29
874,Piper Sandler analyst Chr... V,2022-04-29
875,"Shares of Mastercard (NYSE: MA) and Visa (NYSE: V) rose 4.8% and 3.1%, respectively, on Thursday, as investors cheered the credit card titans' strong quarterly earnings reports.  Mastercard's revenue jumped 24% year over year to $5.2 billion in the first quarter.  Its operating leverage was once again on full display.",2022-04-28
876,"Today's Research Daily features new research reports on 16 major stocks, including Visa Inc. (V), The Walt Disney Company (DIS), and Abbott Laboratories (ABT).",2022-04-28
877,"SAN FRANCISCO, April 28, 2022--Visa Inc. (NYSE: V) today announced its participation in the following investor conferences.",2022-04-28
878,"Shares of Visa Inc. Cl A advanced 3.06% to $220.66 Thursday, on what proved to be an all-around favorable trading session for the stock market, with the S&P...",2022-04-28
879,"This management's discussion and analysis provides a review of the results ofoperations, financial condition and the liquidity and capital resources of VisaInc. and its subsidiaries on... | April 28, 2022",2022-04-28
880,"Airbnb (NASDAQ:ABNB) has been mixed lately as fundamentals clash with aggressive selling and poor technicals. On the one hand, travel trends are improving considerably around the world. On the other hand, ABNB stock remains 27% below its all-time high as a bear market rattles growth stocks. Not only is Airbnb outperforming most of its growth-stock peers, but it’s down just 6.8% so far on the year. That’s outperforming both the S&P 500 and the Nasdaq. Now the question becomes, can ABNB stock figh",2022-04-28
881,"Mastercard's (MA) first-quarter results reflect improved GDV and switched transactions, partly offset by higher operating expenses.",2022-04-28
882,These are the stocks posting the largest moves in midday trading. ,2022-04-28
883,"Mastercard Inc. became the latest card giant to report resilient results in the face of a complicated macroeconomic backdrop, as the company notched a...",2022-04-28
884,"Here at CryptocurrenciesChannel.com, we find it interesting to track various ETF and stock prices versus various digital assets over time.",2022-04-28
885,Bread Financial Holdings’ BFH operating earnings of $4.21 per share for the first quarter of 2022 missed the Zacks Consensus Estimate of $4.50. The bottom line plunged 33% year over year.,2022-04-28
886,"Investors in Visa Inc (Symbol: V) saw new options begin trading today, for the June 10th expiration. At Stock Options Channel, our YieldBoost formula has looked up and down the V options chain for the new June 10th contracts and identified one put and one call contract of par",2022-04-28
887,"The stock market is more dynamic than you probably realize.  History has consistently shown that, due to innovation and execution, today's largest publicly traded companies are unlikely to retain their pedestal position for a significant length of time.  As an example, just one of the 10 largest publicly traded companies in 1999 is still in the top 10 (Microsoft).",2022-04-28
888,"Unusual total active opti... XELA, NOK, MA, MCD, V, LUV, CHPT, KO, MRVL",2022-04-28
889,Shares of Mastercard Inc. undefined were up more than 3% in premarket trading Thursday after the payments giant easily topped profit expectations for its...,2022-04-28
890,"CNBC's 'Squawk Box' team break down the latest first-quarter earnings results from Comcast, which beat analysts' expectations on the top and bottom lines.",2022-04-28
891,"Triumph Bancorp (NASDAQ: TBK), a $6 billion asset bank based in Dallas, Texas, has seen its stock plummet by roughly 40% this year. It's certainly not the only stock in today's market to suffer in the face of rising bond yields, the Federal Reserve's tightening monetary policies,",2022-04-28
892,,2022-04-28
893,"All eyes will be on Comcast's broadband division, which is expected to add 229,000 new high-speed internet customers during the first quarter. ",2022-04-28
894,Cyclical stocks to pay attention to this earnings season.,2022-04-27
895,"The S&P 500 ended higher on Wednesday following a steep drop the day before, with strong revenue forecasts from Microsoft and Visa helping to alleviate worries about slowing global economic growth and rising interest rates.  Microsoft Corp rallied after the software heavyweight late on Tuesday gave a strong revenue forecast, while payments network Visa Inc jumped after it predicted revenue above pre-pandemic levels.",2022-04-27
896,"In this article, we will discuss some of the notable stocks soaring on Wednesday. To take a look at some more stocks that are gaining, go to These 5 Stocks Are Soaring Today. The US equity market is in the green today. The S&P 500 Index is up 0.96% as of 12:16 PM ET and […]",2022-04-27
897,"Nearing the final hour of trading, Visa (NYSE: V), the largest payments processing company in the world, lead the rally in the Dow Jones Industrial Average, which was up about 320 points as of 2:50 p.m. ET today.  Visa's stock traded 7.3% higher.  Investors piled into Visa after the company reported earnings results for its second fiscal quarter of 2022 ending on March 31, which impressed the market.",2022-04-27
898,"Shares of Visa Inc. Cl A rose 6.47% to $214.11 Wednesday, on what proved to be an all-around positive trading session for the stock market, with the S&P 500...",2022-04-27
899,"Key U.S. equity indexes ended higher after choppy trade on Wednesday on a boost from strong earnings from Microsoft and Visa, as commodity stocks lifted European shares to their first gain in four sessions.",2022-04-27
900,"U.S. stocks rose in choppy trading on Wednesday, as strong earnings from Microsoft and Visa lifted investor spirits dented by concerns around slowing global growth and a more aggressive monetary policy.  Microsoft Corp gained 5.8% on cloud computing-led strong revenue growth forecast, while payments network Visa Inc jumped 8.2% after it predicted revenue to exceed pre-pandemic levels.",2022-04-27
901,Looking for stock market analysis and research with proves results? Zacks.com offers in-depth financial research with over 30years of proven results.,2022-04-27
902,"The S&P 500 ended higher on Wednesday following a steep drop the day before, with strong revenue forecasts from Microsoft and Visa helping to alleviate worries about slowing global economic growth and rising interest rates.",2022-04-27
903,Looking for stock market analysis and research with proves results? Zacks.com offers in-depth financial research with over 30years of proven results.,2022-04-27
904,"In this article, we will take a look at the 11 much-awaited earnings reports to watch. You can skip our detailed analysis of these companies and go directly to the 5 Much-Awaited Earnings Reports to Watch. Some of the largest U.S. stocks, including Microsoft Corporation (NASDAQ:MSFT), Alphabet Inc. (NASDAQ:GOOG) and Visa Inc. (NYSE:V), are making […]",2022-04-27
905,"Shares of the two largest payment rails, Visa (NYSE: V) and Mastercard (NYSE: MA), had risen nearly 8% and 6%, respectively, as of 10:22 a.m. ET today after Visa reported strong earnings results for its second fiscal quarter of the year.  Mastercard, which will report its latest earnings results tomorrow morning, is also benefiting considering how similar the two companies are.  ""The Omicron variant impacts were short-lived and the global economic recovery that began in the middle of last year continued,"" Visa CEO Alfred Kelly Jr. said in an earnings statement.",2022-04-27
906,"Wall Street bounced back on Wednesday following a steep drop the day before, with strong revenue forecasts from Microsoft and Visa boosting investors who have been about fretting about slowing global growth and rising interest rates.",2022-04-27
907,Looking for stock market analysis and research with proves results? Zacks.com offers in-depth financial research with over 30years of proven results.,2022-04-27
908,"Wall Street's main indexes opened higher on Wednesday on strong earnings from Microsoft and Visa, following a brutal selloff in the previous session that sent the tech-heavy Nasdaq to its lowest close since December 2020.",2022-04-27
909,Shares of Visa Inc. were shooting higher Wednesday after the financial-technology giant issued an upbeat signal about spending trends with its latest...,2022-04-27
910,"U.S. stocks were set to open higher on Wednesday on strong earnings updates from Microsoft and Visa, following a brutal selloff in the previous session that sent the tech-heavy Nasdaq to its lowest close since December 2020.  Growing fears of a global economic slowdown and more aggressive Federal Reserve pummeled technology and growth stocks on Tuesday, with Tesla's 12% slump weighing the most on the S&P 500 and the Nasdaq.",2022-04-27
911,"Shares of Visa Inc. surged 5.9% and Microsoft Corp.'s stock rallied 3.5% to pace the Dow Jones Industrial Average's premarket gainers Wednesday, in the wake of the companies' better-than-expected quarterly results. The stocks' price gains were adding a combined 141 points to the Dow's price, which accounts for more than half of the Dow futures' gains of 234 points, or 0.7%. Meanwhile, Boeing Co.'s stock fell 3.5% to pace the Dow's decliners, after the company reported disappointing results. The",2022-04-27
912,,2022-04-27
913,,2022-04-27
914,,2022-04-27
915,By Sam Boughedda,2022-04-27
916,"Major U.S. and European equity indexes rose in choppy trade on Wednesday, and the euro dropped to its weakest since 2017 after Russia halted gas supplies to Bulgaria and Poland and investors worried more about the region's economy.",2022-04-27
917,"Visa's (V) fiscal second-quarter results indicate better payments volume, processed transactions and cross-border volume, partly offset by high operating costs.",2022-04-27
918,"The S&P 500 ended higher on Wednesday following a steep drop the day before, with strong revenue forecasts from Microsoft and Visa helping to alleviate worries about slowing global economic growth and rising interest rates.  Microsoft Corp rallied after the software heavyweight late on Tuesday gave a strong revenue forecast, while payments network Visa Inc jumped after it predicted  revenue above pre-pandemic levels.  Tuesday's gains in the S&P 500 and Dow Jones Industrial Average followed a steep selloff the day before that saw the Nasdaq drop to its lowest close since December 2020 as investors worried that the U.S. Federal Reserve might raise interest rates more than expected in its fight against inflation.",2022-04-27
919,"U.S. stock index futures jumped on Wednesday on strong earnings updates from Microsoft and Visa, following a brutal selloff in the previous session that sent the tech-heavy Nasdaq to its lowest close since December 2020.  Growing fears of a global economic slowdown and a more aggressive Federal Reserve pummeled technology and growth stocks on Tuesday, with Tesla's 12% slump weighing the most on the S&P 500 and the Nasdaq.  The sentiment appeared to improve in premarket trading as Microsoft Corp jumped 5% after it forecast double-digit revenue growth for the next fiscal year, driven by demand for cloud computing services.",2022-04-27
920,"Looking today at week-over-week shares outstanding changes among the universe of ETFs covered at ETF Channel, one standout is the iShares Russell 1000 Growth ETF (Symbol: IWF) where we have detected an approximate $589.5 million dollar outflow -- that's a 0.9% decrease week ove",2022-04-27
921,"Midday Stock Movers: Boeing, Enphase Energy, Roblox",2022-04-27
922,"U.S. stocks edged higher on Wednesday, as strong earnings from Microsoft and Visa lifted investor spirits dented by concerns around slowing global growth and a more aggressive monetary policy.",2022-04-27
923,"By Will Feuer Visa Inc. rose about 8% in morning trading to $217.50 a share after the company posted second-quarter results that topped analysts' expectations. The company said Tuesday... | April 27, 2022",2022-04-27
924,"Five top five lists with the news and calls moving stocks, powered by The Fly. MSFT, GOOG, GOOGL, GM, V, BA, TSLA, TWTR, JNJ, ESLOY, JPM, GS, VIVK, ZNTL, PFE, MAT, NCR, DB, HA, TXN, TMUS, SPOT, HOG, TENB, JBLU, RSI, COF, BAM, CRI, WBA, APO",2022-04-27
925,"In early trading on Wednesday, shares of Enphase Energy topped the list of the day's best performing components of the S&P 500 index, trading up 13.4%. Year to date, Enphase Energy has lost about 4.6% of its value.",2022-04-27
926,"In early trading on Wednesday, shares of Visa topped the list of the day's best performing Dow Jones Industrial Average components, trading up 10.0%. Year to date, Visa registers a 2.1% gain.",2022-04-27
927,"Canada's main stock index was subdued on Wednesday, as energy companies declined tracking oil prices, overshadowing gains in technology stocks and upbeat earnings reports.",2022-04-27
928,"NEW YORK, April 27, 2022 /PRNewswire/ -- InvestorsObserver issues critical PriceWatch Alerts for V, RIO, MSFT, JKS, and FCX. ... | April 27, 2022",2022-04-27
929,U.S. Stocks Rebound as Earnings Continue to Pour in,2022-04-27
930,"In early trading on Wednesday, shares of Enphase Energy topped the list of the day's best performing components of the S&P 500 index, trading up 13.4% - Year to date, Enphase Energy has lost about 4.6% of its value - FFIV,ENPH,BA,V.",2022-04-27
931,Financial stocks were advancing premarket Wednesday as the Select Financial Sector SPDR (XLF) was recently climbing by 0.03%. The Direxion Daily Financial Bull 3X shares (FAS) were 1.19% higher and its bearish counterpart Direxion Daily Financial Bear 3X shares (FAZ) were down b,2022-04-27
932,"Notable gainers among liq... ENPH, V, MA, SEDG, MSFT",2022-04-27
933,"A mixed bag of earnings from some of Wall Street’s biggest companies may muddy the outlook for investors hoping to ""buy the dip"" amid a vicious stock market selloff.",2022-04-27
