,summary,date
1595,"Generation Investment’s 13F portfolio value grew from $24.05B to $24.33B. The top 3 positions are Baxter, Amazon and Jones Lang, adding up to ~18% of portfolio.",2022-02-21
1596,"In this article, we discuss the top 10 stock picks of Thomas Steyer’s Farallon Capital. If you want to skip our detailed analysis of these stocks, go directly to Top 5 Stock Picks of Thomas Steyer’s Farallon Capital. Thomas Steyer is an American businessman and hedge fund manager, who founded Farallon Capital in 1986, which […]",2022-02-21
1597,"(Bloomberg) -- Most Read from BloombergU.S. Condemns Russian Move at UN, Reassures Kyiv: Ukraine UpdatePorsches, Lamborghinis Lost at Sea May Cost VW $155 MillionStocks Retreat, Ruble Weakens on Ukraine Tension: Markets WrapKremlin Cautious on Prospect of Biden-Putin Summit Amid TensionsTrump Holds Onto Piles of Cash, Gives None to GOP CandidatesTingo Inc, which does most of its business in Nigeria, is seeking $500 million to expand across Africa partly through acquisitions, Chief Executive Offi",2022-02-21
1598,"In this article, we examined David Tepper’s portfolio management strategy and approach to investing in stocks. We also reviewed 10 stocks David Tepper’s Appaloosa Management sold before entering 2022. You can skip our detailed discussion about David Tepper’s investment philosophy and portfolio management strategies and jump directly to David Tepper’s Appaloosa Management Sold These 5 […]",2022-02-21
1599,"For new and old investors, taking full advantage of the stock market and investing with confidence are common goals. Zacks Premium provides lots of different ways to do both.",2022-02-21
1600,,2022-02-21
1601,PayPal stock declined about 2/3 since its peaked last year. See why I think the market’s overreaction to PYPL's recent issues created an entry opportunity.,2022-02-21
1602,"Polen Capital, an investment management firm, published its “Polen Global Growth” fourth quarter 2021 investor letter – a copy of which can be downloaded here. A quarterly gross return of 7.08% was delivered by the fund for the fourth quarter of 2021, versus the MSCI All-Country World Index (the “Index”)’s return of 6.67% for the […]",2022-02-21
1603,This portfolio strategy uses the quarterly 13F filings to extract 50 consensus stocks from 40 large hedge funds that have more than $3.5 billion Assets Under Management.,2022-02-20
1604,"In this article, we discuss the 10 stocks that Warren Buffett is selling. If you want to skip our detailed analysis of these stocks, go directly to Warren Buffett Is Selling These 5 Stocks. Value investors have once again come into the spotlight as inflation batters growth stocks. Warren Buffett, the chief of Berkshire Hathaway, […]",2022-02-18
1605,"Shares of Visa Inc. Cl A slipped 0.85% to $222.69 Friday, on what proved to be an all-around poor trading session for the stock market, with the S&P 500...",2022-02-18
1606,"InvestorPlace - Stock Market News, Stock Advice & Trading Tips",2022-02-18
1607,"Visa's Atlanta office is set to employ 1,000 people in the next three years. Office lead Elizabeth Rector calls it “the workplace of the future.”",2022-02-18
1608,,2022-02-18
1609,,2022-02-18
1610,,2022-02-18
1611,,2022-02-18
1612,,2022-02-18
1613,"Mastercard, Visa, Chevron and AbbVie are highlighted in this Value Trader article.",2022-02-18
1614,,2022-02-18
1615,,2022-02-18
1616,Volatility is constantly fueled these days by a vast number of uncertainties. Click here to know more...,2022-02-18
1617,"My dividend income amounted to $385, which is up 23% Y/Y and up 9%. I am continuing my monthly investment plans while still awaiting a real market correction.",2022-02-18
1618,,2022-02-18
1619,,2022-02-18
1620,,2022-02-18
1621,,2022-02-18
1622,,2022-02-18
1623,,2022-02-18
1624,,2022-02-18
1625,,2022-02-18
1626,,2022-02-18
1627,"Shares of Visa Inc. Cl A shed 1.84% to $224.61 Thursday, on what proved to be an all-around rough trading session for the stock market, with the S&P 500...",2022-02-17
1628,"(Bloomberg) -- Amazon.com Inc. has agreed to accept Visa Inc.’s cards across its global network, settling a feud that threatened to damage the financial giant’s business and disrupt e-commerce payments.Most Read from BloombergJapan’s Kishida Speaks With Putin on Crisis: Ukraine UpdateElon Musk Ratchets Up Trudeau Criticism With Hitler Comparison MemeMoney That Won Melania Trump NFT Came From Melania Trump WalletStocks Tumble, Bonds Rally in Flight-to-Safety Bid: Markets WrapNew York’s Adams Tell",2022-02-17
1629,Looking for stock market analysis and research with proves results? Zacks.com offers in-depth financial research with over 30years of proven results.,2022-02-17
1630,"Ukraine blamed a missile strike on Russian separatists, who in turn accused Ukraine of ceasefire violations as the Eastern Europe situation grew more uncertain.  The Dow Jones, S&P 500, and the Nasdaq all fell as the market opened.  The Treasury yield curve steepened following a rally in the yield of the two-year note, after the release of the Federal Reserve's minutes from its January meeting, showing that while the central bank intends to begin raising interest rates in March, its decisions would be made on a meeting-by-meeting basis.",2022-02-17
1631,"Yahoo Finance Live's Julie Hyman highlights the top business headlines, which include Amazon no longer charging its customers additional fees for purchases made with a Visa card, FAA chief Stephen Dickinson resigning halfway through his 5-year term, and Twitter CEO Parag Agrawal announcing that he will be going on paternity leave.",2022-02-17
1632,"When hedge fund manager ""titans"" think alike, investors are wise to pay attention. At Holdings Channel, we have reviewed 6,466 13F filings for the 12/31/2021 reporting period, and noticed that Visa Inc (Symbol: V) was held by 8 of the particular managers we have flagged as ""tita",2022-02-17
1633,,2022-02-17
1634,"While dividends are nice, they can be hard to find in the technology sector, with many companies either staying unprofitable or opting for share repurchases instead.  The first company on the list is Texas Instruments (NASDAQ: TXN).  Texas Instruments is the leading manufacturer of analog semiconductor chips, mainly serving the automotive, industrial, and personal electronics industries.",2022-02-17
1635,"Amazon.com Inc (NASDAQ: AMZN) has agreed to accept Visa Inc's (NYSE: V) cards across its global network, Bloomberg reports. Last November, Amazon decided to stop accepting Visa credit cards issued in the U.K. due to the payments processor's high transaction fees charged by the payment processor, Reuters reports. Amazon had considered shifting its popular co-brand credit card to Mastercard Inc (NYSE: MA). Related Content: Analysts Remain Divided Over Amazon's Crusade On Visa Amazon will no longer",2022-02-17
1636,Buffett and Berkshire Hathaway recently disclosed what stocks they bought and sold in the fourth quarter of 2021.,2022-02-17
1637,The recent market rout offers an opportune entry point to these seven robust stocks. These are good stocks to buy at their bottom now.,2022-02-17
1638,The fund is taking larger positions in its favorite equities,2022-02-17
1639,"Five top five lists with the news and calls moving stocks, powered by The Fly. WMT, NVDA, CSCO, DASH, PLTR, MMM, YUM, UPST, MNST, TSLA, SAFM, AMZN, V, ROKU, MAR, HAS, GLBE, ACVA, FVRR, ATUS, BCOV, AMPL, INFA, RBBN, YETI, FSLY, TRIP, USFD, GPC",2022-02-17
1640,,2022-02-17
1641,,2022-02-17
1642,Fidelity MSCI Information Technology Index ETF is a fund with cheap fees for investors seeking a capital-weighted exposure in tech. Read more about FTEC here.,2022-02-17
1643,PayPal stock declined 25% after its earnings report like Meta Platforms. Read more to see why I think it would be dangerous to assume PYPL stock is a bargain.,2022-02-17
1644,Amazon has reached an agreement with Visa over the fees it pays to accept the payment giant’s cards on its website.,2022-02-17
1645,Looking for stock market analysis and research with proves results? Zacks.com offers in-depth financial research with over 30years of proven results.,2022-02-17
1646,"Palantir sinks following fourth quarter earnings V, AN, DASH, CSCO, PLTR, YETI, COMM, USFD, NVDA, FSLY, TRIP, AMZN",2022-02-17
1647,"In this article, we will discuss 10 technology stock picks of John Kim’s Night Owl Capital. If you want to skip our detailed analysis of Kim’s history, investment philosophy performance, you can go directly to 5 Technology Stock Picks of John Kim’s Night Owl Capital. John Sang-Hyun Kim is the Managing Director and Chief Compliance […]",2022-02-17
1648,"Visa Inc cards will be accepted at all Amazon.com Inc stores and sites as part of a global agreement, the companies said on Thursday.",2022-02-17
1649,"(RTTNews) - Amazon.com and Visa have reached a global agreement to settle their dispute over payment fees, reports said citing an email. Accordingly, Visa credit card will now be accepted across all websites and stores of the e-commerce giant.",2022-02-17
1650,"Amazon.com Inc has reached agreement with Visa Inc to accept its credit cards across its network, ending a standoff between the two that threatened to disrupt e-commerce payments and deal a blow to the U.S.-based payments processor.  Details of the deal were not disclosed but Visa and other payments cards have faced increased pressure about their fees as more shoppers have turned online during the pandemic.  Amazon had said in November it was considering dropping Visa as partner on its U.S. co-branded credit card, after earlier confirming it would stop accepting Visa credit cards in the UK because of high transaction fees.",2022-02-17
1651,"Walmart, DoorDash, Cisco Rise Premarket; Fastly, TripAdvisor Slump",2022-02-17
1652,The deal follows a disagreement late last year in which Amazon said Visa cards would on longer be accepted in the U.K. starting in 2022.,2022-02-17
1653,,2022-02-17
1654,,2022-02-17
1655,"Amazon Chatter, Walmart Earnings, Ukraine Bubbles - What's Moving Markets",2022-02-17
1656,Visa Inc. and Amazon.com Inc. announced an agreement Thursday that allows customers to use Visa cards on Amazon sites worldwide without additional fees.,2022-02-17
1657,By Geoffrey Smith,2022-02-17
1658,"Dow Futures Down 175 Pts; Jobless Claims, Corporate Earnings in Focus",2022-02-17
1659,"(Reuters) -Amazon.com Inc has reached agreement with Visa Inc to accept its credit cards across its network, ending a standoff between the two that threatened to disrupt e-commerce payments and deal a blow to the U.S.-based payments processor.  Details of the deal were not disclosed but Visa and other payments cards have faced increased pressure about their fees as more shoppers have turned online during the pandemic.  Amazon had said in November it was considering dropping Visa as partner on its U.S. co-branded credit card, after earlier confirming it would stop accepting Visa credit cards in the UK because of high transaction fees.",2022-02-17
1660,"Visa Inc cards will be accepted at all Amazon.com Inc stores and sites as part of a global agreement, the payments giant said late on Wednesday.  Amazon said last November that it would stop accepting Visa credit cards issued in the UK because of the high transaction fees charged by the payment processor.  Earlier this year, the e-commerce giant eventually said it would not stop accepting UK-issued Visa credit cards on its British website, adding that it was working with Visa to resolve a dispute over payment fees.",2022-02-17
1661,,2022-02-17
1662,,2022-02-17
1663,,2022-02-17
1664,"Amazon (AMZN) and Visa (V... AMZN, V",2022-02-17
1665,"On Feb. 15, institutional investment managers with over $100m AUM disclosed their 2021-end positions. Check my list of some of the best-performing hedge funds.",2022-02-17
1666,Visa credit cards can now be used across all of Amazon's websites and stores.,2022-02-17
1667,,2022-02-17
1668,,2022-02-17
1669,,2022-02-17
1670,"Five top five lists with the news and calls moving stocks, powered by The Fly. WMT, NVDA, CSCO, DASH, KO, MMM, YUM, UPST, MNST, TSLA, SAFM, AMZN, V, ROKU, MQBKY, NGG, HAS, GLBE, ACVA, FVRR, ATUS, BCOV, AMPL, INFA, RBBN, YETI, FSLY, TRIP, USFD, PLTR",2022-02-17
1671,Guru reports 4th-quarter portfolio,2022-02-17
1672,,2022-02-17
1673,,2022-02-17
1674,"The Western Union Company stock (NYSE: WU) has gained 7.8% in the last week, outperforming the S&P 500 (down 2%). Further, the stock increased 6.9% in the last month vs a 5.6% fall in the broader markets. Overall, the stock has gained in the near term, as compared to t",2022-02-17
1675,,2022-02-17
1676,,2022-02-17
1677,,2022-02-17
1678,"SAN FRANCISCO, February 16, 2022--Visa Inc. (NYSE: V) today announced its participation in the following investor conferences.",2022-02-16
1679,"Shares of Visa Inc. Cl A inched 0.44% higher to $228.82 Wednesday, on what proved to be an all-around mixed trading session for the stock market, with the...",2022-02-16
1680,"The NASDAQ 100 After Hours Indicator is down -11.86 to 14,591.78.  The total After hours volume is currently 67,718,621 shares traded.The following are the most active stocks for the after hours session: Alibaba Group Holding Limited (BABA) is unchanged at $125.56, with 6,409,685",2022-02-16
1681,"Mastercard Incorporated MA recently forged an alliance with Payment International Enterprise for introducing the digital first program FLOOSS. This latest launch provides financial services across the Kingdom of Bahrain.With this banking alternative, consumers get a virtu",2022-02-16
1682,"Discover Financial Services DFS has plans to tie up with the fintech firm Buy It Mobility Networks Inc. (""BIM"") to introduce the cardless payments method for US merchants, per reports. Buy It Mobility Network’s technology allows customers to make payments directly from th",2022-02-16
1683,Western Union (WU) teams up with Travel Wallet to provide hassle-free money transfer services to the latter's app users in South Korea.,2022-02-16
1684,,2022-02-16
1685,Looking for stock market analysis and research with proves results? Zacks.com offers in-depth financial research with over 30years of proven results.,2022-02-16
1686,"Silvergate Capital (NYSE: SI), a top bank providing crucial behind-the-scenes services to cryptocurrency investors, recently acquired the crypto project Diem from Meta Systems (NASDAQ: FB), formerly Facebook.",2022-02-16
1687,,2022-02-16
1688,,2022-02-16
1689,"PayPal Holdings (NASDAQ: PYPL) got off to a rough start in 2022, as investors continued their transition away from tech stocks and into value-oriented companies in order to combat rising interest rates. Right when it seemed matters couldn't get worse, PayPal released discouraging",2022-02-16
1690,"Shares of Affirm Holdings (NASDAQ: AFRM) recently lost over a fifth of their value overnight after delivering mixed results for its fiscal second quarter ended Dec. 31, 2021. The company's latest earnings call contained lots of great news, but the stock market focused on a wider-",2022-02-16
1691,,2022-02-16
1692,"China's aim to make an Olympic splash with its digital currency, thwarted by a COVID 19-induced decision to exclude foreign spectators, has been taken up instead by a captive audience of locals unable to use their usual digital payment apps.",2022-02-16
1693,,2022-02-16
1694,"Charlie Munger is back to slamming cryptocurrency and angering crypto bulls. But, didn't he just make a $1B investment in crypto banking?",2022-02-16
1695,"Realogy (RLGY) announced ... RLGY, V",2022-02-16
1696,These companies have consistently increased sales and Ebitda,2022-02-16
1697,Berkshire Hathaway's 13F stock portfolio value increased from ~$293B to ~$331B. BRK.B's largest 3 holdings are 2/3rds of the portfolio. Read the full list here.,2022-02-15
1698,"Shares of Visa Inc. Cl A advanced 1.10% to $227.82 Tuesday, on what proved to be an all-around great trading session for the stock market, with the S&P 500...",2022-02-15
1699,"In July of 2020, my wife and I converted all of our net worth into cryptocurrency, mostly bitcoin (CRYPTO: BTC) . We called this ""going full crypto "" and even began a podcast documenting our journey. We decided to convert all of our money into cryptocurrency because we saw it as",2022-02-15
1700,The share prices of Shopify Inc. (SHOP) remain in a downward trend as the company prepares to report earnings for the fiscal fourth quarter.  Shopify stock has drifted lower with the technology sector as inflation fears have spiked and is currently trading nearly 50% off its 52-week highs.  Analysts expect the e-commerce company to report $1.31 in earnings per share (EPS) and $1.34 billion in revenue.,2022-02-15
1701,Investing large sums into proven winners with long growth runways can be lucrative for your portfolio.,2022-02-15
1702,"China's new digital currency, the e-CNY, is being used to make 2 billion yuan ($300 million) or more of payments a day in its latest pilot at the Beijing Winter Olympics, a top official from the Chinese central bank (PBOC) has said.",2022-02-15
1703,"Looking today at week-over-week shares outstanding changes among the universe of ETFs covered at ETF Channel, one standout is the iShares Russell 1000 Growth ETF (Symbol: IWF) where we have detected an approximate $268.9 million dollar inflow -- that's a 0.4% increase week over",2022-02-15
1704,"Buy now, pay later company Affirm Holdings (NASDAQ: AFRM) has left many investors scratching their heads and licking their wounds over the past couple of days. The company leaked and then quickly deleted incomplete earnings data in a social-media post that caused the stock to pop",2022-02-15
1705,"As the cryptocurrency market continues its volatility in 2022, some themes are beginning to emerge. One is that developers are taking the opportunity extremely seriously, building some incredible utilities that could be disruptive in markets ranging from finance to event ticketin",2022-02-15
1706,Apple (NASDAQ: AAPL) posts record revenue. Microsoft (NASDAQ: MSFT) makes its intentions clear with respect to its gaming division. Visa (NYSE: V) and American Express (NYSE: AXP) rise on strong results. Tesla (NASDAQ: TSLA) tells Wall Street not to expect any new models this yea,2022-02-14
1707,"Shares of Visa Inc. Cl A inched 0.29% higher to $225.34 Monday, on what proved to be an all-around grim trading session for the stock market, with the S&P...",2022-02-14
1708,"Berkshire Hathaway (BRK.B) filed its latest Form 13F with the Securities and Exchange Commission on Monday evening, revealing the stocks Warren Buffett and his team bought and sold during the fourth quarter of 2021.And once again, Buffett and his team were fairly active sell",2022-02-14
1709,"Everybody knows Visa (NYSE: V) is a credit card giant, but the company is expanding its business in new ways, including through cryptocurrency and partnering with tech e-commerce companies.",2022-02-14
1710,"Mastercard (NYSE: MA) enjoys some of the strongest operating margins of any publicly traded company, and it's also putting up strong growth numbers.",2022-02-14
1711,"Warren Buffett's investing savvy through his holding company Berkshire Hathaway (NYSE: BRK.A)(NYSE: BRK.B) has made more millionaires than almost every other company in history.  For instance, a $1,000 investment made in the stock when Buffett stepped in as CEO in 1965 would now be worth $18 million.  The first stock in Berkshire Hathaway's portfolio to buy is the pharma stock AbbVie (NYSE: ABBV), with Berkshire's stake in AbbVie currently valued at $2 billion.",2022-02-14
1712,"Warren Buffett is without a doubt one of the greatest stock pickers and business minds of our time. During his tenure as CEO of Berkshire Hathaway, he has used the holding company to fund a variety of acquisitions and investments, building an empire that has created tremendous we",2022-02-14
1713,"Crypto companies are betting sports advertising will help them go mainstream, and none have made a bigger splash than Crypto.com with a commercial on Sunday's Super Bowl and a $700 million deal last year to rename the Staples Center in Los Angeles as the Crypto.com Arena.",2022-02-14
1714,"Akre Capital Management’s 13F portfolio value increased from $16.24B to $17.92B this quarter. The top three positions are American Tower, Mastercard, and Moody’s.",2022-02-13
1715,"In this article, we discuss about two sample Breakout Stocks for Week 7 with better than 10% short-term upside potential. Check out a Dow stock pick.",2022-02-13
1716,"Capital One, the bank holding company that specializes in credit cards, has been grouped among those stocks that seem to have benefited nicely from the pandemic. As a result, its stock price is up about 36% over the last year and while it's not trading at all-time highs, it's sti",2022-02-12
1717,"The overall fintech space appears to be healthy, with high growth rates and strong margins. This provides support for a rebound in valuations heading into Q4 earnings.",2022-02-11
1718,"Shares of Visa Inc. Cl A slumped 0.40% to $224.69 Friday, on what proved to be an all-around dismal trading session for the stock market, with the S&P 500...",2022-02-11
1719,"Visa is a leading global payments company, but its moat is increasingly being challenged due to increasing competition in the industry. Read more here.",2022-02-11
1720,,2022-02-11
1721,U.S. stock indexes were mixed in choppy trading on Friday as investors digested hot inflation data that spurred a sharp selloff in the previous session on fears about aggressive interest rate hikes by the Federal Reserve.,2022-02-11
1722,"A lot has changed in the past 50 years since the ATMs first came to market, especially in the last two years with the pandemic. Clinton Chenge, VP and GM, global head of Plus ATM network at Visa Inc.,... | February 11, 2022",2022-02-11
1723,"After 2 months, new figures suggest the stock is still undervalued",2022-02-11
1724,,2022-02-11
1725,Wall Street's main indexes were mixed on Friday as investors digested hot inflation data that caused a sharp selloff in the previous session on fears about quicker interest rate hikes.,2022-02-11
1726,,2022-02-11
1727,"In early trading on Friday, shares of Chevron topped the list of the day's best performing Dow Jones Industrial Average components, trading up 1.4%.  Year to date, Chevron registers a 17.6% gain.",2022-02-11
1728,"Here at Zacks, we offer our members many different opportunities to take full advantage of the stock market, as well as how to invest in ways that lead to long-term success.",2022-02-11
1729,Visa has guided for the next few years to see accelerated growth relative to pre-pandemic growth rates. Read more to find out if V stock is a buy or sell.,2022-02-11
1730,,2022-02-11
1731,"The crypto economy has exploded in recent years, creating a tremendous amount of wealth in the process. But few blockchain projects have generated as much enthusiasm as Cardano (CRYPTO: ADA) and Solana(CRYPTO: SOL), which rank as the seventh- and eighth-most-valuable cryptocurren",2022-02-11
1732,A look at GMO's top 4th-quarter portfolio updates,2022-02-11
1733,,2022-02-11
1734,"When there is a gold rush, sell shovels",2022-02-11
1735,,2022-02-11
1736,,2022-02-11
1737,,2022-02-11
1738,"Shares of Visa Inc. Cl A slipped 2.13% to $225.59 Thursday, on what proved to be an all-around poor trading session for the stock market, with the S&P 500...",2022-02-10
1739,"InvestorPlace - Stock Market News, Stock Advice & Trading Tips",2022-02-10
1740,"SAN FRANCISCO, February 10, 2022--Visa (NYSE: V) today announced that the U.S. Spending Momentum Index (SMI) was 102.4 in January (seasonally adjusted), down from a revised 109.4 in December. The Visa SMI is an economic indicator of the health of consumer spending. When the Visa SMI rises above 100, the consumer spending momentum is strengthening and when it falls below 100, the spending momentum is weakening as fewer consumers are spending more relative to the previous year.",2022-02-10
1741,"In this article, we discuss 10 best cryptocurrencies to invest in for beginners in 2022 according to Reddit. If you want to skip our detailed analysis of these currencies, go directly to 5 Best Cryptocurrencies to Invest In For Beginners in 2022 According to Reddit. 2021 was a breakthrough year for “alternative coins”, a term […]",2022-02-10
1742,,2022-02-10
1743,"Investors in Visa Inc (Symbol: V) saw new options begin trading today, for the April 1st expiration.   At Stock Options Channel, our YieldBoost formula has looked up and down the V options chain for the new April 1st contracts and identified one put and one call contract of par",2022-02-10
1744,"InvestorPlace - Stock Market News, Stock Advice & Trading Tips",2022-02-10
1745,,2022-02-10
1746,"Visa today announced that the U.S. Spending Momentum Index was 102.4 in January , down from a revised 109.4 in December. The Visa SMI is an economic indicator of the health of consumer spending.... | February 10, 2022",2022-02-10
1747,Analysts across Wall Street sang the praises of Disney after a quarterly print showing a stunning recovery in its parks business.,2022-02-10
1748,"With Bitcoin (CRYPTO:BTC) and the cryptocurrency market as a whole experiencing some severe volatility in January, it's a good time to look for some opportunities, some of which are trading at a substantial discount to where they were just a few weeks ago, even as the networks th",2022-02-10
1749,,2022-02-10
1750,,2022-02-10
1751,,2022-02-10
1752,"“Having spent the last 10 years at Visa, I had a front-row seat to the rise of Marqeta,"" the new CFO said.",2022-02-10
1753,,2022-02-10
1754,,2022-02-10
1755,,2022-02-10
1756,,2022-02-10
1757,,2022-02-10
1758,,2022-02-10
